id,room_id,category,subcategory,date,photoUrl,description,cost,dateFixed
380,68,3,15,2019-4-8 11:03:53,http://lorempixel.com/400/400/business,Est et corporis sed autem voluptatum voluptatem.,865,2019-6-12 13:02:09
381,3,2,13,2019-5-13 20:08:13,http://lorempixel.com/400/400/business,Quam aspernatur esse sint fugiat quae qui et aut placeat.,711,2019-6-4 12:32:29
382,14,3,14,2019-6-18 17:27:54,http://lorempixel.com/400/400/business,Perferendis vel nobis sapiente ipsam enim dicta.,698,2019-9-13 14:33:43
383,17,2,13,2019-7-26 05:53:02,http://lorempixel.com/400/400/business,Aut expedita quis beatae ipsam maiores eum veritatis numquam suscipit.,601,2019-9-13 05:12:58
384,23,2,11,2019-6-30 14:31:15,http://lorempixel.com/400/400/business,Alias est error pariatur voluptate.,765,2019-8-24 21:52:57
385,22,4,18,2019-7-9 01:29:00,http://lorempixel.com/400/400/business,Quo adipisci voluptatibus aut eos non.,112,2019-7-16 13:28:01
386,2,1,3,2019-4-8 11:28:07,http://lorempixel.com/400/400/business,Repellat et officiis laborum ipsum.,770,2019-5-12 05:41:42
387,70,3,17,2019-6-26 11:26:38,http://lorempixel.com/400/400/business,Dolorum labore enim beatae iusto illum optio.,368,2019-8-3 00:58:37
388,61,5,22,2019-5-15 09:57:54,http://lorempixel.com/400/400/business,Asperiores veritatis id totam perferendis qui facilis omnis.,963,2019-9-23 04:05:25
389,54,4,20,2019-5-1 19:23:35,http://lorempixel.com/400/400/business,Enim aperiam repudiandae fugit molestiae ut.,743,2019-8-25 06:33:48
390,28,1,6,2019-6-21 14:52:51,http://lorempixel.com/400/400/business,Iure et optio hic ipsum esse alias est molestiae nam.,773,2019-8-27 14:37:49
391,31,1,3,2019-5-8 15:32:58,http://lorempixel.com/400/400/business,Quo quia voluptatem ea ipsum non sequi.,930,2019-9-22 12:06:44
392,61,4,21,2019-6-23 03:56:49,http://lorempixel.com/400/400/business,Et officia quas excepturi.,739,2019-9-10 21:06:54
393,35,5,22,2019-5-7 05:25:34,http://lorempixel.com/400/400/business,Possimus libero qui.,84,2019-7-20 21:16:40
394,15,3,14,2019-6-3 22:45:03,http://lorempixel.com/400/400/business,Corporis aut aut voluptatem facilis repellendus.,411,2019-7-30 19:50:59
395,46,3,14,2019-5-2 13:50:20,http://lorempixel.com/400/400/business,Molestiae itaque libero.,811,2019-6-18 07:21:24
396,69,2,12,2019-7-5 08:08:19,http://lorempixel.com/400/400/business,Tenetur qui beatae eos possimus quos.,440,2019-8-6 16:13:17
397,96,1,1,2019-5-7 00:30:07,http://lorempixel.com/400/400/business,Non minima facere non deserunt vitae animi at omnis.,948,2019-9-12 11:24:05
398,87,3,16,2019-4-2 09:20:34,http://lorempixel.com/400/400/business,Minima ab unde eaque voluptatem.,815,2019-5-12 22:56:36
399,59,3,15,2019-4-18 14:23:55,http://lorempixel.com/400/400/business,Quibusdam magnam sapiente tenetur sequi necessitatibus asperiores quas quaerat dolorem.,954,2019-8-25 16:55:52
400,84,3,17,2019-6-1 01:47:16,http://lorempixel.com/400/400/business,Suscipit et quisquam blanditiis mollitia.,724,2019-6-5 16:06:55
401,25,5,22,2019-7-2 17:56:12,http://lorempixel.com/400/400/business,Mollitia vitae et sit ullam iusto quas.,76,2019-9-5 00:01:38
402,86,1,3,2019-7-11 05:54:26,http://lorempixel.com/400/400/business,Eos ut similique ut distinctio quo ut.,85,2019-7-22 16:30:57
403,5,5,22,2019-4-23 22:49:04,http://lorempixel.com/400/400/business,Est ut corrupti porro aspernatur earum.,613,2019-7-2 18:09:23
404,88,2,9,2019-3-31 20:09:12,http://lorempixel.com/400/400/business,Aliquid voluptas eum illum quis minus sit.,629,2019-7-23 06:58:47
405,62,4,18,2019-7-13 13:50:00,http://lorempixel.com/400/400/business,Eum repudiandae non soluta voluptates provident.,534,2019-9-5 00:14:33
406,54,1,4,2019-5-6 08:32:34,http://lorempixel.com/400/400/business,Unde odio numquam earum similique et architecto optio maxime corporis.,455,2019-9-14 06:34:10
407,32,4,19,2019-6-1 20:22:06,http://lorempixel.com/400/400/business,Sed quibusdam quam adipisci rerum incidunt sit deleniti dolores dolorem.,3,2019-7-30 19:40:05
408,5,2,9,2019-4-6 05:33:04,http://lorempixel.com/400/400/business,Consequuntur culpa quis saepe dolor aut nostrum quod amet assumenda.,65,2019-9-9 14:42:53
409,60,3,15,2019-7-22 03:45:29,http://lorempixel.com/400/400/business,Iure harum esse eum quibusdam omnis consectetur unde.,148,2019-9-7 08:30:47
410,61,3,14,2019-6-29 21:44:34,http://lorempixel.com/400/400/business,Repudiandae et quo.,497,2019-8-27 20:56:29
411,28,4,19,2019-7-11 03:23:45,http://lorempixel.com/400/400/business,Neque consectetur error veniam quibusdam.,428,2019-9-19 03:29:03
412,59,3,17,2019-6-23 08:44:49,http://lorempixel.com/400/400/business,Perferendis aut quos accusamus ut rerum est quisquam accusamus et.,531,2019-7-18 03:20:52
413,81,4,20,2019-6-9 04:33:34,http://lorempixel.com/400/400/business,Occaecati esse facilis veniam assumenda illo id.,64,2019-6-19 22:14:12
414,86,4,21,2019-4-12 10:22:18,http://lorempixel.com/400/400/business,Consequatur consequatur quia est fugiat blanditiis repellat perspiciatis.,209,2019-9-22 09:26:05
415,89,1,1,2019-4-5 01:48:24,http://lorempixel.com/400/400/business,Officia est animi dolor nostrum.,615,2019-9-8 19:04:08
416,13,2,11,2019-6-13 21:41:13,http://lorempixel.com/400/400/business,Inventore vel earum.,95,2019-7-23 17:19:15
417,84,3,16,2019-6-7 16:58:18,http://lorempixel.com/400/400/business,Pariatur accusantium quod vel consectetur.,78,2019-9-23 07:32:54
418,32,4,19,2019-7-2 18:37:23,http://lorempixel.com/400/400/business,Animi quas veniam est consequatur qui cupiditate nemo doloribus.,611,2019-7-29 19:42:41
419,92,1,5,2019-4-26 05:54:14,http://lorempixel.com/400/400/business,Iusto explicabo vero in ullam harum incidunt.,914,2019-7-3 23:53:42
420,58,4,21,2019-7-12 16:19:33,http://lorempixel.com/400/400/business,Molestiae pariatur et nihil.,992,2019-8-5 00:51:43
421,2,4,20,2019-5-1 12:42:34,http://lorempixel.com/400/400/business,Dignissimos doloremque deserunt soluta qui fugiat consequatur incidunt nostrum.,841,2019-5-18 18:04:23
422,45,1,8,2019-5-3 04:45:44,http://lorempixel.com/400/400/business,Iure dolorum et iusto.,808,2019-8-24 22:33:09
423,51,4,21,2019-5-24 08:57:43,http://lorempixel.com/400/400/business,Deserunt placeat et dicta quis iure ullam.,267,2019-9-8 14:49:18
424,40,2,12,2019-7-22 01:37:25,http://lorempixel.com/400/400/business,Ex qui impedit.,209,2019-9-29 20:00:49
425,44,5,23,2019-7-18 23:32:51,http://lorempixel.com/400/400/business,Totam doloremque iusto aliquam sed.,746,2019-7-24 16:18:50
426,95,2,12,2019-7-15 11:46:53,http://lorempixel.com/400/400/business,Odit sit voluptatem similique nihil.,306,2019-8-11 06:05:50
427,43,5,23,2019-8-2 12:16:44,http://lorempixel.com/400/400/business,A voluptas repudiandae dolor eveniet.,109,2019-8-29 02:13:36
428,11,2,11,2019-7-12 04:05:55,http://lorempixel.com/400/400/business,Quia est consequuntur odio enim nihil.,99,2019-9-19 17:16:04
429,66,3,15,2019-6-23 22:36:13,http://lorempixel.com/400/400/business,Deleniti sapiente alias voluptatibus neque eligendi eaque ipsam modi.,789,2019-7-31 04:06:33
430,70,2,12,2019-6-27 06:09:00,http://lorempixel.com/400/400/business,Nisi voluptatem beatae eum ut.,196,2019-9-6 09:58:47
431,24,4,19,2019-6-18 03:04:08,http://lorempixel.com/400/400/business,Saepe sint laborum quisquam omnis.,654,2019-8-1 10:00:01
432,7,2,11,2019-6-20 23:29:30,http://lorempixel.com/400/400/business,Quos vero ipsa est mollitia illum animi vel reiciendis neque.,890,2019-8-18 23:38:44
433,78,5,22,2019-4-10 04:48:57,http://lorempixel.com/400/400/business,Rerum perspiciatis nobis saepe porro dolor.,317,2019-9-24 12:58:19
434,58,2,12,2019-5-25 07:12:40,http://lorempixel.com/400/400/business,Nam totam at.,646,2019-8-14 15:17:49
435,18,2,13,2019-7-27 09:37:18,http://lorempixel.com/400/400/business,Doloremque explicabo nostrum.,159,2019-8-20 05:48:46
436,16,4,19,2019-4-21 12:02:02,http://lorempixel.com/400/400/business,Ab aspernatur voluptates.,240,2019-5-23 02:21:46
437,97,5,23,2019-7-22 01:34:18,http://lorempixel.com/400/400/business,Veniam earum et ducimus voluptatem et cum.,56,2019-9-22 03:26:43
438,39,5,23,2019-8-1 07:42:42,http://lorempixel.com/400/400/business,Natus sequi ipsam quam eum nam et assumenda.,566,2019-9-17 05:25:03
439,62,1,7,2019-7-2 22:34:57,http://lorempixel.com/400/400/business,Quos quisquam quidem voluptas harum mollitia mollitia.,316,2019-9-14 16:32:20
440,25,2,13,2019-4-11 13:40:58,http://lorempixel.com/400/400/business,Qui suscipit dolore ipsa enim veniam sunt praesentium.,923,2019-9-19 22:31:18
441,97,1,6,2019-6-5 02:11:08,http://lorempixel.com/400/400/business,Dicta ut praesentium et impedit officiis.,348,2019-7-26 06:32:16
442,6,1,8,2019-7-15 04:30:03,http://lorempixel.com/400/400/business,Aut et voluptatem quia provident excepturi et rerum.,665,2019-8-6 08:50:55
443,88,5,23,2019-8-1 23:20:56,http://lorempixel.com/400/400/business,Qui magni maiores dolorem voluptatibus unde aliquam et.,414,2019-8-2 20:04:50
444,52,3,16,2019-5-19 23:12:46,http://lorempixel.com/400/400/business,Culpa quia quidem consequatur quasi occaecati.,735,2019-7-3 03:17:56
445,34,3,17,2019-7-23 23:10:53,http://lorempixel.com/400/400/business,Voluptatem est aut tempora nihil doloribus quae.,461,2019-9-27 00:49:13
446,4,2,12,2019-6-26 19:17:50,http://lorempixel.com/400/400/business,Nam quae ut velit amet quia dolorem aspernatur.,74,2019-8-14 17:13:56
447,78,5,22,2019-7-19 06:49:28,http://lorempixel.com/400/400/business,Vel ex tempora aut et molestiae temporibus sit quis.,397,2019-7-23 18:19:53
448,29,5,22,2019-6-11 20:52:08,http://lorempixel.com/400/400/business,Provident eaque quae sit in quo eveniet voluptas rerum.,509,2019-9-4 07:12:12
449,11,4,20,2019-4-6 01:45:06,http://lorempixel.com/400/400/business,Culpa eum voluptatem aut est maxime in sint.,899,2019-9-9 12:55:16
450,33,1,4,2019-6-24 05:28:18,http://lorempixel.com/400/400/business,Molestiae rerum consequatur.,17,2019-8-8 18:27:02
451,38,2,11,2019-4-24 00:20:49,http://lorempixel.com/400/400/business,Harum et optio.,996,2019-7-10 05:17:01
452,26,3,17,2019-7-27 21:17:49,http://lorempixel.com/400/400/business,Voluptatem est quasi quod quia numquam totam velit dolores dolorum.,594,2019-8-31 21:00:00
453,51,1,1,2019-5-25 05:59:40,http://lorempixel.com/400/400/business,Inventore ea nisi necessitatibus quisquam repellendus.,371,2019-9-2 09:17:08
454,82,2,13,2019-4-19 12:08:32,http://lorempixel.com/400/400/business,Neque necessitatibus sit excepturi nihil.,831,2019-5-16 22:47:55
455,30,5,23,2019-4-12 02:33:13,http://lorempixel.com/400/400/business,Consectetur fuga suscipit nostrum.,539,2019-4-25 09:09:42
456,39,4,21,2019-5-28 03:34:22,http://lorempixel.com/400/400/business,Aut maiores eaque.,561,2019-9-10 04:12:07
457,87,1,6,2019-7-5 19:15:26,http://lorempixel.com/400/400/business,Beatae sint voluptate sint a ut voluptatum voluptatem est.,395,2019-8-11 06:19:40
458,47,5,23,2019-6-23 09:22:12,http://lorempixel.com/400/400/business,Explicabo dignissimos neque.,415,2019-9-27 02:28:11
459,92,3,17,2019-7-31 17:10:21,http://lorempixel.com/400/400/business,Enim possimus vel quibusdam beatae temporibus voluptatibus molestiae aperiam ut.,926,2019-8-2 21:22:36
460,96,2,12,2019-5-18 01:49:00,http://lorempixel.com/400/400/business,Aut saepe et quibusdam similique velit saepe ut nemo pariatur.,715,2019-6-25 04:02:49
461,66,2,9,2019-7-7 14:10:48,http://lorempixel.com/400/400/business,Provident et et similique unde veritatis recusandae et.,178,2019-8-13 19:17:04
462,98,4,21,2019-7-12 00:27:43,http://lorempixel.com/400/400/business,Et nostrum sequi excepturi dignissimos soluta est.,49,2019-7-26 13:13:09
463,44,3,15,2019-7-8 10:57:57,http://lorempixel.com/400/400/business,Quas fugit autem aut.,94,2019-7-14 05:06:29
464,88,4,20,2019-4-1 18:40:50,http://lorempixel.com/400/400/business,Asperiores sit dignissimos laboriosam unde necessitatibus fugit mollitia qui deleniti.,522,2019-7-10 23:40:17
465,59,5,22,2019-5-2 20:59:24,http://lorempixel.com/400/400/business,Nemo hic et blanditiis eos suscipit exercitationem minima.,328,2019-9-21 15:50:03
466,50,4,21,2019-5-19 11:36:09,http://lorempixel.com/400/400/business,Id soluta quae autem fuga a quod.,458,2019-8-5 12:19:13
467,68,2,13,2019-7-26 07:59:17,http://lorempixel.com/400/400/business,Nihil placeat quisquam cumque expedita.,770,2019-8-21 00:26:22
468,24,5,23,2019-4-3 23:06:12,http://lorempixel.com/400/400/business,Dolores rerum illo deserunt facere ex cumque amet.,533,2019-5-9 09:15:20
469,43,2,13,2019-4-18 15:28:07,http://lorempixel.com/400/400/business,A est expedita repellendus eum ullam doloribus praesentium.,149,2019-9-16 03:19:26
470,98,3,14,2019-6-30 23:37:28,http://lorempixel.com/400/400/business,Ut vero voluptatem sint distinctio sint.,613,2019-7-19 15:13:45
471,98,2,13,2019-7-10 19:31:04,http://lorempixel.com/400/400/business,Voluptatem aut sit.,890,2019-7-24 18:16:20
472,80,1,4,2019-6-15 09:49:47,http://lorempixel.com/400/400/business,Fuga ea et et modi nostrum atque laboriosam molestiae.,442,2019-7-15 00:52:42
473,15,4,18,2019-8-3 04:35:56,http://lorempixel.com/400/400/business,Impedit quae explicabo voluptatem temporibus qui doloremque et rerum.,848,2019-9-24 08:21:50
474,26,1,6,2019-7-31 21:47:19,http://lorempixel.com/400/400/business,Placeat quam quia nihil modi at recusandae dolorem vel et.,312,2019-9-24 12:41:04
475,23,5,22,2019-4-20 10:36:18,http://lorempixel.com/400/400/business,Et exercitationem consequatur.,604,2019-5-23 01:00:56
476,83,1,2,2019-6-29 06:53:39,http://lorempixel.com/400/400/business,Consectetur facilis expedita id est qui aut.,594,2019-9-28 15:57:53
477,20,1,6,2019-6-10 04:04:26,http://lorempixel.com/400/400/business,Sunt explicabo aperiam sed soluta amet deserunt reprehenderit deserunt.,534,2019-7-12 13:37:58
478,18,2,12,2019-6-2 15:28:17,http://lorempixel.com/400/400/business,Ut voluptatum quaerat maxime modi.,495,2019-9-11 16:41:50
479,92,1,7,2019-4-13 00:02:58,http://lorempixel.com/400/400/business,Quas impedit aut placeat porro velit.,889,2019-7-14 02:23:35
480,67,4,19,2019-7-7 06:53:38,http://lorempixel.com/400/400/business,Pariatur accusamus ipsa.,581,2019-8-23 23:46:58
481,49,2,10,2019-5-1 00:03:08,http://lorempixel.com/400/400/business,Ad sequi ea quo fugit at accusamus.,112,2019-5-29 22:34:36
482,55,2,12,2019-4-20 21:25:04,http://lorempixel.com/400/400/business,Consequatur sint itaque id odit est modi non reiciendis.,317,2019-6-4 11:02:19
483,42,1,4,2019-4-2 23:52:24,http://lorempixel.com/400/400/business,Qui dolorum quaerat earum labore optio.,971,2019-8-7 19:26:44
484,90,5,23,2019-5-10 09:39:24,http://lorempixel.com/400/400/business,Quasi illo doloremque.,358,2019-6-13 04:43:39
485,53,4,20,2019-5-2 14:02:05,http://lorempixel.com/400/400/business,Voluptatum reprehenderit fugiat consectetur.,280,2019-5-28 00:04:02
486,39,5,23,2019-5-12 00:59:31,http://lorempixel.com/400/400/business,Beatae ullam autem voluptatem incidunt aut aspernatur quia corporis est.,548,2019-9-17 14:21:44
487,83,4,18,2019-5-7 17:04:21,http://lorempixel.com/400/400/business,Quas qui et illum debitis et nobis quisquam vero et.,315,2019-6-4 09:20:02
488,16,3,17,2019-5-18 08:09:43,http://lorempixel.com/400/400/business,Quis expedita unde cumque odit.,143,2019-6-26 19:25:36
489,97,2,13,2019-5-9 10:59:14,http://lorempixel.com/400/400/business,Velit et eaque.,609,2019-5-26 03:20:14
490,83,2,13,2019-4-13 13:18:02,http://lorempixel.com/400/400/business,Assumenda eos veniam ex dolor ratione harum est perspiciatis voluptatem.,980,2019-6-12 06:34:22
491,82,5,22,2019-7-5 09:25:26,http://lorempixel.com/400/400/business,Omnis aliquid deserunt molestiae tenetur quasi maiores dolore.,944,2019-7-23 22:14:48
492,70,4,18,2019-6-8 19:15:15,http://lorempixel.com/400/400/business,Iste hic laborum nostrum quo inventore ipsa optio veritatis.,60,2019-7-20 00:16:08
493,15,2,11,2019-4-12 11:17:42,http://lorempixel.com/400/400/business,Fugit iste ad.,710,2019-8-8 14:22:43
494,4,4,19,2019-7-17 01:26:25,http://lorempixel.com/400/400/business,Et at animi ullam id cumque quia similique repudiandae provident.,576,2019-9-9 02:11:44
495,19,3,14,2019-5-20 17:59:28,http://lorempixel.com/400/400/business,Ullam omnis repellat saepe fugit et aut.,865,2019-5-22 23:50:49
496,39,1,2,2019-4-11 05:31:36,http://lorempixel.com/400/400/business,Sapiente et veritatis expedita minus et mollitia placeat dolorem asperiores.,41,2019-6-12 10:52:07
497,38,3,15,2019-6-9 17:44:33,http://lorempixel.com/400/400/business,Quae eius est debitis ea eum totam magni nihil a.,309,2019-8-18 17:49:12
498,100,3,16,2019-5-25 21:38:58,http://lorempixel.com/400/400/business,Porro repellat voluptatem dolores accusantium distinctio rerum.,437,2019-8-21 06:50:19
499,57,2,9,2019-7-22 04:28:14,http://lorempixel.com/400/400/business,Voluptatem aut est voluptas voluptatibus mollitia est eligendi earum.,915,2019-9-12 05:55:27
500,93,5,23,2019-4-26 05:42:20,http://lorempixel.com/400/400/business,Occaecati dolor harum recusandae ipsam.,84,2019-8-27 07:23:18
501,9,3,15,2019-7-8 03:00:49,http://lorempixel.com/400/400/business,Rerum porro enim quo adipisci placeat facilis est facere.,43,2019-9-18 13:24:25
502,32,1,1,2019-7-24 20:21:24,http://lorempixel.com/400/400/business,Vel ex consequatur.,318,2019-9-26 16:44:55
503,81,2,13,2019-5-28 14:49:21,http://lorempixel.com/400/400/business,Omnis voluptas et nobis.,213,2019-5-29 03:07:27
504,62,2,12,2019-7-9 08:41:39,http://lorempixel.com/400/400/business,Eius libero labore.,696,2019-9-11 03:20:11
505,47,4,20,2019-6-20 17:07:45,http://lorempixel.com/400/400/business,Et sit praesentium mollitia.,505,2019-6-30 12:36:54
506,39,1,5,2019-7-20 08:47:52,http://lorempixel.com/400/400/business,Dolorum sunt aut id non totam et dignissimos.,261,2019-8-21 10:23:38
507,7,5,23,2019-7-20 20:08:08,http://lorempixel.com/400/400/business,Sint aliquid ut.,372,2019-8-5 03:33:24
508,60,4,20,2019-3-31 20:01:00,http://lorempixel.com/400/400/business,Culpa laboriosam incidunt beatae a itaque eius vero possimus.,831,2019-7-12 18:11:08
509,82,4,20,2019-6-18 12:58:44,http://lorempixel.com/400/400/business,Dolores nobis vel totam magni.,896,2019-8-3 09:28:02
510,84,3,15,2019-5-29 21:11:51,http://lorempixel.com/400/400/business,Et nesciunt ex.,98,2019-6-2 00:21:07
511,30,4,20,2019-6-23 18:56:22,http://lorempixel.com/400/400/business,Autem nulla aut omnis molestiae.,198,2019-9-22 18:54:23
512,19,5,23,2019-5-16 00:58:19,http://lorempixel.com/400/400/business,Consequatur quo animi omnis praesentium quis pariatur sit veniam.,904,2019-5-25 23:10:29
513,28,3,16,2019-7-13 10:30:40,http://lorempixel.com/400/400/business,Non perspiciatis beatae voluptatem totam ipsam corporis.,323,2019-8-31 15:10:30
514,100,5,23,2019-6-14 03:19:12,http://lorempixel.com/400/400/business,Aliquam alias pariatur modi.,824,2019-9-26 12:41:21
515,13,4,18,2019-6-10 22:42:56,http://lorempixel.com/400/400/business,Molestiae quia ut at.,260,2019-9-25 09:27:50
516,49,3,14,2019-8-2 21:51:29,http://lorempixel.com/400/400/business,Occaecati rem blanditiis fugit non non et unde magni.,345,2019-9-29 22:33:02
517,97,4,21,2019-6-4 00:39:51,http://lorempixel.com/400/400/business,Eum modi sed alias consectetur.,221,2019-7-16 03:21:00
518,8,5,23,2019-5-15 02:33:45,http://lorempixel.com/400/400/business,Velit consequatur nihil.,379,2019-6-22 21:25:17
519,24,5,22,2019-4-12 17:57:30,http://lorempixel.com/400/400/business,Recusandae quisquam occaecati cupiditate et porro possimus recusandae.,887,2019-6-17 02:31:49
520,34,2,10,2019-7-30 15:37:42,http://lorempixel.com/400/400/business,Enim sed aut.,80,2019-8-12 13:12:12
521,97,1,7,2019-7-8 16:36:37,http://lorempixel.com/400/400/business,Nihil nisi quia.,587,2019-9-13 20:20:30
522,47,4,21,2019-5-17 04:39:36,http://lorempixel.com/400/400/business,Ullam libero quasi quae.,195,2019-7-25 06:36:14
523,24,5,23,2019-5-18 00:10:26,http://lorempixel.com/400/400/business,Voluptate et vitae esse magnam nihil doloribus rem sint.,673,2019-6-3 16:49:28
524,54,3,17,2019-5-31 10:19:13,http://lorempixel.com/400/400/business,Voluptas cupiditate et quidem qui nemo dicta.,657,2019-8-7 01:39:35
525,17,4,19,2019-5-16 15:31:05,http://lorempixel.com/400/400/business,Dolor repudiandae eum enim possimus dolor laborum debitis.,229,2019-6-12 08:19:35
526,10,1,6,2019-6-17 23:42:03,http://lorempixel.com/400/400/business,Voluptates et molestiae qui exercitationem distinctio rerum quasi non.,816,2019-9-5 18:28:27
527,60,5,23,2019-5-8 22:37:29,http://lorempixel.com/400/400/business,Incidunt quia nihil in dolor mollitia.,437,2019-9-28 09:25:44
528,21,2,12,2019-4-13 02:54:23,http://lorempixel.com/400/400/business,Repudiandae sit adipisci voluptatem.,759,2019-9-26 16:45:44
529,80,2,11,2019-7-15 08:44:59,http://lorempixel.com/400/400/business,Dicta est ut deleniti sit.,678,2019-9-28 02:46:40
530,35,2,12,2019-7-1 20:21:42,http://lorempixel.com/400/400/business,Voluptas sequi quod eum.,274,2019-8-8 06:40:43
531,16,5,22,2019-5-4 05:04:26,http://lorempixel.com/400/400/business,Sapiente atque eveniet.,195,2019-5-15 23:18:23
532,30,5,22,2019-4-8 18:29:41,http://lorempixel.com/400/400/business,Aut omnis amet aut.,725,2019-6-19 04:21:46
533,98,5,22,2019-7-22 03:17:14,http://lorempixel.com/400/400/business,Qui aperiam corporis nihil itaque rerum qui asperiores.,898,2019-9-18 19:27:13
534,64,5,23,2019-7-25 04:05:07,http://lorempixel.com/400/400/business,Iusto doloribus dolorum quia ea ullam.,330,2019-8-31 23:39:29
535,48,5,22,2019-6-18 20:09:07,http://lorempixel.com/400/400/business,Ducimus odio beatae.,974,2019-8-17 18:25:54
536,43,2,12,2019-6-11 21:39:33,http://lorempixel.com/400/400/business,Numquam dicta natus quia.,251,2019-9-8 01:20:43
537,98,4,20,2019-5-12 18:14:26,http://lorempixel.com/400/400/business,Quia veniam et hic corrupti quae consequatur ad officiis.,721,2019-7-2 15:33:00
538,44,3,15,2019-5-27 20:28:09,http://lorempixel.com/400/400/business,Et et et aut quia in ut at velit veniam.,626,2019-6-23 02:45:12
539,28,3,14,2019-5-12 18:25:29,http://lorempixel.com/400/400/business,Magni deserunt dicta modi ipsum est voluptatem fuga voluptatum est.,494,2019-7-2 08:48:52
540,97,3,15,2019-4-14 02:01:28,http://lorempixel.com/400/400/business,Enim consectetur porro pariatur et repellat ex consequuntur quibusdam.,422,2019-6-9 21:33:40
541,61,3,16,2019-6-4 03:17:23,http://lorempixel.com/400/400/business,Ea et dicta alias et enim.,712,2019-8-22 11:25:31
542,89,2,9,2019-6-4 01:00:38,http://lorempixel.com/400/400/business,Consectetur laborum aut reiciendis dolores animi.,139,2019-6-8 05:01:02
543,3,1,2,2019-6-5 23:16:46,http://lorempixel.com/400/400/business,Ut ut nobis deleniti.,366,2019-6-14 15:21:07
544,15,2,13,2019-6-3 07:54:06,http://lorempixel.com/400/400/business,Magni velit natus officiis repudiandae.,912,2019-9-19 20:10:32
545,22,2,11,2019-4-5 00:54:38,http://lorempixel.com/400/400/business,Sunt consequuntur in qui quasi est quia qui blanditiis.,344,2019-5-20 14:55:23
546,14,1,3,2019-6-28 02:52:23,http://lorempixel.com/400/400/business,Alias similique non eum quos asperiores atque molestias non.,182,2019-9-17 21:25:31
547,34,3,16,2019-4-4 12:37:41,http://lorempixel.com/400/400/business,Magnam id quisquam et et dolor tempora aut et.,311,2019-4-14 01:12:46
548,81,5,23,2019-7-16 02:16:30,http://lorempixel.com/400/400/business,Est ex numquam occaecati in iure natus.,215,2019-8-31 00:10:49
549,2,1,6,2019-4-14 00:42:07,http://lorempixel.com/400/400/business,Distinctio libero assumenda.,997,2019-7-31 07:23:57
550,84,4,19,2019-6-5 05:24:36,http://lorempixel.com/400/400/business,Beatae architecto dolorum nobis accusantium omnis magnam nostrum fuga porro.,533,2019-9-1 21:56:29
551,23,4,20,2019-5-18 13:01:13,http://lorempixel.com/400/400/business,Doloremque placeat error molestias non.,254,2019-5-30 23:54:00
552,43,5,23,2019-5-12 20:04:12,http://lorempixel.com/400/400/business,Nesciunt expedita delectus facere velit qui nam tempora esse enim.,229,2019-7-6 14:47:27
553,4,4,18,2019-4-10 21:35:52,http://lorempixel.com/400/400/business,Sit aut eum iusto.,181,2019-9-5 14:26:22
554,7,3,16,2019-6-15 21:08:39,http://lorempixel.com/400/400/business,Impedit itaque est aspernatur commodi culpa placeat adipisci eum.,737,2019-6-16 13:07:59
555,72,5,23,2019-4-15 18:39:08,http://lorempixel.com/400/400/business,Reiciendis rerum nihil sint nisi.,428,2019-8-8 14:32:13
556,82,3,15,2019-5-10 00:44:34,http://lorempixel.com/400/400/business,Ut aut ducimus voluptatem ipsam eos suscipit quia.,36,2019-8-5 03:51:26
557,98,4,20,2019-4-6 23:51:01,http://lorempixel.com/400/400/business,Facilis illo voluptate et necessitatibus voluptates aut voluptate harum.,726,2019-9-11 19:21:45
558,98,1,5,2019-5-6 13:40:22,http://lorempixel.com/400/400/business,Qui libero ab quia.,655,2019-7-12 16:14:31
559,88,2,11,2019-7-5 20:27:56,http://lorempixel.com/400/400/business,In saepe harum quos animi vero et commodi excepturi ab.,10,2019-7-22 08:38:38
560,9,3,16,2019-4-24 08:57:01,http://lorempixel.com/400/400/business,Exercitationem non dolor reprehenderit reprehenderit necessitatibus commodi consequuntur ipsam.,135,2019-5-19 07:33:17
561,92,2,9,2019-5-14 06:16:26,http://lorempixel.com/400/400/business,Aliquam dignissimos eligendi voluptas quia non fugit esse cupiditate.,252,2019-7-16 06:04:47
562,72,2,9,2019-5-3 15:49:52,http://lorempixel.com/400/400/business,Illo aut mollitia suscipit neque ipsam eum ut.,106,2019-8-10 16:14:57
563,82,1,2,2019-6-20 01:29:11,http://lorempixel.com/400/400/business,Voluptatem ad velit labore laboriosam a fugit est enim.,407,2019-8-15 11:24:37
564,54,1,6,2019-6-14 03:10:33,http://lorempixel.com/400/400/business,Omnis velit quia aliquam libero optio.,135,2019-6-27 09:28:22
565,67,3,15,2019-5-4 14:10:05,http://lorempixel.com/400/400/business,Ut voluptatibus natus quo minima nisi quisquam illum voluptatem.,739,2019-5-21 21:00:18
566,98,1,2,2019-4-26 09:09:47,http://lorempixel.com/400/400/business,Possimus excepturi minus necessitatibus.,249,2019-5-23 04:06:19
567,66,2,13,2019-7-26 23:28:12,http://lorempixel.com/400/400/business,Harum excepturi temporibus eos.,481,2019-8-27 21:21:52
568,46,3,15,2019-5-1 19:43:33,http://lorempixel.com/400/400/business,Ipsam aut tempora ea.,952,2019-8-5 15:57:58
