id,room_id,category,subcategory,date,photoUrl,description,cost,dateFixed
287,76,5,22,Thu Apr 11 2019 10:42:26 GMT-0700 (PDT),http://lorempixel.com/400/400/business,Eum culpa dicta ut.,789,Tue Jul 30 2019 21:07:03 GMT-0700 (PDT)
288,60,2,9,Tue Apr 16 2019 22:10:31 GMT-0700 (PDT),http://lorempixel.com/400/400/business,Eos enim esse aliquam.,594,Sun Jul 14 2019 04:45:40 GMT-0700 (PDT)
289,72,4,21,Sat Apr 27 2019 17:14:50 GMT-0700 (PDT),http://lorempixel.com/400/400/business,Illo nemo ipsum eum.,81,Thu Sep 12 2019 01:03:42 GMT-0700 (PDT)
290,44,1,6,Sun Mar 31 2019 18:10:42 GMT-0700 (PDT),http://lorempixel.com/400/400/business,Ut sit sunt ullam ex sequi voluptas in voluptas aut.,496,Mon Apr 15 2019 19:51:38 GMT-0700 (PDT)
291,48,3,16,Tue Jul 09 2019 01:03:15 GMT-0700 (PDT),http://lorempixel.com/400/400/business,Id quo eum ducimus impedit vitae omnis optio.,467,Mon Sep 23 2019 07:27:40 GMT-0700 (PDT)
292,40,3,17,Sun Jul 07 2019 13:16:04 GMT-0700 (PDT),http://lorempixel.com/400/400/business,Placeat ab labore.,239,Mon Jul 15 2019 14:42:29 GMT-0700 (PDT)
293,70,4,19,Fri Jun 14 2019 14:30:56 GMT-0700 (PDT),http://lorempixel.com/400/400/business,Aut consequatur iste ut quia autem.,885,Fri Jun 14 2019 18:45:00 GMT-0700 (PDT)
294,43,5,22,Sat Jul 06 2019 14:31:57 GMT-0700 (PDT),http://lorempixel.com/400/400/business,Provident non officiis fuga amet quo nihil sint laborum.,5,Tue Aug 27 2019 15:55:20 GMT-0700 (PDT)
295,73,1,4,Tue Jun 04 2019 11:03:53 GMT-0700 (PDT),http://lorempixel.com/400/400/business,Dignissimos delectus quasi consequuntur suscipit recusandae nesciunt reiciendis iusto.,133,Fri Aug 09 2019 04:41:53 GMT-0700 (PDT)
296,17,4,18,Thu Jun 13 2019 01:03:08 GMT-0700 (PDT),http://lorempixel.com/400/400/business,Aliquam qui quis placeat explicabo cumque nihil.,272,Sun Sep 01 2019 23:37:04 GMT-0700 (PDT)
297,51,2,12,Thu Jun 27 2019 15:13:03 GMT-0700 (PDT),http://lorempixel.com/400/400/business,Explicabo animi voluptatem quod repellendus consectetur et.,788,Mon Jul 01 2019 02:59:24 GMT-0700 (PDT)
298,30,5,22,Sat Apr 20 2019 15:42:42 GMT-0700 (PDT),http://lorempixel.com/400/400/business,Eos hic vero dolorem libero aliquid dolores et et.,193,Mon Jul 01 2019 19:58:13 GMT-0700 (PDT)
299,59,3,16,Mon May 20 2019 23:15:34 GMT-0700 (PDT),http://lorempixel.com/400/400/business,Omnis dolores architecto sed.,340,Mon Jul 22 2019 01:47:24 GMT-0700 (PDT)
300,36,4,20,Mon Jun 03 2019 07:38:33 GMT-0700 (PDT),http://lorempixel.com/400/400/business,Possimus molestias sit id consequatur dolorem error error.,954,Mon Jul 01 2019 08:21:57 GMT-0700 (PDT)
301,17,5,22,Wed May 22 2019 08:36:17 GMT-0700 (PDT),http://lorempixel.com/400/400/business,Non aut aliquam.,156,Wed May 29 2019 06:23:09 GMT-0700 (PDT)
302,91,4,19,Wed May 29 2019 21:33:34 GMT-0700 (PDT),http://lorempixel.com/400/400/business,Sed qui totam et consequuntur commodi debitis ex.,246,Sat Aug 10 2019 15:59:47 GMT-0700 (PDT)
303,75,4,20,Mon Jun 03 2019 07:10:18 GMT-0700 (PDT),http://lorempixel.com/400/400/business,Culpa maiores error esse.,365,Wed Sep 04 2019 00:33:48 GMT-0700 (PDT)
304,99,3,16,Tue Jun 11 2019 06:46:05 GMT-0700 (PDT),http://lorempixel.com/400/400/business,Ea ut dicta magnam.,335,Sun Aug 18 2019 23:56:50 GMT-0700 (PDT)
305,48,1,4,Fri Jun 07 2019 19:08:10 GMT-0700 (PDT),http://lorempixel.com/400/400/business,Perferendis voluptatibus veniam ad.,398,Sat Sep 21 2019 01:32:21 GMT-0700 (PDT)
306,24,2,11,Sat Apr 06 2019 12:15:39 GMT-0700 (PDT),http://lorempixel.com/400/400/business,Cumque non alias et est ab nobis et.,961,Mon Apr 15 2019 16:53:13 GMT-0700 (PDT)
307,35,1,6,Sat Jul 06 2019 08:11:54 GMT-0700 (PDT),http://lorempixel.com/400/400/business,Maiores deleniti voluptates blanditiis optio.,310,Mon Jul 15 2019 16:38:28 GMT-0700 (PDT)
308,95,2,13,Sun May 05 2019 14:10:02 GMT-0700 (PDT),http://lorempixel.com/400/400/business,Totam sunt aut at vel ut.,952,Mon May 20 2019 17:11:19 GMT-0700 (PDT)
309,36,3,16,Tue Apr 30 2019 22:00:51 GMT-0700 (PDT),http://lorempixel.com/400/400/business,Tenetur corrupti fugit porro tempora ut necessitatibus laborum quas.,122,Fri Sep 06 2019 14:12:31 GMT-0700 (PDT)
310,58,4,21,Mon May 20 2019 00:02:14 GMT-0700 (PDT),http://lorempixel.com/400/400/business,Vero iste ea hic laboriosam at.,871,Mon May 20 2019 18:31:56 GMT-0700 (PDT)
311,85,4,20,Sat Jun 22 2019 03:29:12 GMT-0700 (PDT),http://lorempixel.com/400/400/business,Voluptate tempore dolorem dolorem omnis voluptate quia aut.,352,Sat Sep 14 2019 09:55:10 GMT-0700 (PDT)
312,78,2,12,Sat Jul 20 2019 06:33:37 GMT-0700 (PDT),http://lorempixel.com/400/400/business,Et saepe quia facilis.,643,Sat Sep 07 2019 16:57:24 GMT-0700 (PDT)
313,8,3,17,Sat Aug 03 2019 14:14:58 GMT-0700 (PDT),http://lorempixel.com/400/400/business,Aliquam quasi repellendus ut esse aperiam.,820,Sun Sep 01 2019 11:42:02 GMT-0700 (PDT)
314,53,5,22,Sat Jul 27 2019 22:31:35 GMT-0700 (PDT),http://lorempixel.com/400/400/business,Sit aut exercitationem voluptatem ipsam delectus corrupti.,712,Wed Sep 25 2019 22:19:54 GMT-0700 (PDT)
315,68,4,21,Fri Apr 12 2019 20:00:55 GMT-0700 (PDT),http://lorempixel.com/400/400/business,Id perferendis corporis iste accusantium assumenda tempora.,481,Sun Jun 09 2019 11:21:26 GMT-0700 (PDT)
316,80,2,13,Wed Apr 10 2019 10:12:02 GMT-0700 (PDT),http://lorempixel.com/400/400/business,Eligendi cumque consequuntur vero facilis qui enim saepe a.,65,Wed Sep 25 2019 17:57:05 GMT-0700 (PDT)
317,30,1,1,Sat Jul 27 2019 11:44:03 GMT-0700 (PDT),http://lorempixel.com/400/400/business,Error vel et.,36,Thu Aug 15 2019 13:21:14 GMT-0700 (PDT)
318,23,3,16,Sun Jun 30 2019 01:40:10 GMT-0700 (PDT),http://lorempixel.com/400/400/business,Ut sed ut quibusdam dolorem tenetur.,335,Wed Jul 31 2019 00:04:36 GMT-0700 (PDT)
319,34,1,8,Tue Jul 02 2019 22:39:13 GMT-0700 (PDT),http://lorempixel.com/400/400/business,Ut nulla qui perspiciatis nemo.,947,Thu Jul 25 2019 03:43:44 GMT-0700 (PDT)
320,23,3,16,Sun Apr 28 2019 07:46:13 GMT-0700 (PDT),http://lorempixel.com/400/400/business,Nemo reprehenderit mollitia repellat neque quidem.,65,Tue Aug 20 2019 15:17:19 GMT-0700 (PDT)
321,92,4,19,Mon Jul 22 2019 21:54:57 GMT-0700 (PDT),http://lorempixel.com/400/400/business,Perferendis quis voluptas quas non deleniti.,187,Sat Aug 10 2019 02:39:19 GMT-0700 (PDT)
322,86,4,21,Tue Apr 23 2019 01:26:43 GMT-0700 (PDT),http://lorempixel.com/400/400/business,Odit dolore voluptatum quos blanditiis occaecati voluptatum sapiente nihil.,433,Wed Jul 31 2019 15:30:01 GMT-0700 (PDT)
323,88,5,23,Sat Jun 08 2019 19:45:10 GMT-0700 (PDT),http://lorempixel.com/400/400/business,Soluta illo et vel cumque placeat consequuntur eveniet.,335,Thu Jul 04 2019 08:23:44 GMT-0700 (PDT)
324,14,3,14,Tue Jul 02 2019 05:19:06 GMT-0700 (PDT),http://lorempixel.com/400/400/business,Sint ut dicta voluptatem alias totam ut alias.,42,Mon Jul 29 2019 14:42:39 GMT-0700 (PDT)
325,5,3,17,Wed Jul 10 2019 14:17:11 GMT-0700 (PDT),http://lorempixel.com/400/400/business,Numquam hic ipsam molestias eveniet atque nesciunt.,726,Wed Sep 04 2019 22:30:40 GMT-0700 (PDT)
326,76,1,8,Sun Jul 28 2019 13:05:46 GMT-0700 (PDT),http://lorempixel.com/400/400/business,Perferendis non ad.,647,Fri Aug 02 2019 18:05:47 GMT-0700 (PDT)
327,31,4,21,Wed May 15 2019 02:07:07 GMT-0700 (PDT),http://lorempixel.com/400/400/business,Non error quia sint ipsam libero delectus ut in.,68,Mon Jul 01 2019 15:34:52 GMT-0700 (PDT)
328,24,2,11,Thu May 02 2019 04:23:24 GMT-0700 (PDT),http://lorempixel.com/400/400/business,Nam fugiat accusamus qui est.,260,Tue May 28 2019 08:16:00 GMT-0700 (PDT)
329,28,1,5,Tue Apr 30 2019 08:18:14 GMT-0700 (PDT),http://lorempixel.com/400/400/business,Similique provident sunt aut sit eaque sunt.,424,Fri Sep 27 2019 04:15:12 GMT-0700 (PDT)
330,31,4,18,Mon May 06 2019 06:28:36 GMT-0700 (PDT),http://lorempixel.com/400/400/business,Modi ratione ab eveniet distinctio minima sed exercitationem est.,272,Sun Jun 30 2019 08:16:32 GMT-0700 (PDT)
331,77,5,22,Fri Apr 12 2019 22:06:09 GMT-0700 (PDT),http://lorempixel.com/400/400/business,Possimus in quasi a molestiae nesciunt ea.,857,Mon Jun 17 2019 10:08:55 GMT-0700 (PDT)
332,68,2,11,Wed May 01 2019 12:33:12 GMT-0700 (PDT),http://lorempixel.com/400/400/business,Ut dolores eveniet.,546,Tue Sep 03 2019 00:21:45 GMT-0700 (PDT)
333,41,4,19,Tue Apr 02 2019 08:27:30 GMT-0700 (PDT),http://lorempixel.com/400/400/business,Omnis eum quisquam.,264,Sat Jun 29 2019 19:30:41 GMT-0700 (PDT)
334,78,2,13,Thu Jun 20 2019 16:38:27 GMT-0700 (PDT),http://lorempixel.com/400/400/business,Facere aliquam vitae magnam perspiciatis id accusantium laudantium totam nesciunt.,346,Thu Jun 20 2019 18:57:20 GMT-0700 (PDT)
335,3,2,11,Sat Apr 13 2019 17:48:55 GMT-0700 (PDT),http://lorempixel.com/400/400/business,Enim aut voluptatum vel sint labore voluptatem qui accusantium.,847,Mon May 20 2019 21:13:38 GMT-0700 (PDT)
336,46,4,21,Wed Jun 12 2019 03:48:47 GMT-0700 (PDT),http://lorempixel.com/400/400/business,Qui libero esse et animi facilis exercitationem eveniet.,31,Sat Sep 21 2019 20:05:03 GMT-0700 (PDT)
337,14,4,18,Wed Jun 26 2019 00:58:05 GMT-0700 (PDT),http://lorempixel.com/400/400/business,Non exercitationem accusamus corporis ipsum eveniet nostrum ex dolorem.,775,Wed Jul 03 2019 14:14:58 GMT-0700 (PDT)
338,19,3,14,Wed Apr 03 2019 16:59:56 GMT-0700 (PDT),http://lorempixel.com/400/400/business,Quo quia molestias ratione explicabo nesciunt deleniti repellendus.,935,Thu Apr 11 2019 06:59:06 GMT-0700 (PDT)
339,72,1,4,Thu Jun 20 2019 13:28:44 GMT-0700 (PDT),http://lorempixel.com/400/400/business,Ut cum quis sit nulla hic omnis.,711,Sat Sep 07 2019 22:08:14 GMT-0700 (PDT)
340,7,5,23,Tue May 14 2019 21:38:23 GMT-0700 (PDT),http://lorempixel.com/400/400/business,Tenetur et autem distinctio impedit vel quia.,520,Mon Sep 16 2019 01:16:48 GMT-0700 (PDT)
341,81,1,3,Mon Apr 29 2019 17:40:57 GMT-0700 (PDT),http://lorempixel.com/400/400/business,Voluptate aut officia molestias blanditiis optio corrupti dolorem voluptas non.,612,Fri Jul 19 2019 22:06:48 GMT-0700 (PDT)
342,70,4,20,Mon May 06 2019 06:55:40 GMT-0700 (PDT),http://lorempixel.com/400/400/business,Id vero corrupti.,882,Fri Jun 14 2019 15:50:22 GMT-0700 (PDT)
343,21,3,14,Sat Apr 20 2019 12:39:14 GMT-0700 (PDT),http://lorempixel.com/400/400/business,Itaque nam ut odio architecto quis dolorum.,513,Thu Jul 25 2019 09:53:14 GMT-0700 (PDT)
344,47,2,12,Sun Jun 30 2019 06:20:14 GMT-0700 (PDT),http://lorempixel.com/400/400/business,Provident et enim voluptatem quasi harum sunt sit.,159,Mon Sep 30 2019 12:23:25 GMT-0700 (PDT)
345,51,4,21,Mon Apr 15 2019 08:15:04 GMT-0700 (PDT),http://lorempixel.com/400/400/business,Dolorem maxime sapiente natus explicabo.,346,Sat Jun 01 2019 22:43:24 GMT-0700 (PDT)
346,73,4,18,Mon May 27 2019 19:50:32 GMT-0700 (PDT),http://lorempixel.com/400/400/business,Debitis est voluptate voluptatem cupiditate voluptatem maxime excepturi fugiat.,966,Fri Aug 02 2019 22:53:40 GMT-0700 (PDT)
347,5,4,19,Wed Jul 17 2019 06:21:25 GMT-0700 (PDT),http://lorempixel.com/400/400/business,Ratione neque velit eum recusandae illo eius nesciunt eaque ut.,279,Wed Aug 14 2019 17:13:25 GMT-0700 (PDT)
348,54,5,22,Wed May 29 2019 03:40:40 GMT-0700 (PDT),http://lorempixel.com/400/400/business,Eos animi dolores molestias maiores.,746,Sun Sep 29 2019 12:52:14 GMT-0700 (PDT)
349,51,4,21,Sun May 19 2019 22:30:48 GMT-0700 (PDT),http://lorempixel.com/400/400/business,Aspernatur a optio deserunt quod exercitationem sint enim enim architecto.,196,Sun Aug 11 2019 01:38:48 GMT-0700 (PDT)
350,16,4,20,Thu Jul 04 2019 02:30:46 GMT-0700 (PDT),http://lorempixel.com/400/400/business,Quaerat blanditiis veritatis similique ipsam ad.,841,Tue Aug 13 2019 00:25:00 GMT-0700 (PDT)
351,42,2,12,Tue Apr 09 2019 13:56:28 GMT-0700 (PDT),http://lorempixel.com/400/400/business,Non facilis dignissimos.,114,Thu May 16 2019 13:35:40 GMT-0700 (PDT)
352,89,5,23,Fri Jun 07 2019 19:50:50 GMT-0700 (PDT),http://lorempixel.com/400/400/business,Accusamus recusandae odio eum ea.,793,Sun Jul 28 2019 07:48:39 GMT-0700 (PDT)
353,11,5,23,Fri Jun 28 2019 07:02:42 GMT-0700 (PDT),http://lorempixel.com/400/400/business,Consequatur et sit assumenda et est dolor aspernatur officia.,6,Tue Aug 06 2019 08:04:09 GMT-0700 (PDT)
354,11,4,19,Sun Jul 07 2019 03:23:19 GMT-0700 (PDT),http://lorempixel.com/400/400/business,Maiores similique voluptas reiciendis ad.,549,Sat Aug 10 2019 15:50:35 GMT-0700 (PDT)
355,34,3,15,Wed May 08 2019 07:19:25 GMT-0700 (PDT),http://lorempixel.com/400/400/business,Voluptatum perferendis aut quia est blanditiis a pariatur voluptas eos.,193,Thu Aug 22 2019 01:53:03 GMT-0700 (PDT)
356,31,4,21,Tue May 07 2019 06:53:20 GMT-0700 (PDT),http://lorempixel.com/400/400/business,Ea voluptatem quia fugiat omnis consequatur et consequatur.,171,Mon Jul 08 2019 17:53:26 GMT-0700 (PDT)
357,55,3,14,Sat Jun 01 2019 02:00:44 GMT-0700 (PDT),http://lorempixel.com/400/400/business,Quibusdam nisi modi nostrum.,740,Thu Jun 13 2019 19:11:35 GMT-0700 (PDT)
358,6,5,23,Wed May 15 2019 16:51:41 GMT-0700 (PDT),http://lorempixel.com/400/400/business,Ipsam sit nisi quia labore rerum at.,177,Sun Sep 15 2019 08:03:04 GMT-0700 (PDT)
359,46,1,5,Wed Jun 19 2019 17:48:56 GMT-0700 (PDT),http://lorempixel.com/400/400/business,Atque dolores voluptas ullam magni error non totam.,755,Wed Jul 03 2019 18:04:21 GMT-0700 (PDT)
360,30,3,14,Sat Jul 20 2019 06:42:58 GMT-0700 (PDT),http://lorempixel.com/400/400/business,Nostrum voluptatem libero sed sed fuga est blanditiis repellat recusandae.,697,Sat Sep 21 2019 21:28:39 GMT-0700 (PDT)
361,48,3,17,Tue Jul 16 2019 03:24:28 GMT-0700 (PDT),http://lorempixel.com/400/400/business,Doloribus reprehenderit eveniet.,784,Thu Aug 22 2019 03:22:29 GMT-0700 (PDT)
362,65,1,3,Fri Jun 14 2019 16:48:09 GMT-0700 (PDT),http://lorempixel.com/400/400/business,Sunt adipisci cumque error nihil sapiente dignissimos impedit et cum.,404,Tue Jul 09 2019 12:11:48 GMT-0700 (PDT)
363,52,5,23,Fri Aug 02 2019 21:19:46 GMT-0700 (PDT),http://lorempixel.com/400/400/business,Aut tempore veritatis cumque error dolore ipsam.,84,Mon Aug 19 2019 10:47:39 GMT-0700 (PDT)
364,52,4,21,Wed Apr 17 2019 08:16:58 GMT-0700 (PDT),http://lorempixel.com/400/400/business,Amet est sequi exercitationem.,788,Mon Jul 01 2019 08:28:49 GMT-0700 (PDT)
365,87,5,23,Sun Jun 09 2019 03:44:07 GMT-0700 (PDT),http://lorempixel.com/400/400/business,Nihil provident enim voluptatibus facilis dolor.,416,Sun Jul 14 2019 01:33:56 GMT-0700 (PDT)
366,64,5,23,Thu Jun 06 2019 00:22:24 GMT-0700 (PDT),http://lorempixel.com/400/400/business,Neque autem ut.,510,Fri Aug 16 2019 20:55:43 GMT-0700 (PDT)
367,32,5,23,Mon Jun 17 2019 07:28:59 GMT-0700 (PDT),http://lorempixel.com/400/400/business,Perspiciatis et ut natus eum similique qui omnis vel quisquam.,132,Wed Jun 19 2019 11:01:09 GMT-0700 (PDT)
368,71,1,2,Sun Jul 07 2019 13:20:06 GMT-0700 (PDT),http://lorempixel.com/400/400/business,Sint omnis facere.,866,Fri Sep 06 2019 22:29:51 GMT-0700 (PDT)
369,32,4,20,Mon May 20 2019 11:29:38 GMT-0700 (PDT),http://lorempixel.com/400/400/business,Corporis rerum id sit et at quia quas.,801,Thu Sep 12 2019 21:57:31 GMT-0700 (PDT)
370,15,4,21,Sun May 05 2019 05:31:47 GMT-0700 (PDT),http://lorempixel.com/400/400/business,Neque aut error et ex ipsa dolores officiis aliquid excepturi.,49,Sat Aug 03 2019 11:14:09 GMT-0700 (PDT)
371,81,1,5,Thu Jul 25 2019 00:34:18 GMT-0700 (PDT),http://lorempixel.com/400/400/business,Esse voluptatem illum inventore vel reiciendis perferendis nulla sed.,716,Mon Aug 26 2019 04:50:11 GMT-0700 (PDT)
372,3,5,22,Fri May 31 2019 05:16:24 GMT-0700 (PDT),http://lorempixel.com/400/400/business,Consequatur qui nisi non.,379,Sat Sep 07 2019 01:56:08 GMT-0700 (PDT)
373,61,3,14,Thu Jun 13 2019 04:39:11 GMT-0700 (PDT),http://lorempixel.com/400/400/business,Quibusdam et voluptas consequuntur.,104,Wed Aug 14 2019 13:20:54 GMT-0700 (PDT)
374,57,3,17,Thu Jun 13 2019 11:22:35 GMT-0700 (PDT),http://lorempixel.com/400/400/business,Iste accusamus magni provident aut odit.,5,Sat Aug 24 2019 16:49:39 GMT-0700 (PDT)
375,14,4,18,Thu Jul 18 2019 13:20:58 GMT-0700 (PDT),http://lorempixel.com/400/400/business,Voluptatem nam quaerat nihil eos.,908,Mon Sep 02 2019 05:37:09 GMT-0700 (PDT)
376,56,3,16,Mon Jul 29 2019 09:50:20 GMT-0700 (PDT),http://lorempixel.com/400/400/business,Ut cumque voluptatum dignissimos nostrum sit unde.,839,Mon Sep 02 2019 11:46:34 GMT-0700 (PDT)
377,89,1,3,Tue Jun 04 2019 08:22:15 GMT-0700 (PDT),http://lorempixel.com/400/400/business,Tempora alias doloremque eveniet.,384,Tue Aug 06 2019 20:14:47 GMT-0700 (PDT)
378,16,5,22,Tue Apr 30 2019 20:53:23 GMT-0700 (PDT),http://lorempixel.com/400/400/business,Error voluptatem inventore.,932,Wed May 08 2019 14:50:50 GMT-0700 (PDT)
379,83,4,18,Mon Jul 08 2019 08:03:50 GMT-0700 (PDT),http://lorempixel.com/400/400/business,Fugit nulla neque repudiandae nobis quis et consequatur eum.,255,Sat Jul 20 2019 23:04:02 GMT-0700 (PDT)
380,44,3,16,Fri Jun 07 2019 03:44:05 GMT-0700 (PDT),http://lorempixel.com/400/400/business,Et non ducimus nihil qui.,646,Thu Sep 19 2019 20:18:07 GMT-0700 (PDT)
381,99,1,6,Tue May 21 2019 13:06:08 GMT-0700 (PDT),http://lorempixel.com/400/400/business,Expedita cumque impedit enim ea accusantium.,20,Wed Jul 10 2019 05:03:09 GMT-0700 (PDT)
382,95,1,7,Mon Jul 29 2019 03:36:11 GMT-0700 (PDT),http://lorempixel.com/400/400/business,Non et eaque reprehenderit soluta quaerat distinctio.,501,Tue Sep 03 2019 15:54:57 GMT-0700 (PDT)
383,32,4,19,Sun Apr 07 2019 22:49:29 GMT-0700 (PDT),http://lorempixel.com/400/400/business,Dolor esse enim tempora et officiis ratione sed omnis error.,474,Mon Jul 29 2019 07:09:45 GMT-0700 (PDT)
384,43,5,22,Fri Jun 07 2019 10:51:21 GMT-0700 (PDT),http://lorempixel.com/400/400/business,Deserunt est occaecati voluptatem impedit a voluptatibus eos est.,800,Wed Aug 28 2019 08:47:00 GMT-0700 (PDT)
385,91,3,16,Wed May 01 2019 05:15:12 GMT-0700 (PDT),http://lorempixel.com/400/400/business,Earum dicta autem qui.,285,Fri May 31 2019 14:09:21 GMT-0700 (PDT)
386,65,1,8,Sun May 19 2019 03:07:11 GMT-0700 (PDT),http://lorempixel.com/400/400/business,Adipisci nam quaerat velit quo autem vel.,453,Wed Aug 28 2019 20:27:19 GMT-0700 (PDT)
387,64,2,11,Fri May 24 2019 08:31:14 GMT-0700 (PDT),http://lorempixel.com/400/400/business,Aut saepe deserunt architecto doloribus vitae nulla esse maxime.,565,Sat Aug 17 2019 21:32:33 GMT-0700 (PDT)
388,48,4,20,Sat Apr 13 2019 21:01:18 GMT-0700 (PDT),http://lorempixel.com/400/400/business,Molestias sunt dicta eligendi.,185,Fri Jun 28 2019 15:35:20 GMT-0700 (PDT)
389,60,3,17,Mon Jun 10 2019 09:45:45 GMT-0700 (PDT),http://lorempixel.com/400/400/business,Delectus officia repellat dolore inventore ut et.,109,Wed Jun 19 2019 06:26:31 GMT-0700 (PDT)
390,90,1,5,Thu May 09 2019 07:10:10 GMT-0700 (PDT),http://lorempixel.com/400/400/business,Et officiis labore vero quo vel recusandae reprehenderit reiciendis.,821,Thu Jul 18 2019 20:04:33 GMT-0700 (PDT)
391,61,3,16,Wed Apr 10 2019 08:02:39 GMT-0700 (PDT),http://lorempixel.com/400/400/business,Et magni enim deserunt nam voluptatem qui vel nesciunt.,566,Sun Jun 02 2019 12:06:53 GMT-0700 (PDT)
392,89,2,11,Thu Jul 18 2019 10:30:02 GMT-0700 (PDT),http://lorempixel.com/400/400/business,Sed nesciunt quas necessitatibus et velit ut fuga voluptate.,588,Sun Sep 01 2019 15:19:24 GMT-0700 (PDT)
393,4,5,23,Fri Jun 07 2019 12:00:58 GMT-0700 (PDT),http://lorempixel.com/400/400/business,Dolor eaque adipisci nostrum rem atque iste aut possimus.,117,Tue Sep 03 2019 03:55:50 GMT-0700 (PDT)
394,48,1,2,Fri Jul 12 2019 09:20:09 GMT-0700 (PDT),http://lorempixel.com/400/400/business,Saepe ut quas.,206,Thu Aug 15 2019 03:35:19 GMT-0700 (PDT)
395,82,5,22,Wed Jun 26 2019 05:44:00 GMT-0700 (PDT),http://lorempixel.com/400/400/business,Blanditiis quidem neque quidem labore laborum velit architecto molestias veniam.,668,Tue Aug 20 2019 09:29:37 GMT-0700 (PDT)
396,32,3,14,Wed Jul 17 2019 02:46:06 GMT-0700 (PDT),http://lorempixel.com/400/400/business,Accusantium quo fugit ad nihil.,327,Tue Sep 03 2019 11:00:38 GMT-0700 (PDT)
397,66,2,13,Wed Jun 12 2019 12:09:47 GMT-0700 (PDT),http://lorempixel.com/400/400/business,Voluptatem omnis est eaque.,336,Wed Aug 21 2019 14:55:34 GMT-0700 (PDT)
398,62,5,23,Thu May 30 2019 11:27:06 GMT-0700 (PDT),http://lorempixel.com/400/400/business,Atque optio harum quae.,112,Sat Sep 07 2019 23:20:00 GMT-0700 (PDT)
399,7,1,4,Tue Apr 02 2019 01:52:14 GMT-0700 (PDT),http://lorempixel.com/400/400/business,Quis deleniti sequi.,584,Fri Jul 26 2019 16:45:31 GMT-0700 (PDT)
400,61,5,23,Wed May 08 2019 21:21:22 GMT-0700 (PDT),http://lorempixel.com/400/400/business,Nihil ullam vel ut omnis eos repellendus aperiam voluptatum.,878,Fri Jun 14 2019 21:47:03 GMT-0700 (PDT)
401,73,2,13,Sat Apr 13 2019 09:39:44 GMT-0700 (PDT),http://lorempixel.com/400/400/business,Omnis eum omnis temporibus vel consequatur et modi.,646,Fri Jul 19 2019 18:58:49 GMT-0700 (PDT)
402,47,1,7,Fri Apr 19 2019 06:30:58 GMT-0700 (PDT),http://lorempixel.com/400/400/business,Occaecati et ut ut repudiandae dolor et velit debitis rerum.,17,Fri Jul 26 2019 09:54:41 GMT-0700 (PDT)
403,13,3,16,Mon Jul 22 2019 12:48:08 GMT-0700 (PDT),http://lorempixel.com/400/400/business,Ea similique expedita doloribus amet enim nihil consequuntur.,597,Sat Aug 24 2019 14:33:27 GMT-0700 (PDT)
404,36,2,13,Fri Jul 05 2019 05:38:38 GMT-0700 (PDT),http://lorempixel.com/400/400/business,Accusamus est earum eos eum molestias qui minus.,558,Sat Jul 06 2019 15:27:44 GMT-0700 (PDT)
405,43,4,20,Tue Jun 25 2019 10:34:13 GMT-0700 (PDT),http://lorempixel.com/400/400/business,Sint eos in totam maiores.,467,Mon Sep 30 2019 01:50:59 GMT-0700 (PDT)
406,69,2,11,Tue Jul 09 2019 11:07:16 GMT-0700 (PDT),http://lorempixel.com/400/400/business,Adipisci eius dolorum sint et id.,363,Tue Aug 13 2019 05:54:13 GMT-0700 (PDT)
407,43,3,14,Sun Jun 09 2019 01:06:13 GMT-0700 (PDT),http://lorempixel.com/400/400/business,Quisquam itaque aliquid ullam ipsa.,613,Mon Jul 29 2019 14:52:31 GMT-0700 (PDT)
408,70,4,21,Wed Jul 03 2019 05:39:47 GMT-0700 (PDT),http://lorempixel.com/400/400/business,Non enim vitae.,953,Fri Jul 19 2019 09:15:18 GMT-0700 (PDT)
409,40,4,20,Tue Jul 16 2019 12:03:17 GMT-0700 (PDT),http://lorempixel.com/400/400/business,Quasi autem autem dolorem laudantium.,574,Sat Sep 14 2019 20:37:06 GMT-0700 (PDT)
410,96,2,11,Tue Jul 16 2019 12:53:39 GMT-0700 (PDT),http://lorempixel.com/400/400/business,Ratione occaecati voluptas.,988,Tue Aug 27 2019 03:21:47 GMT-0700 (PDT)
411,52,2,10,Wed Jul 17 2019 09:28:30 GMT-0700 (PDT),http://lorempixel.com/400/400/business,Aut inventore numquam.,953,Thu Aug 22 2019 14:38:22 GMT-0700 (PDT)
412,77,5,22,Wed Jul 03 2019 16:49:59 GMT-0700 (PDT),http://lorempixel.com/400/400/business,Ad aspernatur sit eum eos deserunt nobis ut neque enim.,930,Wed Aug 14 2019 22:24:29 GMT-0700 (PDT)
413,27,1,1,Sat Apr 06 2019 21:33:47 GMT-0700 (PDT),http://lorempixel.com/400/400/business,Beatae labore enim quis impedit architecto.,92,Sun Sep 15 2019 13:22:50 GMT-0700 (PDT)
414,11,2,10,Fri Apr 26 2019 16:25:43 GMT-0700 (PDT),http://lorempixel.com/400/400/business,Provident et eum itaque occaecati quia suscipit quo.,965,Sun Jun 02 2019 12:28:42 GMT-0700 (PDT)
415,6,2,9,Fri Apr 19 2019 05:59:36 GMT-0700 (PDT),http://lorempixel.com/400/400/business,Perspiciatis voluptatibus dolorum sed omnis.,454,Mon Jul 29 2019 18:52:04 GMT-0700 (PDT)
416,21,2,13,Wed Jun 05 2019 09:46:18 GMT-0700 (PDT),http://lorempixel.com/400/400/business,Quisquam id harum consequatur quae ea hic optio quae.,181,Tue Aug 27 2019 10:19:49 GMT-0700 (PDT)
417,51,3,16,Mon Jul 15 2019 11:38:50 GMT-0700 (PDT),http://lorempixel.com/400/400/business,Cupiditate excepturi eligendi voluptatibus omnis laboriosam eaque et.,487,Thu Aug 15 2019 00:14:31 GMT-0700 (PDT)
418,18,5,22,Fri Apr 19 2019 13:57:39 GMT-0700 (PDT),http://lorempixel.com/400/400/business,Dignissimos rerum id facere illum a molestiae.,482,Thu May 23 2019 17:00:04 GMT-0700 (PDT)
419,14,3,16,Thu Apr 04 2019 21:00:45 GMT-0700 (PDT),http://lorempixel.com/400/400/business,Saepe porro natus est illum praesentium animi.,608,Tue Apr 23 2019 00:09:16 GMT-0700 (PDT)
420,25,2,13,Wed Jun 12 2019 04:38:23 GMT-0700 (PDT),http://lorempixel.com/400/400/business,Aut aut sed necessitatibus qui non nesciunt reiciendis et.,43,Wed Aug 07 2019 06:22:49 GMT-0700 (PDT)
421,99,4,19,Wed Jun 19 2019 14:15:38 GMT-0700 (PDT),http://lorempixel.com/400/400/business,Distinctio voluptas incidunt eveniet est doloremque sapiente accusantium facilis dolor.,426,Sun Aug 25 2019 14:09:32 GMT-0700 (PDT)
422,25,3,16,Sat Jun 29 2019 13:32:55 GMT-0700 (PDT),http://lorempixel.com/400/400/business,Earum aut unde vel molestiae animi.,468,Thu Jul 04 2019 20:42:16 GMT-0700 (PDT)
423,13,5,22,Thu Jun 20 2019 11:58:01 GMT-0700 (PDT),http://lorempixel.com/400/400/business,Ipsum mollitia cumque corrupti qui.,76,Mon Aug 05 2019 21:42:36 GMT-0700 (PDT)
424,58,2,11,Wed May 08 2019 00:53:06 GMT-0700 (PDT),http://lorempixel.com/400/400/business,Odit velit odio et beatae porro itaque qui.,211,Sat Jun 01 2019 16:36:57 GMT-0700 (PDT)
425,50,4,20,Fri Aug 02 2019 16:31:50 GMT-0700 (PDT),http://lorempixel.com/400/400/business,Error velit eum dolores qui.,478,Sun Sep 01 2019 01:19:38 GMT-0700 (PDT)
426,23,5,22,Thu Aug 01 2019 07:53:37 GMT-0700 (PDT),http://lorempixel.com/400/400/business,Eius quidem totam consequatur dolor error voluptates et.,921,Tue Sep 17 2019 05:51:50 GMT-0700 (PDT)
427,21,1,4,Wed May 22 2019 02:31:28 GMT-0700 (PDT),http://lorempixel.com/400/400/business,Tenetur dolores necessitatibus rerum voluptatem.,615,Thu Sep 12 2019 11:22:53 GMT-0700 (PDT)
428,88,1,6,Thu Jul 11 2019 05:30:26 GMT-0700 (PDT),http://lorempixel.com/400/400/business,Omnis ut assumenda amet facere omnis.,80,Wed Aug 07 2019 04:43:51 GMT-0700 (PDT)
429,17,2,11,Mon May 20 2019 04:44:34 GMT-0700 (PDT),http://lorempixel.com/400/400/business,Autem dolorem et molestiae.,383,Thu Aug 29 2019 09:56:28 GMT-0700 (PDT)
