id,room_id,category,subcategory,date,photoUrl,description,cost,dateFixed
574,86,2,13,Wed Jun 05 2019 01:07:56 GMT-0700 (PDT),http://lorempixel.com/400/400/business,Veniam voluptatibus quo fugiat magni.,378,Sun Jul 07 2019 00:22:31 GMT-0700 (PDT)
575,96,4,18,Wed May 29 2019 18:05:28 GMT-0700 (PDT),http://lorempixel.com/400/400/business,Quasi vero corporis quia amet.,45,Sun Sep 22 2019 16:43:25 GMT-0700 (PDT)
576,1,5,22,Fri Jul 26 2019 15:28:53 GMT-0700 (PDT),http://lorempixel.com/400/400/business,Quae qui nihil dolor.,628,Tue Sep 10 2019 22:46:44 GMT-0700 (PDT)
577,15,1,8,Wed Jun 05 2019 15:42:48 GMT-0700 (PDT),http://lorempixel.com/400/400/business,Sint hic iusto.,189,Sat Jun 08 2019 10:47:36 GMT-0700 (PDT)
578,15,2,9,Tue Jun 25 2019 03:08:58 GMT-0700 (PDT),http://lorempixel.com/400/400/business,Voluptatibus sequi molestias et et ut ullam qui quis modi.,347,Sun Aug 25 2019 14:33:47 GMT-0700 (PDT)
579,53,1,8,Sun Jul 14 2019 23:02:37 GMT-0700 (PDT),http://lorempixel.com/400/400/business,Qui cum sit dolores aliquid quia magnam consectetur doloribus.,905,Wed Aug 14 2019 07:51:16 GMT-0700 (PDT)
580,14,2,12,Wed May 15 2019 20:19:33 GMT-0700 (PDT),http://lorempixel.com/400/400/business,At id rerum molestias aliquam ut ipsum.,228,Fri Aug 16 2019 04:12:22 GMT-0700 (PDT)
581,53,2,11,Wed Jul 31 2019 11:48:50 GMT-0700 (PDT),http://lorempixel.com/400/400/business,Facilis molestias error dignissimos quo est quis et exercitationem.,317,Wed Sep 18 2019 03:29:52 GMT-0700 (PDT)
582,25,4,21,Tue Apr 23 2019 14:49:37 GMT-0700 (PDT),http://lorempixel.com/400/400/business,Qui sed eum animi voluptatem reiciendis totam et.,677,Sat Jul 06 2019 14:30:39 GMT-0700 (PDT)
583,5,5,23,Fri May 17 2019 23:56:32 GMT-0700 (PDT),http://lorempixel.com/400/400/business,Ratione est doloribus magnam quia.,334,Tue Aug 27 2019 14:32:22 GMT-0700 (PDT)
584,53,3,14,Mon Jun 24 2019 23:25:28 GMT-0700 (PDT),http://lorempixel.com/400/400/business,Dolorem omnis et.,203,Tue Jul 09 2019 05:27:42 GMT-0700 (PDT)
585,19,2,11,Sun Jul 14 2019 07:09:53 GMT-0700 (PDT),http://lorempixel.com/400/400/business,Suscipit magnam recusandae neque nostrum.,181,Sun Sep 08 2019 08:54:07 GMT-0700 (PDT)
586,49,2,13,Tue May 28 2019 13:45:34 GMT-0700 (PDT),http://lorempixel.com/400/400/business,Eos vitae beatae.,992,Sun Jun 30 2019 23:45:15 GMT-0700 (PDT)
587,97,4,19,Tue Jun 11 2019 14:41:30 GMT-0700 (PDT),http://lorempixel.com/400/400/business,Quia eos laboriosam enim asperiores dolor expedita nulla eveniet.,953,Sun Sep 01 2019 03:40:27 GMT-0700 (PDT)
588,32,5,22,Tue May 07 2019 22:37:04 GMT-0700 (PDT),http://lorempixel.com/400/400/business,Quod et eos magnam aut.,885,Wed Aug 14 2019 11:57:54 GMT-0700 (PDT)
589,9,3,17,Fri Apr 26 2019 12:25:00 GMT-0700 (PDT),http://lorempixel.com/400/400/business,Suscipit quod maxime similique.,136,Thu Jul 04 2019 21:42:19 GMT-0700 (PDT)
590,58,2,9,Fri Jul 05 2019 21:43:33 GMT-0700 (PDT),http://lorempixel.com/400/400/business,Aliquid est magnam dolorem.,912,Thu Sep 19 2019 14:48:53 GMT-0700 (PDT)
591,45,4,21,Sun May 05 2019 03:18:29 GMT-0700 (PDT),http://lorempixel.com/400/400/business,Aut optio voluptatibus sunt provident dolor quae provident deleniti necessitatibus.,963,Sun Jul 21 2019 03:43:49 GMT-0700 (PDT)
592,63,4,20,Fri Apr 12 2019 17:52:16 GMT-0700 (PDT),http://lorempixel.com/400/400/business,Illum nobis dignissimos quaerat voluptas quis.,998,Fri Sep 06 2019 15:26:46 GMT-0700 (PDT)
593,23,1,2,Sat Aug 03 2019 21:19:55 GMT-0700 (PDT),http://lorempixel.com/400/400/business,Et voluptatem molestiae assumenda enim dolores.,857,Sun Aug 25 2019 16:11:23 GMT-0700 (PDT)
594,42,1,5,Sat May 18 2019 07:30:42 GMT-0700 (PDT),http://lorempixel.com/400/400/business,Perspiciatis consequuntur illum expedita dicta iure labore qui nisi in.,813,Fri Sep 27 2019 10:59:19 GMT-0700 (PDT)
595,40,3,16,Thu Apr 18 2019 17:49:20 GMT-0700 (PDT),http://lorempixel.com/400/400/business,Hic est est numquam sunt consequuntur aut voluptatem quia sint.,303,Fri Jul 05 2019 05:48:13 GMT-0700 (PDT)
596,30,1,4,Sun Jul 14 2019 12:30:58 GMT-0700 (PDT),http://lorempixel.com/400/400/business,Quisquam vitae omnis cumque sunt saepe autem consequatur error.,982,Thu Sep 19 2019 16:10:31 GMT-0700 (PDT)
597,52,4,21,Mon Jul 01 2019 20:11:26 GMT-0700 (PDT),http://lorempixel.com/400/400/business,Modi neque enim.,778,Tue Sep 03 2019 07:01:39 GMT-0700 (PDT)
598,25,2,10,Fri Apr 26 2019 18:50:35 GMT-0700 (PDT),http://lorempixel.com/400/400/business,Exercitationem laboriosam perferendis ut.,588,Tue Jul 16 2019 00:48:30 GMT-0700 (PDT)
599,5,5,23,Sat May 11 2019 05:59:54 GMT-0700 (PDT),http://lorempixel.com/400/400/business,Atque sit odit.,255,Sat Jul 06 2019 22:21:41 GMT-0700 (PDT)
600,2,3,17,Sat May 25 2019 01:40:29 GMT-0700 (PDT),http://lorempixel.com/400/400/business,Magnam earum sint officia ea qui sed voluptatibus est.,241,Tue Aug 27 2019 06:27:02 GMT-0700 (PDT)
601,36,4,19,Sun Jul 28 2019 21:24:52 GMT-0700 (PDT),http://lorempixel.com/400/400/business,Delectus et est ipsa.,750,Mon Aug 05 2019 16:08:33 GMT-0700 (PDT)
602,35,1,2,Fri May 31 2019 01:29:04 GMT-0700 (PDT),http://lorempixel.com/400/400/business,Perferendis inventore quod repellat provident veniam fugit quibusdam corporis qui.,766,Wed Jun 12 2019 15:52:22 GMT-0700 (PDT)
603,28,4,19,Tue Apr 02 2019 00:02:39 GMT-0700 (PDT),http://lorempixel.com/400/400/business,Soluta ea possimus voluptate.,221,Thu Jul 11 2019 18:04:04 GMT-0700 (PDT)
604,10,5,22,Fri Jun 21 2019 17:25:57 GMT-0700 (PDT),http://lorempixel.com/400/400/business,Quisquam dolores beatae labore voluptatem et beatae dicta.,563,Tue Aug 06 2019 15:24:04 GMT-0700 (PDT)
605,55,3,14,Mon Apr 22 2019 15:16:05 GMT-0700 (PDT),http://lorempixel.com/400/400/business,Quod est atque et sit.,362,Mon Aug 19 2019 15:52:22 GMT-0700 (PDT)
606,7,4,19,Tue May 07 2019 05:35:10 GMT-0700 (PDT),http://lorempixel.com/400/400/business,Id veniam dolorum aliquid deleniti.,321,Wed Aug 28 2019 14:12:12 GMT-0700 (PDT)
607,60,3,14,Sun Jun 16 2019 13:24:01 GMT-0700 (PDT),http://lorempixel.com/400/400/business,Autem in sed quidem odit ea deserunt.,114,Wed Jul 03 2019 05:19:44 GMT-0700 (PDT)
608,79,5,22,Sun Jun 02 2019 05:16:45 GMT-0700 (PDT),http://lorempixel.com/400/400/business,Accusantium id quo sed excepturi debitis debitis nisi.,562,Fri Jun 07 2019 04:01:05 GMT-0700 (PDT)
609,100,1,2,Wed Jul 17 2019 00:50:33 GMT-0700 (PDT),http://lorempixel.com/400/400/business,Debitis neque aut illum sequi ipsa eos hic aspernatur.,750,Tue Aug 13 2019 10:51:00 GMT-0700 (PDT)
610,40,3,17,Sat May 11 2019 23:27:38 GMT-0700 (PDT),http://lorempixel.com/400/400/business,Dicta dolores nulla qui reprehenderit nemo vitae sit aperiam aspernatur.,323,Thu Jun 27 2019 06:18:24 GMT-0700 (PDT)
611,12,4,20,Fri Apr 05 2019 00:02:15 GMT-0700 (PDT),http://lorempixel.com/400/400/business,Esse voluptas ea fuga.,79,Thu Apr 18 2019 20:30:51 GMT-0700 (PDT)
612,21,2,12,Fri Jun 28 2019 23:56:56 GMT-0700 (PDT),http://lorempixel.com/400/400/business,Eum rem eveniet officia exercitationem quia ut aut et est.,652,Tue Jul 30 2019 20:42:57 GMT-0700 (PDT)
613,89,2,10,Fri May 24 2019 14:32:10 GMT-0700 (PDT),http://lorempixel.com/400/400/business,Ipsam ut et sapiente doloremque at.,960,Wed Jul 31 2019 04:16:43 GMT-0700 (PDT)
614,43,3,17,Fri Jul 05 2019 01:04:53 GMT-0700 (PDT),http://lorempixel.com/400/400/business,Ut ut in quia ut nisi et ratione consequuntur debitis.,181,Sat Jul 20 2019 22:01:16 GMT-0700 (PDT)
615,28,4,19,Thu May 16 2019 18:37:55 GMT-0700 (PDT),http://lorempixel.com/400/400/business,Vitae voluptas quasi.,957,Fri Jun 28 2019 22:28:55 GMT-0700 (PDT)
616,37,5,23,Tue Jun 18 2019 07:31:10 GMT-0700 (PDT),http://lorempixel.com/400/400/business,Nesciunt voluptatum error et aliquam.,54,Thu Jul 25 2019 11:23:32 GMT-0700 (PDT)
617,37,5,22,Tue Apr 09 2019 18:55:08 GMT-0700 (PDT),http://lorempixel.com/400/400/business,Ipsam quis quas tempore.,541,Mon May 13 2019 03:59:36 GMT-0700 (PDT)
618,62,4,20,Mon Jun 17 2019 07:34:29 GMT-0700 (PDT),http://lorempixel.com/400/400/business,Iusto expedita aut.,783,Sat Sep 07 2019 08:21:01 GMT-0700 (PDT)
619,91,2,12,Fri May 24 2019 18:56:03 GMT-0700 (PDT),http://lorempixel.com/400/400/business,Laudantium numquam sit.,241,Mon Jul 15 2019 17:39:34 GMT-0700 (PDT)
620,29,1,8,Thu May 16 2019 03:06:58 GMT-0700 (PDT),http://lorempixel.com/400/400/business,Voluptas est voluptatem.,194,Sat Sep 07 2019 23:37:21 GMT-0700 (PDT)
621,44,2,11,Mon May 13 2019 12:51:08 GMT-0700 (PDT),http://lorempixel.com/400/400/business,Maxime qui alias aut laboriosam.,434,Sun Jun 02 2019 13:26:21 GMT-0700 (PDT)
622,2,4,18,Wed May 15 2019 07:36:22 GMT-0700 (PDT),http://lorempixel.com/400/400/business,Sed possimus molestias mollitia.,362,Wed Jul 10 2019 11:15:27 GMT-0700 (PDT)
623,13,2,12,Sat Jul 13 2019 21:25:39 GMT-0700 (PDT),http://lorempixel.com/400/400/business,Occaecati qui sed quia explicabo exercitationem qui.,667,Mon Aug 19 2019 16:39:52 GMT-0700 (PDT)
624,94,2,10,Mon Jul 01 2019 03:18:57 GMT-0700 (PDT),http://lorempixel.com/400/400/business,Quos perferendis dicta est eos.,312,Thu Aug 15 2019 20:59:28 GMT-0700 (PDT)
625,76,3,14,Mon Jul 01 2019 08:38:43 GMT-0700 (PDT),http://lorempixel.com/400/400/business,Sit possimus aliquam doloribus veritatis.,375,Wed Aug 21 2019 06:30:24 GMT-0700 (PDT)
626,93,3,16,Thu Jun 20 2019 23:16:55 GMT-0700 (PDT),http://lorempixel.com/400/400/business,Facilis unde laborum et.,980,Tue Jul 30 2019 17:03:14 GMT-0700 (PDT)
627,92,2,9,Sat Jul 27 2019 08:50:36 GMT-0700 (PDT),http://lorempixel.com/400/400/business,Minima qui ipsum laborum deserunt.,780,Fri Sep 27 2019 08:34:47 GMT-0700 (PDT)
628,98,1,4,Sun Apr 28 2019 01:53:43 GMT-0700 (PDT),http://lorempixel.com/400/400/business,Blanditiis est qui error assumenda asperiores necessitatibus.,358,Fri Jun 28 2019 05:38:57 GMT-0700 (PDT)
629,65,4,18,Wed May 15 2019 17:03:53 GMT-0700 (PDT),http://lorempixel.com/400/400/business,Tempora aut odio reiciendis et tempora voluptates reprehenderit ex.,819,Tue Jul 09 2019 11:39:32 GMT-0700 (PDT)
630,9,1,5,Sat Aug 03 2019 03:54:18 GMT-0700 (PDT),http://lorempixel.com/400/400/business,Ut eos vel est ipsa.,856,Fri Aug 23 2019 21:20:32 GMT-0700 (PDT)
631,97,2,12,Wed Jul 10 2019 16:36:36 GMT-0700 (PDT),http://lorempixel.com/400/400/business,Similique cumque qui harum quis.,326,Mon Sep 09 2019 22:13:48 GMT-0700 (PDT)
632,96,3,14,Thu Apr 18 2019 14:03:30 GMT-0700 (PDT),http://lorempixel.com/400/400/business,Asperiores vitae autem numquam nam eum consectetur.,498,Tue Jul 23 2019 05:40:14 GMT-0700 (PDT)
633,62,5,22,Tue Apr 23 2019 08:27:05 GMT-0700 (PDT),http://lorempixel.com/400/400/business,Et dolor provident.,284,Sun Jun 02 2019 11:18:10 GMT-0700 (PDT)
634,41,2,11,Sun Apr 21 2019 13:42:14 GMT-0700 (PDT),http://lorempixel.com/400/400/business,Velit beatae laborum consequatur dolores vel aut.,879,Fri Aug 30 2019 07:26:14 GMT-0700 (PDT)
635,78,2,10,Thu Jul 04 2019 22:52:01 GMT-0700 (PDT),http://lorempixel.com/400/400/business,Molestiae porro quia laudantium.,374,Mon Sep 16 2019 03:50:01 GMT-0700 (PDT)
636,44,1,8,Sat May 18 2019 20:16:55 GMT-0700 (PDT),http://lorempixel.com/400/400/business,Assumenda velit deleniti perspiciatis expedita natus occaecati iure blanditiis.,984,Sat Aug 10 2019 00:42:31 GMT-0700 (PDT)
637,16,1,7,Tue May 14 2019 11:56:35 GMT-0700 (PDT),http://lorempixel.com/400/400/business,Maiores sapiente sunt vitae.,333,Thu Jun 06 2019 03:46:00 GMT-0700 (PDT)
638,86,1,4,Thu Jun 13 2019 02:57:06 GMT-0700 (PDT),http://lorempixel.com/400/400/business,Aut fuga officiis et illo atque blanditiis.,57,Mon Jun 17 2019 00:03:21 GMT-0700 (PDT)
639,88,5,23,Sun Apr 14 2019 22:34:33 GMT-0700 (PDT),http://lorempixel.com/400/400/business,Labore magnam nemo.,24,Fri Jun 28 2019 23:06:26 GMT-0700 (PDT)
640,5,2,9,Mon Apr 01 2019 03:00:07 GMT-0700 (PDT),http://lorempixel.com/400/400/business,Unde voluptatem eos beatae.,973,Sun May 12 2019 18:17:57 GMT-0700 (PDT)
641,77,5,22,Mon Jul 01 2019 06:55:30 GMT-0700 (PDT),http://lorempixel.com/400/400/business,Et ipsum totam illum et voluptas qui.,304,Sun Sep 22 2019 19:34:36 GMT-0700 (PDT)
642,2,3,14,Fri Jun 28 2019 01:56:27 GMT-0700 (PDT),http://lorempixel.com/400/400/business,Impedit inventore qui dolor omnis amet quia ipsum facere fugiat.,775,Mon Jul 01 2019 23:18:16 GMT-0700 (PDT)
643,46,2,13,Fri May 10 2019 18:19:00 GMT-0700 (PDT),http://lorempixel.com/400/400/business,Dicta aut sunt sunt dicta fugiat tenetur ratione.,703,Sun May 12 2019 09:43:18 GMT-0700 (PDT)
644,7,3,17,Thu Apr 04 2019 10:32:01 GMT-0700 (PDT),http://lorempixel.com/400/400/business,Possimus non exercitationem velit asperiores ducimus.,557,Sat Aug 17 2019 20:59:16 GMT-0700 (PDT)
645,51,5,23,Fri Jun 14 2019 04:35:08 GMT-0700 (PDT),http://lorempixel.com/400/400/business,Et nobis aut.,782,Sat Sep 21 2019 14:07:23 GMT-0700 (PDT)
646,23,2,11,Tue May 21 2019 02:22:14 GMT-0700 (PDT),http://lorempixel.com/400/400/business,Voluptate rem quia magnam sequi.,769,Thu Jul 04 2019 18:39:45 GMT-0700 (PDT)
647,22,5,23,Tue May 28 2019 03:29:40 GMT-0700 (PDT),http://lorempixel.com/400/400/business,Et repellendus aut voluptas omnis.,443,Sun Jul 07 2019 01:32:05 GMT-0700 (PDT)
648,42,4,18,Thu Jun 06 2019 10:24:01 GMT-0700 (PDT),http://lorempixel.com/400/400/business,Exercitationem qui ut et quo.,4,Wed Aug 28 2019 05:27:35 GMT-0700 (PDT)
649,41,2,11,Thu Apr 04 2019 21:49:08 GMT-0700 (PDT),http://lorempixel.com/400/400/business,Inventore dignissimos vero ipsum repellat expedita nihil.,53,Sat Sep 07 2019 23:49:52 GMT-0700 (PDT)
650,51,5,22,Mon Jul 01 2019 07:13:00 GMT-0700 (PDT),http://lorempixel.com/400/400/business,Quia rerum iure.,479,Thu Jul 18 2019 00:06:45 GMT-0700 (PDT)
651,68,4,18,Sat Jun 22 2019 04:33:56 GMT-0700 (PDT),http://lorempixel.com/400/400/business,Deserunt dolor fugit mollitia fuga.,483,Sat Jun 29 2019 06:30:10 GMT-0700 (PDT)
652,93,3,17,Thu Apr 25 2019 00:12:54 GMT-0700 (PDT),http://lorempixel.com/400/400/business,Corrupti eum quia sapiente consequatur totam consequatur.,402,Tue Aug 27 2019 14:48:29 GMT-0700 (PDT)
653,68,5,22,Fri Jul 26 2019 15:13:42 GMT-0700 (PDT),http://lorempixel.com/400/400/business,Omnis aut unde voluptates quaerat veniam.,502,Sun Sep 08 2019 18:50:37 GMT-0700 (PDT)
654,27,1,8,Tue Jun 04 2019 23:35:06 GMT-0700 (PDT),http://lorempixel.com/400/400/business,Ratione commodi dolores.,587,Tue Aug 13 2019 23:44:04 GMT-0700 (PDT)
655,27,1,3,Tue Apr 09 2019 06:52:47 GMT-0700 (PDT),http://lorempixel.com/400/400/business,Voluptas necessitatibus officia deserunt corporis et quia aperiam molestias.,695,Tue Jun 18 2019 00:53:20 GMT-0700 (PDT)
656,77,4,21,Wed May 01 2019 09:36:46 GMT-0700 (PDT),http://lorempixel.com/400/400/business,Aut ipsam itaque deleniti dolor omnis sunt.,222,Wed May 29 2019 03:44:25 GMT-0700 (PDT)
657,53,1,1,Wed May 08 2019 12:35:44 GMT-0700 (PDT),http://lorempixel.com/400/400/business,Eius repudiandae fuga itaque culpa natus ducimus aperiam ipsa quibusdam.,147,Sun Jul 14 2019 22:38:13 GMT-0700 (PDT)
658,75,2,9,Mon Apr 15 2019 23:14:02 GMT-0700 (PDT),http://lorempixel.com/400/400/business,Adipisci nostrum id voluptatem nam.,427,Mon Jun 17 2019 03:49:46 GMT-0700 (PDT)
659,63,2,9,Sun Jun 30 2019 16:55:53 GMT-0700 (PDT),http://lorempixel.com/400/400/business,Iusto sunt deleniti.,438,Sat Aug 31 2019 13:39:34 GMT-0700 (PDT)
660,40,1,2,Tue Apr 02 2019 13:59:41 GMT-0700 (PDT),http://lorempixel.com/400/400/business,Temporibus est explicabo nisi eius.,423,Sun Jun 09 2019 05:41:49 GMT-0700 (PDT)
661,53,2,11,Tue Jul 02 2019 16:11:25 GMT-0700 (PDT),http://lorempixel.com/400/400/business,Quas nesciunt repellat sequi repudiandae.,23,Thu Jul 11 2019 13:01:54 GMT-0700 (PDT)
662,30,4,20,Fri Jul 26 2019 20:12:00 GMT-0700 (PDT),http://lorempixel.com/400/400/business,Nesciunt doloribus culpa ut ab fuga et architecto.,874,Mon Aug 19 2019 18:17:05 GMT-0700 (PDT)
663,83,5,22,Sat Jun 01 2019 12:15:04 GMT-0700 (PDT),http://lorempixel.com/400/400/business,Optio ullam id temporibus sed earum iste dignissimos.,458,Mon Jun 24 2019 13:46:34 GMT-0700 (PDT)
664,58,5,22,Sat May 25 2019 10:50:15 GMT-0700 (PDT),http://lorempixel.com/400/400/business,Impedit perspiciatis quis maiores.,167,Tue Jun 18 2019 03:35:25 GMT-0700 (PDT)
665,79,2,10,Sat Jun 08 2019 01:03:29 GMT-0700 (PDT),http://lorempixel.com/400/400/business,Ex deserunt alias odit voluptates ut.,164,Mon Aug 26 2019 00:08:29 GMT-0700 (PDT)
666,94,5,22,Thu Jun 06 2019 12:37:08 GMT-0700 (PDT),http://lorempixel.com/400/400/business,Animi inventore ad deleniti.,511,Sat Aug 03 2019 01:38:31 GMT-0700 (PDT)
667,56,1,5,Thu Jun 06 2019 18:32:24 GMT-0700 (PDT),http://lorempixel.com/400/400/business,Est qui qui saepe molestiae.,226,Tue Aug 13 2019 12:54:25 GMT-0700 (PDT)
668,57,4,21,Sat Jul 27 2019 15:19:02 GMT-0700 (PDT),http://lorempixel.com/400/400/business,Molestiae tempore ad aliquid non in illo non vel.,476,Sat Aug 24 2019 06:15:53 GMT-0700 (PDT)
669,74,3,15,Tue Jul 16 2019 20:49:34 GMT-0700 (PDT),http://lorempixel.com/400/400/business,Distinctio ab magnam.,928,Wed Aug 28 2019 18:00:50 GMT-0700 (PDT)
670,71,3,17,Tue Apr 16 2019 02:20:10 GMT-0700 (PDT),http://lorempixel.com/400/400/business,Placeat quod et debitis consectetur sed accusamus consequatur omnis fugiat.,784,Wed Aug 14 2019 10:43:54 GMT-0700 (PDT)
671,68,3,17,Sat Apr 13 2019 01:10:26 GMT-0700 (PDT),http://lorempixel.com/400/400/business,Veniam sunt accusamus cumque quo quam debitis laborum.,453,Sun Apr 14 2019 17:23:50 GMT-0700 (PDT)
672,47,5,23,Mon Apr 01 2019 23:11:57 GMT-0700 (PDT),http://lorempixel.com/400/400/business,Dicta repellat beatae ea ut harum delectus expedita.,801,Fri Jul 12 2019 01:00:41 GMT-0700 (PDT)
673,73,1,1,Sun Jul 14 2019 15:32:01 GMT-0700 (PDT),http://lorempixel.com/400/400/business,Sed vel sed.,460,Thu Aug 29 2019 23:15:56 GMT-0700 (PDT)
674,20,2,10,Tue Jul 16 2019 15:17:10 GMT-0700 (PDT),http://lorempixel.com/400/400/business,Consequuntur corrupti facere.,677,Tue Sep 17 2019 02:31:41 GMT-0700 (PDT)
675,21,5,22,Wed May 29 2019 04:37:41 GMT-0700 (PDT),http://lorempixel.com/400/400/business,Odio illo voluptatem a impedit earum necessitatibus voluptas.,667,Thu Jun 13 2019 14:53:39 GMT-0700 (PDT)
676,20,3,15,Thu Apr 18 2019 08:20:47 GMT-0700 (PDT),http://lorempixel.com/400/400/business,Ut qui quas et ipsa sapiente facilis.,451,Sun Sep 22 2019 00:50:06 GMT-0700 (PDT)
677,31,2,9,Sat Jul 20 2019 12:47:17 GMT-0700 (PDT),http://lorempixel.com/400/400/business,Quisquam dolores id facilis totam voluptates.,158,Tue Sep 10 2019 20:55:10 GMT-0700 (PDT)
678,81,3,17,Wed May 22 2019 07:32:44 GMT-0700 (PDT),http://lorempixel.com/400/400/business,Eius velit est maiores pariatur dignissimos impedit aspernatur.,2,Sat Sep 28 2019 19:30:18 GMT-0700 (PDT)
679,85,4,21,Thu May 16 2019 19:06:51 GMT-0700 (PDT),http://lorempixel.com/400/400/business,Doloremque corporis ad quia quaerat vitae ut aliquam.,605,Sat Sep 07 2019 16:01:31 GMT-0700 (PDT)
680,54,5,22,Sat Jun 22 2019 20:25:10 GMT-0700 (PDT),http://lorempixel.com/400/400/business,Incidunt enim accusantium inventore.,11,Thu Aug 01 2019 13:49:55 GMT-0700 (PDT)
681,6,4,21,Tue May 07 2019 04:34:15 GMT-0700 (PDT),http://lorempixel.com/400/400/business,Est at sit iste totam asperiores.,99,Thu Sep 05 2019 06:11:20 GMT-0700 (PDT)
682,69,5,22,Fri Jul 05 2019 09:49:48 GMT-0700 (PDT),http://lorempixel.com/400/400/business,Sint dolores sunt ipsum dignissimos quam doloribus.,938,Fri Jul 12 2019 05:31:55 GMT-0700 (PDT)
683,97,3,17,Mon Jun 03 2019 11:37:45 GMT-0700 (PDT),http://lorempixel.com/400/400/business,Et nihil id nesciunt voluptatem voluptas animi voluptas.,349,Thu Sep 05 2019 07:30:27 GMT-0700 (PDT)
684,75,5,22,Wed Jul 03 2019 00:06:23 GMT-0700 (PDT),http://lorempixel.com/400/400/business,Laborum in tenetur quidem.,27,Thu Jul 11 2019 09:04:48 GMT-0700 (PDT)
685,4,3,16,Tue Apr 09 2019 06:37:07 GMT-0700 (PDT),http://lorempixel.com/400/400/business,Sequi alias ut dolor aut earum et blanditiis.,376,Tue Aug 20 2019 14:00:40 GMT-0700 (PDT)
686,37,2,13,Sat Jun 01 2019 01:01:10 GMT-0700 (PDT),http://lorempixel.com/400/400/business,Odio iste dolorem provident.,932,Tue Jul 23 2019 06:41:37 GMT-0700 (PDT)
687,29,2,9,Sat Jul 13 2019 04:28:09 GMT-0700 (PDT),http://lorempixel.com/400/400/business,Dicta eveniet tempore nobis et laudantium sint facilis.,72,Fri Aug 16 2019 04:18:47 GMT-0700 (PDT)
688,25,4,21,Wed Jul 31 2019 00:00:31 GMT-0700 (PDT),http://lorempixel.com/400/400/business,Esse facilis accusamus.,485,Wed Aug 14 2019 22:31:00 GMT-0700 (PDT)
689,19,4,20,Tue Jun 18 2019 06:03:39 GMT-0700 (PDT),http://lorempixel.com/400/400/business,Et totam iste at laudantium numquam consequuntur ipsa.,718,Wed Jun 26 2019 03:42:23 GMT-0700 (PDT)
690,48,2,12,Sat May 25 2019 15:59:12 GMT-0700 (PDT),http://lorempixel.com/400/400/business,Beatae est maxime similique est non.,738,Tue Jul 02 2019 23:58:35 GMT-0700 (PDT)
691,36,3,17,Tue May 21 2019 15:50:36 GMT-0700 (PDT),http://lorempixel.com/400/400/business,Quibusdam eos sit perspiciatis distinctio quia sit voluptas labore et.,441,Tue Jul 30 2019 11:48:35 GMT-0700 (PDT)
692,94,4,19,Mon Jul 15 2019 21:23:38 GMT-0700 (PDT),http://lorempixel.com/400/400/business,Nobis libero est molestiae dolor.,669,Mon Aug 05 2019 01:13:42 GMT-0700 (PDT)
693,62,4,18,Sat Jun 22 2019 19:30:47 GMT-0700 (PDT),http://lorempixel.com/400/400/business,Voluptatem recusandae est.,908,Fri Aug 30 2019 04:22:51 GMT-0700 (PDT)
694,81,2,11,Fri Aug 02 2019 14:45:15 GMT-0700 (PDT),http://lorempixel.com/400/400/business,Dolore illum deserunt velit error.,971,Fri Aug 30 2019 12:07:21 GMT-0700 (PDT)
695,20,1,7,Wed Apr 10 2019 13:50:19 GMT-0700 (PDT),http://lorempixel.com/400/400/business,Dolorem magni minus dolorem quia atque officia enim eius deleniti.,463,Wed Jun 26 2019 02:39:19 GMT-0700 (PDT)
696,81,5,22,Wed May 29 2019 05:03:29 GMT-0700 (PDT),http://lorempixel.com/400/400/business,Quaerat et labore et.,236,Sun Sep 01 2019 21:21:06 GMT-0700 (PDT)
697,68,5,23,Sat May 04 2019 06:50:23 GMT-0700 (PDT),http://lorempixel.com/400/400/business,Est consequuntur quas id consequatur vitae ratione repellat.,259,Thu Jul 18 2019 00:47:34 GMT-0700 (PDT)
698,58,4,20,Sat Apr 20 2019 07:04:54 GMT-0700 (PDT),http://lorempixel.com/400/400/business,Sint non mollitia officiis eius dolorum animi quam impedit consequuntur.,73,Wed Jun 05 2019 09:10:51 GMT-0700 (PDT)
699,96,3,14,Mon Jun 10 2019 17:34:08 GMT-0700 (PDT),http://lorempixel.com/400/400/business,Sed voluptatem perferendis neque debitis rerum ipsam est pariatur asperiores.,394,Tue Jul 16 2019 15:49:27 GMT-0700 (PDT)
700,14,5,22,Wed Jul 24 2019 09:41:46 GMT-0700 (PDT),http://lorempixel.com/400/400/business,Assumenda dolores enim tempora.,308,Mon Sep 23 2019 04:44:14 GMT-0700 (PDT)
701,9,2,13,Fri Apr 19 2019 22:06:36 GMT-0700 (PDT),http://lorempixel.com/400/400/business,In unde similique veniam.,638,Mon Jun 10 2019 12:04:19 GMT-0700 (PDT)
702,91,2,9,Thu May 09 2019 16:27:12 GMT-0700 (PDT),http://lorempixel.com/400/400/business,Veniam modi qui dicta facere consequatur expedita velit et nihil.,472,Sun Sep 08 2019 08:32:11 GMT-0700 (PDT)
703,67,2,12,Sun Jul 07 2019 19:03:12 GMT-0700 (PDT),http://lorempixel.com/400/400/business,Eaque harum et facilis eos quibusdam qui iure.,231,Tue Aug 27 2019 00:06:46 GMT-0700 (PDT)
704,58,5,22,Tue Jul 30 2019 08:21:19 GMT-0700 (PDT),http://lorempixel.com/400/400/business,Nesciunt sit assumenda iure quia culpa ut assumenda.,388,Thu Sep 05 2019 07:28:22 GMT-0700 (PDT)
705,21,3,16,Thu Jun 27 2019 18:57:22 GMT-0700 (PDT),http://lorempixel.com/400/400/business,Modi enim nobis pariatur.,429,Tue Aug 20 2019 00:28:05 GMT-0700 (PDT)
706,90,1,3,Sun Jul 14 2019 08:34:26 GMT-0700 (PDT),http://lorempixel.com/400/400/business,Vero omnis qui atque est ut quo.,618,Sun Sep 15 2019 21:36:05 GMT-0700 (PDT)
707,100,5,23,Mon Jul 15 2019 21:30:49 GMT-0700 (PDT),http://lorempixel.com/400/400/business,Non iure repudiandae accusantium pariatur officiis.,174,Mon Aug 26 2019 08:58:41 GMT-0700 (PDT)
708,78,5,22,Thu May 23 2019 06:05:04 GMT-0700 (PDT),http://lorempixel.com/400/400/business,Consectetur deleniti molestias.,299,Sat Jun 22 2019 02:39:45 GMT-0700 (PDT)
709,5,3,16,Tue May 07 2019 10:06:36 GMT-0700 (PDT),http://lorempixel.com/400/400/business,Et beatae eum soluta molestiae qui repellendus placeat iure ullam.,204,Fri Jul 05 2019 19:49:16 GMT-0700 (PDT)
710,78,4,21,Mon Jul 01 2019 14:20:50 GMT-0700 (PDT),http://lorempixel.com/400/400/business,Voluptatem ullam laudantium officiis suscipit pariatur velit at laboriosam.,351,Sat Jul 27 2019 06:26:35 GMT-0700 (PDT)
711,89,3,17,Thu Apr 18 2019 03:54:11 GMT-0700 (PDT),http://lorempixel.com/400/400/business,Voluptatem numquam iure id praesentium illo et sint fugit.,997,Sat Aug 31 2019 15:09:04 GMT-0700 (PDT)
712,75,5,23,Mon Apr 08 2019 10:13:52 GMT-0700 (PDT),http://lorempixel.com/400/400/business,Ipsa occaecati nostrum at.,294,Sat Aug 24 2019 13:34:28 GMT-0700 (PDT)
713,15,2,9,Mon Apr 22 2019 23:16:46 GMT-0700 (PDT),http://lorempixel.com/400/400/business,Et consequatur odio dolorum dolor amet.,993,Fri May 31 2019 00:48:54 GMT-0700 (PDT)
714,71,2,13,Sat Jul 13 2019 17:17:47 GMT-0700 (PDT),http://lorempixel.com/400/400/business,Quam sequi itaque aut culpa porro.,128,Thu Sep 26 2019 15:22:10 GMT-0700 (PDT)
715,95,3,14,Thu Jul 25 2019 03:18:41 GMT-0700 (PDT),http://lorempixel.com/400/400/business,Quaerat non officia exercitationem aut blanditiis.,795,Wed Sep 11 2019 09:43:18 GMT-0700 (PDT)
716,97,4,21,Mon Apr 15 2019 08:52:40 GMT-0700 (PDT),http://lorempixel.com/400/400/business,Repellendus aut suscipit eum sed neque velit totam ea quia.,965,Mon Sep 23 2019 05:35:15 GMT-0700 (PDT)
717,38,5,22,Sun May 19 2019 18:49:47 GMT-0700 (PDT),http://lorempixel.com/400/400/business,Omnis enim numquam qui harum atque quibusdam recusandae.,405,Thu Aug 01 2019 07:00:10 GMT-0700 (PDT)
718,37,5,22,Sat May 04 2019 10:54:08 GMT-0700 (PDT),http://lorempixel.com/400/400/business,Rem aut similique et fuga possimus et necessitatibus esse.,865,Sun Jun 16 2019 04:36:53 GMT-0700 (PDT)
