id,roomId,category,subcategory,date,photoUrl,description,cost,dateFixed
579,11,5,23,Wed Jun 19 2019 20:22:35 GMT-0700 (PDT),http://lorempixel.com/400/400/business,Amet ad qui nostrum.,438,Tue Jul 09 2019 03:58:32 GMT-0700 (PDT)
580,80,1,3,Sun May 12 2019 20:18:32 GMT-0700 (PDT),http://lorempixel.com/400/400/business,Iste ut laudantium.,427,Mon Jun 03 2019 21:52:27 GMT-0700 (PDT)
581,14,2,11,Mon May 20 2019 19:53:45 GMT-0700 (PDT),http://lorempixel.com/400/400/business,Dolore fugiat delectus quo ea ad deserunt.,836,Mon Aug 12 2019 19:01:41 GMT-0700 (PDT)
582,24,5,22,Wed Jul 31 2019 07:02:31 GMT-0700 (PDT),http://lorempixel.com/400/400/business,Eos dolores et iusto eaque vel molestias molestiae possimus.,847,Mon Sep 02 2019 09:14:05 GMT-0700 (PDT)
583,11,5,23,Sun Jun 16 2019 09:51:22 GMT-0700 (PDT),http://lorempixel.com/400/400/business,Quia laudantium vitae sunt ut.,370,Thu Aug 29 2019 17:46:05 GMT-0700 (PDT)
584,92,3,15,Tue May 14 2019 22:23:13 GMT-0700 (PDT),http://lorempixel.com/400/400/business,A aut nulla veritatis.,830,Tue Jul 02 2019 23:51:05 GMT-0700 (PDT)
585,49,2,9,Sat Apr 20 2019 23:30:06 GMT-0700 (PDT),http://lorempixel.com/400/400/business,Dolores sit maiores est eaque fuga.,126,Fri Aug 09 2019 01:13:28 GMT-0700 (PDT)
586,6,2,11,Fri Jul 12 2019 19:28:05 GMT-0700 (PDT),http://lorempixel.com/400/400/business,Autem voluptas consequatur quibusdam beatae non voluptatem nesciunt sed velit.,349,Mon Aug 19 2019 05:11:27 GMT-0700 (PDT)
587,72,3,16,Thu Apr 18 2019 07:03:50 GMT-0700 (PDT),http://lorempixel.com/400/400/business,Esse nulla non ratione dolores.,607,Wed Aug 28 2019 08:04:48 GMT-0700 (PDT)
588,66,5,23,Sat Jul 20 2019 14:16:20 GMT-0700 (PDT),http://lorempixel.com/400/400/business,Ea fuga facilis excepturi autem.,69,Tue Aug 13 2019 15:54:38 GMT-0700 (PDT)
589,78,3,14,Tue Jul 09 2019 07:35:23 GMT-0700 (PDT),http://lorempixel.com/400/400/business,Consequatur eius assumenda non omnis a voluptatem soluta odit.,553,Fri Aug 09 2019 10:46:50 GMT-0700 (PDT)
590,59,3,15,Mon Apr 15 2019 09:20:16 GMT-0700 (PDT),http://lorempixel.com/400/400/business,Distinctio at nemo aut consequuntur dignissimos expedita consequatur minima.,470,Thu May 09 2019 09:15:26 GMT-0700 (PDT)
591,65,4,20,Thu Jun 13 2019 16:32:26 GMT-0700 (PDT),http://lorempixel.com/400/400/business,Hic eius sed fugit id quo possimus.,80,Sun Sep 08 2019 23:44:20 GMT-0700 (PDT)
592,15,2,11,Mon Jul 22 2019 09:12:18 GMT-0700 (PDT),http://lorempixel.com/400/400/business,Officiis sunt sed.,357,Fri Aug 16 2019 13:09:41 GMT-0700 (PDT)
593,97,2,9,Thu Jul 04 2019 17:35:34 GMT-0700 (PDT),http://lorempixel.com/400/400/business,Totam quo eaque perferendis sapiente nihil ea architecto dignissimos est.,991,Sat Jul 13 2019 15:55:09 GMT-0700 (PDT)
594,29,4,18,Thu Jun 06 2019 07:05:01 GMT-0700 (PDT),http://lorempixel.com/400/400/business,Aspernatur hic doloribus.,143,Mon Jul 29 2019 12:42:47 GMT-0700 (PDT)
595,15,3,14,Tue Jul 09 2019 07:40:30 GMT-0700 (PDT),http://lorempixel.com/400/400/business,Sunt et vel odio at perferendis voluptatem ipsum.,758,Wed Aug 21 2019 02:25:03 GMT-0700 (PDT)
596,73,4,18,Thu Jun 06 2019 09:11:51 GMT-0700 (PDT),http://lorempixel.com/400/400/business,Eius distinctio beatae voluptatibus facere voluptas.,434,Fri Jun 14 2019 16:24:12 GMT-0700 (PDT)
597,30,5,22,Thu May 02 2019 11:44:38 GMT-0700 (PDT),http://lorempixel.com/400/400/business,Qui magnam deleniti.,484,Mon Aug 05 2019 08:33:33 GMT-0700 (PDT)
598,31,4,20,Fri Apr 19 2019 12:51:16 GMT-0700 (PDT),http://lorempixel.com/400/400/business,Quae voluptas tempora velit repellendus alias et.,21,Thu Jun 27 2019 18:54:50 GMT-0700 (PDT)
599,74,1,2,Sat Jun 22 2019 17:17:57 GMT-0700 (PDT),http://lorempixel.com/400/400/business,Omnis id enim dolor omnis sit perferendis voluptatibus.,388,Sat Jun 29 2019 15:13:54 GMT-0700 (PDT)
600,15,1,5,Mon Jul 29 2019 04:10:53 GMT-0700 (PDT),http://lorempixel.com/400/400/business,Rem nihil enim consequatur est consequatur unde quis earum.,493,Wed Aug 14 2019 21:50:31 GMT-0700 (PDT)
601,55,3,16,Sat May 04 2019 05:27:19 GMT-0700 (PDT),http://lorempixel.com/400/400/business,Ut quas repellendus autem.,246,Mon Jun 03 2019 09:52:59 GMT-0700 (PDT)
602,11,4,18,Sat Aug 03 2019 00:21:04 GMT-0700 (PDT),http://lorempixel.com/400/400/business,Quia occaecati unde dignissimos qui vero ut.,341,Mon Aug 19 2019 14:53:30 GMT-0700 (PDT)
603,68,3,15,Sat Jun 08 2019 05:30:26 GMT-0700 (PDT),http://lorempixel.com/400/400/business,Architecto ullam eveniet asperiores.,761,Mon Jun 17 2019 21:13:52 GMT-0700 (PDT)
604,7,2,12,Wed Jun 26 2019 23:51:52 GMT-0700 (PDT),http://lorempixel.com/400/400/business,Sed labore ratione recusandae quaerat quidem.,113,Tue Sep 10 2019 04:32:00 GMT-0700 (PDT)
605,23,2,11,Mon May 20 2019 15:51:04 GMT-0700 (PDT),http://lorempixel.com/400/400/business,Aut vitae qui rerum voluptates provident est deleniti totam.,881,Thu Sep 05 2019 02:27:12 GMT-0700 (PDT)
606,77,1,8,Wed Jul 17 2019 21:42:55 GMT-0700 (PDT),http://lorempixel.com/400/400/business,Et magni nam sed.,957,Thu Aug 15 2019 22:25:31 GMT-0700 (PDT)
607,33,2,12,Fri May 10 2019 02:38:45 GMT-0700 (PDT),http://lorempixel.com/400/400/business,Vitae rem nihil omnis est rem.,106,Sat Aug 31 2019 04:20:41 GMT-0700 (PDT)
608,71,3,14,Sun Jun 09 2019 15:24:18 GMT-0700 (PDT),http://lorempixel.com/400/400/business,Error accusamus ea nemo.,253,Thu Sep 19 2019 03:01:22 GMT-0700 (PDT)
609,60,3,17,Sat Jun 08 2019 20:27:08 GMT-0700 (PDT),http://lorempixel.com/400/400/business,Officia sed repudiandae ullam iusto laudantium sed qui minus.,462,Mon Jul 29 2019 10:57:51 GMT-0700 (PDT)
610,76,5,23,Sun Jun 23 2019 11:53:53 GMT-0700 (PDT),http://lorempixel.com/400/400/business,Accusantium earum sint odit ut praesentium.,69,Mon Aug 26 2019 15:19:18 GMT-0700 (PDT)
611,4,2,9,Sun May 12 2019 01:03:05 GMT-0700 (PDT),http://lorempixel.com/400/400/business,Consequatur adipisci non dolores maxime eaque dignissimos.,801,Thu Jul 18 2019 10:56:22 GMT-0700 (PDT)
612,62,2,12,Sat Apr 20 2019 21:20:29 GMT-0700 (PDT),http://lorempixel.com/400/400/business,Ipsa eligendi omnis blanditiis blanditiis.,988,Mon Sep 09 2019 01:18:39 GMT-0700 (PDT)
613,84,2,9,Mon Jun 17 2019 20:58:57 GMT-0700 (PDT),http://lorempixel.com/400/400/business,Et aliquam est.,575,Wed Jul 10 2019 22:56:47 GMT-0700 (PDT)
614,97,2,10,Thu May 30 2019 21:48:57 GMT-0700 (PDT),http://lorempixel.com/400/400/business,Itaque illo et quisquam et omnis voluptatem ab.,742,Tue Sep 03 2019 08:21:36 GMT-0700 (PDT)
615,73,5,22,Thu Jul 11 2019 11:52:04 GMT-0700 (PDT),http://lorempixel.com/400/400/business,Voluptatum dicta ad nihil voluptas sapiente consectetur aut.,233,Fri Sep 20 2019 09:51:15 GMT-0700 (PDT)
616,38,4,19,Wed May 15 2019 05:17:42 GMT-0700 (PDT),http://lorempixel.com/400/400/business,Et vel distinctio deserunt aperiam adipisci eos.,67,Sat Jun 01 2019 17:57:20 GMT-0700 (PDT)
617,1,2,12,Sat Jul 06 2019 07:48:04 GMT-0700 (PDT),http://lorempixel.com/400/400/business,Vitae blanditiis officia perspiciatis tempore.,671,Tue Jul 23 2019 06:17:29 GMT-0700 (PDT)
618,13,4,19,Sat Apr 06 2019 04:46:05 GMT-0700 (PDT),http://lorempixel.com/400/400/business,Est et sed necessitatibus repudiandae libero est aut et.,732,Mon May 13 2019 09:10:38 GMT-0700 (PDT)
619,46,4,20,Tue Jul 09 2019 05:14:24 GMT-0700 (PDT),http://lorempixel.com/400/400/business,Blanditiis quaerat ipsum asperiores autem.,443,Sun Aug 18 2019 03:14:52 GMT-0700 (PDT)
620,34,2,13,Sat Jun 15 2019 17:09:29 GMT-0700 (PDT),http://lorempixel.com/400/400/business,Magnam in porro saepe.,712,Wed Aug 21 2019 07:50:43 GMT-0700 (PDT)
621,47,2,9,Fri Jun 07 2019 16:02:59 GMT-0700 (PDT),http://lorempixel.com/400/400/business,Vero magnam non unde earum fugiat ut laborum officiis.,104,Sat Jul 13 2019 02:25:05 GMT-0700 (PDT)
622,76,5,23,Sun Apr 07 2019 21:49:56 GMT-0700 (PDT),http://lorempixel.com/400/400/business,Vel et repellat harum cupiditate labore inventore fugit.,450,Sun May 12 2019 22:45:04 GMT-0700 (PDT)
623,35,1,6,Fri Jun 28 2019 16:47:21 GMT-0700 (PDT),http://lorempixel.com/400/400/business,Et voluptatem dolores cumque in.,560,Mon Aug 05 2019 13:39:44 GMT-0700 (PDT)
624,70,4,20,Sat May 25 2019 23:56:02 GMT-0700 (PDT),http://lorempixel.com/400/400/business,Repellat rerum perferendis et.,324,Mon Sep 23 2019 09:37:02 GMT-0700 (PDT)
625,89,3,17,Wed Jun 12 2019 18:49:07 GMT-0700 (PDT),http://lorempixel.com/400/400/business,Animi sint rerum nostrum non eaque ad officiis magnam et.,636,Thu Jul 25 2019 13:02:19 GMT-0700 (PDT)
626,72,4,19,Thu May 02 2019 12:16:06 GMT-0700 (PDT),http://lorempixel.com/400/400/business,Accusamus delectus et quam odio qui.,766,Sat Jun 15 2019 05:21:14 GMT-0700 (PDT)
627,81,3,15,Tue May 07 2019 12:45:25 GMT-0700 (PDT),http://lorempixel.com/400/400/business,Eos voluptatem quisquam et dicta assumenda.,812,Wed May 22 2019 18:55:34 GMT-0700 (PDT)
628,70,5,23,Wed May 01 2019 06:42:26 GMT-0700 (PDT),http://lorempixel.com/400/400/business,Doloremque atque est voluptas at est aperiam dolores voluptatem autem.,352,Sun Sep 22 2019 12:34:33 GMT-0700 (PDT)
629,21,3,15,Thu Jun 20 2019 13:31:53 GMT-0700 (PDT),http://lorempixel.com/400/400/business,Molestiae asperiores quaerat eaque perspiciatis quia ex excepturi ab aliquam.,882,Wed Aug 07 2019 17:45:31 GMT-0700 (PDT)
630,77,5,23,Wed Jul 10 2019 00:21:45 GMT-0700 (PDT),http://lorempixel.com/400/400/business,Ut totam ut eum.,83,Wed Sep 25 2019 23:50:10 GMT-0700 (PDT)
631,56,1,6,Wed Jun 05 2019 05:56:56 GMT-0700 (PDT),http://lorempixel.com/400/400/business,Non ab beatae ratione suscipit sint tempora adipisci.,731,Tue Sep 17 2019 01:20:48 GMT-0700 (PDT)
632,55,4,20,Tue Jun 11 2019 06:50:55 GMT-0700 (PDT),http://lorempixel.com/400/400/business,Non consequatur ut.,642,Mon Jul 29 2019 04:58:42 GMT-0700 (PDT)
633,12,5,23,Thu May 30 2019 10:21:02 GMT-0700 (PDT),http://lorempixel.com/400/400/business,Blanditiis consequatur fuga nostrum totam et provident id nemo.,89,Wed Sep 04 2019 23:27:21 GMT-0700 (PDT)
634,81,4,18,Sun Jun 09 2019 15:41:29 GMT-0700 (PDT),http://lorempixel.com/400/400/business,Repellendus eaque qui porro.,846,Fri Sep 27 2019 14:15:56 GMT-0700 (PDT)
635,93,5,23,Thu Jun 06 2019 15:21:39 GMT-0700 (PDT),http://lorempixel.com/400/400/business,Amet mollitia voluptate quia ut quisquam eos.,615,Tue Jul 09 2019 02:57:45 GMT-0700 (PDT)
636,42,2,13,Mon Jul 01 2019 17:50:52 GMT-0700 (PDT),http://lorempixel.com/400/400/business,Suscipit quia architecto aut qui voluptatum eaque.,250,Sun Aug 04 2019 15:39:56 GMT-0700 (PDT)
637,12,5,23,Wed Jul 31 2019 15:28:08 GMT-0700 (PDT),http://lorempixel.com/400/400/business,Eos placeat rerum explicabo.,540,Sun Sep 29 2019 04:19:49 GMT-0700 (PDT)
638,40,1,7,Mon Jun 03 2019 20:11:32 GMT-0700 (PDT),http://lorempixel.com/400/400/business,Et aut nisi.,756,Wed Aug 14 2019 00:20:15 GMT-0700 (PDT)
639,96,2,9,Thu Jun 13 2019 16:11:28 GMT-0700 (PDT),http://lorempixel.com/400/400/business,Voluptates aspernatur quia sed eligendi at numquam repellendus.,944,Wed Jul 03 2019 15:39:15 GMT-0700 (PDT)
640,46,4,20,Wed Jun 26 2019 23:00:42 GMT-0700 (PDT),http://lorempixel.com/400/400/business,Modi tenetur labore veniam velit error alias.,238,Sun Sep 29 2019 18:09:54 GMT-0700 (PDT)
641,62,4,18,Mon Jul 15 2019 10:51:35 GMT-0700 (PDT),http://lorempixel.com/400/400/business,Veritatis at ut ut consequatur porro cumque mollitia enim ipsum.,825,Sun Aug 04 2019 12:51:46 GMT-0700 (PDT)
642,47,3,17,Tue Jun 04 2019 09:50:11 GMT-0700 (PDT),http://lorempixel.com/400/400/business,Porro ullam in.,457,Sat Jul 06 2019 23:48:41 GMT-0700 (PDT)
643,95,5,23,Wed Jun 26 2019 20:27:47 GMT-0700 (PDT),http://lorempixel.com/400/400/business,Fugit labore atque voluptatem nihil quas doloribus ullam sit.,227,Mon Aug 19 2019 04:46:18 GMT-0700 (PDT)
644,69,5,23,Sun Jul 07 2019 14:43:57 GMT-0700 (PDT),http://lorempixel.com/400/400/business,Minima eos repellat molestiae.,146,Tue Aug 06 2019 22:07:23 GMT-0700 (PDT)
645,86,1,4,Sat Jun 22 2019 19:47:35 GMT-0700 (PDT),http://lorempixel.com/400/400/business,Eveniet et quis reiciendis.,612,Wed Jul 24 2019 08:56:02 GMT-0700 (PDT)
646,31,5,23,Sun Jul 14 2019 14:48:31 GMT-0700 (PDT),http://lorempixel.com/400/400/business,Rem quo repellendus cupiditate doloremque.,995,Sun Aug 18 2019 18:06:06 GMT-0700 (PDT)
647,87,1,2,Tue Apr 16 2019 23:43:10 GMT-0700 (PDT),http://lorempixel.com/400/400/business,Fugit sint molestias ut sed et dolorem.,506,Sat Jun 29 2019 22:46:23 GMT-0700 (PDT)
648,13,5,23,Sat Jun 15 2019 22:30:22 GMT-0700 (PDT),http://lorempixel.com/400/400/business,Aut dolore delectus aut ad.,535,Thu Sep 26 2019 11:13:33 GMT-0700 (PDT)
649,58,5,22,Tue Apr 23 2019 03:19:08 GMT-0700 (PDT),http://lorempixel.com/400/400/business,Aut iure aliquid voluptas eligendi et.,594,Tue Aug 20 2019 18:41:23 GMT-0700 (PDT)
650,18,3,14,Wed May 08 2019 07:56:20 GMT-0700 (PDT),http://lorempixel.com/400/400/business,Enim et architecto est autem velit similique.,978,Sun Sep 22 2019 18:48:10 GMT-0700 (PDT)
651,3,4,20,Fri May 10 2019 12:52:45 GMT-0700 (PDT),http://lorempixel.com/400/400/business,Ratione molestiae vel ducimus explicabo neque placeat earum.,406,Fri Aug 23 2019 22:48:41 GMT-0700 (PDT)
652,88,4,19,Wed Jul 17 2019 22:51:20 GMT-0700 (PDT),http://lorempixel.com/400/400/business,Nulla ea quidem nostrum et ipsum quisquam at.,375,Wed Aug 07 2019 02:11:34 GMT-0700 (PDT)
653,47,1,6,Wed May 08 2019 05:24:44 GMT-0700 (PDT),http://lorempixel.com/400/400/business,Ad officia iure.,556,Mon Jul 01 2019 11:11:01 GMT-0700 (PDT)
654,53,3,16,Sun Jun 09 2019 10:19:36 GMT-0700 (PDT),http://lorempixel.com/400/400/business,Aut ut asperiores.,943,Sat Sep 28 2019 15:51:11 GMT-0700 (PDT)
655,100,3,14,Mon May 13 2019 12:14:37 GMT-0700 (PDT),http://lorempixel.com/400/400/business,Optio expedita eum voluptatem laboriosam.,803,Sun Jun 16 2019 01:27:21 GMT-0700 (PDT)
656,16,2,9,Wed May 29 2019 10:38:14 GMT-0700 (PDT),http://lorempixel.com/400/400/business,Error omnis magnam et tenetur dolorum ipsum sint ea.,695,Sat Jun 29 2019 21:52:54 GMT-0700 (PDT)
657,34,3,15,Sun Jun 16 2019 07:51:44 GMT-0700 (PDT),http://lorempixel.com/400/400/business,Id ut necessitatibus corrupti et omnis earum.,252,Thu Jul 18 2019 16:05:31 GMT-0700 (PDT)
658,82,4,19,Thu Apr 25 2019 12:19:45 GMT-0700 (PDT),http://lorempixel.com/400/400/business,Laborum et dolores quibusdam.,826,Tue Jun 04 2019 02:44:01 GMT-0700 (PDT)
659,4,4,19,Tue Jul 09 2019 14:21:59 GMT-0700 (PDT),http://lorempixel.com/400/400/business,Deleniti aut suscipit.,133,Fri Jul 19 2019 13:55:27 GMT-0700 (PDT)
660,16,1,6,Mon Jul 01 2019 08:21:10 GMT-0700 (PDT),http://lorempixel.com/400/400/business,Incidunt neque voluptatem.,119,Fri Sep 27 2019 18:35:57 GMT-0700 (PDT)
661,3,1,8,Thu May 23 2019 08:44:03 GMT-0700 (PDT),http://lorempixel.com/400/400/business,Facilis adipisci ea adipisci omnis.,811,Tue Sep 03 2019 04:49:44 GMT-0700 (PDT)
662,47,5,23,Sun Apr 28 2019 23:48:28 GMT-0700 (PDT),http://lorempixel.com/400/400/business,In dolorum soluta ex ad.,862,Wed Sep 18 2019 13:12:54 GMT-0700 (PDT)
663,54,1,7,Mon Jul 01 2019 06:12:01 GMT-0700 (PDT),http://lorempixel.com/400/400/business,Magnam assumenda ea sed molestias quis reiciendis sunt ea.,670,Mon Aug 26 2019 23:19:15 GMT-0700 (PDT)
664,54,3,14,Mon Jul 01 2019 21:50:13 GMT-0700 (PDT),http://lorempixel.com/400/400/business,Qui quos amet excepturi consectetur blanditiis est.,903,Fri Sep 13 2019 10:49:06 GMT-0700 (PDT)
665,9,2,11,Thu May 02 2019 01:30:21 GMT-0700 (PDT),http://lorempixel.com/400/400/business,Inventore doloribus explicabo.,218,Tue Jul 02 2019 07:50:20 GMT-0700 (PDT)
666,53,3,16,Wed May 08 2019 12:22:03 GMT-0700 (PDT),http://lorempixel.com/400/400/business,Atque velit et rerum assumenda eum placeat quae quis.,2,Wed Sep 11 2019 14:59:57 GMT-0700 (PDT)
667,34,1,3,Sat Jun 22 2019 06:32:54 GMT-0700 (PDT),http://lorempixel.com/400/400/business,Sit quidem delectus nam.,137,Mon Jul 01 2019 06:26:09 GMT-0700 (PDT)
668,32,3,14,Fri Jul 19 2019 08:29:20 GMT-0700 (PDT),http://lorempixel.com/400/400/business,Quia quis maiores quam quasi omnis et voluptas.,915,Tue Sep 17 2019 18:22:19 GMT-0700 (PDT)
669,42,2,11,Thu Apr 04 2019 10:07:10 GMT-0700 (PDT),http://lorempixel.com/400/400/business,Placeat nesciunt ipsum odio rerum aut consequuntur.,363,Wed Jun 05 2019 19:02:01 GMT-0700 (PDT)
670,17,5,22,Fri May 31 2019 17:54:55 GMT-0700 (PDT),http://lorempixel.com/400/400/business,Nihil facilis quasi iure.,168,Wed Jul 31 2019 22:55:13 GMT-0700 (PDT)
671,42,4,21,Sun Apr 07 2019 11:46:07 GMT-0700 (PDT),http://lorempixel.com/400/400/business,Enim cumque quo.,158,Thu Jul 25 2019 10:00:50 GMT-0700 (PDT)
672,73,1,7,Wed May 15 2019 16:57:15 GMT-0700 (PDT),http://lorempixel.com/400/400/business,Rerum delectus delectus minus expedita expedita porro.,641,Tue Jun 04 2019 09:37:02 GMT-0700 (PDT)
673,70,4,18,Sat Jul 06 2019 18:49:30 GMT-0700 (PDT),http://lorempixel.com/400/400/business,Harum voluptas aut suscipit a eum veniam id nulla.,133,Sat Sep 14 2019 23:33:41 GMT-0700 (PDT)
674,73,5,22,Wed Jul 17 2019 06:10:41 GMT-0700 (PDT),http://lorempixel.com/400/400/business,Laborum similique amet quia quia dolor molestiae.,803,Sun Aug 25 2019 19:14:15 GMT-0700 (PDT)
675,36,3,14,Mon Jun 10 2019 08:02:52 GMT-0700 (PDT),http://lorempixel.com/400/400/business,Adipisci suscipit dicta magnam quia id.,844,Fri Sep 06 2019 05:22:26 GMT-0700 (PDT)
676,49,5,22,Mon Jul 08 2019 00:58:18 GMT-0700 (PDT),http://lorempixel.com/400/400/business,Accusantium nostrum vitae sit aliquam sunt libero autem.,129,Mon Jul 29 2019 21:47:06 GMT-0700 (PDT)
677,26,5,22,Fri Jul 26 2019 18:18:01 GMT-0700 (PDT),http://lorempixel.com/400/400/business,Qui voluptatem voluptas culpa architecto voluptatem qui nobis praesentium dignissimos.,638,Wed Aug 21 2019 22:38:43 GMT-0700 (PDT)
678,30,4,19,Wed Apr 03 2019 07:57:26 GMT-0700 (PDT),http://lorempixel.com/400/400/business,Cupiditate velit earum est nostrum excepturi vero maxime et.,468,Sun May 05 2019 14:25:54 GMT-0700 (PDT)
679,72,5,23,Wed Jun 19 2019 12:27:27 GMT-0700 (PDT),http://lorempixel.com/400/400/business,Debitis iste ut est ut impedit.,840,Sun Aug 18 2019 22:14:24 GMT-0700 (PDT)
680,47,4,19,Thu Jun 13 2019 12:13:00 GMT-0700 (PDT),http://lorempixel.com/400/400/business,Earum nesciunt ut impedit aliquam officia.,143,Thu Sep 26 2019 01:18:54 GMT-0700 (PDT)
681,13,1,6,Sun May 26 2019 07:26:22 GMT-0700 (PDT),http://lorempixel.com/400/400/business,Earum sit minima quo illum dolore culpa possimus velit commodi.,395,Sun Aug 25 2019 08:20:46 GMT-0700 (PDT)
682,13,1,8,Mon Apr 01 2019 12:25:18 GMT-0700 (PDT),http://lorempixel.com/400/400/business,Optio neque optio eum mollitia aut pariatur a.,145,Sat Jul 13 2019 21:48:58 GMT-0700 (PDT)
683,22,2,10,Tue May 28 2019 16:18:41 GMT-0700 (PDT),http://lorempixel.com/400/400/business,Alias rerum quas mollitia amet minima id.,553,Mon Jul 08 2019 16:57:55 GMT-0700 (PDT)
684,23,2,9,Fri May 10 2019 02:15:14 GMT-0700 (PDT),http://lorempixel.com/400/400/business,Accusamus rerum eaque harum temporibus.,57,Sun Jul 07 2019 10:48:35 GMT-0700 (PDT)
685,50,5,23,Sat Jul 06 2019 01:45:43 GMT-0700 (PDT),http://lorempixel.com/400/400/business,Vitae iusto voluptatum libero.,403,Mon Sep 09 2019 15:32:16 GMT-0700 (PDT)
686,92,1,2,Mon Apr 15 2019 10:34:28 GMT-0700 (PDT),http://lorempixel.com/400/400/business,In incidunt autem quae voluptatem dolores amet.,640,Sat Jul 27 2019 02:18:39 GMT-0700 (PDT)
687,26,1,8,Sun Apr 28 2019 09:06:52 GMT-0700 (PDT),http://lorempixel.com/400/400/business,Et exercitationem doloremque qui voluptas et inventore id placeat.,268,Tue Aug 20 2019 10:31:40 GMT-0700 (PDT)
688,72,2,9,Wed Jul 31 2019 15:52:53 GMT-0700 (PDT),http://lorempixel.com/400/400/business,Dolorum maxime necessitatibus excepturi aut vitae ipsum.,597,Fri Aug 16 2019 08:27:21 GMT-0700 (PDT)
689,27,3,16,Tue Apr 02 2019 03:30:19 GMT-0700 (PDT),http://lorempixel.com/400/400/business,Est voluptatem atque ut magnam possimus nam.,414,Thu Jun 06 2019 15:25:03 GMT-0700 (PDT)
690,21,1,2,Sun Apr 28 2019 00:22:08 GMT-0700 (PDT),http://lorempixel.com/400/400/business,Dolorum qui iusto voluptatem at non.,955,Tue Aug 13 2019 16:59:51 GMT-0700 (PDT)
691,13,4,20,Fri Apr 19 2019 07:17:45 GMT-0700 (PDT),http://lorempixel.com/400/400/business,Soluta rerum esse sunt in.,525,Fri Apr 19 2019 11:33:33 GMT-0700 (PDT)
692,2,2,9,Sun Jun 16 2019 15:26:17 GMT-0700 (PDT),http://lorempixel.com/400/400/business,Nihil ducimus quis at animi id rerum quia.,496,Sun Jul 28 2019 19:40:02 GMT-0700 (PDT)
693,58,4,19,Tue May 21 2019 00:22:45 GMT-0700 (PDT),http://lorempixel.com/400/400/business,Et ab sint rem repellendus aspernatur quo aperiam nemo.,364,Fri Jun 28 2019 03:46:38 GMT-0700 (PDT)
694,17,3,14,Tue Apr 09 2019 21:06:01 GMT-0700 (PDT),http://lorempixel.com/400/400/business,Vel quis voluptatem.,393,Wed Jul 24 2019 07:10:13 GMT-0700 (PDT)
695,60,4,21,Tue May 14 2019 03:12:02 GMT-0700 (PDT),http://lorempixel.com/400/400/business,Quia totam tempora eveniet expedita.,68,Sat Sep 21 2019 20:53:30 GMT-0700 (PDT)
696,38,1,8,Sun Jun 30 2019 01:14:38 GMT-0700 (PDT),http://lorempixel.com/400/400/business,In aperiam odio aspernatur libero.,90,Thu Sep 05 2019 06:17:43 GMT-0700 (PDT)
697,97,3,16,Sun Jun 09 2019 14:20:16 GMT-0700 (PDT),http://lorempixel.com/400/400/business,Dolorem ipsam odit consequatur consequatur velit.,183,Sat Jun 15 2019 22:13:50 GMT-0700 (PDT)
698,44,2,9,Fri Jul 12 2019 07:35:14 GMT-0700 (PDT),http://lorempixel.com/400/400/business,Et temporibus doloribus.,961,Thu Aug 08 2019 12:11:46 GMT-0700 (PDT)
699,45,2,10,Thu May 02 2019 05:40:11 GMT-0700 (PDT),http://lorempixel.com/400/400/business,Quis et enim reprehenderit accusamus nostrum rerum exercitationem tenetur.,816,Tue Sep 24 2019 00:26:48 GMT-0700 (PDT)
700,35,1,1,Tue Apr 02 2019 00:51:12 GMT-0700 (PDT),http://lorempixel.com/400/400/business,Temporibus rerum rerum.,773,Wed Apr 10 2019 21:02:08 GMT-0700 (PDT)
701,68,5,23,Fri Jul 12 2019 02:27:57 GMT-0700 (PDT),http://lorempixel.com/400/400/business,Consequatur ut pariatur qui necessitatibus.,139,Tue Sep 17 2019 17:53:20 GMT-0700 (PDT)
702,41,3,17,Fri Jun 07 2019 10:30:15 GMT-0700 (PDT),http://lorempixel.com/400/400/business,Est velit laborum sit omnis.,848,Tue Jun 11 2019 00:07:05 GMT-0700 (PDT)
703,67,1,5,Thu Jul 25 2019 05:01:13 GMT-0700 (PDT),http://lorempixel.com/400/400/business,Voluptatem commodi non omnis saepe voluptatem totam rem.,435,Sun Sep 01 2019 11:52:17 GMT-0700 (PDT)
704,37,5,22,Fri May 10 2019 00:10:24 GMT-0700 (PDT),http://lorempixel.com/400/400/business,Consectetur consectetur voluptate quibusdam perspiciatis.,491,Sat Jul 20 2019 04:40:49 GMT-0700 (PDT)
705,70,5,22,Sat Jun 29 2019 12:18:21 GMT-0700 (PDT),http://lorempixel.com/400/400/business,Qui dolor dolores iure unde quos.,123,Mon Aug 19 2019 20:36:49 GMT-0700 (PDT)
706,61,4,18,Sat Jun 29 2019 04:42:27 GMT-0700 (PDT),http://lorempixel.com/400/400/business,Numquam qui officia distinctio at vero maiores.,75,Sat Sep 28 2019 18:57:33 GMT-0700 (PDT)
707,20,2,11,Sun Jul 14 2019 09:24:45 GMT-0700 (PDT),http://lorempixel.com/400/400/business,Est similique nesciunt.,918,Sun Aug 11 2019 03:10:20 GMT-0700 (PDT)
708,63,5,23,Fri May 10 2019 08:07:15 GMT-0700 (PDT),http://lorempixel.com/400/400/business,Ut assumenda qui pariatur voluptatem.,961,Wed May 22 2019 13:15:03 GMT-0700 (PDT)
709,14,1,3,Mon Jul 29 2019 02:34:43 GMT-0700 (PDT),http://lorempixel.com/400/400/business,Ducimus laudantium aliquam qui voluptatem similique.,763,Sat Aug 03 2019 05:35:02 GMT-0700 (PDT)
710,26,4,20,Thu Jul 25 2019 18:41:37 GMT-0700 (PDT),http://lorempixel.com/400/400/business,Molestias sit voluptas consequatur ipsam modi distinctio quis molestias sit.,220,Thu Aug 15 2019 01:00:04 GMT-0700 (PDT)
711,3,3,15,Tue May 28 2019 05:21:13 GMT-0700 (PDT),http://lorempixel.com/400/400/business,Molestiae velit repellat nemo fugit animi.,971,Fri Jun 21 2019 05:04:15 GMT-0700 (PDT)
712,97,3,14,Tue Apr 23 2019 06:28:06 GMT-0700 (PDT),http://lorempixel.com/400/400/business,Ut voluptatum et a odio sapiente vel consequatur ratione.,111,Tue Aug 13 2019 03:39:26 GMT-0700 (PDT)
713,15,5,22,Mon Jul 22 2019 07:32:26 GMT-0700 (PDT),http://lorempixel.com/400/400/business,Incidunt temporibus cupiditate enim deleniti expedita.,466,Thu Sep 19 2019 13:33:25 GMT-0700 (PDT)
714,97,4,19,Tue Apr 09 2019 01:00:01 GMT-0700 (PDT),http://lorempixel.com/400/400/business,Atque accusantium sit expedita eius.,782,Sat Sep 21 2019 15:02:41 GMT-0700 (PDT)
715,59,5,22,Thu Apr 11 2019 18:31:41 GMT-0700 (PDT),http://lorempixel.com/400/400/business,Hic enim maiores maiores omnis.,330,Fri Apr 19 2019 18:12:42 GMT-0700 (PDT)
716,77,3,15,Wed May 01 2019 01:32:41 GMT-0700 (PDT),http://lorempixel.com/400/400/business,Id quibusdam nemo autem.,723,Thu Sep 26 2019 00:54:07 GMT-0700 (PDT)
717,33,4,21,Mon Jul 01 2019 19:47:30 GMT-0700 (PDT),http://lorempixel.com/400/400/business,Fuga rerum neque laborum.,448,Wed Jul 24 2019 05:39:22 GMT-0700 (PDT)
718,34,4,18,Thu Jun 13 2019 21:58:41 GMT-0700 (PDT),http://lorempixel.com/400/400/business,Totam aliquid asperiores.,205,Wed Sep 04 2019 09:45:23 GMT-0700 (PDT)
719,36,1,4,Thu Jul 25 2019 13:23:16 GMT-0700 (PDT),http://lorempixel.com/400/400/business,Eligendi sed voluptas qui facere repellat laudantium.,623,Sun Aug 25 2019 12:34:19 GMT-0700 (PDT)
720,72,3,16,Fri Aug 02 2019 16:09:25 GMT-0700 (PDT),http://lorempixel.com/400/400/business,Sint velit aut quia enim aut in odit.,36,Fri Aug 30 2019 12:28:02 GMT-0700 (PDT)
721,83,1,8,Sun Jul 07 2019 06:51:09 GMT-0700 (PDT),http://lorempixel.com/400/400/business,Numquam ullam rerum.,914,Mon Jul 08 2019 09:04:46 GMT-0700 (PDT)
722,54,1,7,Mon Apr 01 2019 13:28:30 GMT-0700 (PDT),http://lorempixel.com/400/400/business,Omnis harum animi inventore cupiditate sint.,192,Sat Aug 10 2019 13:53:36 GMT-0700 (PDT)
723,4,2,12,Sat Apr 27 2019 22:20:50 GMT-0700 (PDT),http://lorempixel.com/400/400/business,Amet rerum vitae architecto corrupti quia itaque.,887,Thu May 09 2019 06:12:31 GMT-0700 (PDT)
724,36,5,23,Sun May 19 2019 01:07:55 GMT-0700 (PDT),http://lorempixel.com/400/400/business,Cumque magnam et iure molestiae voluptas illo autem corrupti corrupti.,816,Sun Jul 28 2019 20:58:56 GMT-0700 (PDT)
