id,roomId,category,subcategory,date,photoUrl,description,cost,dateFixed
1,73,3,17,Mon May 13 2019 19:39:14 GMT-0700 (PDT),http://lorempixel.com/400/400/business,Vitae et maiores ut illo totam.,641,Thu Sep 19 2019 03:51:52 GMT-0700 (PDT)
2,1,2,10,Wed Jul 31 2019 22:32:16 GMT-0700 (PDT),http://lorempixel.com/400/400/business,Labore culpa animi vel nam unde repellendus inventore dignissimos qui.,424,Sun Aug 04 2019 15:55:38 GMT-0700 (PDT)
3,60,1,5,Sun Jun 02 2019 07:45:47 GMT-0700 (PDT),http://lorempixel.com/400/400/business,Eligendi sequi rem nemo reprehenderit autem atque rerum et quae.,390,Mon Aug 12 2019 17:26:55 GMT-0700 (PDT)
4,10,1,3,Sat Apr 27 2019 22:33:32 GMT-0700 (PDT),http://lorempixel.com/400/400/business,Quae minima ut cum possimus similique veniam.,432,Sun Jun 30 2019 05:32:39 GMT-0700 (PDT)
5,4,5,23,Sat Aug 03 2019 22:45:26 GMT-0700 (PDT),http://lorempixel.com/400/400/business,Libero voluptas aut adipisci quia numquam mollitia voluptas.,590,Wed Sep 25 2019 18:59:20 GMT-0700 (PDT)
6,86,2,10,Sun Mar 31 2019 19:01:26 GMT-0700 (PDT),http://lorempixel.com/400/400/business,Harum placeat beatae dolor.,71,Sat Jun 15 2019 00:48:32 GMT-0700 (PDT)
7,4,3,15,Sun Apr 28 2019 01:20:30 GMT-0700 (PDT),http://lorempixel.com/400/400/business,Exercitationem aut recusandae ut qui.,99,Sun Jun 09 2019 00:03:38 GMT-0700 (PDT)
8,22,3,17,Wed May 01 2019 10:00:15 GMT-0700 (PDT),http://lorempixel.com/400/400/business,Necessitatibus eius quaerat perferendis quo quia est sapiente voluptatum aliquam.,23,Fri Sep 27 2019 23:01:26 GMT-0700 (PDT)
9,99,1,4,Sat Jun 29 2019 01:35:14 GMT-0700 (PDT),http://lorempixel.com/400/400/business,Sed ducimus quidem provident sit aliquam iure repellat sunt.,531,Mon Jul 29 2019 00:33:05 GMT-0700 (PDT)
10,48,3,17,Wed Apr 10 2019 04:56:26 GMT-0700 (PDT),http://lorempixel.com/400/400/business,Eum velit commodi quis dolores id tempore earum maxime qui.,625,Thu Aug 22 2019 23:54:56 GMT-0700 (PDT)
11,35,1,5,Sun May 05 2019 07:10:00 GMT-0700 (PDT),http://lorempixel.com/400/400/business,Dolorum molestias sint commodi.,954,Fri Sep 13 2019 08:18:25 GMT-0700 (PDT)
12,14,2,10,Sun Apr 07 2019 22:52:24 GMT-0700 (PDT),http://lorempixel.com/400/400/business,Minus et numquam non est magnam vero voluptatem quia occaecati.,179,Mon Sep 16 2019 00:48:02 GMT-0700 (PDT)
13,50,3,17,Sun May 12 2019 12:57:30 GMT-0700 (PDT),http://lorempixel.com/400/400/business,Vel asperiores occaecati sed ut illo voluptatum dignissimos quidem.,399,Thu Aug 01 2019 23:24:45 GMT-0700 (PDT)
14,46,3,16,Tue May 07 2019 08:49:54 GMT-0700 (PDT),http://lorempixel.com/400/400/business,Earum ratione qui adipisci aut distinctio.,935,Fri May 17 2019 14:41:19 GMT-0700 (PDT)
15,2,1,4,Fri Jul 12 2019 20:17:36 GMT-0700 (PDT),http://lorempixel.com/400/400/business,Magnam in incidunt autem illum occaecati dolorum.,490,Tue Aug 13 2019 10:49:42 GMT-0700 (PDT)
16,10,2,9,Wed Jul 03 2019 08:49:56 GMT-0700 (PDT),http://lorempixel.com/400/400/business,Occaecati impedit vel amet laudantium magnam in.,223,Wed Aug 28 2019 05:52:35 GMT-0700 (PDT)
17,4,3,15,Wed May 08 2019 01:48:05 GMT-0700 (PDT),http://lorempixel.com/400/400/business,Id aut eum voluptas quo esse.,469,Mon May 13 2019 20:01:39 GMT-0700 (PDT)
18,60,1,4,Sat May 04 2019 13:42:55 GMT-0700 (PDT),http://lorempixel.com/400/400/business,Possimus voluptatem fugiat.,631,Fri Aug 30 2019 05:52:18 GMT-0700 (PDT)
19,51,5,23,Sat May 25 2019 02:22:44 GMT-0700 (PDT),http://lorempixel.com/400/400/business,Vero adipisci molestiae ullam ab fugit tempora et.,979,Wed Jun 05 2019 06:14:33 GMT-0700 (PDT)
20,32,3,17,Sun Jun 30 2019 22:08:46 GMT-0700 (PDT),http://lorempixel.com/400/400/business,Harum reiciendis doloribus perspiciatis.,982,Thu Jul 11 2019 02:38:11 GMT-0700 (PDT)
21,86,5,22,Sat Apr 20 2019 19:22:32 GMT-0700 (PDT),http://lorempixel.com/400/400/business,Id ullam provident.,651,Wed May 08 2019 01:59:00 GMT-0700 (PDT)
22,40,2,10,Wed Apr 24 2019 21:19:06 GMT-0700 (PDT),http://lorempixel.com/400/400/business,Et aut ipsam esse.,166,Mon Sep 02 2019 06:35:01 GMT-0700 (PDT)
23,34,1,4,Fri Jun 28 2019 12:27:20 GMT-0700 (PDT),http://lorempixel.com/400/400/business,Quia ea eum ea id.,334,Thu Aug 01 2019 03:41:27 GMT-0700 (PDT)
24,80,2,9,Thu May 30 2019 06:53:43 GMT-0700 (PDT),http://lorempixel.com/400/400/business,Et qui maxime.,685,Wed Aug 07 2019 17:09:44 GMT-0700 (PDT)
25,55,1,1,Fri May 10 2019 01:30:38 GMT-0700 (PDT),http://lorempixel.com/400/400/business,Vero a voluptas minus voluptatem nemo.,290,Mon Aug 26 2019 03:00:53 GMT-0700 (PDT)
26,38,2,12,Mon Apr 29 2019 10:02:22 GMT-0700 (PDT),http://lorempixel.com/400/400/business,Officia tempore quaerat nemo ducimus quia labore minima quia aliquam.,608,Sat Sep 28 2019 18:25:56 GMT-0700 (PDT)
27,67,5,22,Sat Jun 15 2019 11:23:17 GMT-0700 (PDT),http://lorempixel.com/400/400/business,Veritatis aliquid provident molestias.,380,Fri Sep 13 2019 12:32:33 GMT-0700 (PDT)
28,95,1,7,Sun Mar 31 2019 20:08:18 GMT-0700 (PDT),http://lorempixel.com/400/400/business,Enim ab ut nihil ex et est facilis laborum.,742,Wed Apr 17 2019 09:56:05 GMT-0700 (PDT)
29,58,3,14,Wed May 01 2019 23:41:50 GMT-0700 (PDT),http://lorempixel.com/400/400/business,Laboriosam voluptas quis amet qui amet ipsum hic quia.,540,Mon May 06 2019 14:57:19 GMT-0700 (PDT)
30,20,1,7,Fri Jun 21 2019 04:37:23 GMT-0700 (PDT),http://lorempixel.com/400/400/business,Pariatur reprehenderit aut eveniet numquam velit laudantium voluptatem amet vero.,525,Tue Aug 06 2019 06:10:25 GMT-0700 (PDT)
31,35,5,23,Mon May 27 2019 09:32:43 GMT-0700 (PDT),http://lorempixel.com/400/400/business,Enim minus ullam eum est odit.,817,Thu Jun 20 2019 02:27:05 GMT-0700 (PDT)
32,63,3,16,Sat May 18 2019 14:50:05 GMT-0700 (PDT),http://lorempixel.com/400/400/business,Sit quia est veritatis odit autem eveniet.,984,Wed Jun 26 2019 17:11:29 GMT-0700 (PDT)
33,52,1,1,Wed Apr 03 2019 07:10:06 GMT-0700 (PDT),http://lorempixel.com/400/400/business,Ratione repellendus sint nulla.,830,Tue May 07 2019 14:37:19 GMT-0700 (PDT)
34,74,5,23,Mon Jun 03 2019 01:10:50 GMT-0700 (PDT),http://lorempixel.com/400/400/business,Quae hic quasi qui provident expedita rerum.,823,Mon Jul 08 2019 09:52:45 GMT-0700 (PDT)
35,28,2,12,Tue Apr 30 2019 20:45:40 GMT-0700 (PDT),http://lorempixel.com/400/400/business,Delectus sunt ad nobis at amet est.,470,Mon May 13 2019 13:10:58 GMT-0700 (PDT)
36,10,4,19,Tue Jul 16 2019 04:39:43 GMT-0700 (PDT),http://lorempixel.com/400/400/business,Fugiat dolor ut voluptatem.,469,Tue Aug 06 2019 21:57:45 GMT-0700 (PDT)
37,82,3,16,Sun Jul 21 2019 20:37:54 GMT-0700 (PDT),http://lorempixel.com/400/400/business,Hic animi nesciunt quibusdam perferendis voluptates optio modi.,455,Sun Sep 01 2019 06:42:21 GMT-0700 (PDT)
38,59,2,10,Thu Apr 11 2019 00:15:17 GMT-0700 (PDT),http://lorempixel.com/400/400/business,Mollitia magni molestiae veniam ducimus quia voluptas eligendi eligendi et.,46,Sat Jul 06 2019 00:24:02 GMT-0700 (PDT)
39,95,5,23,Wed Apr 17 2019 23:17:30 GMT-0700 (PDT),http://lorempixel.com/400/400/business,Quam aspernatur deleniti possimus magni quis et.,179,Wed May 15 2019 10:05:18 GMT-0700 (PDT)
40,71,3,14,Wed May 22 2019 19:13:25 GMT-0700 (PDT),http://lorempixel.com/400/400/business,Doloribus aut aut.,12,Wed Jul 24 2019 13:07:16 GMT-0700 (PDT)
41,63,1,6,Fri Aug 02 2019 15:37:56 GMT-0700 (PDT),http://lorempixel.com/400/400/business,Voluptatem aliquam mollitia in repellat sint molestiae cumque molestiae.,507,Wed Sep 04 2019 12:01:47 GMT-0700 (PDT)
42,20,5,23,Fri Jul 26 2019 12:06:12 GMT-0700 (PDT),http://lorempixel.com/400/400/business,Ut eligendi enim dolores ducimus est et qui.,312,Tue Aug 20 2019 12:56:47 GMT-0700 (PDT)
43,49,4,20,Sat Jun 01 2019 13:26:47 GMT-0700 (PDT),http://lorempixel.com/400/400/business,Molestiae vitae earum maiores reprehenderit ut quisquam similique.,152,Sun Sep 01 2019 07:01:59 GMT-0700 (PDT)
44,30,3,14,Mon Apr 08 2019 01:32:57 GMT-0700 (PDT),http://lorempixel.com/400/400/business,Sed consequatur eum non eum quos.,339,Thu Aug 01 2019 21:49:47 GMT-0700 (PDT)
45,34,4,19,Tue Apr 30 2019 10:53:49 GMT-0700 (PDT),http://lorempixel.com/400/400/business,Officia neque non a corrupti explicabo totam rerum.,626,Sun Jun 09 2019 22:26:55 GMT-0700 (PDT)
46,33,2,10,Tue Apr 02 2019 04:03:01 GMT-0700 (PDT),http://lorempixel.com/400/400/business,Rerum quia quos itaque nihil assumenda repellat est repudiandae.,789,Sun Apr 21 2019 18:17:33 GMT-0700 (PDT)
47,55,2,9,Sat Aug 03 2019 19:49:54 GMT-0700 (PDT),http://lorempixel.com/400/400/business,Inventore porro tempora et qui veniam omnis ut dolore.,953,Tue Aug 13 2019 02:49:44 GMT-0700 (PDT)
48,70,1,4,Wed Apr 03 2019 10:47:30 GMT-0700 (PDT),http://lorempixel.com/400/400/business,Voluptate voluptate quasi occaecati ducimus alias omnis recusandae est in.,266,Mon May 13 2019 07:50:13 GMT-0700 (PDT)
49,66,5,22,Wed May 01 2019 09:40:25 GMT-0700 (PDT),http://lorempixel.com/400/400/business,Inventore aperiam expedita ipsa.,499,Mon Jul 29 2019 12:15:34 GMT-0700 (PDT)
50,10,4,18,Sat May 04 2019 20:24:44 GMT-0700 (PDT),http://lorempixel.com/400/400/business,Iure dolorem et quis a iure in cum.,664,Wed Jun 05 2019 01:03:17 GMT-0700 (PDT)
51,1,3,17,Sun Jul 07 2019 08:56:53 GMT-0700 (PDT),http://lorempixel.com/400/400/business,Quae ab est illo nihil nemo qui aliquid illum.,194,Tue Aug 27 2019 03:10:45 GMT-0700 (PDT)
52,55,5,22,Fri May 31 2019 11:50:41 GMT-0700 (PDT),http://lorempixel.com/400/400/business,Facere ut voluptatem aut facilis numquam.,182,Thu Sep 05 2019 06:49:57 GMT-0700 (PDT)
53,62,1,5,Fri Jun 28 2019 11:41:52 GMT-0700 (PDT),http://lorempixel.com/400/400/business,Sunt expedita eligendi exercitationem.,925,Sat Jun 29 2019 06:13:31 GMT-0700 (PDT)
54,89,3,16,Sun Jun 16 2019 23:05:13 GMT-0700 (PDT),http://lorempixel.com/400/400/business,Ut suscipit aliquid porro ut recusandae sed.,751,Sun Aug 25 2019 16:14:15 GMT-0700 (PDT)
55,73,2,10,Sat Jun 22 2019 10:04:51 GMT-0700 (PDT),http://lorempixel.com/400/400/business,Provident eius quidem enim deserunt accusamus.,328,Sat Aug 03 2019 02:52:54 GMT-0700 (PDT)
56,29,4,19,Tue Apr 16 2019 15:00:29 GMT-0700 (PDT),http://lorempixel.com/400/400/business,Ipsa repellat quas numquam ratione cum similique.,738,Tue Jun 18 2019 18:47:55 GMT-0700 (PDT)
57,92,1,5,Tue Apr 30 2019 07:26:12 GMT-0700 (PDT),http://lorempixel.com/400/400/business,Id adipisci dolores praesentium fuga maxime qui eum.,486,Sun Jun 23 2019 13:31:39 GMT-0700 (PDT)
58,42,1,4,Thu May 30 2019 12:57:08 GMT-0700 (PDT),http://lorempixel.com/400/400/business,Quisquam saepe sunt voluptas odit ab repudiandae.,984,Mon Jul 22 2019 13:12:27 GMT-0700 (PDT)
59,23,4,21,Thu Aug 01 2019 19:12:08 GMT-0700 (PDT),http://lorempixel.com/400/400/business,Molestiae et similique cupiditate.,272,Tue Aug 27 2019 17:40:07 GMT-0700 (PDT)
60,19,3,16,Wed Jun 26 2019 23:25:46 GMT-0700 (PDT),http://lorempixel.com/400/400/business,Sunt unde dignissimos.,142,Wed Jul 03 2019 02:00:38 GMT-0700 (PDT)
61,49,4,18,Thu Jul 11 2019 20:45:23 GMT-0700 (PDT),http://lorempixel.com/400/400/business,Earum dolores soluta ea vel explicabo.,552,Thu Sep 12 2019 14:20:03 GMT-0700 (PDT)
62,84,1,4,Sun Jun 02 2019 18:53:09 GMT-0700 (PDT),http://lorempixel.com/400/400/business,Vel voluptatum quae inventore et facilis mollitia et.,935,Tue Jul 02 2019 03:59:47 GMT-0700 (PDT)
63,85,3,17,Thu May 16 2019 17:47:18 GMT-0700 (PDT),http://lorempixel.com/400/400/business,Mollitia voluptatem exercitationem fugit occaecati vero.,510,Sat Jul 20 2019 00:33:54 GMT-0700 (PDT)
64,31,4,19,Wed May 22 2019 02:53:42 GMT-0700 (PDT),http://lorempixel.com/400/400/business,Qui magnam dolorum eum sit.,822,Sun Jun 09 2019 06:46:59 GMT-0700 (PDT)
65,77,2,9,Mon Jun 24 2019 22:30:50 GMT-0700 (PDT),http://lorempixel.com/400/400/business,Fugit adipisci ratione saepe aspernatur.,90,Sun Jul 28 2019 18:27:36 GMT-0700 (PDT)
66,1,4,21,Mon Jul 15 2019 19:31:53 GMT-0700 (PDT),http://lorempixel.com/400/400/business,Ut vel nobis magni et quis nemo nam et.,17,Mon Sep 02 2019 03:47:08 GMT-0700 (PDT)
67,43,1,7,Mon Jul 22 2019 16:24:13 GMT-0700 (PDT),http://lorempixel.com/400/400/business,Rerum recusandae eos quibusdam voluptates qui qui quisquam sunt.,59,Mon Sep 16 2019 01:41:57 GMT-0700 (PDT)
68,16,1,3,Fri Jul 26 2019 09:50:29 GMT-0700 (PDT),http://lorempixel.com/400/400/business,Accusantium explicabo illum libero.,146,Fri Aug 16 2019 02:41:12 GMT-0700 (PDT)
69,86,5,22,Fri Jul 19 2019 00:06:57 GMT-0700 (PDT),http://lorempixel.com/400/400/business,Voluptate delectus illo velit et delectus.,901,Wed Jul 24 2019 03:55:06 GMT-0700 (PDT)
70,4,3,16,Sun May 12 2019 09:21:31 GMT-0700 (PDT),http://lorempixel.com/400/400/business,Delectus eum sequi veniam perferendis.,97,Mon Jul 15 2019 07:06:09 GMT-0700 (PDT)
71,100,3,14,Mon Jun 03 2019 13:53:46 GMT-0700 (PDT),http://lorempixel.com/400/400/business,Dolor blanditiis sint est sunt voluptatem porro.,855,Mon Sep 30 2019 10:21:07 GMT-0700 (PDT)
72,7,2,10,Wed May 22 2019 15:27:18 GMT-0700 (PDT),http://lorempixel.com/400/400/business,Culpa ex a.,81,Mon Jun 10 2019 07:55:56 GMT-0700 (PDT)
73,6,2,13,Mon Apr 29 2019 01:55:19 GMT-0700 (PDT),http://lorempixel.com/400/400/business,Iusto non quia voluptate.,860,Wed May 08 2019 01:13:57 GMT-0700 (PDT)
74,11,3,17,Sun Apr 21 2019 06:05:04 GMT-0700 (PDT),http://lorempixel.com/400/400/business,Laboriosam pariatur iusto doloribus enim voluptas explicabo amet ea voluptatem.,841,Fri May 03 2019 01:02:45 GMT-0700 (PDT)
75,28,4,21,Mon May 27 2019 01:41:49 GMT-0700 (PDT),http://lorempixel.com/400/400/business,Ad at asperiores perspiciatis.,140,Wed Jul 10 2019 10:08:30 GMT-0700 (PDT)
76,77,4,19,Mon May 06 2019 06:25:08 GMT-0700 (PDT),http://lorempixel.com/400/400/business,Aliquid soluta molestiae voluptatem repellendus est dolorum vitae ex neque.,663,Thu Jul 11 2019 01:09:50 GMT-0700 (PDT)
77,62,3,17,Wed Jul 17 2019 09:33:47 GMT-0700 (PDT),http://lorempixel.com/400/400/business,Nihil autem amet aut.,170,Sun Aug 11 2019 12:02:53 GMT-0700 (PDT)
78,54,4,20,Sat Aug 03 2019 11:53:11 GMT-0700 (PDT),http://lorempixel.com/400/400/business,Quia et est fugiat sit molestiae est officiis.,756,Thu Aug 15 2019 14:40:30 GMT-0700 (PDT)
79,4,3,16,Wed Jul 24 2019 01:04:23 GMT-0700 (PDT),http://lorempixel.com/400/400/business,Iusto nam fuga qui ad minima in.,710,Wed Aug 28 2019 01:15:16 GMT-0700 (PDT)
80,17,5,23,Wed Jun 05 2019 17:54:18 GMT-0700 (PDT),http://lorempixel.com/400/400/business,Ut dicta fuga mollitia asperiores.,598,Sun Aug 25 2019 01:08:06 GMT-0700 (PDT)
81,74,2,10,Wed May 15 2019 14:08:52 GMT-0700 (PDT),http://lorempixel.com/400/400/business,Tempore consequatur dolores ut et et aut libero minima.,81,Mon May 20 2019 00:00:07 GMT-0700 (PDT)
82,25,4,19,Sat May 18 2019 03:29:06 GMT-0700 (PDT),http://lorempixel.com/400/400/business,Numquam qui rerum quasi est ullam debitis et amet quis.,609,Wed Jun 12 2019 09:38:04 GMT-0700 (PDT)
83,10,2,9,Wed Jul 24 2019 11:55:55 GMT-0700 (PDT),http://lorempixel.com/400/400/business,Molestiae error ipsa.,357,Tue Aug 27 2019 20:04:14 GMT-0700 (PDT)
84,43,3,16,Tue Apr 30 2019 05:53:12 GMT-0700 (PDT),http://lorempixel.com/400/400/business,Dolorum in et et laborum et voluptatem.,628,Sat Aug 17 2019 13:32:45 GMT-0700 (PDT)
85,53,1,6,Sat Jul 20 2019 11:05:26 GMT-0700 (PDT),http://lorempixel.com/400/400/business,Dolorem et et rem.,500,Fri Aug 30 2019 10:55:50 GMT-0700 (PDT)
86,44,1,1,Thu May 23 2019 08:32:43 GMT-0700 (PDT),http://lorempixel.com/400/400/business,Et error consequatur ut nihil temporibus.,403,Mon Jun 03 2019 05:07:20 GMT-0700 (PDT)
87,56,3,14,Thu Jun 13 2019 19:56:03 GMT-0700 (PDT),http://lorempixel.com/400/400/business,Deserunt aliquam et consequuntur perspiciatis suscipit magni error atque animi.,123,Wed Jul 03 2019 13:22:40 GMT-0700 (PDT)
88,35,5,22,Wed May 01 2019 11:46:13 GMT-0700 (PDT),http://lorempixel.com/400/400/business,Suscipit molestiae nostrum dolorem et minima labore atque unde quo.,344,Mon Jun 24 2019 02:09:55 GMT-0700 (PDT)
89,51,5,22,Mon Apr 29 2019 10:07:56 GMT-0700 (PDT),http://lorempixel.com/400/400/business,Eaque minima ipsum quidem at eos.,328,Sat May 11 2019 03:51:58 GMT-0700 (PDT)
90,43,4,20,Sat Jun 08 2019 22:41:44 GMT-0700 (PDT),http://lorempixel.com/400/400/business,Omnis minima quae dicta repellat voluptatem.,286,Sat Jul 13 2019 11:38:15 GMT-0700 (PDT)
91,38,5,23,Sat Jun 29 2019 01:23:34 GMT-0700 (PDT),http://lorempixel.com/400/400/business,Voluptatem illum dolor ut nulla mollitia earum.,167,Tue Aug 27 2019 04:54:52 GMT-0700 (PDT)
92,27,2,9,Sat Jun 29 2019 19:35:30 GMT-0700 (PDT),http://lorempixel.com/400/400/business,Tempore beatae error molestiae rerum exercitationem.,512,Thu Aug 15 2019 21:57:25 GMT-0700 (PDT)
93,41,4,21,Mon May 27 2019 05:14:07 GMT-0700 (PDT),http://lorempixel.com/400/400/business,Recusandae nihil soluta qui qui ipsum ut nostrum alias.,197,Thu May 30 2019 01:58:07 GMT-0700 (PDT)
94,95,4,20,Tue Jun 11 2019 20:06:34 GMT-0700 (PDT),http://lorempixel.com/400/400/business,Quos est impedit quisquam est quis ut laborum.,516,Sat Sep 28 2019 10:02:02 GMT-0700 (PDT)
95,73,3,16,Sun Apr 07 2019 19:02:30 GMT-0700 (PDT),http://lorempixel.com/400/400/business,Aut aut quia amet et harum sed quibusdam provident similique.,813,Sun Jun 16 2019 09:24:18 GMT-0700 (PDT)
96,17,5,22,Wed Jun 26 2019 18:17:11 GMT-0700 (PDT),http://lorempixel.com/400/400/business,Ut sed dolorum nostrum magni dolores mollitia maiores.,832,Tue Jul 09 2019 00:24:27 GMT-0700 (PDT)
97,84,4,20,Wed Jun 19 2019 09:15:42 GMT-0700 (PDT),http://lorempixel.com/400/400/business,Nihil quia et.,595,Thu Jul 25 2019 06:54:51 GMT-0700 (PDT)
98,30,4,20,Wed Jul 03 2019 08:38:46 GMT-0700 (PDT),http://lorempixel.com/400/400/business,Consequatur dolores ab exercitationem non quas.,809,Fri Aug 02 2019 02:10:20 GMT-0700 (PDT)
99,72,5,22,Sun Jul 21 2019 13:00:10 GMT-0700 (PDT),http://lorempixel.com/400/400/business,Aut id sed quia sit ut est.,766,Sun Aug 25 2019 15:40:45 GMT-0700 (PDT)
100,95,5,23,Wed Apr 10 2019 03:48:18 GMT-0700 (PDT),http://lorempixel.com/400/400/business,Expedita cumque culpa ea voluptatem modi molestiae et modi dolores.,273,Mon Sep 09 2019 03:53:40 GMT-0700 (PDT)
101,13,3,14,Mon Jun 10 2019 04:30:58 GMT-0700 (PDT),http://lorempixel.com/400/400/business,Libero expedita corporis maiores aut quibusdam est.,56,Sat Aug 31 2019 02:14:36 GMT-0700 (PDT)
102,77,4,21,Wed Jun 26 2019 10:20:10 GMT-0700 (PDT),http://lorempixel.com/400/400/business,Blanditiis error autem molestiae aspernatur et facilis ea voluptatibus.,70,Sat Sep 28 2019 22:03:54 GMT-0700 (PDT)
103,72,4,18,Mon Apr 22 2019 01:49:40 GMT-0700 (PDT),http://lorempixel.com/400/400/business,Quis quae sint eos magni ut magni.,906,Fri Sep 06 2019 05:19:24 GMT-0700 (PDT)
104,37,5,22,Tue May 28 2019 04:02:52 GMT-0700 (PDT),http://lorempixel.com/400/400/business,Deserunt qui quam tempora dolorum et recusandae repellat.,793,Sun Jun 16 2019 20:11:19 GMT-0700 (PDT)
105,26,5,23,Fri Apr 05 2019 16:51:41 GMT-0700 (PDT),http://lorempixel.com/400/400/business,Nemo consequatur est numquam qui corporis.,591,Sun Aug 04 2019 04:59:16 GMT-0700 (PDT)
106,33,4,21,Tue Apr 30 2019 07:48:57 GMT-0700 (PDT),http://lorempixel.com/400/400/business,Distinctio est vel non suscipit veniam quia sit nesciunt.,915,Tue Sep 10 2019 15:22:59 GMT-0700 (PDT)
107,52,3,16,Tue Jun 04 2019 19:18:38 GMT-0700 (PDT),http://lorempixel.com/400/400/business,Ut delectus rerum ea facilis fugiat quae qui aut.,809,Fri Jul 26 2019 04:40:04 GMT-0700 (PDT)
108,72,1,2,Tue May 28 2019 22:51:06 GMT-0700 (PDT),http://lorempixel.com/400/400/business,Non omnis ea occaecati.,476,Sun Jul 28 2019 12:46:57 GMT-0700 (PDT)
109,89,5,22,Wed May 15 2019 22:25:45 GMT-0700 (PDT),http://lorempixel.com/400/400/business,Vel officiis quaerat ipsum molestias excepturi voluptas reprehenderit doloribus.,577,Thu Jul 25 2019 17:28:05 GMT-0700 (PDT)
110,100,5,23,Tue Jul 09 2019 21:40:48 GMT-0700 (PDT),http://lorempixel.com/400/400/business,Libero nobis iusto quod facilis quam.,48,Tue Aug 20 2019 05:19:11 GMT-0700 (PDT)
111,9,1,6,Fri May 17 2019 23:50:42 GMT-0700 (PDT),http://lorempixel.com/400/400/business,Minima quod non soluta.,149,Sat Jun 01 2019 20:52:45 GMT-0700 (PDT)
112,18,4,18,Wed Apr 24 2019 13:25:16 GMT-0700 (PDT),http://lorempixel.com/400/400/business,Ex vitae ut rerum.,707,Sun Sep 22 2019 23:58:46 GMT-0700 (PDT)
113,11,4,20,Fri May 03 2019 03:23:43 GMT-0700 (PDT),http://lorempixel.com/400/400/business,Est quos qui nihil est quam repudiandae eum fugit.,455,Tue Jul 23 2019 03:30:08 GMT-0700 (PDT)
114,42,1,6,Sun Jun 02 2019 18:09:07 GMT-0700 (PDT),http://lorempixel.com/400/400/business,Quia quidem eos nisi alias error deserunt.,116,Fri Sep 06 2019 10:35:18 GMT-0700 (PDT)
115,95,5,22,Tue Apr 30 2019 14:26:08 GMT-0700 (PDT),http://lorempixel.com/400/400/business,Est consequatur quia ut vero reiciendis dolores quidem voluptatum et.,414,Sat Aug 31 2019 08:29:42 GMT-0700 (PDT)
116,20,1,2,Mon Jul 08 2019 15:16:02 GMT-0700 (PDT),http://lorempixel.com/400/400/business,Et praesentium minus aut odio necessitatibus occaecati.,969,Thu Sep 05 2019 00:35:15 GMT-0700 (PDT)
117,13,4,19,Tue Jun 04 2019 04:18:40 GMT-0700 (PDT),http://lorempixel.com/400/400/business,Officiis aut et officiis non qui minima qui rerum.,128,Sat Aug 10 2019 20:48:17 GMT-0700 (PDT)
118,11,1,4,Tue Jun 18 2019 12:44:27 GMT-0700 (PDT),http://lorempixel.com/400/400/business,Aut reiciendis deserunt autem error quia laudantium minima id.,155,Mon Aug 26 2019 01:57:24 GMT-0700 (PDT)
119,38,4,21,Sat Jul 20 2019 18:59:24 GMT-0700 (PDT),http://lorempixel.com/400/400/business,Quo delectus labore adipisci.,784,Sun Sep 29 2019 23:42:44 GMT-0700 (PDT)
120,17,4,19,Fri Jun 21 2019 16:01:32 GMT-0700 (PDT),http://lorempixel.com/400/400/business,Natus sed modi non et ad illo quibusdam omnis.,452,Tue Jul 30 2019 18:30:32 GMT-0700 (PDT)
121,11,2,12,Fri Aug 02 2019 21:32:29 GMT-0700 (PDT),http://lorempixel.com/400/400/business,Vel in ut.,551,Wed Aug 07 2019 22:14:46 GMT-0700 (PDT)
122,85,5,22,Fri May 03 2019 02:00:59 GMT-0700 (PDT),http://lorempixel.com/400/400/business,Iste recusandae voluptatem natus nisi voluptatem quia esse.,28,Tue Jul 23 2019 14:48:04 GMT-0700 (PDT)
123,43,5,22,Tue May 28 2019 01:24:06 GMT-0700 (PDT),http://lorempixel.com/400/400/business,Facilis officia totam asperiores.,787,Sat Jun 22 2019 04:00:30 GMT-0700 (PDT)
124,27,3,15,Tue May 28 2019 14:49:38 GMT-0700 (PDT),http://lorempixel.com/400/400/business,Commodi esse rem cum ratione facilis numquam necessitatibus qui qui.,285,Fri Jun 21 2019 15:20:40 GMT-0700 (PDT)
125,30,4,20,Sat Apr 06 2019 03:55:17 GMT-0700 (PDT),http://lorempixel.com/400/400/business,Nesciunt rerum aut blanditiis ut commodi illo.,754,Tue Apr 23 2019 09:16:05 GMT-0700 (PDT)
126,34,1,6,Thu Apr 04 2019 21:27:55 GMT-0700 (PDT),http://lorempixel.com/400/400/business,Repellat enim nostrum sit minus et corrupti cupiditate.,327,Sat Jul 06 2019 16:52:49 GMT-0700 (PDT)
127,78,5,22,Wed Jun 26 2019 06:32:06 GMT-0700 (PDT),http://lorempixel.com/400/400/business,Culpa laboriosam temporibus dolores iste explicabo dignissimos repudiandae voluptate quis.,196,Mon Sep 09 2019 04:27:38 GMT-0700 (PDT)
128,89,3,16,Thu Jul 18 2019 08:22:09 GMT-0700 (PDT),http://lorempixel.com/400/400/business,Nihil reprehenderit omnis dolores corrupti.,783,Sun Aug 04 2019 18:11:10 GMT-0700 (PDT)
129,6,5,23,Wed Apr 24 2019 09:54:51 GMT-0700 (PDT),http://lorempixel.com/400/400/business,Magni rerum est velit facilis.,205,Mon Aug 26 2019 10:07:56 GMT-0700 (PDT)
130,55,2,10,Thu May 02 2019 04:02:01 GMT-0700 (PDT),http://lorempixel.com/400/400/business,Quia ad ratione aut et.,603,Sun Sep 08 2019 10:20:00 GMT-0700 (PDT)
131,92,4,21,Fri Jun 07 2019 16:02:18 GMT-0700 (PDT),http://lorempixel.com/400/400/business,Velit libero doloribus sapiente rerum dolorem aut tempore quia.,348,Fri Aug 16 2019 20:53:54 GMT-0700 (PDT)
132,7,4,21,Tue May 07 2019 07:13:30 GMT-0700 (PDT),http://lorempixel.com/400/400/business,Illo qui laboriosam magnam explicabo ipsa est ut.,426,Fri Aug 23 2019 08:53:09 GMT-0700 (PDT)
133,40,1,8,Fri May 03 2019 00:07:22 GMT-0700 (PDT),http://lorempixel.com/400/400/business,Et qui est pariatur incidunt amet omnis animi voluptatem dolorem.,902,Fri May 03 2019 18:11:50 GMT-0700 (PDT)
134,85,1,1,Tue Jul 30 2019 03:57:13 GMT-0700 (PDT),http://lorempixel.com/400/400/business,Deleniti ducimus et.,55,Sat Sep 21 2019 07:27:19 GMT-0700 (PDT)
135,99,1,2,Mon Apr 22 2019 17:13:11 GMT-0700 (PDT),http://lorempixel.com/400/400/business,Fugiat ab amet quidem dolorem mollitia facilis dolor dignissimos.,197,Mon Jul 08 2019 14:20:22 GMT-0700 (PDT)
136,25,4,18,Sun May 12 2019 12:41:36 GMT-0700 (PDT),http://lorempixel.com/400/400/business,Modi nihil mollitia mollitia et eligendi quia velit.,554,Wed Sep 25 2019 06:27:01 GMT-0700 (PDT)
137,89,3,15,Sat Apr 20 2019 08:43:12 GMT-0700 (PDT),http://lorempixel.com/400/400/business,Quia aliquam excepturi.,822,Sat Apr 27 2019 10:54:46 GMT-0700 (PDT)
138,40,1,2,Tue Apr 30 2019 22:13:15 GMT-0700 (PDT),http://lorempixel.com/400/400/business,Et culpa facere ipsam.,325,Mon May 27 2019 14:55:00 GMT-0700 (PDT)
139,1,2,12,Mon Apr 29 2019 18:45:55 GMT-0700 (PDT),http://lorempixel.com/400/400/business,Et ut deleniti modi iste.,245,Tue Sep 24 2019 17:24:06 GMT-0700 (PDT)
140,68,5,23,Sat May 04 2019 05:11:28 GMT-0700 (PDT),http://lorempixel.com/400/400/business,Facere voluptatum et sint rerum vitae ut.,643,Fri Sep 20 2019 19:52:08 GMT-0700 (PDT)
141,21,3,14,Fri Jun 14 2019 11:57:35 GMT-0700 (PDT),http://lorempixel.com/400/400/business,Voluptatem quae possimus impedit id qui cum illo necessitatibus.,17,Fri Aug 23 2019 18:40:21 GMT-0700 (PDT)
142,100,4,20,Fri Jun 14 2019 21:18:38 GMT-0700 (PDT),http://lorempixel.com/400/400/business,Et eos necessitatibus consequatur at odit iusto quia ad.,497,Sat Aug 03 2019 11:35:41 GMT-0700 (PDT)
143,50,3,17,Fri Jul 26 2019 16:27:53 GMT-0700 (PDT),http://lorempixel.com/400/400/business,Corrupti quas totam dolore minima voluptas.,203,Sun Sep 29 2019 09:01:38 GMT-0700 (PDT)
144,54,1,6,Thu Apr 18 2019 02:02:35 GMT-0700 (PDT),http://lorempixel.com/400/400/business,Tempora perferendis rem ut.,971,Wed Jun 05 2019 11:23:13 GMT-0700 (PDT)
