id,room_id,category,subcategory,date,photoUrl,description,cost,dateFixed
430,65,3,15,Mon Jul 22 2019 01:18:35 GMT-0700 (PDT),http://lorempixel.com/400/400/business,Suscipit non ut tempora fuga.,862,Mon Aug 05 2019 12:02:53 GMT-0700 (PDT)
431,8,4,21,Sun Jun 23 2019 15:56:30 GMT-0700 (PDT),http://lorempixel.com/400/400/business,Accusantium esse eos sequi perspiciatis et aut iure.,274,Wed Sep 04 2019 03:04:31 GMT-0700 (PDT)
432,31,4,18,Mon Jul 15 2019 20:55:43 GMT-0700 (PDT),http://lorempixel.com/400/400/business,Qui explicabo quae minima aut qui minima tempore.,998,Wed Sep 11 2019 05:44:55 GMT-0700 (PDT)
433,4,4,18,Sun Jun 16 2019 20:41:43 GMT-0700 (PDT),http://lorempixel.com/400/400/business,Quod ut odit animi modi libero.,152,Thu Jul 04 2019 06:17:56 GMT-0700 (PDT)
434,90,2,10,Sun Jun 09 2019 11:15:41 GMT-0700 (PDT),http://lorempixel.com/400/400/business,Molestias saepe dolore necessitatibus ullam occaecati rerum aut soluta voluptas.,505,Wed Jul 24 2019 10:49:50 GMT-0700 (PDT)
435,5,2,10,Sat Jun 08 2019 08:32:49 GMT-0700 (PDT),http://lorempixel.com/400/400/business,Tempora harum vitae velit similique ullam.,152,Sun Jul 14 2019 05:29:08 GMT-0700 (PDT)
436,11,5,23,Fri May 03 2019 02:40:59 GMT-0700 (PDT),http://lorempixel.com/400/400/business,Omnis corrupti cum sit autem.,285,Fri Sep 27 2019 06:22:52 GMT-0700 (PDT)
437,58,5,22,Sat Apr 20 2019 17:21:30 GMT-0700 (PDT),http://lorempixel.com/400/400/business,Velit temporibus quaerat in voluptas voluptate est.,806,Sun Apr 28 2019 20:41:38 GMT-0700 (PDT)
438,83,5,23,Wed May 01 2019 22:02:17 GMT-0700 (PDT),http://lorempixel.com/400/400/business,Ipsam nobis veritatis et accusantium id beatae labore.,937,Thu Aug 08 2019 02:00:31 GMT-0700 (PDT)
439,50,2,10,Fri Apr 19 2019 00:42:37 GMT-0700 (PDT),http://lorempixel.com/400/400/business,Omnis amet voluptate sed.,282,Sun Aug 25 2019 00:52:34 GMT-0700 (PDT)
440,89,3,14,Mon Jul 29 2019 06:51:51 GMT-0700 (PDT),http://lorempixel.com/400/400/business,Perferendis ab voluptates molestiae sunt quo dolor impedit quia distinctio.,830,Mon Sep 16 2019 07:42:28 GMT-0700 (PDT)
441,13,2,13,Wed Apr 24 2019 19:56:41 GMT-0700 (PDT),http://lorempixel.com/400/400/business,Id beatae deserunt et.,357,Fri May 24 2019 15:49:22 GMT-0700 (PDT)
442,86,1,6,Tue May 21 2019 09:51:44 GMT-0700 (PDT),http://lorempixel.com/400/400/business,Repudiandae exercitationem non labore illum repellat sit.,815,Thu Aug 29 2019 19:16:29 GMT-0700 (PDT)
443,59,3,15,Mon Jul 01 2019 00:17:42 GMT-0700 (PDT),http://lorempixel.com/400/400/business,Voluptas itaque dolorem ut aut et quibusdam natus et.,418,Wed Sep 18 2019 02:30:38 GMT-0700 (PDT)
444,83,1,1,Mon Jun 03 2019 10:22:49 GMT-0700 (PDT),http://lorempixel.com/400/400/business,Qui quasi accusamus.,652,Fri Aug 09 2019 19:30:52 GMT-0700 (PDT)
445,92,3,14,Mon Jun 03 2019 10:46:01 GMT-0700 (PDT),http://lorempixel.com/400/400/business,Id distinctio ut laudantium.,92,Tue Jul 23 2019 00:08:10 GMT-0700 (PDT)
446,43,4,20,Fri Jun 28 2019 18:12:43 GMT-0700 (PDT),http://lorempixel.com/400/400/business,Dolorum eligendi totam dolores ex soluta molestias qui voluptates autem.,347,Sun Jul 14 2019 03:09:55 GMT-0700 (PDT)
447,93,3,17,Tue Jul 23 2019 10:59:20 GMT-0700 (PDT),http://lorempixel.com/400/400/business,Omnis officia sequi eum optio alias omnis ratione.,217,Fri Sep 20 2019 16:49:23 GMT-0700 (PDT)
448,16,4,20,Mon Jun 10 2019 23:50:18 GMT-0700 (PDT),http://lorempixel.com/400/400/business,Rerum cum voluptatibus nobis iure maiores natus nobis.,382,Sat Jun 22 2019 18:17:46 GMT-0700 (PDT)
449,95,3,16,Sat Jul 20 2019 10:27:04 GMT-0700 (PDT),http://lorempixel.com/400/400/business,Quia ad veritatis rem.,588,Tue Aug 06 2019 14:18:51 GMT-0700 (PDT)
450,3,1,1,Tue May 21 2019 11:08:43 GMT-0700 (PDT),http://lorempixel.com/400/400/business,Voluptas aut veritatis esse dolorum et maxime provident.,773,Fri Sep 13 2019 22:12:53 GMT-0700 (PDT)
451,5,1,5,Tue Jul 23 2019 05:39:43 GMT-0700 (PDT),http://lorempixel.com/400/400/business,Modi repellendus impedit sunt odit voluptas.,618,Tue Aug 13 2019 06:31:39 GMT-0700 (PDT)
452,73,1,1,Fri Jul 12 2019 00:08:34 GMT-0700 (PDT),http://lorempixel.com/400/400/business,Veritatis minima nesciunt molestiae rerum fuga.,648,Sun Sep 08 2019 22:57:46 GMT-0700 (PDT)
453,68,2,12,Sat Apr 06 2019 07:43:50 GMT-0700 (PDT),http://lorempixel.com/400/400/business,Eligendi eos facere ut magnam aut ut.,19,Sun Sep 29 2019 09:51:30 GMT-0700 (PDT)
454,17,5,23,Sun Jul 21 2019 13:58:17 GMT-0700 (PDT),http://lorempixel.com/400/400/business,Eos quo perspiciatis magnam dolorem esse sapiente accusamus incidunt laborum.,664,Fri Sep 20 2019 20:54:36 GMT-0700 (PDT)
455,87,4,19,Sun Apr 14 2019 08:41:28 GMT-0700 (PDT),http://lorempixel.com/400/400/business,Dolor soluta et sit ipsa nemo.,241,Sun Sep 01 2019 04:52:58 GMT-0700 (PDT)
456,20,1,3,Mon Apr 01 2019 22:33:14 GMT-0700 (PDT),http://lorempixel.com/400/400/business,Consequatur aperiam dolorem laborum laudantium harum quia occaecati quam et.,865,Wed Sep 11 2019 01:48:50 GMT-0700 (PDT)
457,70,3,17,Mon Jul 15 2019 23:20:16 GMT-0700 (PDT),http://lorempixel.com/400/400/business,Et qui ipsum nemo voluptatem.,520,Sat Aug 10 2019 23:50:11 GMT-0700 (PDT)
458,79,5,23,Tue Apr 02 2019 14:14:01 GMT-0700 (PDT),http://lorempixel.com/400/400/business,Veniam in et dolorum voluptas libero quidem accusantium.,678,Tue May 14 2019 07:57:56 GMT-0700 (PDT)
459,33,4,18,Thu May 02 2019 11:13:26 GMT-0700 (PDT),http://lorempixel.com/400/400/business,Et odit non expedita.,88,Mon Jul 08 2019 16:15:51 GMT-0700 (PDT)
460,9,4,21,Tue Jun 11 2019 00:53:15 GMT-0700 (PDT),http://lorempixel.com/400/400/business,Eum porro est repudiandae laudantium quibusdam harum molestias beatae minus.,838,Mon Sep 16 2019 05:52:22 GMT-0700 (PDT)
461,60,1,1,Thu Apr 04 2019 03:26:19 GMT-0700 (PDT),http://lorempixel.com/400/400/business,Ex doloremque non laboriosam animi dicta quia quo.,683,Mon Aug 19 2019 09:30:30 GMT-0700 (PDT)
462,29,5,22,Thu Apr 11 2019 09:45:50 GMT-0700 (PDT),http://lorempixel.com/400/400/business,Totam suscipit non asperiores nihil quo.,660,Wed Jul 03 2019 13:41:12 GMT-0700 (PDT)
463,74,5,23,Sun Jul 07 2019 19:23:49 GMT-0700 (PDT),http://lorempixel.com/400/400/business,Aut aliquid dolorum accusantium ut libero.,81,Tue Aug 13 2019 14:28:33 GMT-0700 (PDT)
464,12,3,17,Tue Apr 30 2019 19:20:57 GMT-0700 (PDT),http://lorempixel.com/400/400/business,Ut libero dignissimos quod tempore.,442,Sun May 19 2019 16:56:09 GMT-0700 (PDT)
465,56,3,17,Mon Apr 08 2019 13:42:53 GMT-0700 (PDT),http://lorempixel.com/400/400/business,Rerum magni non voluptate ipsa commodi quibusdam autem reprehenderit.,354,Tue May 07 2019 16:15:55 GMT-0700 (PDT)
466,21,2,9,Sun Apr 21 2019 04:56:11 GMT-0700 (PDT),http://lorempixel.com/400/400/business,Quo quo minus corporis laudantium.,371,Thu Jun 27 2019 14:16:16 GMT-0700 (PDT)
467,29,2,11,Tue May 21 2019 01:40:37 GMT-0700 (PDT),http://lorempixel.com/400/400/business,Officia quia labore rerum qui quis minima possimus et.,746,Thu Aug 29 2019 08:44:41 GMT-0700 (PDT)
468,76,5,22,Sun Jun 02 2019 11:59:39 GMT-0700 (PDT),http://lorempixel.com/400/400/business,Et voluptas et magnam aut quis rerum numquam non enim.,211,Thu Jul 04 2019 12:47:49 GMT-0700 (PDT)
469,35,2,13,Thu Apr 04 2019 07:46:40 GMT-0700 (PDT),http://lorempixel.com/400/400/business,Perferendis natus voluptatem beatae.,256,Thu Apr 18 2019 02:06:51 GMT-0700 (PDT)
470,61,4,19,Thu Jul 25 2019 02:41:46 GMT-0700 (PDT),http://lorempixel.com/400/400/business,Fuga ut repellendus sed ipsam ut sunt earum culpa.,528,Wed Sep 25 2019 14:45:56 GMT-0700 (PDT)
471,70,2,10,Sat Jun 15 2019 22:47:21 GMT-0700 (PDT),http://lorempixel.com/400/400/business,Ut cumque quo.,237,Sat Jun 22 2019 11:30:55 GMT-0700 (PDT)
472,43,3,16,Sat Jul 13 2019 16:27:56 GMT-0700 (PDT),http://lorempixel.com/400/400/business,Cum doloremque temporibus voluptatem et esse earum quibusdam.,632,Thu Aug 22 2019 20:05:40 GMT-0700 (PDT)
473,46,2,12,Wed May 08 2019 05:21:06 GMT-0700 (PDT),http://lorempixel.com/400/400/business,Qui enim quas omnis.,517,Fri Jul 26 2019 17:45:07 GMT-0700 (PDT)
474,69,5,23,Sat Jul 27 2019 15:43:26 GMT-0700 (PDT),http://lorempixel.com/400/400/business,Tenetur harum repellat.,324,Sat Sep 07 2019 01:22:29 GMT-0700 (PDT)
475,85,4,20,Wed May 01 2019 06:46:52 GMT-0700 (PDT),http://lorempixel.com/400/400/business,Distinctio minima ea vel sapiente quia rerum et.,112,Mon Jul 01 2019 02:34:16 GMT-0700 (PDT)
476,16,1,5,Tue Apr 23 2019 13:36:42 GMT-0700 (PDT),http://lorempixel.com/400/400/business,Dignissimos ut dolores quaerat.,391,Wed Sep 25 2019 01:36:17 GMT-0700 (PDT)
477,50,5,22,Wed Jun 12 2019 22:50:36 GMT-0700 (PDT),http://lorempixel.com/400/400/business,Fuga recusandae praesentium.,298,Sun Aug 25 2019 12:27:16 GMT-0700 (PDT)
478,44,5,23,Sat May 04 2019 07:09:58 GMT-0700 (PDT),http://lorempixel.com/400/400/business,Est aut necessitatibus odit ut.,454,Wed May 08 2019 09:19:14 GMT-0700 (PDT)
479,11,2,12,Tue Apr 16 2019 02:06:47 GMT-0700 (PDT),http://lorempixel.com/400/400/business,Quo deleniti molestias qui minus.,206,Sun Sep 08 2019 21:46:15 GMT-0700 (PDT)
480,20,2,12,Mon May 13 2019 21:23:11 GMT-0700 (PDT),http://lorempixel.com/400/400/business,Autem sed nemo non ut quisquam suscipit labore occaecati commodi.,735,Sun Jul 14 2019 14:57:50 GMT-0700 (PDT)
481,16,3,16,Mon Jun 03 2019 19:56:40 GMT-0700 (PDT),http://lorempixel.com/400/400/business,Impedit ipsam eum doloribus iste placeat.,126,Sun Aug 18 2019 10:05:58 GMT-0700 (PDT)
482,27,1,4,Sat May 25 2019 13:45:17 GMT-0700 (PDT),http://lorempixel.com/400/400/business,Fuga voluptate est.,863,Tue Jul 30 2019 01:11:16 GMT-0700 (PDT)
483,72,5,22,Fri Apr 19 2019 17:47:49 GMT-0700 (PDT),http://lorempixel.com/400/400/business,Temporibus et sunt et dolor.,407,Sun Jun 23 2019 11:19:40 GMT-0700 (PDT)
484,96,5,23,Wed Jun 19 2019 02:38:42 GMT-0700 (PDT),http://lorempixel.com/400/400/business,Expedita dolorem rerum autem velit possimus.,663,Mon Sep 30 2019 08:15:38 GMT-0700 (PDT)
485,70,3,15,Thu Jun 27 2019 15:48:48 GMT-0700 (PDT),http://lorempixel.com/400/400/business,Est labore amet sed.,491,Thu Sep 19 2019 12:04:45 GMT-0700 (PDT)
486,28,2,10,Mon Jun 24 2019 00:29:52 GMT-0700 (PDT),http://lorempixel.com/400/400/business,Eaque esse nulla amet et veniam possimus.,336,Fri Sep 13 2019 03:29:13 GMT-0700 (PDT)
487,80,1,1,Thu Apr 11 2019 17:26:07 GMT-0700 (PDT),http://lorempixel.com/400/400/business,Sint tenetur quia et nemo.,722,Sun Jun 02 2019 17:39:43 GMT-0700 (PDT)
488,69,1,4,Tue Apr 30 2019 22:57:46 GMT-0700 (PDT),http://lorempixel.com/400/400/business,Qui vel dolores et maxime.,17,Wed Jul 10 2019 02:58:35 GMT-0700 (PDT)
489,80,1,6,Fri May 17 2019 12:15:26 GMT-0700 (PDT),http://lorempixel.com/400/400/business,Libero totam aliquid consectetur sint voluptates in a est.,393,Thu Jul 18 2019 16:44:43 GMT-0700 (PDT)
490,69,4,19,Wed Apr 17 2019 21:01:39 GMT-0700 (PDT),http://lorempixel.com/400/400/business,Non culpa quidem et rerum.,87,Sun Aug 18 2019 05:02:39 GMT-0700 (PDT)
491,5,5,22,Fri May 10 2019 14:20:04 GMT-0700 (PDT),http://lorempixel.com/400/400/business,Numquam quia eius magnam nihil ipsam itaque adipisci.,784,Thu Sep 05 2019 17:50:27 GMT-0700 (PDT)
492,87,4,18,Wed Jul 17 2019 04:14:53 GMT-0700 (PDT),http://lorempixel.com/400/400/business,Et reiciendis libero facere praesentium est.,119,Thu Aug 15 2019 10:55:57 GMT-0700 (PDT)
493,10,1,4,Fri May 17 2019 22:09:25 GMT-0700 (PDT),http://lorempixel.com/400/400/business,Sed et numquam.,476,Sat Sep 21 2019 12:23:47 GMT-0700 (PDT)
494,69,3,15,Sat Jun 29 2019 17:50:30 GMT-0700 (PDT),http://lorempixel.com/400/400/business,Molestiae sed sed corrupti quisquam fuga assumenda doloremque ipsam.,664,Mon Aug 19 2019 10:57:54 GMT-0700 (PDT)
495,8,5,23,Wed Apr 10 2019 12:07:20 GMT-0700 (PDT),http://lorempixel.com/400/400/business,Nulla incidunt corrupti qui consequatur labore inventore.,804,Sun Jul 28 2019 03:58:52 GMT-0700 (PDT)
496,81,3,17,Sun Jun 09 2019 12:34:52 GMT-0700 (PDT),http://lorempixel.com/400/400/business,Recusandae aliquid sed placeat dolore reiciendis.,975,Sun Sep 15 2019 11:06:17 GMT-0700 (PDT)
497,47,5,22,Fri Jul 12 2019 17:10:36 GMT-0700 (PDT),http://lorempixel.com/400/400/business,Laboriosam repellendus magnam modi ut optio.,471,Thu Jul 18 2019 06:51:34 GMT-0700 (PDT)
498,14,5,23,Mon Apr 15 2019 00:31:03 GMT-0700 (PDT),http://lorempixel.com/400/400/business,Aut tempore maiores et tempora expedita omnis voluptates in sed.,834,Fri Jun 14 2019 07:33:03 GMT-0700 (PDT)
499,24,2,9,Wed Apr 24 2019 19:22:03 GMT-0700 (PDT),http://lorempixel.com/400/400/business,Autem sunt velit delectus quidem libero consequatur architecto.,96,Wed Jun 12 2019 09:17:23 GMT-0700 (PDT)
500,89,4,19,Fri May 03 2019 02:10:42 GMT-0700 (PDT),http://lorempixel.com/400/400/business,Dolorum et eaque non.,952,Mon Sep 23 2019 18:24:08 GMT-0700 (PDT)
501,54,2,12,Sun Jul 14 2019 12:17:32 GMT-0700 (PDT),http://lorempixel.com/400/400/business,Cupiditate harum sit debitis earum dolorem itaque temporibus ut quibusdam.,382,Fri Sep 13 2019 11:27:12 GMT-0700 (PDT)
502,31,5,23,Tue Jun 18 2019 00:39:59 GMT-0700 (PDT),http://lorempixel.com/400/400/business,Nihil vel molestias adipisci in quaerat illum dolor.,7,Thu Sep 12 2019 06:00:00 GMT-0700 (PDT)
503,98,4,19,Tue May 28 2019 13:01:26 GMT-0700 (PDT),http://lorempixel.com/400/400/business,Molestiae aut aliquid.,64,Thu May 30 2019 03:46:19 GMT-0700 (PDT)
504,69,4,18,Fri Jun 07 2019 12:39:12 GMT-0700 (PDT),http://lorempixel.com/400/400/business,Saepe dolore molestias dolore rerum labore nihil in qui.,456,Thu Sep 26 2019 18:03:29 GMT-0700 (PDT)
505,77,3,15,Tue Apr 09 2019 14:26:14 GMT-0700 (PDT),http://lorempixel.com/400/400/business,Sequi provident animi consectetur voluptas non eos maiores.,566,Tue Aug 20 2019 00:25:01 GMT-0700 (PDT)
506,54,1,6,Wed Jul 24 2019 04:27:37 GMT-0700 (PDT),http://lorempixel.com/400/400/business,Officiis neque corrupti rerum et voluptatem.,897,Wed Jul 31 2019 17:59:50 GMT-0700 (PDT)
507,30,4,20,Sat Jul 20 2019 13:31:18 GMT-0700 (PDT),http://lorempixel.com/400/400/business,Perferendis voluptas eaque voluptatum rerum amet.,676,Thu Aug 29 2019 09:39:26 GMT-0700 (PDT)
508,89,5,23,Tue Jul 16 2019 02:35:51 GMT-0700 (PDT),http://lorempixel.com/400/400/business,Eaque aspernatur deleniti assumenda.,698,Thu Aug 08 2019 00:05:56 GMT-0700 (PDT)
509,37,1,3,Sat May 11 2019 20:15:17 GMT-0700 (PDT),http://lorempixel.com/400/400/business,Cum dolor qui dolores et.,755,Tue Aug 27 2019 11:51:13 GMT-0700 (PDT)
510,50,5,22,Tue Jun 11 2019 00:11:30 GMT-0700 (PDT),http://lorempixel.com/400/400/business,Aut autem autem sed.,587,Sun Aug 04 2019 17:15:07 GMT-0700 (PDT)
511,86,2,11,Wed Apr 17 2019 13:57:29 GMT-0700 (PDT),http://lorempixel.com/400/400/business,Modi accusantium ut maxime.,723,Sat Jul 27 2019 10:30:04 GMT-0700 (PDT)
512,90,5,22,Thu May 23 2019 08:36:56 GMT-0700 (PDT),http://lorempixel.com/400/400/business,Sunt nemo exercitationem ratione itaque.,413,Wed Jul 31 2019 04:23:29 GMT-0700 (PDT)
513,43,5,22,Tue Apr 30 2019 23:15:46 GMT-0700 (PDT),http://lorempixel.com/400/400/business,Itaque nihil rerum accusantium odit.,707,Thu Sep 26 2019 12:05:33 GMT-0700 (PDT)
514,39,2,9,Tue Jul 23 2019 02:33:08 GMT-0700 (PDT),http://lorempixel.com/400/400/business,Hic non alias ipsum.,645,Sun Aug 18 2019 21:21:28 GMT-0700 (PDT)
515,42,3,14,Wed May 22 2019 21:48:06 GMT-0700 (PDT),http://lorempixel.com/400/400/business,Quo dolor maxime voluptatem.,178,Mon Sep 23 2019 23:50:06 GMT-0700 (PDT)
516,60,2,9,Thu Apr 18 2019 05:15:33 GMT-0700 (PDT),http://lorempixel.com/400/400/business,Eum sint unde adipisci sed neque itaque dolor.,338,Thu Sep 05 2019 14:47:49 GMT-0700 (PDT)
517,26,3,15,Tue Apr 09 2019 09:03:35 GMT-0700 (PDT),http://lorempixel.com/400/400/business,Saepe odio distinctio id.,759,Sun Sep 29 2019 07:56:02 GMT-0700 (PDT)
518,87,2,10,Sat Apr 20 2019 19:08:11 GMT-0700 (PDT),http://lorempixel.com/400/400/business,Molestias voluptates iste deleniti.,205,Mon Aug 05 2019 15:33:16 GMT-0700 (PDT)
519,26,1,5,Tue May 21 2019 12:44:10 GMT-0700 (PDT),http://lorempixel.com/400/400/business,Dicta ducimus excepturi repudiandae asperiores qui esse.,424,Fri Aug 30 2019 10:20:20 GMT-0700 (PDT)
520,26,3,17,Tue Apr 16 2019 06:50:37 GMT-0700 (PDT),http://lorempixel.com/400/400/business,Veritatis ipsum magni optio inventore neque.,107,Mon Jun 17 2019 05:53:31 GMT-0700 (PDT)
521,53,2,11,Tue Apr 02 2019 23:42:05 GMT-0700 (PDT),http://lorempixel.com/400/400/business,Consectetur dolor ea a laboriosam iste aut optio vel non.,501,Sat May 04 2019 23:57:29 GMT-0700 (PDT)
522,54,1,1,Sun Apr 21 2019 07:55:13 GMT-0700 (PDT),http://lorempixel.com/400/400/business,Impedit qui voluptatem nesciunt modi reiciendis.,893,Sun Apr 28 2019 21:24:24 GMT-0700 (PDT)
523,37,4,21,Thu Apr 25 2019 10:15:03 GMT-0700 (PDT),http://lorempixel.com/400/400/business,Vero perspiciatis pariatur nulla ex.,335,Thu May 30 2019 13:50:07 GMT-0700 (PDT)
524,77,1,5,Fri May 10 2019 18:28:53 GMT-0700 (PDT),http://lorempixel.com/400/400/business,Error rerum fuga iure natus autem ea.,100,Fri Sep 13 2019 15:59:22 GMT-0700 (PDT)
525,58,3,17,Sat Jul 06 2019 11:23:57 GMT-0700 (PDT),http://lorempixel.com/400/400/business,Dolore ipsum tempora rerum sed et ex a officiis.,258,Sun Aug 11 2019 12:25:12 GMT-0700 (PDT)
526,40,1,3,Sat Aug 03 2019 20:31:50 GMT-0700 (PDT),http://lorempixel.com/400/400/business,Placeat nam similique mollitia veritatis corrupti ullam et ab.,113,Wed Aug 21 2019 15:33:23 GMT-0700 (PDT)
527,57,1,4,Thu May 30 2019 15:33:40 GMT-0700 (PDT),http://lorempixel.com/400/400/business,Facilis vero laudantium voluptatem provident aut qui animi.,209,Fri Sep 06 2019 02:08:14 GMT-0700 (PDT)
528,32,4,20,Fri Jun 21 2019 05:22:56 GMT-0700 (PDT),http://lorempixel.com/400/400/business,Fuga sint in ipsa.,918,Mon Sep 23 2019 22:43:51 GMT-0700 (PDT)
529,85,1,5,Thu Jun 06 2019 02:43:10 GMT-0700 (PDT),http://lorempixel.com/400/400/business,Debitis eligendi aliquam.,645,Wed Jul 31 2019 10:55:03 GMT-0700 (PDT)
530,41,2,9,Mon Jul 22 2019 10:36:37 GMT-0700 (PDT),http://lorempixel.com/400/400/business,Sint nemo omnis quos mollitia in dolorem id.,863,Tue Jul 30 2019 12:58:05 GMT-0700 (PDT)
531,19,2,12,Sun Jul 14 2019 18:24:47 GMT-0700 (PDT),http://lorempixel.com/400/400/business,Quibusdam dicta fugiat voluptates.,436,Mon Jul 29 2019 12:32:51 GMT-0700 (PDT)
532,91,4,21,Mon May 27 2019 13:41:12 GMT-0700 (PDT),http://lorempixel.com/400/400/business,Sint voluptatum laboriosam qui harum ut molestiae ea.,395,Wed Jul 31 2019 19:02:25 GMT-0700 (PDT)
533,37,2,9,Wed Apr 10 2019 14:59:03 GMT-0700 (PDT),http://lorempixel.com/400/400/business,Tempore consequuntur ut quisquam dolor ut dolorem.,2,Sun Jul 07 2019 00:02:14 GMT-0700 (PDT)
534,95,2,10,Tue May 28 2019 15:48:38 GMT-0700 (PDT),http://lorempixel.com/400/400/business,Autem omnis omnis quia est minus est.,9,Sun Jun 16 2019 13:47:57 GMT-0700 (PDT)
535,16,4,19,Fri May 24 2019 04:53:42 GMT-0700 (PDT),http://lorempixel.com/400/400/business,Ut facere nobis quis totam exercitationem beatae consequatur esse et.,59,Tue Jun 25 2019 06:24:41 GMT-0700 (PDT)
536,64,1,3,Thu May 23 2019 09:24:22 GMT-0700 (PDT),http://lorempixel.com/400/400/business,Rem qui et reiciendis voluptatum quasi numquam.,193,Wed Jun 26 2019 10:09:02 GMT-0700 (PDT)
537,1,5,23,Fri Apr 05 2019 16:30:29 GMT-0700 (PDT),http://lorempixel.com/400/400/business,Culpa praesentium a recusandae in assumenda placeat voluptas corporis est.,430,Wed May 29 2019 09:41:13 GMT-0700 (PDT)
538,50,1,8,Tue Jun 25 2019 05:20:54 GMT-0700 (PDT),http://lorempixel.com/400/400/business,Enim aliquid fuga quis sit ullam deleniti itaque.,386,Sat Sep 28 2019 02:42:17 GMT-0700 (PDT)
539,79,2,10,Wed Apr 17 2019 23:49:57 GMT-0700 (PDT),http://lorempixel.com/400/400/business,Laborum enim qui optio.,475,Sat Jun 29 2019 09:35:40 GMT-0700 (PDT)
540,52,1,1,Mon Jun 17 2019 06:05:22 GMT-0700 (PDT),http://lorempixel.com/400/400/business,Numquam quae optio quo sapiente eveniet.,134,Sat Jul 20 2019 19:14:27 GMT-0700 (PDT)
541,46,2,13,Mon Jul 08 2019 15:51:49 GMT-0700 (PDT),http://lorempixel.com/400/400/business,Delectus et sunt aut suscipit.,600,Wed Sep 25 2019 04:16:44 GMT-0700 (PDT)
542,34,2,10,Sun Jul 21 2019 05:20:18 GMT-0700 (PDT),http://lorempixel.com/400/400/business,Molestiae quas nobis quia beatae rerum sed delectus.,912,Thu Aug 08 2019 11:09:27 GMT-0700 (PDT)
543,97,2,12,Sat Apr 20 2019 22:06:51 GMT-0700 (PDT),http://lorempixel.com/400/400/business,Qui accusamus quia quas maiores.,78,Fri Sep 20 2019 05:53:31 GMT-0700 (PDT)
544,70,3,14,Fri Apr 05 2019 12:43:19 GMT-0700 (PDT),http://lorempixel.com/400/400/business,Natus nemo est iste molestiae.,706,Tue Jul 23 2019 21:07:49 GMT-0700 (PDT)
545,10,5,22,Mon Jul 08 2019 08:43:32 GMT-0700 (PDT),http://lorempixel.com/400/400/business,Autem laborum qui sint.,926,Sat Sep 14 2019 22:30:39 GMT-0700 (PDT)
546,63,2,11,Wed Jun 26 2019 08:32:21 GMT-0700 (PDT),http://lorempixel.com/400/400/business,Impedit quasi quibusdam distinctio dolores.,773,Thu Sep 19 2019 02:16:53 GMT-0700 (PDT)
547,93,3,17,Tue Apr 23 2019 05:05:19 GMT-0700 (PDT),http://lorempixel.com/400/400/business,Culpa ea deleniti omnis et sunt necessitatibus voluptatem.,931,Tue Jul 16 2019 17:35:02 GMT-0700 (PDT)
548,64,5,23,Mon Jul 08 2019 10:24:48 GMT-0700 (PDT),http://lorempixel.com/400/400/business,Qui repellat sit qui nam labore ipsam ab consequuntur.,402,Tue Aug 06 2019 02:54:32 GMT-0700 (PDT)
549,25,3,16,Sat Jun 01 2019 08:12:43 GMT-0700 (PDT),http://lorempixel.com/400/400/business,Ut quo asperiores enim reiciendis ratione quia at aut voluptas.,156,Thu Sep 19 2019 22:35:18 GMT-0700 (PDT)
550,46,1,7,Sat May 25 2019 18:24:19 GMT-0700 (PDT),http://lorempixel.com/400/400/business,Aliquid officia sint accusamus et natus provident numquam cum qui.,860,Sun Jun 02 2019 04:37:33 GMT-0700 (PDT)
551,94,2,9,Thu Jul 18 2019 08:53:21 GMT-0700 (PDT),http://lorempixel.com/400/400/business,Quis eveniet facere laudantium qui qui.,929,Wed Sep 25 2019 23:21:57 GMT-0700 (PDT)
552,85,4,21,Fri Jul 26 2019 03:39:49 GMT-0700 (PDT),http://lorempixel.com/400/400/business,Aut quia sint aut blanditiis velit facilis molestiae.,136,Mon Aug 26 2019 01:36:58 GMT-0700 (PDT)
553,36,3,16,Sun Mar 31 2019 21:18:15 GMT-0700 (PDT),http://lorempixel.com/400/400/business,Officiis placeat illo officia minima sint voluptatibus necessitatibus quos et.,814,Wed Apr 17 2019 07:06:03 GMT-0700 (PDT)
554,96,5,23,Fri Jun 07 2019 11:59:14 GMT-0700 (PDT),http://lorempixel.com/400/400/business,Accusamus aspernatur et.,968,Fri Jun 21 2019 06:20:40 GMT-0700 (PDT)
555,17,1,6,Mon May 13 2019 14:08:47 GMT-0700 (PDT),http://lorempixel.com/400/400/business,Deserunt magni quasi vel ex voluptas voluptate iste et quia.,266,Thu Aug 08 2019 20:21:15 GMT-0700 (PDT)
556,96,1,1,Wed Jul 17 2019 11:36:52 GMT-0700 (PDT),http://lorempixel.com/400/400/business,Eos velit consequatur repellendus facere minima et.,977,Thu Aug 08 2019 14:16:17 GMT-0700 (PDT)
557,89,3,17,Sat Jun 01 2019 05:53:23 GMT-0700 (PDT),http://lorempixel.com/400/400/business,Quas assumenda cumque quasi.,703,Sun Jul 28 2019 11:21:27 GMT-0700 (PDT)
558,61,2,11,Sat May 04 2019 13:00:23 GMT-0700 (PDT),http://lorempixel.com/400/400/business,Harum velit mollitia esse vel.,407,Sat Aug 03 2019 17:53:01 GMT-0700 (PDT)
559,8,5,23,Fri Jul 26 2019 21:15:07 GMT-0700 (PDT),http://lorempixel.com/400/400/business,At qui consequuntur vero ea aut et.,321,Mon Sep 23 2019 04:54:34 GMT-0700 (PDT)
560,42,5,22,Mon Apr 01 2019 23:51:52 GMT-0700 (PDT),http://lorempixel.com/400/400/business,Iste tenetur qui voluptates distinctio dolorum omnis.,836,Sat Apr 13 2019 10:37:19 GMT-0700 (PDT)
561,49,1,4,Wed May 29 2019 10:07:17 GMT-0700 (PDT),http://lorempixel.com/400/400/business,Est in autem qui cumque.,150,Sat Jul 27 2019 11:27:02 GMT-0700 (PDT)
562,15,4,18,Tue Apr 30 2019 20:10:25 GMT-0700 (PDT),http://lorempixel.com/400/400/business,Vel dolores laboriosam ratione non ipsa nostrum quaerat deserunt porro.,298,Wed Jul 17 2019 16:45:47 GMT-0700 (PDT)
563,15,4,20,Wed Apr 10 2019 02:17:20 GMT-0700 (PDT),http://lorempixel.com/400/400/business,Sunt tempora recusandae aperiam odit maxime totam.,192,Mon Jun 10 2019 23:53:05 GMT-0700 (PDT)
564,55,3,15,Sat Jun 29 2019 08:49:03 GMT-0700 (PDT),http://lorempixel.com/400/400/business,Laudantium sed tempore voluptatem deleniti est voluptatem quibusdam.,290,Tue Jul 16 2019 03:35:59 GMT-0700 (PDT)
565,22,4,20,Mon Jun 10 2019 13:15:13 GMT-0700 (PDT),http://lorempixel.com/400/400/business,Qui soluta itaque natus quibusdam.,403,Wed Jun 12 2019 16:36:22 GMT-0700 (PDT)
566,40,4,18,Wed Jul 31 2019 04:13:43 GMT-0700 (PDT),http://lorempixel.com/400/400/business,Eos autem inventore eligendi sint neque porro pariatur consequatur.,862,Tue Aug 20 2019 01:20:23 GMT-0700 (PDT)
567,50,5,22,Tue Jun 25 2019 04:25:06 GMT-0700 (PDT),http://lorempixel.com/400/400/business,Vel occaecati unde et vel et quisquam.,987,Sat Sep 28 2019 20:50:51 GMT-0700 (PDT)
568,87,4,18,Sat May 04 2019 02:55:27 GMT-0700 (PDT),http://lorempixel.com/400/400/business,Quo reiciendis blanditiis et fugit impedit.,503,Thu Sep 12 2019 20:43:58 GMT-0700 (PDT)
569,49,5,22,Fri Apr 12 2019 09:28:59 GMT-0700 (PDT),http://lorempixel.com/400/400/business,Rerum doloribus eius repudiandae excepturi qui.,637,Mon May 13 2019 23:17:47 GMT-0700 (PDT)
570,7,3,15,Thu Jun 06 2019 23:42:27 GMT-0700 (PDT),http://lorempixel.com/400/400/business,Ipsum aperiam cum laborum modi voluptatem est.,730,Thu Sep 26 2019 21:20:07 GMT-0700 (PDT)
571,16,4,19,Sun Jun 30 2019 09:07:16 GMT-0700 (PDT),http://lorempixel.com/400/400/business,Aperiam quaerat sed ut quas.,58,Thu Aug 22 2019 10:06:17 GMT-0700 (PDT)
572,79,1,4,Thu Jul 04 2019 07:43:43 GMT-0700 (PDT),http://lorempixel.com/400/400/business,Est repellendus dolorem in velit blanditiis recusandae corporis non adipisci.,579,Tue Sep 24 2019 07:17:12 GMT-0700 (PDT)
573,5,2,12,Sun Jul 14 2019 10:20:01 GMT-0700 (PDT),http://lorempixel.com/400/400/business,Placeat veniam quis quis iste voluptatem.,851,Mon Aug 05 2019 08:20:56 GMT-0700 (PDT)
