id,room_id,category,subcategory,date,photoUrl,description,cost,dateFixed
1,7,1,2,2019-7-17 07:10:30,http://lorempixel.com/400/400/business,Porro aut dolores rerum numquam.,827,2019-8-28 13:43:54
2,44,1,2,2019-5-17 17:09:04,http://lorempixel.com/400/400/business,Aut voluptatem totam sit minus.,738,2019-9-1 00:44:00
3,41,2,13,2019-7-2 23:59:16,http://lorempixel.com/400/400/business,Est quasi vitae ab asperiores minus velit sequi velit perspiciatis.,418,2019-8-7 14:00:43
4,24,4,20,2019-7-13 02:14:15,http://lorempixel.com/400/400/business,Odit unde sapiente molestias.,262,2019-9-16 16:34:55
5,2,5,22,2019-5-20 07:15:34,http://lorempixel.com/400/400/business,Tempore quia voluptatum mollitia.,519,2019-9-21 20:59:15
6,32,2,13,2019-4-5 09:43:58,http://lorempixel.com/400/400/business,Commodi nesciunt laudantium minima qui ea.,897,2019-4-24 09:33:31
7,49,5,23,2019-4-6 07:26:47,http://lorempixel.com/400/400/business,Corrupti repudiandae tenetur qui quis est non nemo doloribus ab.,474,2019-9-19 05:00:11
8,14,2,11,2019-4-11 05:06:56,http://lorempixel.com/400/400/business,Et rerum tenetur aut aut.,110,2019-8-24 19:27:32
9,38,4,20,2019-7-31 23:32:54,http://lorempixel.com/400/400/business,Et sit qui quidem maxime est adipisci omnis.,449,2019-8-19 09:44:14
10,96,5,23,2019-4-28 00:55:49,http://lorempixel.com/400/400/business,Ipsa mollitia pariatur eaque voluptate deleniti cupiditate est alias.,811,2019-8-7 11:52:03
11,66,2,9,2019-5-23 00:34:33,http://lorempixel.com/400/400/business,Ad in quo voluptatem repudiandae necessitatibus et.,925,2019-7-8 16:05:40
12,17,1,1,2019-4-17 09:59:55,http://lorempixel.com/400/400/business,Odio dolorem asperiores eos voluptatibus voluptatem voluptate et voluptas.,344,2019-7-19 07:54:33
13,27,5,23,2019-6-9 22:00:48,http://lorempixel.com/400/400/business,Et sit facilis ea qui dolore.,836,2019-7-3 11:40:36
14,41,2,11,2019-4-25 18:01:28,http://lorempixel.com/400/400/business,Odio accusamus commodi voluptates veritatis magnam.,235,2019-5-10 21:08:14
15,76,4,19,2019-4-9 01:14:40,http://lorempixel.com/400/400/business,Dolorem autem et velit accusamus commodi commodi est.,70,2019-8-15 05:14:06
16,46,2,10,2019-7-25 14:49:26,http://lorempixel.com/400/400/business,Labore odio veniam delectus nisi est debitis nobis tenetur.,61,2019-8-2 21:52:03
17,74,3,15,2019-4-3 10:11:01,http://lorempixel.com/400/400/business,Quasi similique at velit aut amet aperiam aut.,634,2019-8-27 04:42:25
18,39,4,18,2019-4-26 18:53:00,http://lorempixel.com/400/400/business,Illum pariatur sed repudiandae et.,845,2019-9-30 07:00:35
19,19,4,20,2019-5-1 07:29:43,http://lorempixel.com/400/400/business,Labore rerum ea voluptas asperiores corporis.,834,2019-8-14 15:46:50
20,10,2,11,2019-5-27 08:00:09,http://lorempixel.com/400/400/business,Quia commodi voluptatem maxime quae suscipit nemo sequi.,946,2019-9-19 11:37:18
21,32,2,12,2019-7-2 11:31:55,http://lorempixel.com/400/400/business,Deserunt dolores alias odit architecto dignissimos laborum laboriosam.,506,2019-7-31 08:22:18
22,94,4,20,2019-7-18 10:08:56,http://lorempixel.com/400/400/business,Explicabo in maxime.,49,2019-7-30 23:26:09
23,77,4,18,2019-7-7 14:17:55,http://lorempixel.com/400/400/business,Maiores repellat tenetur.,641,2019-8-25 15:59:23
24,49,1,6,2019-7-20 15:17:28,http://lorempixel.com/400/400/business,Facilis est quae illo officiis.,17,2019-8-21 05:51:26
25,50,1,4,2019-7-23 15:55:01,http://lorempixel.com/400/400/business,Mollitia id enim fugit.,789,2019-9-27 14:01:58
26,49,3,16,2019-7-3 00:28:14,http://lorempixel.com/400/400/business,Fugit error quibusdam minima officiis.,985,2019-7-14 05:04:18
27,58,1,3,2019-4-16 21:08:35,http://lorempixel.com/400/400/business,Ab totam exercitationem.,584,2019-9-22 09:14:33
28,82,1,4,2019-7-17 13:46:01,http://lorempixel.com/400/400/business,Quidem reprehenderit veniam suscipit aperiam eos qui.,639,2019-8-14 14:49:41
29,6,4,18,2019-5-15 11:16:46,http://lorempixel.com/400/400/business,Id sit quis totam voluptatem in sed odio deleniti labore.,261,2019-8-2 19:26:09
30,89,4,21,2019-6-4 18:21:26,http://lorempixel.com/400/400/business,In libero qui.,653,2019-6-10 12:31:06
31,42,1,2,2019-7-23 06:34:57,http://lorempixel.com/400/400/business,Beatae iste deserunt voluptatem totam.,945,2019-9-15 21:33:45
32,93,2,13,2019-6-4 06:07:15,http://lorempixel.com/400/400/business,Sapiente soluta dolore suscipit dolore placeat.,670,2019-8-25 14:57:58
33,42,1,5,2019-7-23 12:14:44,http://lorempixel.com/400/400/business,Aut et facilis excepturi esse accusamus.,618,2019-8-12 19:38:02
34,98,1,7,2019-7-24 18:52:55,http://lorempixel.com/400/400/business,Repellat dolor facere occaecati fuga beatae.,758,2019-8-16 15:02:52
35,16,4,21,2019-5-22 14:41:25,http://lorempixel.com/400/400/business,Eius aliquam iusto possimus adipisci quas a occaecati recusandae.,355,2019-7-29 10:24:10
36,24,2,10,2019-5-10 11:58:05,http://lorempixel.com/400/400/business,Non quasi ratione soluta dignissimos ex.,193,2019-9-28 15:18:01
37,31,5,23,2019-7-14 17:34:04,http://lorempixel.com/400/400/business,Consectetur reiciendis numquam itaque reprehenderit explicabo accusantium dolor harum.,615,2019-7-24 17:54:32
38,62,4,19,2019-7-15 22:49:59,http://lorempixel.com/400/400/business,Consequuntur cumque doloribus veniam temporibus voluptatem corporis iste iure saepe.,759,2019-9-4 07:04:29
39,26,4,19,2019-5-8 09:23:26,http://lorempixel.com/400/400/business,Aut ad rerum autem saepe nemo ullam.,19,2019-6-20 04:52:44
40,51,1,6,2019-7-14 19:08:51,http://lorempixel.com/400/400/business,Totam voluptatibus cumque corporis nulla quia et eum.,762,2019-8-17 19:33:34
41,64,1,6,2019-4-24 12:15:42,http://lorempixel.com/400/400/business,Vel est neque error officia sed nisi.,273,2019-7-7 04:46:58
42,60,1,2,2019-6-16 08:01:25,http://lorempixel.com/400/400/business,Quo quo beatae ullam blanditiis exercitationem.,209,2019-6-30 04:21:47
43,77,3,14,2019-6-14 05:42:58,http://lorempixel.com/400/400/business,Sit in ratione.,989,2019-9-10 23:59:27
44,92,5,23,2019-6-30 11:56:18,http://lorempixel.com/400/400/business,Maxime rerum dolorem temporibus.,154,2019-8-10 04:36:01
45,50,4,21,2019-7-26 13:20:42,http://lorempixel.com/400/400/business,Laboriosam dicta aperiam aliquid dignissimos neque fugiat reiciendis id dolor.,216,2019-8-14 02:54:29
46,28,1,1,2019-6-24 22:58:15,http://lorempixel.com/400/400/business,Aut veritatis perferendis ex voluptate in amet.,380,2019-7-31 04:15:08
47,73,2,13,2019-5-22 06:01:09,http://lorempixel.com/400/400/business,Ducimus molestias ut est perferendis architecto.,726,2019-8-25 06:48:07
48,51,1,1,2019-5-31 22:35:04,http://lorempixel.com/400/400/business,Possimus accusamus nihil.,197,2019-9-23 10:00:53
49,33,3,17,2019-4-4 03:51:59,http://lorempixel.com/400/400/business,Sed magnam ratione.,325,2019-9-16 22:49:59
50,45,4,19,2019-5-28 17:27:57,http://lorempixel.com/400/400/business,Rem similique soluta vel similique aperiam.,891,2019-6-6 06:11:27
51,96,1,4,2019-7-9 02:13:09,http://lorempixel.com/400/400/business,Enim odio eos molestiae vitae distinctio doloremque.,284,2019-8-19 03:26:21
52,64,4,19,2019-5-23 23:38:55,http://lorempixel.com/400/400/business,Voluptatem voluptas amet nesciunt similique non nostrum.,141,2019-8-30 17:07:51
53,52,2,9,2019-6-21 11:35:28,http://lorempixel.com/400/400/business,Est aut provident et quidem fugiat.,946,2019-7-15 00:02:53
54,64,5,22,2019-5-3 11:38:36,http://lorempixel.com/400/400/business,Et est ut ut dolor accusamus.,753,2019-6-12 08:22:55
55,74,1,7,2019-6-7 06:52:58,http://lorempixel.com/400/400/business,Id voluptas dolorum repudiandae expedita est qui pariatur et.,52,2019-9-4 06:51:10
56,76,4,19,2019-4-12 05:30:16,http://lorempixel.com/400/400/business,Qui nesciunt ad sit inventore.,209,2019-9-8 23:53:55
57,15,1,2,2019-4-19 18:35:37,http://lorempixel.com/400/400/business,Qui sequi sequi aut similique ullam sequi esse et.,327,2019-9-10 07:45:58
58,13,3,14,2019-7-16 03:16:31,http://lorempixel.com/400/400/business,Praesentium natus voluptates ut.,809,2019-9-3 20:56:11
59,13,3,14,2019-6-1 12:56:44,http://lorempixel.com/400/400/business,Placeat consequuntur delectus.,696,2019-6-18 09:23:09
60,11,5,23,2019-7-25 05:14:52,http://lorempixel.com/400/400/business,Quia aut dolor mollitia perspiciatis culpa quibusdam.,151,2019-8-11 16:06:12
61,70,4,18,2019-8-1 14:00:26,http://lorempixel.com/400/400/business,Tenetur aliquam earum fugit et.,121,2019-8-16 16:41:58
62,24,5,22,2019-6-30 12:01:07,http://lorempixel.com/400/400/business,Excepturi veniam aut eum qui deserunt.,816,2019-9-16 04:43:30
63,18,2,9,2019-7-4 23:01:14,http://lorempixel.com/400/400/business,Et illum vero.,261,2019-8-24 16:43:21
64,57,5,23,2019-5-19 09:59:47,http://lorempixel.com/400/400/business,Possimus hic et et quod.,294,2019-8-31 13:22:12
65,69,5,22,2019-4-7 04:25:02,http://lorempixel.com/400/400/business,Deleniti architecto consequatur eum dolores alias doloribus unde ut.,523,2019-9-20 18:23:58
66,49,5,22,2019-6-9 00:40:48,http://lorempixel.com/400/400/business,Qui ut eos velit rerum est iste eum possimus.,105,2019-7-22 18:27:08
67,83,3,17,2019-5-26 14:37:07,http://lorempixel.com/400/400/business,Doloremque aut perferendis placeat dolor minus aut.,363,2019-6-8 10:06:02
68,2,3,16,2019-6-7 05:09:32,http://lorempixel.com/400/400/business,Qui exercitationem accusamus numquam.,817,2019-8-14 04:30:34
69,85,4,21,2019-5-16 23:57:54,http://lorempixel.com/400/400/business,Velit velit accusamus eaque dolor distinctio ea est non.,196,2019-7-27 21:49:21
70,5,4,19,2019-5-27 16:02:49,http://lorempixel.com/400/400/business,Eum sit sit sint qui sunt id id qui et.,840,2019-6-5 02:35:39
71,64,4,19,2019-6-12 22:16:29,http://lorempixel.com/400/400/business,Harum sunt voluptatem.,819,2019-8-7 19:23:29
72,49,2,13,2019-6-23 02:19:42,http://lorempixel.com/400/400/business,Occaecati ut eius.,605,2019-9-11 08:34:02
73,63,4,21,2019-5-24 03:57:11,http://lorempixel.com/400/400/business,Sunt aut eius et sit ad expedita.,845,2019-7-20 22:24:38
74,54,5,22,2019-5-1 05:52:42,http://lorempixel.com/400/400/business,Ea animi maxime esse omnis temporibus.,567,2019-6-24 06:03:15
75,87,4,19,2019-4-8 05:08:14,http://lorempixel.com/400/400/business,Praesentium vel est sed quas ad voluptas.,772,2019-7-3 06:04:32
76,100,3,14,2019-7-28 02:55:40,http://lorempixel.com/400/400/business,Tenetur debitis quidem enim odit perspiciatis.,12,2019-9-4 06:31:28
77,2,5,22,2019-4-11 22:16:38,http://lorempixel.com/400/400/business,Expedita quidem error aspernatur vel velit perspiciatis.,289,2019-4-14 02:25:35
78,49,1,2,2019-5-14 06:10:38,http://lorempixel.com/400/400/business,Consequatur sequi est tempora dolorem.,103,2019-8-11 19:03:05
79,88,5,23,2019-6-14 15:29:53,http://lorempixel.com/400/400/business,Quia nemo aliquid cum excepturi consequatur deserunt molestiae.,890,2019-8-25 05:10:39
80,35,3,16,2019-6-19 15:35:27,http://lorempixel.com/400/400/business,Voluptates magni voluptatem aliquam et qui blanditiis vel occaecati.,718,2019-7-13 05:43:39
81,21,3,14,2019-6-16 02:43:29,http://lorempixel.com/400/400/business,Cum adipisci numquam consequuntur commodi beatae omnis impedit qui.,579,2019-9-6 04:45:19
82,44,1,8,2019-4-11 02:16:39,http://lorempixel.com/400/400/business,Blanditiis debitis accusamus voluptas consequatur iure qui neque.,397,2019-4-23 12:21:43
83,40,3,15,2019-7-8 01:10:36,http://lorempixel.com/400/400/business,Quibusdam aut ut autem deserunt sed consequatur aut.,320,2019-7-28 08:27:56
84,37,3,17,2019-4-26 11:39:34,http://lorempixel.com/400/400/business,Quasi non excepturi eveniet in consequatur quaerat velit labore.,963,2019-5-10 16:58:13
85,96,4,20,2019-6-11 07:39:12,http://lorempixel.com/400/400/business,Autem neque enim qui distinctio voluptas saepe et sunt.,771,2019-7-13 18:06:41
86,31,3,17,2019-4-11 02:44:12,http://lorempixel.com/400/400/business,Quia eius perferendis et exercitationem labore.,956,2019-7-12 09:06:39
87,4,2,13,2019-4-20 13:45:24,http://lorempixel.com/400/400/business,Vitae laboriosam esse perferendis qui.,20,2019-8-7 18:36:41
88,5,3,16,2019-4-30 14:03:40,http://lorempixel.com/400/400/business,Aut iste quae voluptatem voluptate adipisci laborum qui eum.,932,2019-5-13 18:02:20
89,12,1,6,2019-4-27 02:17:48,http://lorempixel.com/400/400/business,Fugit nam sint consequatur rerum.,102,2019-7-17 16:51:06
90,60,3,16,2019-4-11 03:30:59,http://lorempixel.com/400/400/business,Temporibus enim sint est ex aut iste in molestiae.,146,2019-7-24 06:40:40
91,69,1,3,2019-7-20 12:27:39,http://lorempixel.com/400/400/business,Dignissimos totam dolore neque voluptatem reprehenderit soluta tempore iure amet.,228,2019-9-13 13:06:41
92,93,2,13,2019-6-18 07:30:30,http://lorempixel.com/400/400/business,At enim eum fuga minima ea exercitationem.,666,2019-9-30 07:08:52
93,86,4,19,2019-7-22 16:45:36,http://lorempixel.com/400/400/business,Nam reprehenderit voluptas corporis mollitia rerum odit delectus et nobis.,646,2019-9-4 19:21:43
94,87,3,14,2019-7-2 00:39:30,http://lorempixel.com/400/400/business,Autem aperiam minima ut non officia dicta.,589,2019-7-13 05:09:37
95,32,4,21,2019-5-7 06:39:10,http://lorempixel.com/400/400/business,Tempora rem fugit fugiat.,863,2019-6-1 02:12:00
96,71,4,21,2019-5-18 21:12:11,http://lorempixel.com/400/400/business,Ipsum voluptas aut eaque vitae rem doloremque nesciunt.,412,2019-7-25 01:12:29
97,4,5,22,2019-7-1 19:37:57,http://lorempixel.com/400/400/business,Et necessitatibus doloribus et et.,668,2019-9-10 15:01:32
98,37,2,13,2019-6-19 13:08:55,http://lorempixel.com/400/400/business,Adipisci praesentium minus ut sed est enim veniam.,526,2019-6-26 14:10:17
99,79,2,11,2019-6-28 14:39:40,http://lorempixel.com/400/400/business,Quis voluptatem quisquam minima.,102,2019-9-1 04:46:15
100,35,5,23,2019-6-19 16:49:37,http://lorempixel.com/400/400/business,Libero ea consectetur recusandae fuga.,283,2019-9-26 20:37:11
101,61,2,12,2019-7-31 21:40:31,http://lorempixel.com/400/400/business,Natus veniam aperiam ea ut quia.,872,2019-9-3 02:38:11
102,73,3,14,2019-7-9 07:26:11,http://lorempixel.com/400/400/business,Dicta omnis repellat veritatis et.,33,2019-9-11 05:45:29
103,62,4,18,2019-6-16 07:56:14,http://lorempixel.com/400/400/business,Sit ut et ex voluptas blanditiis quis voluptatem.,635,2019-9-6 12:03:11
104,7,3,15,2019-7-25 10:38:45,http://lorempixel.com/400/400/business,Est modi officia amet expedita id architecto.,163,2019-8-9 21:23:14
105,95,4,20,2019-6-14 08:47:40,http://lorempixel.com/400/400/business,Dolores quasi rem ut.,911,2019-7-26 18:23:28
106,80,1,1,2019-6-3 08:00:32,http://lorempixel.com/400/400/business,Recusandae eveniet dolore corrupti nihil.,898,2019-6-6 22:29:35
107,100,1,8,2019-6-19 16:01:08,http://lorempixel.com/400/400/business,Harum ipsam sed et minima.,375,2019-7-4 17:12:04
108,17,3,14,2019-7-22 04:58:47,http://lorempixel.com/400/400/business,Quas inventore beatae ipsum.,231,2019-9-1 12:59:18
109,38,3,14,2019-4-22 07:02:27,http://lorempixel.com/400/400/business,Velit omnis qui veritatis est doloribus culpa.,311,2019-5-29 00:31:18
110,45,4,19,2019-7-25 09:36:40,http://lorempixel.com/400/400/business,Eligendi labore impedit nesciunt corrupti minus debitis.,457,2019-9-19 10:22:45
111,94,1,1,2019-5-31 17:20:07,http://lorempixel.com/400/400/business,Modi optio eaque consequatur sapiente dolor qui.,60,2019-9-10 03:31:45
112,18,2,11,2019-5-8 22:35:41,http://lorempixel.com/400/400/business,Consequuntur dicta corrupti nulla ipsa.,442,2019-6-15 07:55:36
113,66,5,22,2019-7-31 09:59:23,http://lorempixel.com/400/400/business,Quos aut voluptatem explicabo at.,884,2019-9-2 10:11:33
114,79,2,9,2019-5-26 21:43:21,http://lorempixel.com/400/400/business,Vel ex perspiciatis consequatur maxime unde sed.,321,2019-8-28 12:09:43
115,15,5,23,2019-7-12 15:44:18,http://lorempixel.com/400/400/business,Facilis necessitatibus et nam.,271,2019-8-20 00:17:54
116,49,4,21,2019-7-25 12:40:02,http://lorempixel.com/400/400/business,Delectus nihil non.,136,2019-7-31 00:50:31
117,42,3,17,2019-5-28 15:08:09,http://lorempixel.com/400/400/business,Temporibus quae qui voluptatem sed ab facere aut.,155,2019-7-17 22:39:34
118,9,1,7,2019-4-14 07:21:07,http://lorempixel.com/400/400/business,Dolores quas vero sit.,80,2019-9-9 20:58:36
119,100,3,15,2019-4-15 15:43:05,http://lorempixel.com/400/400/business,Animi occaecati quo et debitis blanditiis iste reprehenderit numquam magni.,295,2019-7-11 05:00:37
120,11,2,11,2019-5-7 11:00:21,http://lorempixel.com/400/400/business,Saepe quia omnis necessitatibus iure dolor provident.,978,2019-6-26 18:15:29
121,6,5,22,2019-5-22 22:34:50,http://lorempixel.com/400/400/business,Molestiae optio et.,830,2019-6-10 20:34:22
122,71,5,23,2019-5-11 19:01:04,http://lorempixel.com/400/400/business,Quae eaque debitis dolores rem est.,883,2019-7-31 20:11:44
123,85,5,23,2019-7-19 02:03:43,http://lorempixel.com/400/400/business,Consequatur cumque ut quasi iusto est.,334,2019-9-2 20:55:56
124,62,3,17,2019-6-2 16:43:01,http://lorempixel.com/400/400/business,Fuga voluptas qui qui saepe magnam consequuntur ut repellat.,703,2019-7-30 19:42:24
125,88,4,18,2019-7-6 21:50:45,http://lorempixel.com/400/400/business,In esse ipsam.,442,2019-9-22 03:51:02
126,80,2,11,2019-7-24 00:59:06,http://lorempixel.com/400/400/business,Quia blanditiis magnam et expedita voluptates a pariatur magnam maxime.,491,2019-8-29 20:15:46
127,53,3,15,2019-5-9 14:38:08,http://lorempixel.com/400/400/business,Sunt veniam aliquam nam reprehenderit amet culpa.,323,2019-9-6 08:36:10
128,86,4,21,2019-7-28 06:49:40,http://lorempixel.com/400/400/business,Est qui error.,482,2019-8-23 22:56:44
129,27,1,2,2019-7-27 16:01:04,http://lorempixel.com/400/400/business,Est neque sit enim ex consequatur omnis ullam ducimus molestiae.,638,2019-8-5 12:12:51
130,56,3,16,2019-6-10 20:20:58,http://lorempixel.com/400/400/business,Quo perferendis voluptas provident alias eos facere.,385,2019-7-17 22:07:39
131,96,4,19,2019-4-3 10:20:59,http://lorempixel.com/400/400/business,Reiciendis ab reiciendis iste consequatur.,934,2019-4-7 09:26:15
132,57,4,20,2019-7-2 06:48:28,http://lorempixel.com/400/400/business,Mollitia dignissimos ipsum provident nam eius est voluptatem recusandae.,524,2019-9-6 00:27:31
133,14,1,8,2019-4-27 01:41:23,http://lorempixel.com/400/400/business,Corrupti aut molestias id placeat non consequatur totam doloribus eos.,156,2019-8-1 11:42:35
134,95,5,23,2019-7-14 20:41:26,http://lorempixel.com/400/400/business,Nemo facere qui eveniet rerum.,190,2019-8-7 12:21:23
135,5,3,15,2019-4-8 13:45:24,http://lorempixel.com/400/400/business,Accusantium doloribus qui enim blanditiis perferendis consequatur.,851,2019-6-8 23:49:38
136,69,1,3,2019-6-22 17:28:32,http://lorempixel.com/400/400/business,Magnam reprehenderit aut tenetur tempore eveniet qui saepe.,354,2019-8-29 14:17:29
137,82,4,19,2019-7-6 06:43:20,http://lorempixel.com/400/400/business,Placeat vitae architecto est rerum.,307,2019-8-29 21:49:05
138,53,4,20,2019-7-23 21:57:30,http://lorempixel.com/400/400/business,Est fugit est repudiandae sit.,888,2019-8-26 04:05:06
139,35,1,6,2019-4-14 16:44:33,http://lorempixel.com/400/400/business,Ut alias repudiandae quis.,575,2019-4-14 17:04:06
140,7,4,20,2019-7-24 14:07:19,http://lorempixel.com/400/400/business,Provident velit est rem blanditiis corporis fuga dolore.,213,2019-7-27 22:24:09
141,49,5,23,2019-5-6 01:56:35,http://lorempixel.com/400/400/business,Accusantium blanditiis voluptatibus eveniet.,221,2019-9-26 03:29:10
142,23,4,19,2019-3-31 23:23:13,http://lorempixel.com/400/400/business,Repudiandae quos et autem.,446,2019-7-9 23:08:41
143,66,1,2,2019-7-22 16:25:52,http://lorempixel.com/400/400/business,Blanditiis atque autem rem accusantium similique aut tempora.,986,2019-9-11 22:34:27
144,14,5,22,2019-4-27 15:59:31,http://lorempixel.com/400/400/business,Qui mollitia nesciunt dolore provident minima nulla omnis odit dicta.,204,2019-8-2 20:48:12
145,44,2,11,2019-4-1 02:35:36,http://lorempixel.com/400/400/business,Autem reiciendis aliquid adipisci ipsa distinctio.,169,2019-7-8 10:09:19
146,91,5,23,2019-5-28 13:28:29,http://lorempixel.com/400/400/business,Ea dolores aut.,61,2019-7-22 13:11:44
147,66,5,23,2019-7-28 15:06:31,http://lorempixel.com/400/400/business,Ullam sed quam.,225,2019-8-1 02:39:51
148,81,3,17,2019-4-21 22:23:49,http://lorempixel.com/400/400/business,Vel amet rerum aliquid nisi.,887,2019-7-19 13:00:25
149,24,4,20,2019-6-29 08:55:59,http://lorempixel.com/400/400/business,Eius et nihil deleniti ut qui.,642,2019-7-31 12:08:32
150,45,4,18,2019-6-30 05:00:25,http://lorempixel.com/400/400/business,Ut fugit quia tempora voluptas omnis expedita eius.,210,2019-8-18 09:06:24
151,12,1,1,2019-7-9 14:35:46,http://lorempixel.com/400/400/business,Eos et ut.,907,2019-8-21 22:48:40
152,73,3,15,2019-7-14 12:44:32,http://lorempixel.com/400/400/business,Qui itaque labore quis.,28,2019-8-3 01:23:01
153,79,5,23,2019-6-5 22:14:33,http://lorempixel.com/400/400/business,Et totam sit repudiandae.,306,2019-6-12 02:52:20
154,38,5,22,2019-5-25 01:15:24,http://lorempixel.com/400/400/business,Aut eum labore eius aut.,874,2019-9-19 01:44:26
155,74,2,13,2019-5-4 01:48:27,http://lorempixel.com/400/400/business,Non aliquam incidunt vel ea et.,888,2019-9-20 20:34:30
156,60,1,2,2019-4-20 13:44:12,http://lorempixel.com/400/400/business,Et incidunt repellat veritatis in.,680,2019-5-21 12:37:09
157,45,3,15,2019-4-26 11:04:44,http://lorempixel.com/400/400/business,Quia accusamus maiores aliquam.,792,2019-8-1 06:28:41
158,91,5,22,2019-4-29 05:02:16,http://lorempixel.com/400/400/business,Minima fugit necessitatibus non deserunt aperiam.,987,2019-7-29 11:58:15
159,23,1,8,2019-4-30 11:49:21,http://lorempixel.com/400/400/business,Accusamus animi occaecati impedit voluptas debitis beatae aliquid.,579,2019-5-21 00:15:28
160,21,5,22,2019-6-19 05:47:19,http://lorempixel.com/400/400/business,Deleniti non et in voluptas eligendi quis occaecati.,255,2019-9-8 13:32:51
161,5,1,3,2019-5-28 01:05:09,http://lorempixel.com/400/400/business,Dolores id quia non.,849,2019-8-2 08:57:39
162,93,4,20,2019-7-4 15:51:04,http://lorempixel.com/400/400/business,Perspiciatis non dolores aut voluptate ipsam ipsam cupiditate eaque quia.,581,2019-7-7 10:47:47
163,9,5,23,2019-4-22 14:49:08,http://lorempixel.com/400/400/business,Voluptatem magni perspiciatis.,206,2019-6-1 11:03:53
164,74,2,9,2019-4-16 01:14:46,http://lorempixel.com/400/400/business,Molestias totam nihil explicabo laborum ab fuga.,493,2019-5-22 21:34:07
165,79,2,12,2019-6-21 21:07:10,http://lorempixel.com/400/400/business,Soluta veniam distinctio et et.,917,2019-9-16 23:29:15
166,26,1,1,2019-5-4 03:40:57,http://lorempixel.com/400/400/business,Dolorem aut facilis eius sunt et possimus.,678,2019-5-18 19:28:43
167,92,4,21,2019-7-5 14:37:53,http://lorempixel.com/400/400/business,Non eveniet sed ut.,495,2019-9-7 23:27:34
168,79,4,21,2019-7-24 23:47:35,http://lorempixel.com/400/400/business,Velit blanditiis possimus ut modi ut et est repellendus.,117,2019-9-25 05:01:21
169,24,1,7,2019-4-14 02:21:49,http://lorempixel.com/400/400/business,Aperiam dolores atque recusandae.,196,2019-6-27 16:39:28
170,49,5,22,2019-6-21 12:02:01,http://lorempixel.com/400/400/business,Minus et possimus ut aspernatur qui consectetur consequatur sapiente dicta.,382,2019-7-9 18:13:40
171,26,2,12,2019-4-18 07:39:01,http://lorempixel.com/400/400/business,Temporibus inventore qui aspernatur vel quae.,145,2019-7-24 04:37:53
172,71,3,14,2019-5-31 18:53:46,http://lorempixel.com/400/400/business,Laboriosam voluptas nihil blanditiis.,841,2019-6-11 10:54:34
173,98,1,3,2019-4-21 21:03:11,http://lorempixel.com/400/400/business,Provident nulla tenetur.,184,2019-5-20 07:25:25
174,3,1,2,2019-6-16 21:05:54,http://lorempixel.com/400/400/business,Esse eos saepe neque nobis corrupti officiis repellat et.,32,2019-7-13 06:20:49
175,86,4,18,2019-4-5 10:29:36,http://lorempixel.com/400/400/business,Rerum omnis natus aliquam reprehenderit asperiores.,162,2019-9-17 18:58:34
176,18,1,6,2019-7-7 21:36:38,http://lorempixel.com/400/400/business,Asperiores voluptatum autem dolores vero.,598,2019-8-9 10:27:45
177,40,5,22,2019-6-19 06:09:01,http://lorempixel.com/400/400/business,Laudantium ipsam et qui vel.,221,2019-9-12 02:43:02
178,20,1,8,2019-5-28 00:34:56,http://lorempixel.com/400/400/business,Natus cumque placeat qui quia autem.,353,2019-8-14 10:11:47
179,19,4,18,2019-4-9 09:01:43,http://lorempixel.com/400/400/business,Fugit consequatur quibusdam voluptatem eum voluptatibus magni provident.,260,2019-4-10 15:12:08
180,81,5,22,2019-4-13 10:15:13,http://lorempixel.com/400/400/business,Nihil velit voluptates aliquam saepe deserunt.,883,2019-9-30 03:06:37
181,100,2,10,2019-6-22 22:08:57,http://lorempixel.com/400/400/business,Exercitationem impedit fuga aliquam quia culpa voluptas et quibusdam.,435,2019-8-26 01:22:01
182,85,4,21,2019-6-22 13:26:53,http://lorempixel.com/400/400/business,Molestias veniam maiores et cum harum.,283,2019-9-2 16:10:25
183,21,5,23,2019-5-29 23:09:56,http://lorempixel.com/400/400/business,Rerum non impedit quibusdam cupiditate et est nam culpa quibusdam.,310,2019-6-10 06:00:57
184,11,3,16,2019-6-28 21:05:12,http://lorempixel.com/400/400/business,Occaecati dolorum repellat culpa ut.,403,2019-8-8 10:16:23
185,76,5,22,2019-7-8 05:20:41,http://lorempixel.com/400/400/business,Doloribus aut voluptate rerum quos fugit saepe ad.,29,2019-8-19 16:08:36
186,82,5,23,2019-5-29 01:08:09,http://lorempixel.com/400/400/business,Ad modi qui molestiae eaque adipisci eum.,806,2019-7-26 19:56:24
187,72,1,4,2019-4-16 09:18:30,http://lorempixel.com/400/400/business,Velit illum doloremque ex nostrum ut aut doloremque nisi.,783,2019-5-27 00:54:57
188,100,3,15,2019-7-25 01:29:20,http://lorempixel.com/400/400/business,Necessitatibus cumque molestias quia non sit.,137,2019-9-30 14:08:39
189,36,5,23,2019-5-1 03:49:02,http://lorempixel.com/400/400/business,Vero ex et architecto molestias quis accusamus dolorum dolores.,182,2019-8-25 03:55:54
190,100,2,13,2019-5-4 10:43:25,http://lorempixel.com/400/400/business,Ut omnis qui et et ipsam.,147,2019-9-26 02:08:13
