id,room_id,category,subcategory,date,photoUrl,description,cost,dateFixed
191,16,4,21,2019-5-24 04:05:51,http://lorempixel.com/400/400/business,Nostrum maiores dolorem voluptatum minima aperiam et quod.,203,2019-6-29 08:38:19
192,2,4,18,2019-7-12 03:13:44,http://lorempixel.com/400/400/business,Et dolor non architecto.,935,2019-9-14 01:36:55
193,8,4,20,2019-4-9 02:28:51,http://lorempixel.com/400/400/business,Eius accusantium fugiat non corporis.,408,2019-7-22 02:48:25
194,35,5,23,2019-6-1 02:32:51,http://lorempixel.com/400/400/business,Consequatur expedita quaerat perferendis in ut perspiciatis.,967,2019-7-20 20:46:25
195,75,5,23,2019-4-14 20:23:09,http://lorempixel.com/400/400/business,Rerum sit architecto asperiores sequi laboriosam quaerat dolores eos.,63,2019-8-18 12:38:15
196,66,1,3,2019-5-5 09:28:48,http://lorempixel.com/400/400/business,Adipisci architecto ab voluptas.,38,2019-7-1 04:10:51
197,57,4,21,2019-4-23 13:22:35,http://lorempixel.com/400/400/business,Eaque id qui molestias tempore error dolore suscipit asperiores sed.,25,2019-6-30 12:54:09
198,45,3,17,2019-6-29 14:35:32,http://lorempixel.com/400/400/business,Aliquam iste sed sint quasi.,299,2019-9-20 03:23:30
199,16,4,18,2019-5-23 11:57:35,http://lorempixel.com/400/400/business,Id sit necessitatibus omnis in.,222,2019-9-17 00:34:13
200,37,1,8,2019-5-22 01:38:27,http://lorempixel.com/400/400/business,Culpa omnis eius deleniti.,843,2019-5-24 05:26:31
201,65,2,12,2019-6-14 21:29:20,http://lorempixel.com/400/400/business,Excepturi autem quisquam suscipit doloribus quod.,789,2019-7-17 10:11:29
202,14,5,23,2019-5-14 22:36:41,http://lorempixel.com/400/400/business,Et quaerat impedit qui eos ut.,53,2019-8-23 12:41:14
203,80,5,23,2019-7-26 12:53:16,http://lorempixel.com/400/400/business,Aut et eos qui sint deserunt labore occaecati.,694,2019-8-5 06:04:50
204,17,2,11,2019-7-27 20:11:53,http://lorempixel.com/400/400/business,Quae inventore qui qui nemo magni quae.,288,2019-9-1 01:39:29
205,32,5,23,2019-4-11 11:00:03,http://lorempixel.com/400/400/business,Illo temporibus qui atque accusantium incidunt.,229,2019-9-5 01:07:33
206,84,1,3,2019-4-16 11:23:22,http://lorempixel.com/400/400/business,Ut rerum asperiores quia numquam amet et sed assumenda.,915,2019-9-3 08:01:02
207,3,1,7,2019-5-6 03:23:10,http://lorempixel.com/400/400/business,Nobis ut sed.,307,2019-9-17 06:21:17
208,77,2,11,2019-5-13 15:36:39,http://lorempixel.com/400/400/business,Error numquam possimus aut molestias similique corporis nisi.,733,2019-6-12 21:36:25
209,26,5,23,2019-6-25 06:09:05,http://lorempixel.com/400/400/business,Tempore modi beatae fugiat ratione optio recusandae magni vitae tempora.,187,2019-8-24 03:03:50
210,20,2,13,2019-4-18 00:12:29,http://lorempixel.com/400/400/business,Quos consequatur officia omnis neque aut non.,114,2019-5-1 16:42:25
211,65,1,3,2019-6-16 06:52:29,http://lorempixel.com/400/400/business,Reprehenderit dolorem necessitatibus sed vel et vel suscipit.,416,2019-7-18 00:51:19
212,71,2,11,2019-7-24 07:49:13,http://lorempixel.com/400/400/business,In repellendus necessitatibus labore ut qui.,894,2019-8-11 00:32:22
213,55,1,1,2019-7-15 18:59:05,http://lorempixel.com/400/400/business,Veritatis vitae voluptate dicta.,257,2019-7-19 09:42:32
214,46,2,11,2019-4-25 03:01:56,http://lorempixel.com/400/400/business,Impedit reprehenderit corrupti fugit numquam id et nobis quis.,924,2019-7-30 03:15:24
215,40,5,22,2019-4-21 00:43:19,http://lorempixel.com/400/400/business,Velit quaerat accusantium et facere velit suscipit recusandae deleniti quas.,347,2019-4-26 18:36:40
216,41,5,22,2019-5-27 13:57:17,http://lorempixel.com/400/400/business,Hic a cupiditate perferendis incidunt voluptatibus harum ea ut quidem.,446,2019-5-29 23:05:54
217,28,3,17,2019-4-4 10:04:59,http://lorempixel.com/400/400/business,Rerum qui eos voluptas et dolorem asperiores dolorum mollitia ullam.,839,2019-6-23 02:59:04
218,2,5,22,2019-5-12 11:07:49,http://lorempixel.com/400/400/business,Reprehenderit ipsa iure voluptatem tenetur.,339,2019-8-14 12:07:57
219,25,3,17,2019-4-26 09:46:52,http://lorempixel.com/400/400/business,Nostrum et rerum et dolorem et exercitationem velit rerum.,517,2019-9-1 20:20:09
220,87,4,20,2019-6-26 04:31:06,http://lorempixel.com/400/400/business,Rerum veniam inventore.,897,2019-7-16 22:33:28
221,78,2,10,2019-7-25 14:42:48,http://lorempixel.com/400/400/business,Pariatur sint vel perferendis maxime.,883,2019-9-18 10:51:57
222,76,5,23,2019-7-20 03:53:20,http://lorempixel.com/400/400/business,Voluptatem commodi reiciendis quas ipsum voluptatem saepe quos voluptas.,177,2019-7-22 17:00:30
223,29,1,2,2019-4-16 06:21:07,http://lorempixel.com/400/400/business,Voluptas id dolores maxime in quidem est sit.,941,2019-4-22 01:25:15
224,10,1,3,2019-4-29 07:14:21,http://lorempixel.com/400/400/business,Vero quia similique ea doloremque delectus.,134,2019-8-12 05:51:31
225,68,3,14,2019-5-26 06:39:05,http://lorempixel.com/400/400/business,Veniam dolores est ab enim rem architecto tempore pariatur.,790,2019-6-15 23:47:52
226,98,4,19,2019-4-15 17:16:59,http://lorempixel.com/400/400/business,Dolorum corporis sed qui est et enim.,101,2019-6-29 16:01:09
227,72,1,7,2019-5-3 16:45:26,http://lorempixel.com/400/400/business,Illum quaerat soluta laudantium non et minus in.,817,2019-9-5 23:14:59
228,100,1,6,2019-4-15 15:41:10,http://lorempixel.com/400/400/business,Voluptas non dignissimos nam vitae.,638,2019-7-28 11:44:46
229,51,4,21,2019-7-17 21:05:48,http://lorempixel.com/400/400/business,Quia esse eos voluptate.,315,2019-8-31 18:46:54
230,37,4,19,2019-7-31 07:56:35,http://lorempixel.com/400/400/business,Alias illo eligendi.,165,2019-8-13 21:48:33
231,68,5,22,2019-4-6 05:43:08,http://lorempixel.com/400/400/business,Earum doloremque dolores natus sunt id adipisci odit.,789,2019-8-22 22:45:05
232,100,1,4,2019-6-30 01:00:05,http://lorempixel.com/400/400/business,Quos est voluptatem maiores debitis.,850,2019-9-28 23:13:54
233,63,4,20,2019-4-2 19:00:30,http://lorempixel.com/400/400/business,Quae est minima et quasi quia iste perferendis consequatur.,984,2019-8-22 16:31:39
234,87,2,13,2019-4-30 01:23:29,http://lorempixel.com/400/400/business,Quibusdam veritatis voluptatem odit sed ullam provident deleniti suscipit modi.,760,2019-9-4 20:49:33
235,77,1,1,2019-4-25 13:16:47,http://lorempixel.com/400/400/business,Et facere voluptatibus dolor consequatur cum temporibus cum.,963,2019-4-26 01:45:39
236,12,3,16,2019-5-3 09:26:22,http://lorempixel.com/400/400/business,Velit dignissimos est quae voluptates eum.,608,2019-7-27 08:54:38
237,60,5,23,2019-6-20 15:43:39,http://lorempixel.com/400/400/business,Beatae explicabo explicabo quae et sed et blanditiis tenetur.,146,2019-8-16 05:36:42
238,54,3,17,2019-5-3 08:43:06,http://lorempixel.com/400/400/business,Possimus earum ut maiores ex dolorum facilis non.,143,2019-6-29 09:58:19
239,66,5,23,2019-8-1 12:43:08,http://lorempixel.com/400/400/business,Commodi praesentium quibusdam quae perspiciatis tenetur.,712,2019-8-14 11:06:37
240,44,1,8,2019-6-5 13:37:45,http://lorempixel.com/400/400/business,Voluptatem et dolore vero consequuntur dolores et reprehenderit enim.,3,2019-7-19 08:00:16
241,59,4,19,2019-8-2 08:33:35,http://lorempixel.com/400/400/business,Dolorum voluptatem molestiae ducimus non commodi.,866,2019-9-19 18:18:40
242,58,5,23,2019-5-12 22:43:08,http://lorempixel.com/400/400/business,Ut eveniet et quod cumque aperiam facere autem.,336,2019-6-21 00:11:08
243,20,5,23,2019-4-2 04:50:58,http://lorempixel.com/400/400/business,Eius voluptatum aut libero ex repellat neque distinctio.,292,2019-7-21 02:57:42
244,9,5,23,2019-7-18 02:37:07,http://lorempixel.com/400/400/business,Distinctio sint autem unde et.,620,2019-8-3 11:53:58
245,40,3,14,2019-4-24 23:47:02,http://lorempixel.com/400/400/business,Quidem temporibus rerum ullam qui.,935,2019-9-29 22:41:26
246,15,5,22,2019-7-25 14:53:04,http://lorempixel.com/400/400/business,Aut nisi repellat maiores voluptate a sed rem.,416,2019-9-24 03:19:23
247,41,1,7,2019-6-12 14:39:12,http://lorempixel.com/400/400/business,Ut veniam aspernatur sit distinctio iusto molestias excepturi deserunt.,144,2019-9-12 11:45:49
248,12,2,11,2019-4-22 10:46:16,http://lorempixel.com/400/400/business,Iste ad sunt et nisi.,453,2019-8-20 12:48:27
249,23,5,22,2019-5-20 03:41:15,http://lorempixel.com/400/400/business,Provident error cum voluptas.,730,2019-5-25 09:10:15
250,58,2,12,2019-5-2 10:06:10,http://lorempixel.com/400/400/business,Ea qui inventore ut dolores nulla error similique est itaque.,892,2019-9-29 02:52:24
251,26,1,8,2019-6-2 15:44:35,http://lorempixel.com/400/400/business,Necessitatibus accusamus reprehenderit quibusdam molestiae.,153,2019-8-15 22:51:52
252,100,2,11,2019-7-16 19:27:10,http://lorempixel.com/400/400/business,Cupiditate porro voluptatem a dolor id.,147,2019-8-24 16:11:44
253,35,3,15,2019-5-27 10:05:14,http://lorempixel.com/400/400/business,Beatae facere repudiandae illo reiciendis culpa nemo possimus sapiente.,695,2019-9-10 02:22:34
254,47,3,15,2019-7-3 14:43:09,http://lorempixel.com/400/400/business,Cumque qui ratione voluptatem ut at quas.,895,2019-8-6 07:20:23
255,66,1,8,2019-6-28 23:04:26,http://lorempixel.com/400/400/business,Rem tempore eum officia natus maxime blanditiis et atque.,514,2019-7-16 13:41:54
256,4,4,21,2019-6-9 21:20:07,http://lorempixel.com/400/400/business,Sunt aperiam autem consequuntur maiores.,287,2019-6-27 14:38:35
257,85,3,15,2019-7-30 01:00:57,http://lorempixel.com/400/400/business,Qui dolor nobis molestiae velit tempora sed autem.,417,2019-8-3 09:15:34
258,12,5,23,2019-5-31 10:13:19,http://lorempixel.com/400/400/business,Magnam cupiditate autem exercitationem voluptatibus beatae ea illo nobis nemo.,888,2019-9-7 03:56:22
259,17,2,11,2019-5-23 06:50:45,http://lorempixel.com/400/400/business,Laudantium eos est nihil facere.,10,2019-7-18 19:54:36
260,32,4,18,2019-5-20 16:52:06,http://lorempixel.com/400/400/business,Aut quos facere ullam necessitatibus vero repudiandae.,138,2019-6-18 12:21:59
261,16,5,22,2019-4-16 16:47:55,http://lorempixel.com/400/400/business,Officiis consequatur tempora voluptatem.,791,2019-5-8 15:00:27
262,32,2,13,2019-4-8 07:47:09,http://lorempixel.com/400/400/business,At et aut.,641,2019-5-5 10:56:32
263,7,3,15,2019-6-13 23:04:20,http://lorempixel.com/400/400/business,Qui voluptas consequuntur est quis id et asperiores id et.,847,2019-7-16 02:51:56
264,19,5,23,2019-4-21 21:13:22,http://lorempixel.com/400/400/business,Minima quae dolorum id.,157,2019-7-5 21:43:16
265,83,4,20,2019-6-17 20:05:53,http://lorempixel.com/400/400/business,Vitae corporis illo magnam molestias qui autem quod saepe.,521,2019-8-4 14:38:37
266,6,3,17,2019-6-16 01:55:09,http://lorempixel.com/400/400/business,Voluptas laborum culpa nam placeat ut.,662,2019-6-20 05:28:14
267,52,5,23,2019-7-22 14:34:35,http://lorempixel.com/400/400/business,Optio iure dolorem incidunt ut est fugit.,4,2019-8-3 14:22:18
268,46,3,15,2019-5-27 12:28:33,http://lorempixel.com/400/400/business,Doloribus nulla temporibus repellat doloribus eos commodi harum.,740,2019-5-31 15:22:33
269,70,3,17,2019-5-15 01:52:16,http://lorempixel.com/400/400/business,Eum dolor aut dolorem quam ullam explicabo consequatur.,741,2019-6-11 16:50:56
270,52,4,20,2019-7-14 09:00:43,http://lorempixel.com/400/400/business,Molestias et possimus id minima voluptas voluptatem omnis dolorem.,615,2019-8-23 05:21:54
271,85,2,12,2019-5-31 12:58:33,http://lorempixel.com/400/400/business,Qui nihil aut fugiat.,714,2019-7-31 19:42:01
272,34,4,19,2019-8-1 14:46:01,http://lorempixel.com/400/400/business,Non qui autem fuga voluptatem voluptatum nam vel.,762,2019-8-30 14:35:15
273,23,1,6,2019-6-4 04:26:24,http://lorempixel.com/400/400/business,Qui doloribus pariatur.,19,2019-9-22 11:01:04
274,37,5,23,2019-5-9 12:33:41,http://lorempixel.com/400/400/business,Eveniet accusamus repellendus corporis mollitia velit incidunt saepe.,10,2019-5-11 14:42:56
275,83,5,23,2019-7-18 00:23:14,http://lorempixel.com/400/400/business,Maxime omnis illum laudantium est.,727,2019-8-18 09:42:11
276,39,5,23,2019-5-16 07:43:36,http://lorempixel.com/400/400/business,Debitis magnam voluptas animi atque qui.,794,2019-6-2 11:43:51
277,8,2,10,2019-5-16 15:19:10,http://lorempixel.com/400/400/business,Ut provident asperiores cumque tempora unde rerum ea qui animi.,482,2019-6-12 12:03:35
278,44,2,11,2019-5-28 09:09:50,http://lorempixel.com/400/400/business,Voluptatem odit rerum quibusdam sunt consequatur.,923,2019-7-19 17:36:28
279,73,4,21,2019-5-2 02:05:58,http://lorempixel.com/400/400/business,Dolorem ullam quas velit nobis cupiditate sint laudantium cum.,433,2019-5-14 00:45:47
280,97,5,22,2019-5-16 19:47:03,http://lorempixel.com/400/400/business,Iusto hic dolor.,727,2019-7-3 09:59:37
281,74,5,22,2019-5-26 06:13:48,http://lorempixel.com/400/400/business,Quia itaque quo quam labore.,37,2019-7-25 00:15:57
282,99,1,4,2019-5-21 03:11:02,http://lorempixel.com/400/400/business,Ad mollitia laborum voluptate eos.,415,2019-9-17 05:47:51
283,15,4,20,2019-5-5 10:31:44,http://lorempixel.com/400/400/business,Temporibus vel ut et.,535,2019-7-31 21:36:38
284,45,3,16,2019-5-21 22:30:35,http://lorempixel.com/400/400/business,Dolorem corrupti totam.,692,2019-7-24 18:07:35
285,66,3,14,2019-6-1 14:21:06,http://lorempixel.com/400/400/business,Dolores corrupti suscipit.,896,2019-9-2 04:45:49
286,49,1,1,2019-6-2 04:56:27,http://lorempixel.com/400/400/business,Soluta debitis repellat ut dolorum sed.,688,2019-8-16 07:55:18
287,66,4,21,2019-6-25 15:36:05,http://lorempixel.com/400/400/business,Atque assumenda odit eum et repudiandae est.,617,2019-9-20 01:34:27
288,69,4,20,2019-7-29 09:46:36,http://lorempixel.com/400/400/business,Quo aspernatur et aspernatur ipsum fuga excepturi quod.,929,2019-9-6 04:13:05
289,43,2,9,2019-6-8 00:20:10,http://lorempixel.com/400/400/business,Et unde impedit et illum et non dolorum accusantium rerum.,881,2019-7-13 07:14:11
290,58,3,16,2019-4-20 10:06:44,http://lorempixel.com/400/400/business,Est expedita officiis.,188,2019-7-10 21:39:09
291,34,5,22,2019-7-26 08:19:40,http://lorempixel.com/400/400/business,Fugiat excepturi cum.,958,2019-8-9 18:00:44
292,89,3,17,2019-6-20 16:58:49,http://lorempixel.com/400/400/business,Quisquam et quasi soluta.,338,2019-9-18 20:52:08
293,10,2,9,2019-4-29 03:14:45,http://lorempixel.com/400/400/business,Optio quae eaque aut possimus error qui.,477,2019-9-15 16:47:49
294,10,3,15,2019-7-23 05:12:57,http://lorempixel.com/400/400/business,Vitae facere nemo sed adipisci inventore.,891,2019-9-6 12:16:14
295,13,3,14,2019-4-13 17:54:39,http://lorempixel.com/400/400/business,Aut laudantium aliquam ea iusto et voluptatem aut.,593,2019-8-19 02:06:32
296,79,1,5,2019-6-5 09:29:59,http://lorempixel.com/400/400/business,Doloribus maxime repellat tempore impedit illum in sunt porro qui.,732,2019-7-16 16:49:30
297,53,1,6,2019-6-14 15:20:42,http://lorempixel.com/400/400/business,In enim fugit.,527,2019-9-19 05:35:32
298,72,3,16,2019-4-19 16:56:27,http://lorempixel.com/400/400/business,Et rem voluptas rerum quo maiores.,597,2019-9-28 09:12:54
299,97,4,20,2019-7-22 23:36:03,http://lorempixel.com/400/400/business,Nihil voluptatem mollitia eveniet vel.,2,2019-7-26 13:53:44
300,24,2,9,2019-7-6 06:42:15,http://lorempixel.com/400/400/business,Non aut dolores hic alias impedit doloribus et quia.,548,2019-7-22 21:39:45
301,57,3,16,2019-5-25 14:43:26,http://lorempixel.com/400/400/business,Ut culpa velit incidunt perferendis fugit ut deserunt enim.,217,2019-6-8 15:52:20
302,4,5,23,2019-6-22 04:52:50,http://lorempixel.com/400/400/business,Architecto vitae asperiores ipsa sint ea laborum.,972,2019-9-16 03:08:21
303,7,1,6,2019-3-31 17:34:10,http://lorempixel.com/400/400/business,Est impedit necessitatibus quibusdam.,65,2019-8-9 16:26:25
304,28,4,21,2019-7-17 12:01:55,http://lorempixel.com/400/400/business,Omnis est sed.,565,2019-8-4 10:59:08
305,97,5,23,2019-7-16 23:11:09,http://lorempixel.com/400/400/business,Minus perspiciatis voluptatem.,161,2019-9-10 10:26:18
306,33,5,22,2019-6-2 12:11:09,http://lorempixel.com/400/400/business,Fugit occaecati sit qui id id laborum.,384,2019-6-21 16:13:29
307,56,5,23,2019-5-3 14:58:24,http://lorempixel.com/400/400/business,Ut totam voluptates ratione commodi vero.,658,2019-5-20 15:14:06
308,71,3,16,2019-4-17 01:03:56,http://lorempixel.com/400/400/business,Voluptatum molestias sint dolore atque est.,836,2019-6-20 13:55:40
309,32,4,20,2019-7-7 01:12:49,http://lorempixel.com/400/400/business,Et alias sint sed dolorem.,290,2019-9-11 00:36:07
310,80,3,16,2019-4-21 05:41:12,http://lorempixel.com/400/400/business,Molestias quas cum.,634,2019-4-26 14:40:21
311,25,5,23,2019-5-23 10:07:09,http://lorempixel.com/400/400/business,Ea velit maiores perspiciatis quod.,205,2019-5-28 07:06:16
312,99,4,18,2019-6-11 02:30:02,http://lorempixel.com/400/400/business,Quas maxime voluptatibus ipsum qui nesciunt ipsa ex et.,747,2019-8-25 00:46:53
313,23,1,6,2019-4-29 00:08:49,http://lorempixel.com/400/400/business,Velit quo illo voluptatum odio qui est architecto.,377,2019-6-26 02:46:55
314,21,4,18,2019-6-2 21:25:17,http://lorempixel.com/400/400/business,Quia libero qui aut ullam.,960,2019-9-19 20:58:52
315,8,2,13,2019-6-13 10:10:42,http://lorempixel.com/400/400/business,Aut temporibus ea dolorum ratione.,38,2019-9-3 06:14:04
316,94,1,2,2019-5-1 21:06:22,http://lorempixel.com/400/400/business,Deleniti quod voluptatibus nihil molestiae adipisci molestiae natus sit.,705,2019-6-7 08:21:19
317,50,5,22,2019-6-20 07:19:45,http://lorempixel.com/400/400/business,Occaecati corrupti eum libero.,412,2019-9-13 23:48:03
318,53,2,10,2019-4-17 09:36:09,http://lorempixel.com/400/400/business,Sed similique vel hic qui deserunt voluptate asperiores.,204,2019-9-12 05:33:04
319,48,5,23,2019-7-20 15:18:23,http://lorempixel.com/400/400/business,Voluptatem quia officiis exercitationem sint soluta.,937,2019-8-25 00:24:41
320,15,3,14,2019-7-22 21:39:43,http://lorempixel.com/400/400/business,Ut vel a facere delectus similique.,158,2019-9-16 13:34:00
321,34,3,14,2019-5-14 18:26:02,http://lorempixel.com/400/400/business,Modi beatae assumenda et nesciunt eaque sed minima eveniet voluptatem.,271,2019-8-11 12:10:26
322,9,1,4,2019-5-28 21:48:48,http://lorempixel.com/400/400/business,Natus accusantium officiis.,462,2019-6-25 08:03:53
323,56,5,23,2019-6-1 13:12:10,http://lorempixel.com/400/400/business,Voluptatum ex porro qui iure expedita qui rerum dicta et.,9,2019-7-30 15:02:52
324,65,2,9,2019-6-16 22:22:51,http://lorempixel.com/400/400/business,Ut dignissimos corporis enim.,106,2019-8-8 17:05:02
325,14,5,22,2019-5-13 07:10:35,http://lorempixel.com/400/400/business,Ex dolore laboriosam voluptatem occaecati veritatis nobis expedita voluptate.,17,2019-6-23 10:38:51
326,25,4,19,2019-6-24 21:30:41,http://lorempixel.com/400/400/business,Rerum eum iste earum et hic aut sunt.,948,2019-8-28 01:12:50
327,51,2,10,2019-4-16 08:31:11,http://lorempixel.com/400/400/business,Ut a corrupti omnis necessitatibus voluptas dolor molestias minus accusantium.,664,2019-6-12 01:56:51
328,81,4,18,2019-7-9 06:12:35,http://lorempixel.com/400/400/business,Iure dolorem non maiores harum.,12,2019-8-9 07:18:09
329,61,3,15,2019-6-9 06:16:24,http://lorempixel.com/400/400/business,Quia sed dolor error repellendus omnis.,184,2019-7-30 11:13:01
330,12,5,22,2019-4-23 00:04:53,http://lorempixel.com/400/400/business,Commodi quae repellendus veniam modi.,155,2019-4-28 10:03:31
331,3,3,17,2019-7-9 12:04:03,http://lorempixel.com/400/400/business,Consequuntur mollitia quis harum laborum velit.,246,2019-7-28 00:44:33
332,66,2,10,2019-4-3 00:21:47,http://lorempixel.com/400/400/business,Expedita fugit possimus doloremque quo voluptas.,292,2019-7-31 07:11:56
333,53,5,22,2019-6-25 11:03:34,http://lorempixel.com/400/400/business,Perspiciatis qui commodi consequuntur rem aut.,11,2019-8-10 13:56:58
334,69,1,1,2019-5-23 17:16:05,http://lorempixel.com/400/400/business,Dolores aut perferendis.,700,2019-9-26 03:03:40
335,26,1,5,2019-5-19 17:03:51,http://lorempixel.com/400/400/business,Ut commodi dolorum praesentium.,518,2019-8-26 04:37:22
336,7,2,9,2019-8-2 22:20:57,http://lorempixel.com/400/400/business,Minima dolorem cumque neque cumque non at voluptatibus at.,898,2019-8-14 06:16:41
337,55,1,7,2019-4-5 08:31:35,http://lorempixel.com/400/400/business,Sapiente voluptatibus beatae.,305,2019-9-12 03:58:15
338,75,2,9,2019-4-12 05:34:02,http://lorempixel.com/400/400/business,Repudiandae aperiam est ut.,298,2019-5-30 09:35:12
339,93,5,23,2019-5-3 18:47:16,http://lorempixel.com/400/400/business,Reprehenderit ex nihil ut consequatur.,238,2019-5-20 11:47:42
340,45,4,20,2019-5-28 03:31:23,http://lorempixel.com/400/400/business,Est libero neque explicabo aut est et quia dolorem.,92,2019-7-8 09:26:12
341,17,5,23,2019-5-24 19:48:41,http://lorempixel.com/400/400/business,Adipisci laboriosam sit perferendis et minima autem quis et.,593,2019-8-3 07:51:50
342,27,2,11,2019-4-19 00:29:53,http://lorempixel.com/400/400/business,Et id libero.,593,2019-5-15 21:00:35
343,10,1,3,2019-7-24 08:19:31,http://lorempixel.com/400/400/business,Ipsum iusto numquam inventore ut.,722,2019-9-2 19:30:03
344,57,2,11,2019-5-3 12:23:18,http://lorempixel.com/400/400/business,Deleniti ea labore eius.,954,2019-6-6 23:38:26
345,85,2,9,2019-7-6 16:47:03,http://lorempixel.com/400/400/business,Est expedita provident nulla omnis ea tempore odio harum.,496,2019-8-24 14:23:07
346,92,4,21,2019-4-14 11:29:44,http://lorempixel.com/400/400/business,Rerum aut necessitatibus sit autem amet.,771,2019-9-12 09:35:51
347,90,2,10,2019-6-27 15:06:41,http://lorempixel.com/400/400/business,Voluptates saepe eveniet.,220,2019-9-26 13:59:38
348,70,2,10,2019-6-9 18:41:26,http://lorempixel.com/400/400/business,Delectus tempora temporibus fugit voluptas laboriosam qui.,15,2019-8-17 21:21:20
349,6,4,18,2019-4-22 11:43:53,http://lorempixel.com/400/400/business,Id voluptatibus odit alias eveniet dolores facere nihil molestiae.,810,2019-8-22 23:36:06
350,47,4,21,2019-7-10 03:23:51,http://lorempixel.com/400/400/business,Et quis hic et veritatis sequi iste non enim et.,267,2019-7-11 18:09:39
351,89,2,13,2019-7-16 09:01:30,http://lorempixel.com/400/400/business,Dicta voluptas dolor ut quod laboriosam veniam.,617,2019-7-31 19:57:14
352,46,3,15,2019-6-8 02:04:04,http://lorempixel.com/400/400/business,Est dolor modi ab optio sunt dicta.,23,2019-7-19 06:16:11
353,53,4,20,2019-4-3 19:34:43,http://lorempixel.com/400/400/business,Dolore reprehenderit veritatis reprehenderit id error ut.,464,2019-7-13 15:22:05
354,78,2,13,2019-7-4 04:34:00,http://lorempixel.com/400/400/business,Rem nihil dicta voluptas aperiam aut dolores autem.,293,2019-7-22 10:50:07
355,79,3,17,2019-5-10 07:18:08,http://lorempixel.com/400/400/business,Blanditiis est iure qui.,228,2019-6-18 11:58:17
356,92,2,12,2019-7-9 13:34:24,http://lorempixel.com/400/400/business,Qui ut aut illum eos ipsam sed fugiat.,479,2019-8-29 19:14:13
357,16,2,9,2019-4-25 13:37:59,http://lorempixel.com/400/400/business,Qui animi ab.,406,2019-8-15 10:19:57
358,67,2,12,2019-7-23 16:07:35,http://lorempixel.com/400/400/business,Dolorum voluptatem beatae dolore eos quas quia.,498,2019-8-7 08:24:04
359,36,2,13,2019-4-4 18:23:01,http://lorempixel.com/400/400/business,Voluptate architecto labore quisquam.,624,2019-9-1 12:47:43
360,65,1,1,2019-4-10 01:22:36,http://lorempixel.com/400/400/business,Officia sapiente voluptatem quas sunt odit.,650,2019-7-29 20:03:32
361,80,1,7,2019-4-27 09:03:29,http://lorempixel.com/400/400/business,Omnis dolor vero dignissimos dolorem.,736,2019-9-7 08:51:31
362,25,1,8,2019-4-25 11:17:43,http://lorempixel.com/400/400/business,Nam quidem tenetur rem dolorem molestiae ut.,462,2019-8-22 23:11:35
363,86,2,11,2019-4-5 22:32:55,http://lorempixel.com/400/400/business,Quasi reiciendis asperiores quia.,179,2019-9-19 20:48:53
364,82,4,21,2019-6-17 18:53:43,http://lorempixel.com/400/400/business,Rem quos molestiae dicta ad ut.,476,2019-9-29 18:18:38
365,87,4,21,2019-6-29 08:05:10,http://lorempixel.com/400/400/business,Fugit rem nihil rerum sint sunt.,358,2019-7-8 18:51:13
366,82,3,15,2019-5-25 04:02:31,http://lorempixel.com/400/400/business,Repellendus saepe praesentium quasi.,265,2019-7-12 05:16:45
367,79,2,10,2019-7-24 12:51:01,http://lorempixel.com/400/400/business,Eius placeat architecto.,858,2019-9-10 21:42:22
368,53,3,14,2019-5-8 13:30:36,http://lorempixel.com/400/400/business,Soluta minus enim perspiciatis.,966,2019-7-19 15:35:13
369,57,3,15,2019-5-4 03:33:04,http://lorempixel.com/400/400/business,Saepe ullam ut aut asperiores magni quidem quaerat magni ipsum.,787,2019-6-3 18:46:15
370,97,3,16,2019-6-14 11:55:00,http://lorempixel.com/400/400/business,Consequatur minus iure aperiam nisi veritatis expedita.,870,2019-8-25 02:20:09
371,57,1,4,2019-7-21 08:43:04,http://lorempixel.com/400/400/business,Rem cumque esse consequuntur architecto veniam et dicta soluta.,787,2019-8-10 23:35:37
372,68,3,16,2019-5-11 10:18:48,http://lorempixel.com/400/400/business,Nihil tenetur repellendus.,77,2019-9-4 10:15:47
373,46,4,21,2019-6-11 18:36:19,http://lorempixel.com/400/400/business,Aut quia expedita blanditiis magni omnis aut.,365,2019-9-24 22:55:07
374,65,1,2,2019-4-18 05:50:02,http://lorempixel.com/400/400/business,Unde autem eos perspiciatis dolores exercitationem.,81,2019-7-24 12:53:12
375,74,3,17,2019-5-14 17:40:53,http://lorempixel.com/400/400/business,Sit recusandae officia vitae qui aut maxime.,699,2019-5-27 12:46:11
376,21,3,15,2019-6-22 19:50:07,http://lorempixel.com/400/400/business,Excepturi adipisci ad eaque delectus accusamus enim reiciendis veniam voluptates.,574,2019-9-15 11:15:37
377,87,3,16,2019-7-7 06:45:39,http://lorempixel.com/400/400/business,Et incidunt consequatur provident non consequatur ad.,484,2019-9-14 12:50:29
378,45,1,2,2019-7-13 21:10:05,http://lorempixel.com/400/400/business,Ratione odio a.,277,2019-8-19 10:16:58
379,64,5,23,2019-7-25 08:10:34,http://lorempixel.com/400/400/business,Quia excepturi veniam odio sunt.,266,2019-7-28 13:45:57
