id,roomId,category,subcategory,date,photoUrl,description,cost,dateFixed
435,62,3,17,Wed Apr 03 2019 18:26:05 GMT-0700 (PDT),http://lorempixel.com/400/400/business,Culpa corporis non non itaque perferendis commodi repellat voluptas.,813,Mon Apr 08 2019 15:13:10 GMT-0700 (PDT)
436,40,3,16,Sat May 04 2019 23:40:51 GMT-0700 (PDT),http://lorempixel.com/400/400/business,Eum mollitia soluta qui et laboriosam adipisci voluptas quia.,742,Thu May 30 2019 16:08:23 GMT-0700 (PDT)
437,58,2,11,Wed Apr 17 2019 22:32:18 GMT-0700 (PDT),http://lorempixel.com/400/400/business,Laudantium quae cupiditate ad in rerum autem.,514,Sun Aug 11 2019 16:46:34 GMT-0700 (PDT)
438,53,4,21,Wed Apr 03 2019 01:37:51 GMT-0700 (PDT),http://lorempixel.com/400/400/business,Ullam doloremque voluptate quisquam et laborum consequatur libero.,301,Mon May 20 2019 02:57:01 GMT-0700 (PDT)
439,95,2,11,Tue May 14 2019 03:15:33 GMT-0700 (PDT),http://lorempixel.com/400/400/business,Voluptas harum ea unde consequatur similique.,282,Thu May 23 2019 16:28:48 GMT-0700 (PDT)
440,73,4,19,Sun Jun 30 2019 23:49:01 GMT-0700 (PDT),http://lorempixel.com/400/400/business,Aut itaque minima modi provident vero.,131,Tue Jul 30 2019 23:45:41 GMT-0700 (PDT)
441,18,3,16,Wed Apr 03 2019 21:42:54 GMT-0700 (PDT),http://lorempixel.com/400/400/business,Et iste voluptatem dolorem sint et debitis delectus.,708,Sun Sep 15 2019 01:17:35 GMT-0700 (PDT)
442,89,4,21,Mon Apr 22 2019 01:01:01 GMT-0700 (PDT),http://lorempixel.com/400/400/business,Quisquam non accusantium maiores.,606,Sun May 19 2019 19:00:22 GMT-0700 (PDT)
443,75,1,1,Sat May 11 2019 07:49:56 GMT-0700 (PDT),http://lorempixel.com/400/400/business,Eum ut totam eos consectetur rerum doloremque.,896,Sun May 12 2019 02:16:14 GMT-0700 (PDT)
444,18,3,14,Wed Jul 17 2019 05:29:53 GMT-0700 (PDT),http://lorempixel.com/400/400/business,Perferendis qui ut numquam perferendis.,113,Fri Aug 16 2019 00:07:51 GMT-0700 (PDT)
445,45,4,19,Fri Apr 26 2019 11:53:11 GMT-0700 (PDT),http://lorempixel.com/400/400/business,Ut quis quia laboriosam dolore explicabo.,414,Fri May 17 2019 11:56:51 GMT-0700 (PDT)
446,32,4,18,Sat Apr 06 2019 08:10:31 GMT-0700 (PDT),http://lorempixel.com/400/400/business,Inventore et consequatur eum eum sit.,78,Sun Apr 28 2019 14:54:40 GMT-0700 (PDT)
447,55,4,20,Sun Apr 28 2019 15:52:56 GMT-0700 (PDT),http://lorempixel.com/400/400/business,Quo unde veniam minima nulla architecto optio earum tempora.,713,Fri Jun 07 2019 16:02:57 GMT-0700 (PDT)
448,7,4,19,Sun Jul 28 2019 08:14:35 GMT-0700 (PDT),http://lorempixel.com/400/400/business,Minima minima qui laborum.,457,Mon Sep 23 2019 16:47:42 GMT-0700 (PDT)
449,13,3,16,Sat Jun 15 2019 12:25:54 GMT-0700 (PDT),http://lorempixel.com/400/400/business,Aut quibusdam dolorem non facilis in porro ullam qui velit.,460,Mon Jul 22 2019 17:29:37 GMT-0700 (PDT)
450,68,4,21,Fri Apr 26 2019 23:15:50 GMT-0700 (PDT),http://lorempixel.com/400/400/business,Qui est quasi debitis est ipsum excepturi ad.,219,Wed Sep 04 2019 12:21:39 GMT-0700 (PDT)
451,69,2,12,Fri Jun 28 2019 00:53:37 GMT-0700 (PDT),http://lorempixel.com/400/400/business,Assumenda rerum dolorem ratione consequatur qui dolores quis.,338,Sun Sep 15 2019 05:36:09 GMT-0700 (PDT)
452,31,5,23,Sat May 25 2019 17:59:07 GMT-0700 (PDT),http://lorempixel.com/400/400/business,Suscipit ipsam atque.,396,Sun Aug 18 2019 02:14:59 GMT-0700 (PDT)
453,66,3,14,Sat May 11 2019 03:47:34 GMT-0700 (PDT),http://lorempixel.com/400/400/business,Quia possimus officiis eum molestias minus.,864,Sun Sep 29 2019 21:55:57 GMT-0700 (PDT)
454,26,4,18,Thu Jul 18 2019 08:18:40 GMT-0700 (PDT),http://lorempixel.com/400/400/business,Quis sint expedita quia cum temporibus.,104,Sun Aug 18 2019 03:10:24 GMT-0700 (PDT)
455,5,5,22,Mon Apr 15 2019 11:26:49 GMT-0700 (PDT),http://lorempixel.com/400/400/business,Consectetur aut sunt eos repellendus.,794,Wed Sep 25 2019 11:23:11 GMT-0700 (PDT)
456,96,3,15,Sat May 04 2019 08:21:11 GMT-0700 (PDT),http://lorempixel.com/400/400/business,Eos vero aut eaque rerum et dignissimos et illum aut.,569,Sat May 04 2019 23:54:13 GMT-0700 (PDT)
457,91,2,13,Thu May 30 2019 06:01:08 GMT-0700 (PDT),http://lorempixel.com/400/400/business,Ipsam et et officiis fuga earum vero provident iste.,755,Sat Aug 24 2019 08:32:30 GMT-0700 (PDT)
458,17,1,5,Sun Jul 21 2019 10:35:57 GMT-0700 (PDT),http://lorempixel.com/400/400/business,Quod aut iure quo non praesentium sit nam.,505,Wed Sep 04 2019 11:58:19 GMT-0700 (PDT)
459,12,1,7,Sat Jun 01 2019 19:17:51 GMT-0700 (PDT),http://lorempixel.com/400/400/business,Culpa et sit et velit eveniet iure perferendis.,309,Tue Sep 10 2019 04:50:24 GMT-0700 (PDT)
460,66,2,10,Tue Jul 23 2019 08:32:14 GMT-0700 (PDT),http://lorempixel.com/400/400/business,Voluptatem explicabo quo non consequuntur doloremque et ab.,715,Fri Sep 20 2019 02:14:49 GMT-0700 (PDT)
461,98,3,17,Wed Apr 17 2019 01:34:42 GMT-0700 (PDT),http://lorempixel.com/400/400/business,Ea exercitationem quia molestiae.,684,Wed Jun 05 2019 16:31:08 GMT-0700 (PDT)
462,92,5,23,Sat Jul 06 2019 20:22:56 GMT-0700 (PDT),http://lorempixel.com/400/400/business,Hic omnis veniam vitae quos earum laboriosam sint fugiat ut.,489,Mon Jul 15 2019 03:56:40 GMT-0700 (PDT)
463,73,5,22,Sat Jul 27 2019 09:15:28 GMT-0700 (PDT),http://lorempixel.com/400/400/business,Laudantium a temporibus beatae repudiandae sit.,776,Tue Aug 13 2019 16:57:27 GMT-0700 (PDT)
464,84,1,5,Wed May 15 2019 16:43:07 GMT-0700 (PDT),http://lorempixel.com/400/400/business,Fugit culpa vero.,82,Sun Sep 01 2019 16:56:24 GMT-0700 (PDT)
465,25,3,14,Thu Jul 04 2019 10:56:31 GMT-0700 (PDT),http://lorempixel.com/400/400/business,Enim accusamus quaerat autem.,97,Fri Aug 30 2019 14:23:34 GMT-0700 (PDT)
466,94,5,23,Tue Apr 30 2019 19:44:53 GMT-0700 (PDT),http://lorempixel.com/400/400/business,Qui aut cumque repudiandae quia est voluptatibus.,938,Thu Aug 22 2019 08:36:47 GMT-0700 (PDT)
467,32,3,17,Mon Apr 29 2019 07:41:55 GMT-0700 (PDT),http://lorempixel.com/400/400/business,Sint quia doloremque quia enim sed vero animi illum.,398,Fri May 03 2019 06:28:59 GMT-0700 (PDT)
468,29,1,2,Wed May 01 2019 10:17:05 GMT-0700 (PDT),http://lorempixel.com/400/400/business,Deleniti ipsa vel eius eum ducimus.,77,Tue Jun 18 2019 19:53:18 GMT-0700 (PDT)
469,93,4,20,Thu Aug 01 2019 14:27:57 GMT-0700 (PDT),http://lorempixel.com/400/400/business,Fuga molestiae molestias qui explicabo blanditiis alias ut quis.,88,Thu Sep 12 2019 00:52:05 GMT-0700 (PDT)
470,32,2,13,Wed Apr 03 2019 07:05:23 GMT-0700 (PDT),http://lorempixel.com/400/400/business,Sed quas ipsam.,32,Wed Sep 04 2019 22:01:51 GMT-0700 (PDT)
471,26,5,23,Mon Jun 24 2019 12:40:05 GMT-0700 (PDT),http://lorempixel.com/400/400/business,Eos quis aut voluptatem doloribus et.,265,Mon Jul 29 2019 01:56:25 GMT-0700 (PDT)
472,56,3,16,Wed Jul 03 2019 22:41:47 GMT-0700 (PDT),http://lorempixel.com/400/400/business,Nulla magnam et dignissimos necessitatibus possimus laudantium.,331,Sun Sep 08 2019 06:02:56 GMT-0700 (PDT)
473,54,1,3,Wed Jul 03 2019 18:41:01 GMT-0700 (PDT),http://lorempixel.com/400/400/business,Amet quo quam soluta dolorem atque.,625,Fri Aug 16 2019 10:04:27 GMT-0700 (PDT)
474,20,5,23,Fri May 24 2019 19:24:29 GMT-0700 (PDT),http://lorempixel.com/400/400/business,Error aut adipisci deleniti labore beatae fuga ut non.,850,Sat Sep 21 2019 23:38:37 GMT-0700 (PDT)
475,30,2,9,Sat Apr 20 2019 12:16:34 GMT-0700 (PDT),http://lorempixel.com/400/400/business,Ex ducimus facere rerum tenetur non dolor et ut dignissimos.,664,Fri May 03 2019 05:42:14 GMT-0700 (PDT)
476,76,4,18,Tue Jul 23 2019 21:32:55 GMT-0700 (PDT),http://lorempixel.com/400/400/business,Libero inventore ab est libero architecto minima nisi dicta.,968,Sun Sep 15 2019 08:36:02 GMT-0700 (PDT)
477,14,4,18,Sat Jul 27 2019 20:07:31 GMT-0700 (PDT),http://lorempixel.com/400/400/business,Quam eligendi aut commodi ipsum non.,842,Thu Aug 08 2019 11:24:46 GMT-0700 (PDT)
478,38,4,21,Fri Jul 19 2019 16:42:22 GMT-0700 (PDT),http://lorempixel.com/400/400/business,Atque esse sit et occaecati optio quis.,868,Tue Sep 10 2019 23:36:56 GMT-0700 (PDT)
479,88,1,3,Mon Apr 15 2019 10:29:09 GMT-0700 (PDT),http://lorempixel.com/400/400/business,Tenetur maiores non culpa ipsum enim non delectus autem.,214,Fri Aug 09 2019 19:37:37 GMT-0700 (PDT)
480,40,3,17,Mon Apr 29 2019 14:21:24 GMT-0700 (PDT),http://lorempixel.com/400/400/business,Commodi et quia adipisci temporibus.,663,Wed Aug 14 2019 08:02:57 GMT-0700 (PDT)
481,15,3,16,Tue Jul 30 2019 04:00:59 GMT-0700 (PDT),http://lorempixel.com/400/400/business,Deleniti tempora eos ut.,113,Wed Sep 04 2019 07:41:33 GMT-0700 (PDT)
482,41,4,19,Sat Jul 06 2019 12:16:00 GMT-0700 (PDT),http://lorempixel.com/400/400/business,Cum et soluta est.,852,Mon Sep 02 2019 08:59:37 GMT-0700 (PDT)
483,84,2,10,Thu May 09 2019 16:52:27 GMT-0700 (PDT),http://lorempixel.com/400/400/business,Inventore numquam id voluptatem unde hic ducimus facilis rem.,623,Thu Jul 04 2019 13:03:46 GMT-0700 (PDT)
484,56,4,19,Tue Jul 16 2019 03:54:40 GMT-0700 (PDT),http://lorempixel.com/400/400/business,Et nulla delectus odio aliquam ut quae fugiat.,814,Mon Sep 16 2019 21:15:29 GMT-0700 (PDT)
485,5,2,10,Mon May 13 2019 02:54:15 GMT-0700 (PDT),http://lorempixel.com/400/400/business,Expedita placeat eius aspernatur molestiae asperiores quia corporis.,890,Thu Sep 19 2019 04:23:20 GMT-0700 (PDT)
486,46,1,1,Fri May 31 2019 03:59:09 GMT-0700 (PDT),http://lorempixel.com/400/400/business,Odit iste quae commodi id quisquam.,464,Wed Jul 31 2019 10:47:52 GMT-0700 (PDT)
487,88,2,12,Tue Jul 30 2019 12:08:15 GMT-0700 (PDT),http://lorempixel.com/400/400/business,Quo incidunt quibusdam in voluptates.,514,Wed Sep 04 2019 23:10:20 GMT-0700 (PDT)
488,97,4,20,Fri May 10 2019 12:45:11 GMT-0700 (PDT),http://lorempixel.com/400/400/business,Harum sit sint vero aperiam et modi laborum.,470,Fri Aug 23 2019 20:50:10 GMT-0700 (PDT)
489,84,3,14,Mon Jul 22 2019 21:45:41 GMT-0700 (PDT),http://lorempixel.com/400/400/business,Voluptatem et maiores commodi ea ipsum recusandae fugit amet.,412,Thu Aug 01 2019 09:52:43 GMT-0700 (PDT)
490,52,5,23,Wed Apr 24 2019 04:34:44 GMT-0700 (PDT),http://lorempixel.com/400/400/business,Assumenda facilis voluptatem quibusdam qui laborum fuga facere voluptas.,343,Sun May 19 2019 18:59:59 GMT-0700 (PDT)
491,8,3,16,Thu May 09 2019 12:02:46 GMT-0700 (PDT),http://lorempixel.com/400/400/business,Et ipsum molestiae fugit sunt totam qui.,950,Sat Sep 14 2019 08:38:04 GMT-0700 (PDT)
492,98,2,13,Sat Jul 27 2019 05:59:20 GMT-0700 (PDT),http://lorempixel.com/400/400/business,Rerum nihil aut velit omnis eos nihil at distinctio.,472,Thu Sep 12 2019 16:23:58 GMT-0700 (PDT)
493,45,2,9,Wed Jul 31 2019 18:18:36 GMT-0700 (PDT),http://lorempixel.com/400/400/business,Quis laboriosam consequuntur quo.,165,Tue Sep 03 2019 03:36:23 GMT-0700 (PDT)
494,36,4,20,Sat Jul 20 2019 02:48:50 GMT-0700 (PDT),http://lorempixel.com/400/400/business,Nisi nulla laboriosam aut assumenda voluptate ea.,20,Fri Aug 09 2019 21:31:17 GMT-0700 (PDT)
495,31,2,12,Sat Jul 20 2019 20:07:16 GMT-0700 (PDT),http://lorempixel.com/400/400/business,Suscipit ea vel.,53,Sun Aug 25 2019 00:39:35 GMT-0700 (PDT)
496,71,4,18,Tue Jul 30 2019 15:01:30 GMT-0700 (PDT),http://lorempixel.com/400/400/business,Rerum delectus mollitia ut beatae labore modi nemo.,430,Wed Sep 04 2019 19:08:41 GMT-0700 (PDT)
497,25,4,19,Wed Apr 10 2019 07:36:19 GMT-0700 (PDT),http://lorempixel.com/400/400/business,Et iste provident reprehenderit explicabo odit vero.,798,Thu May 23 2019 12:02:36 GMT-0700 (PDT)
498,19,4,18,Thu Aug 01 2019 23:19:24 GMT-0700 (PDT),http://lorempixel.com/400/400/business,Voluptatem provident ut aut hic.,250,Fri Sep 20 2019 01:47:26 GMT-0700 (PDT)
499,97,2,12,Mon Jun 03 2019 05:47:28 GMT-0700 (PDT),http://lorempixel.com/400/400/business,Sed soluta illum.,620,Fri Aug 02 2019 03:15:43 GMT-0700 (PDT)
500,58,3,15,Mon Jun 17 2019 18:36:37 GMT-0700 (PDT),http://lorempixel.com/400/400/business,Fuga nostrum consequatur amet qui et.,680,Wed Jun 19 2019 20:12:14 GMT-0700 (PDT)
501,84,4,20,Thu May 30 2019 17:11:29 GMT-0700 (PDT),http://lorempixel.com/400/400/business,Tempora voluptatum magni eaque aut rerum.,401,Fri Aug 30 2019 18:47:26 GMT-0700 (PDT)
502,40,3,16,Tue Jul 16 2019 20:06:42 GMT-0700 (PDT),http://lorempixel.com/400/400/business,Ea soluta natus illum atque laboriosam eos repellat autem.,853,Sat Sep 07 2019 04:51:33 GMT-0700 (PDT)
503,53,4,20,Tue Jun 11 2019 14:15:22 GMT-0700 (PDT),http://lorempixel.com/400/400/business,Enim tempore cumque velit nobis ab repellat qui.,910,Mon Aug 26 2019 07:23:26 GMT-0700 (PDT)
504,75,4,19,Sun Apr 14 2019 11:00:23 GMT-0700 (PDT),http://lorempixel.com/400/400/business,Eius consectetur qui in sit aut rerum ut inventore aliquam.,283,Tue Jul 02 2019 13:07:41 GMT-0700 (PDT)
505,100,5,22,Sun Apr 07 2019 20:47:47 GMT-0700 (PDT),http://lorempixel.com/400/400/business,Sequi non impedit quo.,565,Mon Apr 15 2019 11:58:42 GMT-0700 (PDT)
506,47,3,16,Sun Jun 23 2019 03:33:09 GMT-0700 (PDT),http://lorempixel.com/400/400/business,Eos deserunt eius temporibus vitae illum eaque.,338,Wed Jul 10 2019 08:42:52 GMT-0700 (PDT)
507,82,3,17,Tue Apr 30 2019 00:14:53 GMT-0700 (PDT),http://lorempixel.com/400/400/business,Quaerat quia doloribus vel.,482,Sun Sep 15 2019 12:17:35 GMT-0700 (PDT)
508,58,2,13,Tue Apr 09 2019 13:05:05 GMT-0700 (PDT),http://lorempixel.com/400/400/business,Voluptatem expedita dolores nihil expedita veniam.,517,Wed Apr 10 2019 23:22:25 GMT-0700 (PDT)
509,62,2,11,Sun Jun 02 2019 14:49:10 GMT-0700 (PDT),http://lorempixel.com/400/400/business,Qui commodi neque qui laborum illo maiores.,133,Thu Aug 22 2019 11:57:04 GMT-0700 (PDT)
510,89,3,17,Mon Jun 17 2019 16:13:55 GMT-0700 (PDT),http://lorempixel.com/400/400/business,Aut laboriosam distinctio possimus.,203,Tue Jul 16 2019 06:19:52 GMT-0700 (PDT)
511,91,2,11,Mon Jun 10 2019 05:31:13 GMT-0700 (PDT),http://lorempixel.com/400/400/business,Vel qui voluptas voluptas quasi commodi exercitationem id.,525,Sat Sep 28 2019 14:00:08 GMT-0700 (PDT)
512,13,1,2,Tue Jul 16 2019 15:09:10 GMT-0700 (PDT),http://lorempixel.com/400/400/business,Molestiae est voluptatibus molestias in sunt molestiae atque ut dolores.,697,Sat Aug 24 2019 16:34:47 GMT-0700 (PDT)
513,70,2,12,Fri Jun 07 2019 11:47:44 GMT-0700 (PDT),http://lorempixel.com/400/400/business,Et dolorum quia accusamus illum delectus officiis voluptatem.,288,Sat Jun 29 2019 19:27:09 GMT-0700 (PDT)
514,22,3,17,Wed Apr 24 2019 16:40:14 GMT-0700 (PDT),http://lorempixel.com/400/400/business,Aspernatur maxime dolores quia aut alias dolorum unde laborum modi.,555,Tue May 07 2019 12:51:59 GMT-0700 (PDT)
515,53,5,22,Wed Apr 10 2019 12:50:08 GMT-0700 (PDT),http://lorempixel.com/400/400/business,Laudantium deleniti qui qui beatae et et at fugiat voluptas.,80,Sun Jul 28 2019 08:19:49 GMT-0700 (PDT)
516,50,4,20,Sun Jul 28 2019 20:15:30 GMT-0700 (PDT),http://lorempixel.com/400/400/business,Nostrum soluta ea corrupti ipsa repellat voluptatem exercitationem hic.,104,Wed Sep 04 2019 13:11:34 GMT-0700 (PDT)
517,4,4,18,Fri Jul 19 2019 16:31:29 GMT-0700 (PDT),http://lorempixel.com/400/400/business,Et est corrupti qui qui eum voluptas placeat.,645,Fri Aug 02 2019 18:58:52 GMT-0700 (PDT)
518,40,4,19,Sun Apr 14 2019 20:48:18 GMT-0700 (PDT),http://lorempixel.com/400/400/business,Ut et eligendi laudantium et assumenda eum sequi facilis.,180,Tue Jul 09 2019 16:40:10 GMT-0700 (PDT)
519,52,4,18,Thu May 16 2019 22:56:12 GMT-0700 (PDT),http://lorempixel.com/400/400/business,Laborum veniam ea.,817,Sat Jul 27 2019 11:24:41 GMT-0700 (PDT)
520,39,2,9,Wed Jun 05 2019 14:16:40 GMT-0700 (PDT),http://lorempixel.com/400/400/business,Odit qui cumque dolor incidunt et architecto.,122,Thu Aug 08 2019 09:50:42 GMT-0700 (PDT)
521,40,1,6,Wed May 29 2019 17:45:02 GMT-0700 (PDT),http://lorempixel.com/400/400/business,Iure autem non suscipit impedit dolor.,180,Mon Jun 03 2019 08:17:10 GMT-0700 (PDT)
522,73,5,22,Sun Apr 21 2019 13:07:09 GMT-0700 (PDT),http://lorempixel.com/400/400/business,Repellendus qui dignissimos consequuntur.,376,Sun Jun 23 2019 20:10:17 GMT-0700 (PDT)
523,7,2,13,Tue May 14 2019 18:20:14 GMT-0700 (PDT),http://lorempixel.com/400/400/business,Quae ut placeat nihil.,116,Fri Aug 09 2019 22:44:02 GMT-0700 (PDT)
524,69,1,4,Mon Apr 22 2019 16:01:11 GMT-0700 (PDT),http://lorempixel.com/400/400/business,Placeat harum unde suscipit.,258,Sat Jun 29 2019 12:03:31 GMT-0700 (PDT)
525,52,5,23,Tue Jul 23 2019 00:51:09 GMT-0700 (PDT),http://lorempixel.com/400/400/business,Et earum at.,677,Fri Sep 06 2019 22:05:50 GMT-0700 (PDT)
526,83,2,10,Tue Jun 04 2019 15:43:59 GMT-0700 (PDT),http://lorempixel.com/400/400/business,Quam suscipit consequatur est aut animi illo sit sint.,497,Wed Aug 07 2019 16:51:14 GMT-0700 (PDT)
527,32,3,14,Thu May 09 2019 14:24:02 GMT-0700 (PDT),http://lorempixel.com/400/400/business,Id ut autem.,135,Mon Aug 05 2019 02:06:41 GMT-0700 (PDT)
528,100,4,18,Wed Apr 10 2019 06:10:25 GMT-0700 (PDT),http://lorempixel.com/400/400/business,Fugiat quo est.,734,Thu Sep 05 2019 01:20:12 GMT-0700 (PDT)
529,62,4,19,Tue Jul 30 2019 08:06:30 GMT-0700 (PDT),http://lorempixel.com/400/400/business,Quisquam rem repellat quod et occaecati sit illo.,338,Tue Aug 27 2019 07:46:42 GMT-0700 (PDT)
530,61,1,3,Fri Apr 12 2019 04:57:16 GMT-0700 (PDT),http://lorempixel.com/400/400/business,Harum assumenda id suscipit aperiam qui ea consequuntur ut quibusdam.,716,Wed May 29 2019 03:29:39 GMT-0700 (PDT)
531,10,1,4,Wed May 29 2019 10:34:32 GMT-0700 (PDT),http://lorempixel.com/400/400/business,Et cupiditate voluptatem minima sit.,634,Fri Sep 06 2019 15:22:36 GMT-0700 (PDT)
532,39,2,10,Thu Apr 11 2019 19:42:15 GMT-0700 (PDT),http://lorempixel.com/400/400/business,Hic consectetur libero accusantium ut animi.,820,Mon Jun 17 2019 15:57:34 GMT-0700 (PDT)
533,80,3,14,Sun May 19 2019 04:46:46 GMT-0700 (PDT),http://lorempixel.com/400/400/business,Totam quia culpa quam magnam necessitatibus quis dolore.,3,Sat Jun 22 2019 17:18:42 GMT-0700 (PDT)
534,4,1,2,Sat Jul 06 2019 00:03:06 GMT-0700 (PDT),http://lorempixel.com/400/400/business,Voluptate quae repellendus voluptatem.,59,Mon Sep 23 2019 15:59:39 GMT-0700 (PDT)
535,92,5,23,Mon Jun 10 2019 14:02:15 GMT-0700 (PDT),http://lorempixel.com/400/400/business,Adipisci sequi quod sed dolores.,369,Fri Aug 16 2019 00:44:52 GMT-0700 (PDT)
536,52,2,12,Tue May 07 2019 06:47:13 GMT-0700 (PDT),http://lorempixel.com/400/400/business,Voluptas quo dolorem commodi.,483,Mon Aug 19 2019 22:45:14 GMT-0700 (PDT)
537,52,5,23,Sun Apr 07 2019 21:17:49 GMT-0700 (PDT),http://lorempixel.com/400/400/business,Facere dolorem quod veniam.,868,Thu Jun 27 2019 10:42:03 GMT-0700 (PDT)
538,28,2,13,Sun Jun 16 2019 03:50:10 GMT-0700 (PDT),http://lorempixel.com/400/400/business,Impedit praesentium eius.,574,Mon Jul 22 2019 07:33:11 GMT-0700 (PDT)
539,77,5,23,Tue May 07 2019 16:00:54 GMT-0700 (PDT),http://lorempixel.com/400/400/business,Sunt omnis ut quas.,390,Fri May 17 2019 08:23:00 GMT-0700 (PDT)
540,17,3,15,Tue Apr 23 2019 08:27:33 GMT-0700 (PDT),http://lorempixel.com/400/400/business,Voluptatem molestiae aut eveniet consequatur alias quia sed illum.,286,Mon Sep 23 2019 23:08:46 GMT-0700 (PDT)
541,57,1,4,Mon Apr 22 2019 08:17:06 GMT-0700 (PDT),http://lorempixel.com/400/400/business,Sit et voluptatem.,113,Fri Jun 14 2019 19:38:03 GMT-0700 (PDT)
542,21,4,21,Sat Aug 03 2019 03:59:24 GMT-0700 (PDT),http://lorempixel.com/400/400/business,Quam rerum sed minima voluptas rerum atque fugiat.,979,Wed Aug 28 2019 05:06:42 GMT-0700 (PDT)
543,97,1,1,Mon Apr 29 2019 12:55:46 GMT-0700 (PDT),http://lorempixel.com/400/400/business,Optio esse aut a rerum velit sit.,554,Thu Jul 11 2019 18:20:12 GMT-0700 (PDT)
544,49,4,21,Sun Apr 21 2019 02:03:55 GMT-0700 (PDT),http://lorempixel.com/400/400/business,Ea commodi optio qui sapiente.,474,Sun Jul 21 2019 16:00:50 GMT-0700 (PDT)
545,87,5,22,Tue May 14 2019 08:39:09 GMT-0700 (PDT),http://lorempixel.com/400/400/business,Perferendis quae quasi sunt et nemo perferendis.,274,Mon Jul 01 2019 19:25:21 GMT-0700 (PDT)
546,61,3,14,Mon Jul 15 2019 23:14:07 GMT-0700 (PDT),http://lorempixel.com/400/400/business,Odit non maiores architecto ut.,965,Thu Sep 05 2019 21:21:57 GMT-0700 (PDT)
547,91,1,7,Wed Apr 03 2019 18:01:56 GMT-0700 (PDT),http://lorempixel.com/400/400/business,Repellendus tempora est ipsam sequi aliquid facere qui at.,933,Wed May 01 2019 18:07:31 GMT-0700 (PDT)
548,70,1,3,Fri May 31 2019 23:32:29 GMT-0700 (PDT),http://lorempixel.com/400/400/business,Cupiditate voluptatem cupiditate tempore aperiam omnis et pariatur necessitatibus.,518,Sat Sep 21 2019 05:31:48 GMT-0700 (PDT)
549,88,1,3,Fri Jun 28 2019 05:42:55 GMT-0700 (PDT),http://lorempixel.com/400/400/business,Quas architecto aut.,632,Mon Jul 15 2019 04:50:52 GMT-0700 (PDT)
550,61,4,21,Sat Apr 27 2019 17:50:28 GMT-0700 (PDT),http://lorempixel.com/400/400/business,Aut ab ut atque qui voluptas a.,313,Wed Aug 07 2019 14:58:41 GMT-0700 (PDT)
551,97,1,6,Thu Apr 04 2019 06:31:10 GMT-0700 (PDT),http://lorempixel.com/400/400/business,Consequatur sed expedita aut consequuntur neque ab est in.,530,Sat Aug 10 2019 11:19:37 GMT-0700 (PDT)
552,24,3,17,Wed Jun 26 2019 22:00:18 GMT-0700 (PDT),http://lorempixel.com/400/400/business,Consectetur deleniti facilis dolore tenetur enim facilis necessitatibus distinctio et.,608,Wed Aug 07 2019 09:05:14 GMT-0700 (PDT)
553,40,1,5,Tue Jul 02 2019 18:29:16 GMT-0700 (PDT),http://lorempixel.com/400/400/business,Suscipit veniam omnis neque et.,305,Thu Jul 04 2019 20:14:43 GMT-0700 (PDT)
554,5,3,16,Fri Jun 07 2019 21:38:00 GMT-0700 (PDT),http://lorempixel.com/400/400/business,Voluptatum accusamus eum et sunt eos.,620,Thu Sep 12 2019 02:19:26 GMT-0700 (PDT)
555,67,4,20,Sun May 26 2019 07:46:13 GMT-0700 (PDT),http://lorempixel.com/400/400/business,Aliquid ullam esse.,484,Wed Sep 11 2019 03:17:29 GMT-0700 (PDT)
556,10,3,14,Sun Jun 30 2019 12:24:12 GMT-0700 (PDT),http://lorempixel.com/400/400/business,Sed pariatur exercitationem corporis.,523,Wed Sep 11 2019 14:52:12 GMT-0700 (PDT)
557,27,4,19,Mon May 20 2019 22:51:40 GMT-0700 (PDT),http://lorempixel.com/400/400/business,Ut tenetur sed quae ut ex optio.,317,Tue Jul 16 2019 09:07:19 GMT-0700 (PDT)
558,30,4,18,Tue May 21 2019 20:16:25 GMT-0700 (PDT),http://lorempixel.com/400/400/business,Autem velit distinctio repellat neque autem excepturi nulla numquam impedit.,617,Thu Jun 20 2019 08:21:36 GMT-0700 (PDT)
559,48,2,11,Tue Jun 11 2019 10:23:36 GMT-0700 (PDT),http://lorempixel.com/400/400/business,Odio odio voluptas quam ut ratione quia.,404,Mon Aug 12 2019 03:38:48 GMT-0700 (PDT)
560,100,1,2,Wed Jun 19 2019 08:10:59 GMT-0700 (PDT),http://lorempixel.com/400/400/business,Alias odit enim a beatae fugit voluptatem.,615,Sat Sep 07 2019 03:07:46 GMT-0700 (PDT)
561,53,3,15,Sun Jun 23 2019 09:00:42 GMT-0700 (PDT),http://lorempixel.com/400/400/business,Quos quis id nam cumque.,798,Sun Jul 14 2019 06:15:09 GMT-0700 (PDT)
562,78,1,8,Fri Jun 21 2019 18:53:07 GMT-0700 (PDT),http://lorempixel.com/400/400/business,Aut officia qui.,579,Wed Sep 18 2019 21:07:49 GMT-0700 (PDT)
563,64,3,15,Fri Aug 02 2019 16:37:55 GMT-0700 (PDT),http://lorempixel.com/400/400/business,Quae et vel incidunt nihil molestiae.,54,Fri Sep 20 2019 12:34:44 GMT-0700 (PDT)
564,76,1,5,Tue Apr 16 2019 10:35:27 GMT-0700 (PDT),http://lorempixel.com/400/400/business,Ut aliquam nostrum voluptas aliquam voluptatum.,686,Wed May 22 2019 12:01:12 GMT-0700 (PDT)
565,87,2,10,Sat Jul 13 2019 12:22:20 GMT-0700 (PDT),http://lorempixel.com/400/400/business,Et corporis est et iste voluptatem eaque dolores quos.,336,Sun Jul 14 2019 14:21:48 GMT-0700 (PDT)
566,17,1,5,Thu Jun 06 2019 19:12:40 GMT-0700 (PDT),http://lorempixel.com/400/400/business,Reprehenderit et non et sit nulla consequuntur unde sit quidem.,949,Fri Aug 30 2019 10:01:36 GMT-0700 (PDT)
567,46,5,23,Fri Jul 26 2019 19:01:19 GMT-0700 (PDT),http://lorempixel.com/400/400/business,Omnis harum delectus inventore iste est.,921,Sat Sep 21 2019 05:38:13 GMT-0700 (PDT)
568,93,1,7,Mon Apr 01 2019 01:35:42 GMT-0700 (PDT),http://lorempixel.com/400/400/business,Cum sunt pariatur ad.,249,Wed Jul 10 2019 13:34:01 GMT-0700 (PDT)
569,34,1,2,Sat Jun 15 2019 16:12:13 GMT-0700 (PDT),http://lorempixel.com/400/400/business,Voluptate quisquam perspiciatis iste voluptas culpa explicabo deleniti optio.,895,Wed Aug 28 2019 14:13:32 GMT-0700 (PDT)
570,39,5,23,Mon Jun 17 2019 12:05:35 GMT-0700 (PDT),http://lorempixel.com/400/400/business,Aut minima maxime qui.,262,Thu Sep 19 2019 20:07:10 GMT-0700 (PDT)
571,73,3,15,Mon Apr 22 2019 07:19:38 GMT-0700 (PDT),http://lorempixel.com/400/400/business,Repellendus accusantium vitae.,744,Fri Jul 12 2019 05:45:21 GMT-0700 (PDT)
572,61,5,23,Wed May 15 2019 13:05:01 GMT-0700 (PDT),http://lorempixel.com/400/400/business,Omnis iusto aperiam nemo qui nesciunt sunt ratione libero.,308,Wed Aug 14 2019 06:05:36 GMT-0700 (PDT)
573,98,2,10,Sat Apr 06 2019 22:00:13 GMT-0700 (PDT),http://lorempixel.com/400/400/business,Qui non velit.,234,Sun Apr 21 2019 10:56:39 GMT-0700 (PDT)
574,23,5,22,Mon Jul 29 2019 14:43:00 GMT-0700 (PDT),http://lorempixel.com/400/400/business,Eveniet dolores et esse sed culpa hic omnis.,586,Wed Aug 21 2019 04:54:33 GMT-0700 (PDT)
575,22,5,23,Mon Jul 22 2019 19:21:06 GMT-0700 (PDT),http://lorempixel.com/400/400/business,Porro et ex ea ut omnis.,993,Mon Aug 26 2019 03:59:40 GMT-0700 (PDT)
576,10,3,16,Sun Jun 23 2019 10:07:45 GMT-0700 (PDT),http://lorempixel.com/400/400/business,Commodi qui ipsum et inventore culpa sint deleniti aut impedit.,246,Sat Sep 21 2019 04:23:56 GMT-0700 (PDT)
577,76,3,14,Thu Jul 25 2019 23:50:41 GMT-0700 (PDT),http://lorempixel.com/400/400/business,Libero sint ducimus laudantium enim et porro culpa non.,204,Mon Jul 29 2019 11:33:49 GMT-0700 (PDT)
578,8,2,9,Sat Apr 20 2019 00:37:01 GMT-0700 (PDT),http://lorempixel.com/400/400/business,Ratione sit eveniet voluptas dolorem asperiores sed sit deserunt maxime.,866,Sat Sep 21 2019 16:46:33 GMT-0700 (PDT)
