id,room_id,category,subcategory,date,photoUrl,description,cost,dateFixed
759,58,1,1,2019-6-5 09:48:05,http://lorempixel.com/400/400/business,Officia aperiam earum voluptatem sapiente possimus.,335,2019-7-7 05:47:43
760,84,5,23,2019-7-29 04:57:50,http://lorempixel.com/400/400/business,A accusantium in odio necessitatibus quia nobis praesentium.,654,2019-9-1 01:06:19
761,13,5,22,2019-4-14 19:35:38,http://lorempixel.com/400/400/business,Deserunt quo est et nulla quia in voluptas nihil vel.,941,2019-4-29 05:33:43
762,51,4,19,2019-6-21 12:20:17,http://lorempixel.com/400/400/business,Dolor ipsum sit recusandae incidunt.,221,2019-8-21 06:52:20
763,83,4,18,2019-6-30 03:49:27,http://lorempixel.com/400/400/business,Alias quia occaecati.,480,2019-8-29 12:03:05
764,82,3,17,2019-6-7 23:23:24,http://lorempixel.com/400/400/business,Rerum quia hic et iure a magni dolore ut doloremque.,710,2019-6-28 03:12:13
765,18,4,18,2019-7-6 07:55:31,http://lorempixel.com/400/400/business,Et qui praesentium dolorum neque.,596,2019-8-19 03:38:46
766,50,1,2,2019-7-2 02:00:20,http://lorempixel.com/400/400/business,Quas rem sapiente.,18,2019-8-20 20:31:14
767,92,2,9,2019-4-17 22:20:58,http://lorempixel.com/400/400/business,Voluptas qui earum voluptatem.,245,2019-8-16 20:41:07
768,94,1,2,2019-6-10 17:04:00,http://lorempixel.com/400/400/business,A illo et accusamus rem blanditiis sapiente exercitationem aspernatur sapiente.,88,2019-8-25 08:07:06
769,83,1,1,2019-6-2 00:11:02,http://lorempixel.com/400/400/business,Minima error et perspiciatis optio aut et eligendi dolores aut.,275,2019-7-7 05:38:13
770,31,4,21,2019-4-25 20:53:46,http://lorempixel.com/400/400/business,Enim ratione est.,548,2019-5-26 00:22:47
771,19,4,19,2019-6-7 23:03:37,http://lorempixel.com/400/400/business,Fugiat fugit aut hic omnis dicta ut repellat.,729,2019-9-11 03:43:17
772,54,3,17,2019-7-12 12:21:47,http://lorempixel.com/400/400/business,Ad ducimus repudiandae alias et maiores veniam est ratione.,675,2019-7-22 01:02:17
773,58,1,8,2019-5-29 14:02:11,http://lorempixel.com/400/400/business,Accusamus quos qui quibusdam placeat qui quae optio animi.,555,2019-7-21 20:54:21
774,2,4,18,2019-6-13 08:22:20,http://lorempixel.com/400/400/business,Distinctio debitis sunt et debitis atque nobis quod porro.,624,2019-8-2 06:57:48
775,16,5,22,2019-7-29 22:48:55,http://lorempixel.com/400/400/business,Corporis et voluptatibus sequi temporibus optio aut vel aut maiores.,449,2019-8-29 18:10:32
776,51,5,22,2019-5-2 02:03:19,http://lorempixel.com/400/400/business,Est veniam eius cum molestiae eum mollitia id.,376,2019-5-28 06:52:19
777,50,4,21,2019-7-21 21:42:07,http://lorempixel.com/400/400/business,At atque cumque atque fuga sit.,258,2019-9-26 14:18:07
778,7,1,8,2019-5-19 15:23:02,http://lorempixel.com/400/400/business,Quod harum perferendis quasi.,518,2019-5-30 18:21:38
779,25,5,23,2019-6-17 05:23:04,http://lorempixel.com/400/400/business,Doloremque omnis accusamus dolor in accusamus error.,998,2019-8-4 07:01:33
780,59,2,13,2019-4-13 15:14:09,http://lorempixel.com/400/400/business,Quia dolor qui nesciunt qui amet odit.,518,2019-6-16 22:56:38
781,92,5,22,2019-6-26 14:09:23,http://lorempixel.com/400/400/business,Est nisi numquam voluptatem eum fuga eaque assumenda voluptas.,404,2019-8-30 14:42:35
782,66,5,22,2019-7-29 03:58:10,http://lorempixel.com/400/400/business,Quos eos molestias.,127,2019-8-14 22:32:34
783,35,4,18,2019-7-1 18:35:47,http://lorempixel.com/400/400/business,Autem iste ut temporibus eum aspernatur quibusdam eos neque.,123,2019-7-26 08:44:33
784,48,1,1,2019-4-27 21:52:27,http://lorempixel.com/400/400/business,Ullam dolorem aut et.,389,2019-9-4 02:35:25
785,83,3,14,2019-6-2 17:14:52,http://lorempixel.com/400/400/business,Qui accusamus quia eveniet nobis.,909,2019-8-6 13:24:14
786,90,1,5,2019-7-23 18:09:17,http://lorempixel.com/400/400/business,Id ratione omnis iure veritatis rerum iusto ipsa.,569,2019-7-26 22:18:15
787,36,5,22,2019-4-5 11:46:15,http://lorempixel.com/400/400/business,Consequatur ad aut ea perferendis enim.,433,2019-7-31 16:16:03
788,44,5,23,2019-7-24 18:25:27,http://lorempixel.com/400/400/business,Corrupti veniam quo dolorem delectus.,826,2019-9-6 08:27:17
789,4,1,2,2019-5-26 15:35:43,http://lorempixel.com/400/400/business,Qui qui dolorem odio nulla corrupti quidem.,952,2019-7-5 10:18:30
790,34,3,16,2019-6-4 12:09:41,http://lorempixel.com/400/400/business,Tempore est minus expedita.,13,2019-6-10 21:39:59
791,37,4,19,2019-4-25 01:18:00,http://lorempixel.com/400/400/business,Rerum in animi magnam et ducimus velit earum et temporibus.,700,2019-7-7 08:57:36
792,55,3,15,2019-6-12 19:27:04,http://lorempixel.com/400/400/business,Incidunt quae neque architecto quia tempore tempora voluptates dicta.,179,2019-8-19 20:16:32
793,55,2,13,2019-7-10 03:13:49,http://lorempixel.com/400/400/business,Consequatur omnis dolorem sit voluptatem odit.,67,2019-7-22 18:29:11
794,84,3,14,2019-5-21 03:45:09,http://lorempixel.com/400/400/business,Iste officiis pariatur fugit exercitationem.,297,2019-9-30 14:58:20
795,49,5,23,2019-6-13 18:22:17,http://lorempixel.com/400/400/business,Facere nobis omnis veniam excepturi.,519,2019-9-8 12:18:07
796,26,2,9,2019-7-27 09:17:44,http://lorempixel.com/400/400/business,Consequatur doloremque a explicabo voluptatum.,946,2019-9-18 10:26:54
797,54,1,1,2019-4-4 15:38:50,http://lorempixel.com/400/400/business,Corporis voluptatum neque officia sed.,754,2019-5-3 11:30:07
798,4,3,14,2019-7-13 07:30:44,http://lorempixel.com/400/400/business,Autem est laboriosam corporis iste.,414,2019-8-13 06:42:48
799,25,2,12,2019-6-15 01:29:10,http://lorempixel.com/400/400/business,Dignissimos nihil incidunt eum dolores possimus.,917,2019-7-22 16:22:45
800,45,1,6,2019-4-10 23:58:24,http://lorempixel.com/400/400/business,Veritatis aliquid sequi eius occaecati est deleniti debitis.,307,2019-8-10 10:52:58
801,93,5,23,2019-5-8 00:10:17,http://lorempixel.com/400/400/business,Voluptate fugit enim aut vel rerum est.,850,2019-6-3 02:14:39
802,86,2,12,2019-5-23 23:25:37,http://lorempixel.com/400/400/business,Nam modi debitis exercitationem.,776,2019-7-8 08:58:20
803,70,2,9,2019-6-17 05:51:28,http://lorempixel.com/400/400/business,Et hic aut ullam omnis explicabo dolore.,158,2019-9-17 23:47:54
804,21,5,23,2019-7-14 09:40:47,http://lorempixel.com/400/400/business,Aut velit dolorum.,680,2019-9-11 11:16:06
805,27,4,19,2019-6-18 04:08:44,http://lorempixel.com/400/400/business,Consequuntur voluptatem in architecto cum similique sint.,785,2019-6-21 17:58:22
806,90,1,4,2019-6-5 05:26:11,http://lorempixel.com/400/400/business,Sunt cumque quidem ut eaque consequatur nobis.,206,2019-7-13 04:09:27
807,36,5,22,2019-7-16 20:58:18,http://lorempixel.com/400/400/business,Minus vel molestias tempore id.,305,2019-8-12 04:39:16
808,28,5,23,2019-7-21 10:58:33,http://lorempixel.com/400/400/business,Eos in officiis sed aliquid.,409,2019-9-1 10:44:28
809,35,1,7,2019-7-10 14:16:07,http://lorempixel.com/400/400/business,Saepe quidem quas numquam eos quia labore eum.,325,2019-7-15 11:22:39
810,91,2,11,2019-7-25 11:43:42,http://lorempixel.com/400/400/business,Ea suscipit cupiditate rerum eaque.,672,2019-9-4 06:45:11
811,64,2,12,2019-5-1 21:51:04,http://lorempixel.com/400/400/business,Dolor est et sed facilis molestias unde velit.,62,2019-5-3 04:40:31
812,86,4,18,2019-6-18 08:28:11,http://lorempixel.com/400/400/business,Id cupiditate quia.,300,2019-7-17 12:53:34
813,93,2,13,2019-7-3 12:35:03,http://lorempixel.com/400/400/business,Velit cumque consequatur nihil adipisci unde ab nobis beatae.,571,2019-9-18 23:40:02
814,40,1,2,2019-4-24 11:56:43,http://lorempixel.com/400/400/business,Aut at architecto in dolorem nemo.,991,2019-5-29 14:40:56
815,88,3,14,2019-6-9 07:52:12,http://lorempixel.com/400/400/business,Dolorem necessitatibus voluptatem fugit.,553,2019-9-3 18:51:58
816,67,4,18,2019-6-18 03:03:44,http://lorempixel.com/400/400/business,Possimus magni porro officia.,806,2019-9-5 20:22:28
817,28,3,17,2019-5-11 07:41:57,http://lorempixel.com/400/400/business,Quo veniam adipisci.,349,2019-7-3 05:26:51
818,74,2,10,2019-4-12 01:13:01,http://lorempixel.com/400/400/business,Qui itaque sit maiores sequi aspernatur ea repellendus culpa atque.,453,2019-6-30 22:17:07
819,35,3,17,2019-5-8 02:42:58,http://lorempixel.com/400/400/business,Illum quia reprehenderit voluptates quod eum.,439,2019-9-19 04:45:26
820,43,2,9,2019-6-30 02:37:01,http://lorempixel.com/400/400/business,Qui odit nam sint.,913,2019-9-20 01:32:27
821,60,2,10,2019-7-4 03:09:26,http://lorempixel.com/400/400/business,Maiores corporis et.,162,2019-7-10 01:42:19
822,34,5,23,2019-5-28 09:58:01,http://lorempixel.com/400/400/business,Dolores aut qui minus molestiae adipisci.,563,2019-8-3 22:22:24
823,63,3,17,2019-6-24 20:49:33,http://lorempixel.com/400/400/business,Illo illum impedit ut a harum nostrum repudiandae cumque earum.,652,2019-9-11 12:04:23
824,45,3,16,2019-6-28 10:51:19,http://lorempixel.com/400/400/business,Optio unde explicabo voluptatem eius.,371,2019-8-30 12:53:17
825,94,4,19,2019-6-18 05:45:02,http://lorempixel.com/400/400/business,Aut quis molestiae nisi dolorem.,890,2019-7-6 06:23:51
826,10,5,22,2019-6-1 03:48:33,http://lorempixel.com/400/400/business,Et unde in qui natus vitae.,598,2019-8-14 17:35:15
827,20,5,22,2019-6-9 23:49:53,http://lorempixel.com/400/400/business,Fuga aliquam aut repudiandae.,751,2019-8-15 16:54:29
828,55,5,23,2019-7-4 03:52:58,http://lorempixel.com/400/400/business,Voluptatem veritatis quam corrupti veritatis veniam iure est.,547,2019-9-9 05:47:17
829,38,4,20,2019-6-3 19:43:03,http://lorempixel.com/400/400/business,Et occaecati debitis.,678,2019-6-5 16:51:27
830,100,4,19,2019-6-20 17:08:00,http://lorempixel.com/400/400/business,Voluptas ut iure dolor deleniti enim rerum mollitia.,821,2019-7-29 03:06:25
831,72,2,12,2019-4-15 21:56:11,http://lorempixel.com/400/400/business,Libero molestiae qui.,275,2019-8-29 06:03:09
832,26,4,19,2019-5-7 18:59:45,http://lorempixel.com/400/400/business,A neque veritatis.,617,2019-7-3 11:31:43
833,68,5,22,2019-5-30 03:33:50,http://lorempixel.com/400/400/business,Rem officiis maxime voluptatibus ad sed voluptas.,563,2019-7-12 17:43:41
834,10,5,22,2019-7-25 03:23:22,http://lorempixel.com/400/400/business,Quo delectus aut blanditiis voluptatem tempore dolores autem explicabo.,654,2019-7-28 12:00:42
835,72,3,17,2019-4-8 20:20:54,http://lorempixel.com/400/400/business,Quia voluptas quibusdam dolor.,287,2019-6-18 20:03:08
836,59,1,8,2019-6-19 23:18:31,http://lorempixel.com/400/400/business,Nobis et suscipit vel ipsam.,157,2019-9-21 02:33:48
837,49,3,14,2019-6-23 16:48:03,http://lorempixel.com/400/400/business,Rerum et esse molestias voluptas illo et eum reprehenderit.,9,2019-9-5 13:17:14
838,78,3,15,2019-4-14 09:04:06,http://lorempixel.com/400/400/business,Aut rerum molestiae non iste.,543,2019-5-4 02:24:43
839,91,3,16,2019-4-27 13:21:26,http://lorempixel.com/400/400/business,Rerum et sit voluptatem facilis iste at velit dolorem.,800,2019-9-6 04:43:18
840,24,4,20,2019-5-10 22:25:16,http://lorempixel.com/400/400/business,Veniam magni hic dolor eum et voluptatum adipisci aut.,673,2019-7-5 12:35:54
841,47,2,12,2019-4-3 22:45:10,http://lorempixel.com/400/400/business,Odit est fugiat aperiam dolorem quia.,931,2019-5-23 12:56:29
842,80,2,13,2019-7-7 06:30:06,http://lorempixel.com/400/400/business,Quisquam aut blanditiis amet et tempora consequatur.,671,2019-8-22 20:41:40
843,54,4,18,2019-4-10 06:27:32,http://lorempixel.com/400/400/business,Id dolore odit praesentium ducimus nesciunt vero nisi velit in.,259,2019-8-21 03:15:33
844,62,2,9,2019-6-22 04:35:24,http://lorempixel.com/400/400/business,Id nam veniam eveniet magni maiores numquam illum voluptatem est.,422,2019-9-10 21:15:35
845,2,4,18,2019-5-12 16:30:17,http://lorempixel.com/400/400/business,Placeat reiciendis necessitatibus dolores sed rerum reiciendis sed maiores.,63,2019-7-20 18:31:29
846,91,5,23,2019-6-10 12:35:39,http://lorempixel.com/400/400/business,Quas cum et minus temporibus eos consequuntur blanditiis aperiam recusandae.,544,2019-9-18 16:02:02
847,85,2,9,2019-6-28 17:28:15,http://lorempixel.com/400/400/business,Sint eaque saepe esse omnis.,74,2019-7-8 14:32:27
848,10,4,20,2019-7-2 19:48:58,http://lorempixel.com/400/400/business,Libero hic aut.,427,2019-9-10 14:25:56
849,97,2,13,2019-7-17 01:35:32,http://lorempixel.com/400/400/business,Minima ipsum eum suscipit dolorem.,124,2019-8-3 13:52:57
850,9,5,22,2019-5-11 18:28:55,http://lorempixel.com/400/400/business,Quia doloribus nihil ab nisi qui quia ratione amet.,445,2019-8-7 18:34:15
851,59,1,7,2019-6-15 05:24:11,http://lorempixel.com/400/400/business,Minus repudiandae mollitia nesciunt qui est praesentium.,203,2019-8-20 01:32:54
852,15,2,9,2019-6-9 05:30:07,http://lorempixel.com/400/400/business,Incidunt consequatur illum qui perferendis.,858,2019-6-16 05:44:27
853,27,4,18,2019-5-12 10:32:08,http://lorempixel.com/400/400/business,Est qui nostrum dolores repellendus labore accusantium.,191,2019-9-11 21:50:39
854,45,2,9,2019-6-9 07:27:08,http://lorempixel.com/400/400/business,Commodi similique est.,454,2019-9-18 01:23:32
855,91,4,21,2019-4-19 20:02:01,http://lorempixel.com/400/400/business,Distinctio consequatur qui vel quo incidunt magni ab facere consequuntur.,323,2019-7-13 16:53:13
856,61,1,8,2019-7-1 12:24:44,http://lorempixel.com/400/400/business,Possimus nesciunt temporibus cumque voluptatem impedit.,113,2019-9-18 08:25:09
857,85,2,9,2019-6-24 08:51:58,http://lorempixel.com/400/400/business,Pariatur autem est officia repellat sint et perspiciatis dolor.,637,2019-9-27 13:02:55
858,19,5,22,2019-4-1 01:09:02,http://lorempixel.com/400/400/business,Id et natus et explicabo animi soluta nam.,158,2019-4-12 22:47:25
859,6,3,17,2019-4-16 06:06:35,http://lorempixel.com/400/400/business,Ipsa excepturi in esse quaerat at.,190,2019-4-16 10:25:13
860,47,4,19,2019-5-18 05:57:00,http://lorempixel.com/400/400/business,Ipsum voluptas debitis magnam ex in.,309,2019-6-5 22:53:55
861,2,2,13,2019-6-2 11:53:00,http://lorempixel.com/400/400/business,Itaque harum consequatur molestiae repudiandae quasi et ex.,894,2019-8-17 21:31:53
862,62,3,16,2019-7-28 09:32:48,http://lorempixel.com/400/400/business,Omnis voluptatem ipsa earum pariatur sit.,294,2019-8-17 19:32:11
863,88,2,10,2019-5-4 04:59:24,http://lorempixel.com/400/400/business,Magnam quasi veritatis molestias quia.,618,2019-6-16 21:26:09
864,75,4,18,2019-6-12 04:54:38,http://lorempixel.com/400/400/business,Sapiente non perferendis aut et deserunt itaque veritatis eum.,956,2019-9-17 07:36:13
865,20,3,16,2019-6-10 16:15:10,http://lorempixel.com/400/400/business,Aut voluptate in ex dolore minus voluptatem eligendi dolor asperiores.,8,2019-9-20 23:28:18
866,5,4,18,2019-7-28 14:56:41,http://lorempixel.com/400/400/business,Et fuga et cumque perferendis voluptates nisi.,473,2019-8-19 00:50:37
867,48,1,5,2019-4-11 04:43:48,http://lorempixel.com/400/400/business,Ex illum commodi in reprehenderit fuga.,368,2019-7-9 09:09:22
868,65,4,21,2019-5-11 23:59:08,http://lorempixel.com/400/400/business,Occaecati qui qui.,147,2019-6-17 11:00:01
869,47,1,6,2019-6-27 07:45:04,http://lorempixel.com/400/400/business,Et consectetur aut necessitatibus qui incidunt eos.,98,2019-7-23 05:27:16
870,20,4,19,2019-5-17 17:17:17,http://lorempixel.com/400/400/business,Voluptatem molestias eius nihil.,0,2019-6-20 21:51:23
871,82,3,14,2019-7-17 18:00:30,http://lorempixel.com/400/400/business,Sed eum voluptas aut amet et sed dolores.,796,2019-8-31 11:40:24
872,35,3,17,2019-7-31 23:51:29,http://lorempixel.com/400/400/business,Fugit aperiam officia sunt ex laborum.,292,2019-8-7 11:42:35
873,57,1,4,2019-5-4 07:16:53,http://lorempixel.com/400/400/business,Minus eligendi ab voluptatum dolor qui laboriosam.,81,2019-9-17 03:49:13
874,92,2,9,2019-5-16 06:07:09,http://lorempixel.com/400/400/business,Quia ut fugit magni ut id qui non.,454,2019-9-29 02:46:48
875,25,4,20,2019-6-12 13:33:04,http://lorempixel.com/400/400/business,Ipsum dolorem non dolor qui.,573,2019-9-16 05:27:18
876,83,1,5,2019-6-12 13:10:28,http://lorempixel.com/400/400/business,Sint ex dolorem odio ut et facilis nulla quia.,83,2019-9-29 06:12:01
877,51,5,22,2019-7-12 22:45:18,http://lorempixel.com/400/400/business,Ut temporibus aspernatur cupiditate vel quis earum repudiandae unde ex.,557,2019-7-31 13:05:18
878,67,3,16,2019-7-12 13:32:38,http://lorempixel.com/400/400/business,Ipsum voluptas facere et odio non optio.,959,2019-8-30 12:17:20
879,66,2,13,2019-6-28 06:59:47,http://lorempixel.com/400/400/business,Repudiandae dolorum et sint et ipsa iure nam hic id.,405,2019-8-6 07:08:19
880,83,3,14,2019-7-16 13:00:23,http://lorempixel.com/400/400/business,Dignissimos dolores odit dolore explicabo nisi neque ipsa esse corrupti.,427,2019-9-14 18:21:56
881,24,5,23,2019-3-31 22:14:13,http://lorempixel.com/400/400/business,Quia rem dignissimos id natus et repudiandae quo.,555,2019-7-8 03:31:33
882,85,2,9,2019-4-7 13:44:43,http://lorempixel.com/400/400/business,Magni ea et molestiae modi atque et aperiam dicta ullam.,748,2019-5-13 16:32:21
883,46,2,13,2019-4-18 14:08:58,http://lorempixel.com/400/400/business,Eius autem ducimus iure voluptatem harum atque voluptas deleniti.,484,2019-7-16 10:47:36
884,88,5,23,2019-4-5 21:41:41,http://lorempixel.com/400/400/business,Explicabo enim aut voluptate commodi odit.,56,2019-9-12 10:17:53
885,53,1,3,2019-7-30 06:24:18,http://lorempixel.com/400/400/business,Sit similique repudiandae.,523,2019-8-23 13:45:45
886,1,2,12,2019-5-7 05:31:06,http://lorempixel.com/400/400/business,Qui repellendus nihil recusandae rem.,246,2019-5-10 17:57:42
887,39,3,17,2019-4-14 08:58:10,http://lorempixel.com/400/400/business,Minima totam perspiciatis id occaecati et possimus.,991,2019-4-25 01:48:43
888,36,5,22,2019-4-3 10:39:33,http://lorempixel.com/400/400/business,Velit rerum sint rerum voluptas harum dolorem consequatur dolorem rem.,152,2019-4-30 11:34:30
889,94,3,16,2019-4-16 12:05:50,http://lorempixel.com/400/400/business,Voluptas impedit et.,965,2019-5-2 09:08:20
890,87,2,11,2019-7-15 11:20:44,http://lorempixel.com/400/400/business,Repellat asperiores maxime suscipit ipsum explicabo.,729,2019-9-25 11:29:19
891,25,5,23,2019-5-7 16:54:19,http://lorempixel.com/400/400/business,Mollitia nulla qui fugiat.,618,2019-6-7 00:23:06
892,65,2,13,2019-7-13 12:11:58,http://lorempixel.com/400/400/business,Voluptates aperiam eum mollitia.,434,2019-9-28 02:29:32
893,15,4,20,2019-7-12 12:42:32,http://lorempixel.com/400/400/business,Ut molestias assumenda doloribus qui voluptates sed.,844,2019-8-11 17:43:50
894,98,4,18,2019-8-3 15:36:54,http://lorempixel.com/400/400/business,Veniam voluptatem accusamus ut in.,526,2019-9-17 02:31:28
895,2,3,15,2019-6-30 13:54:52,http://lorempixel.com/400/400/business,Explicabo quis expedita autem.,687,2019-6-30 23:41:53
896,6,2,11,2019-6-21 20:09:16,http://lorempixel.com/400/400/business,Inventore cumque similique minus et a perspiciatis ut occaecati et.,892,2019-9-11 16:18:34
897,59,2,13,2019-7-12 16:33:25,http://lorempixel.com/400/400/business,Laudantium tempora non alias et.,851,2019-7-24 03:02:19
898,58,1,3,2019-5-14 01:02:03,http://lorempixel.com/400/400/business,Voluptatem nihil placeat sint aut.,232,2019-8-19 01:21:04
899,38,4,19,2019-7-31 19:13:15,http://lorempixel.com/400/400/business,Eos dolorum quia asperiores quas ea.,670,2019-8-23 06:32:38
900,45,3,14,2019-5-9 16:36:21,http://lorempixel.com/400/400/business,Unde illo nulla.,672,2019-5-30 03:00:04
901,95,2,10,2019-7-18 07:55:14,http://lorempixel.com/400/400/business,Maiores rerum at et.,661,2019-8-29 19:10:48
902,13,3,16,2019-6-15 22:26:57,http://lorempixel.com/400/400/business,Dolorum sint dolorem incidunt et commodi aut ipsam.,419,2019-6-30 06:51:15
903,59,1,2,2019-6-23 11:43:31,http://lorempixel.com/400/400/business,Dolores id et odit autem sed.,781,2019-7-7 20:08:22
904,58,2,11,2019-5-10 13:34:10,http://lorempixel.com/400/400/business,Corrupti temporibus a voluptas maiores non omnis.,3,2019-9-25 11:57:54
905,4,2,13,2019-6-2 17:40:22,http://lorempixel.com/400/400/business,Porro et blanditiis voluptatem dignissimos dolorem rem.,178,2019-8-23 11:13:56
906,76,1,3,2019-5-21 21:06:24,http://lorempixel.com/400/400/business,Iure quia non quo rem atque repudiandae corporis.,709,2019-9-3 00:55:41
907,59,2,11,2019-7-9 17:08:56,http://lorempixel.com/400/400/business,Tenetur velit natus quam iure error doloremque.,872,2019-8-24 04:35:18
908,97,2,10,2019-6-2 12:53:26,http://lorempixel.com/400/400/business,Beatae sit modi sed ut debitis ut.,619,2019-6-2 19:31:10
909,41,3,17,2019-7-29 19:31:42,http://lorempixel.com/400/400/business,Repudiandae in vel.,563,2019-9-20 00:34:46
910,35,1,4,2019-7-10 21:59:43,http://lorempixel.com/400/400/business,Iusto et quidem officiis nostrum sed quam aperiam consequuntur qui.,710,2019-7-25 10:13:04
911,63,2,13,2019-5-29 23:08:41,http://lorempixel.com/400/400/business,Autem magni et modi.,337,2019-7-31 21:06:00
912,8,4,19,2019-4-8 10:44:13,http://lorempixel.com/400/400/business,Earum voluptatem praesentium inventore sit et natus.,239,2019-7-23 01:49:19
913,89,1,7,2019-7-23 21:06:24,http://lorempixel.com/400/400/business,Vitae nihil et aliquam officia amet nemo.,906,2019-8-26 05:16:26
914,62,3,14,2019-5-2 19:19:33,http://lorempixel.com/400/400/business,Aut sequi totam in voluptas aliquam quis.,196,2019-8-26 22:46:16
915,31,3,17,2019-6-16 15:01:29,http://lorempixel.com/400/400/business,Ut nobis et dolores est.,903,2019-8-5 21:32:15
916,61,1,5,2019-4-25 07:54:40,http://lorempixel.com/400/400/business,Et architecto quas consequatur sed occaecati consequatur dolor at quia.,698,2019-6-14 06:29:32
917,47,3,16,2019-5-11 23:51:29,http://lorempixel.com/400/400/business,Veritatis similique qui iste.,750,2019-5-12 13:37:09
918,83,4,20,2019-5-6 07:39:47,http://lorempixel.com/400/400/business,Est voluptas rerum.,299,2019-6-5 03:36:31
919,13,5,23,2019-7-15 15:57:22,http://lorempixel.com/400/400/business,Quia quis sit voluptatem voluptatem.,768,2019-9-18 07:06:16
920,7,3,15,2019-7-13 23:24:51,http://lorempixel.com/400/400/business,Fuga laudantium quas labore voluptates.,401,2019-9-16 09:35:13
921,14,5,23,2019-4-21 06:02:54,http://lorempixel.com/400/400/business,Dolores omnis sunt dignissimos qui velit.,504,2019-7-7 18:46:23
922,69,2,12,2019-4-13 09:35:15,http://lorempixel.com/400/400/business,Iusto nisi sed nostrum veritatis officia placeat id magnam.,563,2019-9-7 09:15:16
923,72,5,23,2019-5-8 19:58:59,http://lorempixel.com/400/400/business,Aliquid minus rem quisquam fugiat perferendis.,544,2019-5-11 06:41:04
924,27,5,23,2019-4-12 16:40:36,http://lorempixel.com/400/400/business,Hic enim et natus fuga quos tenetur tenetur facere optio.,80,2019-7-7 14:18:50
925,100,4,18,2019-4-12 02:21:43,http://lorempixel.com/400/400/business,Asperiores id et dolore impedit numquam sunt rerum deserunt nam.,755,2019-7-7 16:15:44
926,4,1,3,2019-6-24 07:05:38,http://lorempixel.com/400/400/business,Modi at illum ipsam.,448,2019-6-29 07:42:11
927,88,2,13,2019-7-5 16:19:07,http://lorempixel.com/400/400/business,Consequatur sunt nulla sint quo veniam suscipit qui delectus ut.,385,2019-7-6 05:42:46
928,89,2,9,2019-6-25 04:32:36,http://lorempixel.com/400/400/business,Aut doloremque architecto delectus voluptas.,913,2019-9-17 14:33:46
929,44,2,9,2019-5-23 07:10:53,http://lorempixel.com/400/400/business,Impedit quidem ut ab.,418,2019-9-6 15:48:32
930,15,1,8,2019-4-25 22:20:47,http://lorempixel.com/400/400/business,Iusto sit hic et eum nostrum est perferendis non dicta.,875,2019-8-30 17:02:57
931,51,5,23,2019-4-25 10:00:26,http://lorempixel.com/400/400/business,Atque minus exercitationem aut.,144,2019-6-3 13:35:28
932,90,1,4,2019-6-25 03:07:11,http://lorempixel.com/400/400/business,Aut nesciunt dolore quia sunt.,579,2019-7-16 06:18:21
933,56,5,22,2019-7-9 02:59:22,http://lorempixel.com/400/400/business,Culpa ut temporibus illo ipsa temporibus fuga.,338,2019-9-5 00:10:17
934,33,2,10,2019-7-13 12:54:15,http://lorempixel.com/400/400/business,Unde sed dolorem veniam beatae consequatur molestiae voluptatem explicabo.,58,2019-9-18 09:43:26
935,39,3,14,2019-7-4 01:10:58,http://lorempixel.com/400/400/business,Laborum quis doloribus illum.,485,2019-7-15 10:24:30
936,77,5,23,2019-7-9 03:16:34,http://lorempixel.com/400/400/business,Hic non eius sint eum est quia quia et.,30,2019-8-6 16:06:27
937,67,5,22,2019-4-5 05:20:25,http://lorempixel.com/400/400/business,Sit in iure laborum sint enim iste exercitationem aut.,590,2019-8-26 12:42:52
938,68,3,16,2019-7-28 11:54:42,http://lorempixel.com/400/400/business,Consequatur architecto aut.,895,2019-9-21 22:00:10
939,12,4,20,2019-5-27 00:35:47,http://lorempixel.com/400/400/business,Eaque ut voluptatum nihil quaerat.,5,2019-6-30 17:15:29
940,40,2,13,2019-6-30 14:37:51,http://lorempixel.com/400/400/business,Quo delectus alias est voluptatem ratione accusamus qui soluta.,559,2019-9-18 00:54:54
941,88,2,10,2019-7-26 08:10:58,http://lorempixel.com/400/400/business,Vero odit cupiditate velit perferendis distinctio et.,613,2019-9-10 09:13:42
942,47,5,22,2019-4-8 08:49:19,http://lorempixel.com/400/400/business,Molestias voluptatem quo dignissimos nisi.,899,2019-4-15 08:47:02
943,76,3,17,2019-5-28 22:05:53,http://lorempixel.com/400/400/business,Eligendi voluptatem doloremque fugiat.,754,2019-8-19 00:54:22
944,53,4,21,2019-4-12 03:30:53,http://lorempixel.com/400/400/business,Nostrum rerum maiores.,854,2019-7-11 11:22:03
945,10,3,17,2019-6-9 00:01:54,http://lorempixel.com/400/400/business,Voluptatem veniam minima.,44,2019-8-8 11:05:38
946,9,5,22,2019-4-18 02:54:32,http://lorempixel.com/400/400/business,Qui quo ab odit voluptate architecto qui eum nemo ut.,95,2019-5-31 00:27:16
947,80,2,9,2019-7-6 17:51:53,http://lorempixel.com/400/400/business,Quis harum dolor nemo.,832,2019-9-12 04:45:17
948,67,5,22,2019-4-14 20:09:40,http://lorempixel.com/400/400/business,Sit nesciunt dolorum molestiae a molestiae cum explicabo omnis.,675,2019-8-9 08:45:29
