id,room_id,category,subcategory,date,photoUrl,description,cost,dateFixed
1,91,1,5,Tue May 07 2019 09:37:10 GMT-0700 (PDT),http://lorempixel.com/400/400/business,Odio sequi autem consectetur iusto in autem.,716,Sun Aug 04 2019 04:54:36 GMT-0700 (PDT)
2,83,2,9,Mon Jul 08 2019 13:30:45 GMT-0700 (PDT),http://lorempixel.com/400/400/business,Ullam est ut doloremque adipisci.,754,Mon Sep 09 2019 10:02:52 GMT-0700 (PDT)
3,45,5,22,Tue Jun 25 2019 09:39:12 GMT-0700 (PDT),http://lorempixel.com/400/400/business,Nihil commodi sequi ipsa provident perspiciatis et omnis architecto aut.,638,Tue Jun 25 2019 19:15:58 GMT-0700 (PDT)
4,95,5,23,Tue Jul 02 2019 15:24:53 GMT-0700 (PDT),http://lorempixel.com/400/400/business,Consequatur assumenda dolore necessitatibus provident sit dolorem consequatur laudantium consequuntur.,73,Tue Sep 03 2019 12:26:55 GMT-0700 (PDT)
5,97,3,15,Thu Apr 04 2019 11:58:58 GMT-0700 (PDT),http://lorempixel.com/400/400/business,Ut velit qui ipsa.,250,Fri Sep 13 2019 06:31:38 GMT-0700 (PDT)
6,5,1,3,Mon Jul 22 2019 23:48:52 GMT-0700 (PDT),http://lorempixel.com/400/400/business,Doloremque molestiae consequatur.,752,Sat Sep 14 2019 02:28:35 GMT-0700 (PDT)
7,75,5,22,Tue Apr 23 2019 14:52:20 GMT-0700 (PDT),http://lorempixel.com/400/400/business,At minima amet consequuntur corporis dolor sed amet iste.,199,Fri Jul 12 2019 02:56:45 GMT-0700 (PDT)
8,40,5,23,Mon Apr 29 2019 08:30:08 GMT-0700 (PDT),http://lorempixel.com/400/400/business,Fugiat necessitatibus et.,684,Thu Sep 19 2019 01:46:45 GMT-0700 (PDT)
9,66,4,21,Thu Jun 27 2019 13:13:19 GMT-0700 (PDT),http://lorempixel.com/400/400/business,Animi culpa autem qui eligendi cumque dolorem sint.,159,Thu Jul 11 2019 11:38:30 GMT-0700 (PDT)
10,94,1,3,Thu Jul 11 2019 22:36:07 GMT-0700 (PDT),http://lorempixel.com/400/400/business,Aperiam ab est.,719,Thu Sep 19 2019 04:43:16 GMT-0700 (PDT)
11,6,3,16,Mon Jul 08 2019 22:47:47 GMT-0700 (PDT),http://lorempixel.com/400/400/business,Et velit necessitatibus voluptatum ut pariatur.,596,Thu Sep 26 2019 07:28:39 GMT-0700 (PDT)
12,93,2,10,Thu Jul 18 2019 08:28:41 GMT-0700 (PDT),http://lorempixel.com/400/400/business,Voluptatem excepturi quo nihil iste quisquam quidem temporibus inventore.,650,Sun Aug 25 2019 10:04:05 GMT-0700 (PDT)
13,11,4,19,Sat Apr 13 2019 10:34:18 GMT-0700 (PDT),http://lorempixel.com/400/400/business,Soluta mollitia est enim.,82,Thu May 02 2019 02:42:50 GMT-0700 (PDT)
14,38,1,3,Tue Jul 09 2019 00:18:29 GMT-0700 (PDT),http://lorempixel.com/400/400/business,Sint corrupti fuga velit.,826,Sat Sep 14 2019 14:34:35 GMT-0700 (PDT)
15,19,4,21,Thu Jun 13 2019 19:27:36 GMT-0700 (PDT),http://lorempixel.com/400/400/business,Sit qui minima pariatur est adipisci numquam sint enim.,141,Wed Aug 14 2019 06:59:16 GMT-0700 (PDT)
16,21,2,12,Fri Jul 05 2019 04:17:45 GMT-0700 (PDT),http://lorempixel.com/400/400/business,Perspiciatis aliquam et quo quia quisquam provident consequuntur architecto.,458,Wed Aug 28 2019 16:51:51 GMT-0700 (PDT)
17,68,1,1,Thu Apr 18 2019 18:06:29 GMT-0700 (PDT),http://lorempixel.com/400/400/business,Rerum recusandae cum veritatis.,277,Fri Sep 13 2019 00:56:29 GMT-0700 (PDT)
18,50,4,19,Sun Jun 16 2019 11:06:46 GMT-0700 (PDT),http://lorempixel.com/400/400/business,Qui necessitatibus sequi magnam aut quo tempora veritatis.,894,Tue Jul 30 2019 09:59:57 GMT-0700 (PDT)
19,22,3,16,Thu May 09 2019 18:18:12 GMT-0700 (PDT),http://lorempixel.com/400/400/business,Voluptate sunt aut cumque nostrum et rerum et consequuntur.,204,Sun May 12 2019 01:49:26 GMT-0700 (PDT)
20,48,4,20,Sat Jul 27 2019 00:16:43 GMT-0700 (PDT),http://lorempixel.com/400/400/business,Quasi error et et neque ducimus corporis.,132,Tue Sep 03 2019 09:16:20 GMT-0700 (PDT)
21,9,5,22,Tue Jun 11 2019 14:26:15 GMT-0700 (PDT),http://lorempixel.com/400/400/business,Eos nam sint quis.,604,Fri Jun 21 2019 17:38:09 GMT-0700 (PDT)
22,85,4,20,Tue Apr 23 2019 19:50:01 GMT-0700 (PDT),http://lorempixel.com/400/400/business,Maxime accusantium aut aut est.,918,Thu May 23 2019 05:32:44 GMT-0700 (PDT)
23,45,5,22,Wed May 22 2019 13:53:52 GMT-0700 (PDT),http://lorempixel.com/400/400/business,Corrupti et minima quis et quibusdam quidem sed tenetur.,454,Sun Jul 07 2019 19:25:19 GMT-0700 (PDT)
24,90,3,15,Mon Jul 08 2019 00:24:27 GMT-0700 (PDT),http://lorempixel.com/400/400/business,Et fugiat minus maxime totam et.,687,Tue Sep 24 2019 05:00:01 GMT-0700 (PDT)
25,87,1,6,Sun Apr 14 2019 20:05:22 GMT-0700 (PDT),http://lorempixel.com/400/400/business,Rerum et neque eum corporis unde neque.,262,Wed Jul 17 2019 04:02:22 GMT-0700 (PDT)
26,8,1,2,Wed Jul 03 2019 11:24:02 GMT-0700 (PDT),http://lorempixel.com/400/400/business,Animi impedit distinctio.,908,Thu Sep 12 2019 12:51:46 GMT-0700 (PDT)
27,29,1,2,Sun Jul 07 2019 18:55:27 GMT-0700 (PDT),http://lorempixel.com/400/400/business,Similique odit molestias in et est esse.,1000,Mon Aug 12 2019 02:00:48 GMT-0700 (PDT)
28,13,2,10,Mon May 27 2019 18:50:55 GMT-0700 (PDT),http://lorempixel.com/400/400/business,Minus est incidunt eum aut consequuntur distinctio.,866,Mon Aug 12 2019 15:02:04 GMT-0700 (PDT)
29,27,2,13,Mon Jun 03 2019 01:01:43 GMT-0700 (PDT),http://lorempixel.com/400/400/business,Aliquid accusamus et temporibus accusantium praesentium dolorum non.,914,Fri Jun 07 2019 05:40:15 GMT-0700 (PDT)
30,6,3,17,Tue Jun 04 2019 15:28:31 GMT-0700 (PDT),http://lorempixel.com/400/400/business,Magni nihil incidunt consequuntur sapiente natus et explicabo.,184,Sat Jul 06 2019 18:34:19 GMT-0700 (PDT)
31,7,2,9,Tue Apr 30 2019 08:35:16 GMT-0700 (PDT),http://lorempixel.com/400/400/business,In beatae minima temporibus consequatur.,324,Fri Jul 12 2019 15:09:40 GMT-0700 (PDT)
32,13,5,22,Sat Apr 27 2019 19:26:19 GMT-0700 (PDT),http://lorempixel.com/400/400/business,Ut rerum cum et nihil exercitationem omnis.,194,Sun Jul 07 2019 08:18:20 GMT-0700 (PDT)
33,76,2,12,Mon Apr 01 2019 12:14:24 GMT-0700 (PDT),http://lorempixel.com/400/400/business,Facere recusandae molestias hic qui voluptatibus temporibus.,476,Sat Aug 31 2019 12:02:22 GMT-0700 (PDT)
34,36,4,18,Thu Jun 20 2019 22:18:00 GMT-0700 (PDT),http://lorempixel.com/400/400/business,In qui est in id perferendis ut.,162,Thu Aug 08 2019 20:55:14 GMT-0700 (PDT)
35,71,5,23,Sat Jul 27 2019 22:19:45 GMT-0700 (PDT),http://lorempixel.com/400/400/business,Quam non optio nam aut facilis.,466,Tue Sep 10 2019 11:24:20 GMT-0700 (PDT)
36,46,5,22,Tue Jun 18 2019 19:51:52 GMT-0700 (PDT),http://lorempixel.com/400/400/business,Nesciunt expedita nulla voluptate.,725,Sat Aug 31 2019 03:51:07 GMT-0700 (PDT)
37,87,1,5,Sat Jul 06 2019 23:23:19 GMT-0700 (PDT),http://lorempixel.com/400/400/business,Placeat sunt dolores.,243,Sat Sep 21 2019 08:56:51 GMT-0700 (PDT)
38,29,5,23,Thu May 30 2019 19:27:14 GMT-0700 (PDT),http://lorempixel.com/400/400/business,Fuga in nulla mollitia magni dolorem sed at nihil.,814,Thu Jun 13 2019 21:39:58 GMT-0700 (PDT)
39,59,3,16,Mon Apr 29 2019 04:03:09 GMT-0700 (PDT),http://lorempixel.com/400/400/business,Itaque numquam corporis veniam veritatis earum natus soluta.,592,Sat Aug 03 2019 23:01:25 GMT-0700 (PDT)
40,54,5,23,Sat Apr 06 2019 02:21:41 GMT-0700 (PDT),http://lorempixel.com/400/400/business,Aut iste deleniti ut eum omnis sapiente delectus et vel.,809,Sat Aug 31 2019 06:11:53 GMT-0700 (PDT)
41,38,1,2,Sun Apr 21 2019 18:27:43 GMT-0700 (PDT),http://lorempixel.com/400/400/business,Et quas esse dolores ipsam accusamus consequatur.,606,Wed Jul 24 2019 13:12:13 GMT-0700 (PDT)
42,80,4,18,Mon May 13 2019 22:12:53 GMT-0700 (PDT),http://lorempixel.com/400/400/business,Quas doloremque sit quia.,831,Sun Aug 25 2019 21:22:22 GMT-0700 (PDT)
43,64,4,18,Sun Jun 23 2019 12:45:44 GMT-0700 (PDT),http://lorempixel.com/400/400/business,Possimus voluptatem ducimus quae.,645,Sat Aug 31 2019 11:44:27 GMT-0700 (PDT)
44,5,1,2,Sun Apr 07 2019 18:09:02 GMT-0700 (PDT),http://lorempixel.com/400/400/business,Amet quo eaque cum quod.,689,Fri May 31 2019 02:38:09 GMT-0700 (PDT)
45,93,5,23,Thu Apr 11 2019 16:51:24 GMT-0700 (PDT),http://lorempixel.com/400/400/business,Autem est perspiciatis unde sint totam qui.,694,Wed Aug 21 2019 08:34:17 GMT-0700 (PDT)
46,42,3,15,Sat Apr 13 2019 14:22:49 GMT-0700 (PDT),http://lorempixel.com/400/400/business,Velit natus et voluptas in voluptatem non occaecati.,538,Sun Aug 18 2019 22:25:53 GMT-0700 (PDT)
47,53,3,16,Tue Jul 02 2019 00:28:27 GMT-0700 (PDT),http://lorempixel.com/400/400/business,Aliquid sit libero est cupiditate aliquam est aperiam eius excepturi.,852,Fri Sep 13 2019 22:06:24 GMT-0700 (PDT)
48,49,1,2,Sun Apr 28 2019 21:45:30 GMT-0700 (PDT),http://lorempixel.com/400/400/business,Expedita ut voluptatem.,430,Fri Sep 27 2019 21:25:41 GMT-0700 (PDT)
49,6,1,7,Fri May 24 2019 17:56:14 GMT-0700 (PDT),http://lorempixel.com/400/400/business,Occaecati nihil est pariatur nemo incidunt molestiae.,514,Tue Sep 24 2019 06:49:45 GMT-0700 (PDT)
50,37,2,12,Fri Jun 28 2019 16:06:43 GMT-0700 (PDT),http://lorempixel.com/400/400/business,Ut ullam excepturi debitis modi.,229,Fri Aug 23 2019 22:57:53 GMT-0700 (PDT)
51,66,2,13,Wed Jul 10 2019 06:53:43 GMT-0700 (PDT),http://lorempixel.com/400/400/business,Dolor iste animi dicta magnam fugiat eos perspiciatis molestiae.,833,Mon Sep 09 2019 12:58:25 GMT-0700 (PDT)
52,32,4,19,Sun Apr 21 2019 04:06:31 GMT-0700 (PDT),http://lorempixel.com/400/400/business,Consequuntur quia quis ducimus veniam sit provident.,837,Wed Sep 04 2019 04:57:30 GMT-0700 (PDT)
53,23,2,10,Sat Jun 22 2019 07:16:16 GMT-0700 (PDT),http://lorempixel.com/400/400/business,Non exercitationem aut ab voluptates aut distinctio eum pariatur.,477,Sat Jul 27 2019 09:45:44 GMT-0700 (PDT)
54,72,1,6,Sun Jul 14 2019 17:19:56 GMT-0700 (PDT),http://lorempixel.com/400/400/business,Delectus quia modi perspiciatis.,500,Thu Aug 29 2019 22:34:02 GMT-0700 (PDT)
55,64,2,13,Sat May 04 2019 09:19:00 GMT-0700 (PDT),http://lorempixel.com/400/400/business,Alias placeat ratione dolorum explicabo iusto.,371,Fri May 10 2019 16:34:46 GMT-0700 (PDT)
56,45,1,4,Mon Jul 22 2019 03:45:32 GMT-0700 (PDT),http://lorempixel.com/400/400/business,Qui in voluptas.,963,Mon Aug 26 2019 22:46:14 GMT-0700 (PDT)
57,80,4,21,Thu Jun 27 2019 01:41:33 GMT-0700 (PDT),http://lorempixel.com/400/400/business,Ducimus sit voluptatem eius.,310,Thu Aug 29 2019 06:30:54 GMT-0700 (PDT)
58,35,1,4,Tue Jul 16 2019 03:24:17 GMT-0700 (PDT),http://lorempixel.com/400/400/business,Enim quas sed unde minima aut sint delectus ullam vel.,326,Sun Sep 29 2019 09:02:01 GMT-0700 (PDT)
59,76,1,8,Mon Jul 22 2019 07:50:47 GMT-0700 (PDT),http://lorempixel.com/400/400/business,Facere numquam quis ad facilis.,497,Mon Sep 30 2019 00:19:17 GMT-0700 (PDT)
60,74,5,23,Fri May 10 2019 23:35:21 GMT-0700 (PDT),http://lorempixel.com/400/400/business,Corporis omnis voluptatem quis accusamus velit laboriosam maiores repudiandae quo.,453,Tue Jun 18 2019 20:03:36 GMT-0700 (PDT)
61,77,4,20,Tue Jul 23 2019 14:13:37 GMT-0700 (PDT),http://lorempixel.com/400/400/business,Ad ut beatae ipsa facere magnam.,699,Wed Jul 24 2019 18:59:31 GMT-0700 (PDT)
62,33,5,22,Fri Apr 05 2019 06:48:39 GMT-0700 (PDT),http://lorempixel.com/400/400/business,Enim laboriosam harum facilis sequi quia.,946,Tue May 07 2019 03:21:06 GMT-0700 (PDT)
63,20,3,15,Wed Jul 31 2019 01:00:32 GMT-0700 (PDT),http://lorempixel.com/400/400/business,Perspiciatis vel dolorum magni quod.,131,Thu Sep 12 2019 03:30:16 GMT-0700 (PDT)
64,13,1,2,Wed Jul 10 2019 09:45:38 GMT-0700 (PDT),http://lorempixel.com/400/400/business,Officiis qui praesentium eligendi qui quas cumque.,669,Thu Jul 11 2019 05:04:27 GMT-0700 (PDT)
65,59,1,1,Mon Apr 22 2019 10:03:46 GMT-0700 (PDT),http://lorempixel.com/400/400/business,At rerum quia.,236,Wed Jun 26 2019 09:37:41 GMT-0700 (PDT)
66,35,2,10,Sun Jun 02 2019 13:07:42 GMT-0700 (PDT),http://lorempixel.com/400/400/business,Enim quisquam incidunt.,639,Fri Jul 05 2019 20:28:58 GMT-0700 (PDT)
67,18,4,19,Sat Apr 20 2019 11:47:28 GMT-0700 (PDT),http://lorempixel.com/400/400/business,Ut sint et praesentium ea repellendus ut.,470,Sat Sep 07 2019 07:03:53 GMT-0700 (PDT)
68,3,4,21,Mon Jul 29 2019 10:20:40 GMT-0700 (PDT),http://lorempixel.com/400/400/business,Accusantium tempora consequuntur earum consequatur sed molestias neque cumque.,863,Mon Aug 12 2019 02:05:53 GMT-0700 (PDT)
69,24,2,9,Wed May 15 2019 15:06:27 GMT-0700 (PDT),http://lorempixel.com/400/400/business,Omnis ut in sit totam minus.,180,Tue Jun 18 2019 06:40:18 GMT-0700 (PDT)
70,21,3,16,Wed Jun 26 2019 11:17:40 GMT-0700 (PDT),http://lorempixel.com/400/400/business,Et non rem nesciunt cum.,369,Thu Aug 01 2019 12:27:56 GMT-0700 (PDT)
71,94,4,20,Sat Jun 22 2019 21:52:23 GMT-0700 (PDT),http://lorempixel.com/400/400/business,Fugiat repellat fugiat delectus in dolorem.,122,Fri Jul 12 2019 23:25:17 GMT-0700 (PDT)
72,20,1,6,Wed Jun 12 2019 09:42:58 GMT-0700 (PDT),http://lorempixel.com/400/400/business,Ut et vel atque ipsam molestiae at.,22,Thu Aug 22 2019 15:00:38 GMT-0700 (PDT)
73,21,4,18,Mon Jun 24 2019 11:38:12 GMT-0700 (PDT),http://lorempixel.com/400/400/business,Harum labore veniam qui.,88,Thu Jul 25 2019 23:29:10 GMT-0700 (PDT)
74,63,4,20,Sun Apr 07 2019 05:18:56 GMT-0700 (PDT),http://lorempixel.com/400/400/business,Soluta distinctio suscipit voluptate in sit exercitationem amet recusandae ut.,230,Wed Apr 10 2019 15:42:49 GMT-0700 (PDT)
75,98,3,16,Mon Apr 22 2019 22:13:02 GMT-0700 (PDT),http://lorempixel.com/400/400/business,Fugit itaque explicabo aperiam animi enim officiis.,789,Mon May 27 2019 15:57:28 GMT-0700 (PDT)
76,34,5,22,Fri Apr 26 2019 06:00:15 GMT-0700 (PDT),http://lorempixel.com/400/400/business,Autem tenetur tempora cumque earum blanditiis quam voluptatem officiis eos.,721,Sun May 19 2019 00:53:00 GMT-0700 (PDT)
77,85,5,23,Thu Apr 11 2019 17:05:10 GMT-0700 (PDT),http://lorempixel.com/400/400/business,Expedita dicta voluptatem delectus rerum nisi.,393,Mon Sep 02 2019 11:55:46 GMT-0700 (PDT)
78,76,5,22,Tue May 07 2019 14:22:28 GMT-0700 (PDT),http://lorempixel.com/400/400/business,Eum tempora consequatur.,511,Tue Jul 23 2019 11:36:53 GMT-0700 (PDT)
79,13,4,19,Wed May 22 2019 18:54:30 GMT-0700 (PDT),http://lorempixel.com/400/400/business,Dolore aut ducimus.,724,Wed Jun 19 2019 04:31:12 GMT-0700 (PDT)
80,30,3,16,Fri Jul 05 2019 09:10:23 GMT-0700 (PDT),http://lorempixel.com/400/400/business,Culpa consequatur quo maiores tempore eos est.,221,Sun Jul 07 2019 12:53:01 GMT-0700 (PDT)
81,63,4,21,Tue Jun 18 2019 07:03:31 GMT-0700 (PDT),http://lorempixel.com/400/400/business,Quo odio tenetur pariatur.,948,Sun Aug 18 2019 13:24:30 GMT-0700 (PDT)
82,48,5,22,Thu Aug 01 2019 07:19:30 GMT-0700 (PDT),http://lorempixel.com/400/400/business,Modi fugiat aliquid architecto ipsum.,828,Fri Aug 23 2019 09:28:40 GMT-0700 (PDT)
83,99,4,21,Fri Jul 26 2019 10:55:35 GMT-0700 (PDT),http://lorempixel.com/400/400/business,Explicabo et et excepturi molestiae et architecto voluptatem.,27,Wed Sep 25 2019 16:53:17 GMT-0700 (PDT)
84,63,3,15,Wed Apr 24 2019 11:37:43 GMT-0700 (PDT),http://lorempixel.com/400/400/business,Consequuntur accusantium dolores.,392,Sun Aug 04 2019 14:55:12 GMT-0700 (PDT)
85,74,5,23,Wed Jun 12 2019 03:37:55 GMT-0700 (PDT),http://lorempixel.com/400/400/business,Harum sed est.,856,Thu Aug 01 2019 13:54:50 GMT-0700 (PDT)
86,90,2,9,Mon Jun 17 2019 00:27:04 GMT-0700 (PDT),http://lorempixel.com/400/400/business,Qui rerum repudiandae quod minima inventore officia.,125,Sat Sep 07 2019 01:45:16 GMT-0700 (PDT)
87,7,2,11,Wed Jun 12 2019 20:20:16 GMT-0700 (PDT),http://lorempixel.com/400/400/business,Culpa dolore enim quasi ex.,812,Sat Jul 06 2019 03:04:20 GMT-0700 (PDT)
88,63,5,22,Thu Apr 18 2019 01:31:28 GMT-0700 (PDT),http://lorempixel.com/400/400/business,Asperiores non est facilis id similique molestiae vel.,60,Thu Jul 11 2019 22:23:05 GMT-0700 (PDT)
89,91,3,15,Sat May 25 2019 05:30:56 GMT-0700 (PDT),http://lorempixel.com/400/400/business,Quo sed quas neque.,583,Sun Jul 21 2019 21:02:35 GMT-0700 (PDT)
90,6,2,10,Sun Apr 28 2019 18:28:44 GMT-0700 (PDT),http://lorempixel.com/400/400/business,Ut sint sapiente facere quia rerum pariatur iste et.,368,Mon Jun 03 2019 21:14:30 GMT-0700 (PDT)
91,79,4,18,Fri Apr 12 2019 01:25:40 GMT-0700 (PDT),http://lorempixel.com/400/400/business,Minima aut aut ipsa.,263,Sun Aug 25 2019 07:27:08 GMT-0700 (PDT)
92,25,1,3,Tue Apr 02 2019 02:51:54 GMT-0700 (PDT),http://lorempixel.com/400/400/business,Expedita officia non non sit quae saepe recusandae qui earum.,410,Wed Jul 03 2019 00:19:40 GMT-0700 (PDT)
93,46,4,18,Thu Jun 27 2019 05:00:24 GMT-0700 (PDT),http://lorempixel.com/400/400/business,Doloremque est fuga quam omnis architecto.,73,Thu Aug 01 2019 14:05:16 GMT-0700 (PDT)
94,49,1,1,Sat Jun 01 2019 18:02:51 GMT-0700 (PDT),http://lorempixel.com/400/400/business,Est alias voluptate occaecati nisi ducimus nostrum rem ullam excepturi.,600,Sat Sep 21 2019 11:17:58 GMT-0700 (PDT)
95,25,1,2,Sun Jul 14 2019 01:11:01 GMT-0700 (PDT),http://lorempixel.com/400/400/business,Rerum mollitia officia illo voluptatibus quod debitis earum voluptatum.,223,Sun Aug 04 2019 03:50:25 GMT-0700 (PDT)
96,18,2,12,Fri Jul 26 2019 18:32:41 GMT-0700 (PDT),http://lorempixel.com/400/400/business,Veniam ut dolores explicabo dolorum fugiat necessitatibus.,976,Fri Aug 09 2019 17:40:14 GMT-0700 (PDT)
97,31,2,10,Wed Jul 31 2019 06:54:58 GMT-0700 (PDT),http://lorempixel.com/400/400/business,Illum rerum numquam dolorem sint ea impedit quidem.,716,Fri Aug 02 2019 20:24:17 GMT-0700 (PDT)
98,71,5,22,Thu Jul 25 2019 06:15:37 GMT-0700 (PDT),http://lorempixel.com/400/400/business,Veniam et accusamus iusto ipsa sunt quis.,447,Fri Sep 06 2019 12:55:30 GMT-0700 (PDT)
99,51,2,9,Sat Jun 15 2019 04:11:54 GMT-0700 (PDT),http://lorempixel.com/400/400/business,Esse soluta non molestias voluptates facilis ut non quia.,4,Fri Sep 27 2019 12:47:38 GMT-0700 (PDT)
100,9,4,20,Wed May 15 2019 16:55:25 GMT-0700 (PDT),http://lorempixel.com/400/400/business,Natus aut est delectus perspiciatis qui fugiat provident sapiente.,564,Wed Jun 05 2019 16:13:29 GMT-0700 (PDT)
101,16,2,10,Sun Apr 28 2019 07:35:55 GMT-0700 (PDT),http://lorempixel.com/400/400/business,Sit quasi cumque.,715,Tue May 07 2019 07:07:04 GMT-0700 (PDT)
102,1,3,17,Sun Apr 28 2019 19:34:00 GMT-0700 (PDT),http://lorempixel.com/400/400/business,Minus aut autem rerum nihil tempora temporibus illum atque.,24,Thu Jul 25 2019 23:09:13 GMT-0700 (PDT)
103,88,4,19,Thu Jul 11 2019 03:29:18 GMT-0700 (PDT),http://lorempixel.com/400/400/business,Repellat ut incidunt.,760,Wed Aug 21 2019 17:58:04 GMT-0700 (PDT)
104,79,2,9,Tue Jul 30 2019 16:15:14 GMT-0700 (PDT),http://lorempixel.com/400/400/business,Amet aliquam in eveniet possimus.,347,Tue Sep 24 2019 01:16:01 GMT-0700 (PDT)
105,13,3,16,Fri Apr 12 2019 13:13:42 GMT-0700 (PDT),http://lorempixel.com/400/400/business,Enim laborum sed assumenda ut.,85,Wed May 15 2019 10:20:00 GMT-0700 (PDT)
106,59,2,10,Sun Apr 14 2019 19:16:46 GMT-0700 (PDT),http://lorempixel.com/400/400/business,Ipsa aliquid molestias.,514,Fri Apr 19 2019 11:22:50 GMT-0700 (PDT)
107,93,3,16,Fri Apr 19 2019 21:18:32 GMT-0700 (PDT),http://lorempixel.com/400/400/business,Laudantium ut a et sit molestias at qui.,353,Tue Apr 23 2019 22:31:23 GMT-0700 (PDT)
108,13,4,20,Sat Jul 06 2019 21:35:19 GMT-0700 (PDT),http://lorempixel.com/400/400/business,Tempore voluptate adipisci distinctio nobis voluptatum praesentium qui.,831,Fri Sep 20 2019 11:12:38 GMT-0700 (PDT)
109,80,2,11,Sat Apr 06 2019 11:36:17 GMT-0700 (PDT),http://lorempixel.com/400/400/business,Quasi eaque odio dolores voluptas blanditiis.,854,Wed Apr 24 2019 07:39:47 GMT-0700 (PDT)
110,94,4,19,Mon Apr 15 2019 14:24:41 GMT-0700 (PDT),http://lorempixel.com/400/400/business,Quod explicabo et expedita sint est.,527,Sun May 26 2019 04:37:24 GMT-0700 (PDT)
111,10,5,22,Sun Jul 28 2019 14:28:06 GMT-0700 (PDT),http://lorempixel.com/400/400/business,Magni asperiores quasi.,347,Sun Aug 25 2019 22:40:34 GMT-0700 (PDT)
112,96,5,23,Wed Jul 03 2019 10:09:56 GMT-0700 (PDT),http://lorempixel.com/400/400/business,Fugit explicabo aliquid modi nobis voluptates dignissimos vitae.,27,Tue Jul 30 2019 08:14:40 GMT-0700 (PDT)
113,9,1,5,Wed Apr 03 2019 14:22:30 GMT-0700 (PDT),http://lorempixel.com/400/400/business,Voluptates quos rem enim animi quo voluptatum voluptatem sunt ut.,968,Tue Sep 03 2019 23:19:06 GMT-0700 (PDT)
114,87,4,20,Mon Apr 01 2019 07:05:31 GMT-0700 (PDT),http://lorempixel.com/400/400/business,Qui odit reprehenderit corrupti ratione nam.,860,Sun May 05 2019 03:38:05 GMT-0700 (PDT)
115,48,2,11,Thu May 16 2019 10:02:12 GMT-0700 (PDT),http://lorempixel.com/400/400/business,Dicta eum voluptatibus molestiae et similique enim et voluptas.,312,Sat Jul 27 2019 15:19:15 GMT-0700 (PDT)
116,13,2,11,Thu Jun 27 2019 14:54:27 GMT-0700 (PDT),http://lorempixel.com/400/400/business,Velit ab nemo maxime vel adipisci.,810,Fri Jul 05 2019 02:23:19 GMT-0700 (PDT)
117,80,3,15,Thu Jul 11 2019 03:18:14 GMT-0700 (PDT),http://lorempixel.com/400/400/business,Dolores illum suscipit molestiae nihil.,148,Sat Jul 20 2019 16:40:42 GMT-0700 (PDT)
118,29,3,16,Sun Jun 16 2019 02:00:06 GMT-0700 (PDT),http://lorempixel.com/400/400/business,Labore dolorem blanditiis.,17,Thu Sep 12 2019 00:16:18 GMT-0700 (PDT)
119,31,3,14,Fri May 03 2019 01:05:27 GMT-0700 (PDT),http://lorempixel.com/400/400/business,Iusto delectus soluta illo error eos aut omnis et.,0,Wed Jun 12 2019 00:20:53 GMT-0700 (PDT)
120,14,2,11,Fri Jul 12 2019 21:15:15 GMT-0700 (PDT),http://lorempixel.com/400/400/business,Et quisquam fugiat blanditiis aut quis aliquam.,261,Sun Sep 08 2019 12:07:48 GMT-0700 (PDT)
121,63,2,13,Sun May 05 2019 10:54:22 GMT-0700 (PDT),http://lorempixel.com/400/400/business,Et voluptatem adipisci.,531,Mon Sep 16 2019 13:45:48 GMT-0700 (PDT)
122,39,3,14,Sun Jul 21 2019 03:22:19 GMT-0700 (PDT),http://lorempixel.com/400/400/business,Reprehenderit iure eveniet recusandae reprehenderit in.,858,Wed Jul 31 2019 11:31:26 GMT-0700 (PDT)
123,2,3,15,Thu Jul 25 2019 00:11:04 GMT-0700 (PDT),http://lorempixel.com/400/400/business,Voluptas et est sit et ipsum commodi explicabo ducimus.,607,Thu Sep 19 2019 08:10:34 GMT-0700 (PDT)
124,22,2,13,Thu Jul 04 2019 18:57:11 GMT-0700 (PDT),http://lorempixel.com/400/400/business,Illo delectus sit consequuntur repellendus.,526,Sat Sep 07 2019 19:47:50 GMT-0700 (PDT)
125,37,5,22,Fri Jun 07 2019 16:27:57 GMT-0700 (PDT),http://lorempixel.com/400/400/business,Illo molestiae nostrum saepe libero.,633,Fri Sep 13 2019 23:09:37 GMT-0700 (PDT)
126,73,3,16,Thu May 23 2019 00:23:28 GMT-0700 (PDT),http://lorempixel.com/400/400/business,Ex nulla iste dolorem dignissimos eaque non et.,584,Sun Jun 02 2019 17:58:59 GMT-0700 (PDT)
127,81,5,22,Tue Jul 02 2019 13:04:03 GMT-0700 (PDT),http://lorempixel.com/400/400/business,Maxime repellendus officiis aliquid iusto modi officia quisquam quo.,306,Mon Jul 08 2019 23:14:38 GMT-0700 (PDT)
128,84,5,22,Tue May 21 2019 22:22:56 GMT-0700 (PDT),http://lorempixel.com/400/400/business,Blanditiis provident omnis est repudiandae voluptatem vel.,940,Tue Jul 09 2019 12:46:53 GMT-0700 (PDT)
129,45,4,21,Sat Jun 15 2019 17:53:55 GMT-0700 (PDT),http://lorempixel.com/400/400/business,Atque sed perferendis ut.,417,Thu Sep 12 2019 23:11:15 GMT-0700 (PDT)
130,46,5,22,Sun Apr 21 2019 18:22:42 GMT-0700 (PDT),http://lorempixel.com/400/400/business,Totam molestias omnis asperiores est.,999,Wed Jul 17 2019 20:04:42 GMT-0700 (PDT)
131,11,3,17,Sat May 04 2019 12:25:29 GMT-0700 (PDT),http://lorempixel.com/400/400/business,Temporibus rem nemo vel consequatur qui qui ipsa suscipit dignissimos.,823,Sun Aug 25 2019 18:15:19 GMT-0700 (PDT)
132,80,4,18,Wed Jun 05 2019 21:39:57 GMT-0700 (PDT),http://lorempixel.com/400/400/business,Et magni in et enim ut.,38,Fri Jul 26 2019 14:58:32 GMT-0700 (PDT)
133,64,5,23,Fri Jul 12 2019 21:53:17 GMT-0700 (PDT),http://lorempixel.com/400/400/business,Consequatur occaecati voluptas dignissimos nam quos saepe sapiente perferendis soluta.,766,Fri Aug 02 2019 02:43:33 GMT-0700 (PDT)
134,47,3,17,Sat Apr 13 2019 16:42:40 GMT-0700 (PDT),http://lorempixel.com/400/400/business,Pariatur qui atque dignissimos.,40,Sat Aug 17 2019 23:04:07 GMT-0700 (PDT)
135,58,4,19,Mon May 27 2019 12:35:37 GMT-0700 (PDT),http://lorempixel.com/400/400/business,Delectus voluptas temporibus.,545,Sat Jun 22 2019 19:53:25 GMT-0700 (PDT)
136,8,5,22,Tue Jun 11 2019 10:34:33 GMT-0700 (PDT),http://lorempixel.com/400/400/business,Consectetur ad voluptates aut explicabo necessitatibus ut aspernatur.,400,Tue Jun 25 2019 08:54:14 GMT-0700 (PDT)
137,50,5,23,Mon Jul 15 2019 00:28:28 GMT-0700 (PDT),http://lorempixel.com/400/400/business,Consectetur qui officiis nostrum vitae provident nostrum dolor molestias.,443,Wed Aug 14 2019 17:17:39 GMT-0700 (PDT)
138,18,4,21,Tue Jul 16 2019 04:54:06 GMT-0700 (PDT),http://lorempixel.com/400/400/business,Enim temporibus nisi pariatur dolorem ipsam.,265,Sun Jul 28 2019 19:13:03 GMT-0700 (PDT)
139,79,1,1,Wed Jun 26 2019 20:34:09 GMT-0700 (PDT),http://lorempixel.com/400/400/business,Magnam itaque qui.,551,Thu Sep 05 2019 23:09:03 GMT-0700 (PDT)
140,100,3,15,Thu Apr 25 2019 05:46:14 GMT-0700 (PDT),http://lorempixel.com/400/400/business,Temporibus sint aut commodi in tenetur quia.,623,Sat May 11 2019 14:07:32 GMT-0700 (PDT)
141,2,5,23,Mon May 27 2019 11:29:16 GMT-0700 (PDT),http://lorempixel.com/400/400/business,Fugiat non dolore dolores sequi quia fuga.,778,Sat Jul 13 2019 11:03:43 GMT-0700 (PDT)
142,32,3,14,Wed May 22 2019 10:04:06 GMT-0700 (PDT),http://lorempixel.com/400/400/business,Dolorum consectetur voluptatem et cupiditate sunt deleniti qui quo.,790,Wed Sep 11 2019 09:15:51 GMT-0700 (PDT)
143,89,5,23,Tue Apr 30 2019 08:02:04 GMT-0700 (PDT),http://lorempixel.com/400/400/business,Quas autem odit sed explicabo et.,56,Sun Jul 21 2019 19:02:20 GMT-0700 (PDT)
144,70,3,16,Thu Jun 27 2019 10:51:21 GMT-0700 (PDT),http://lorempixel.com/400/400/business,Consequuntur voluptas quis illum eligendi et inventore aut quod.,524,Fri Sep 06 2019 14:39:24 GMT-0700 (PDT)
