id,roomId,category,subcategory,date,photoUrl,description,cost,dateFixed
289,80,5,23,Sat May 11 2019 12:06:12 GMT-0700 (PDT),http://lorempixel.com/400/400/business,Et a deleniti sint totam quibusdam natus.,728,Sat Jul 27 2019 06:22:42 GMT-0700 (PDT)
290,4,5,23,Wed May 01 2019 16:51:23 GMT-0700 (PDT),http://lorempixel.com/400/400/business,Qui dolorem dolorem sint.,804,Mon Aug 19 2019 06:24:15 GMT-0700 (PDT)
291,87,5,23,Tue Jul 02 2019 10:24:11 GMT-0700 (PDT),http://lorempixel.com/400/400/business,Velit quia atque officiis.,244,Thu Aug 01 2019 15:36:11 GMT-0700 (PDT)
292,41,3,14,Tue Jul 30 2019 03:10:07 GMT-0700 (PDT),http://lorempixel.com/400/400/business,Excepturi est ducimus.,457,Sun Aug 25 2019 16:38:43 GMT-0700 (PDT)
293,4,3,15,Sat May 18 2019 14:35:27 GMT-0700 (PDT),http://lorempixel.com/400/400/business,Autem voluptas aut aperiam officiis sunt.,189,Thu Jun 06 2019 19:19:43 GMT-0700 (PDT)
294,19,5,23,Tue May 21 2019 18:04:28 GMT-0700 (PDT),http://lorempixel.com/400/400/business,Id neque voluptatem voluptas et hic amet neque.,668,Wed Aug 21 2019 20:46:50 GMT-0700 (PDT)
295,70,5,22,Mon May 13 2019 22:08:38 GMT-0700 (PDT),http://lorempixel.com/400/400/business,Similique saepe recusandae.,809,Fri Jun 28 2019 03:40:12 GMT-0700 (PDT)
296,2,4,20,Sun May 05 2019 12:10:15 GMT-0700 (PDT),http://lorempixel.com/400/400/business,Voluptas doloribus voluptatibus distinctio corrupti non.,26,Sun Jul 07 2019 07:25:36 GMT-0700 (PDT)
297,69,1,5,Fri May 31 2019 02:38:16 GMT-0700 (PDT),http://lorempixel.com/400/400/business,Molestiae et minima omnis quos sunt doloremque voluptate.,86,Thu Aug 01 2019 14:45:23 GMT-0700 (PDT)
298,86,5,23,Wed Jul 31 2019 10:41:21 GMT-0700 (PDT),http://lorempixel.com/400/400/business,Optio enim officia voluptatibus nobis repellendus enim laudantium laborum et.,566,Tue Aug 06 2019 21:50:59 GMT-0700 (PDT)
299,67,2,9,Wed May 22 2019 02:47:24 GMT-0700 (PDT),http://lorempixel.com/400/400/business,Et eum et asperiores.,945,Thu Jul 11 2019 11:55:18 GMT-0700 (PDT)
300,93,4,20,Sat Jul 06 2019 00:30:38 GMT-0700 (PDT),http://lorempixel.com/400/400/business,Eum perspiciatis sit quas est vel.,215,Sat Jul 20 2019 06:41:36 GMT-0700 (PDT)
301,27,2,13,Tue Jul 16 2019 23:59:48 GMT-0700 (PDT),http://lorempixel.com/400/400/business,Est a minus repudiandae odit ut similique veniam qui.,178,Thu Aug 01 2019 18:58:17 GMT-0700 (PDT)
302,31,1,3,Mon Apr 29 2019 15:48:15 GMT-0700 (PDT),http://lorempixel.com/400/400/business,Doloremque laborum corporis in quam eius id.,765,Tue Aug 27 2019 09:12:03 GMT-0700 (PDT)
303,52,3,16,Fri Jul 05 2019 08:22:55 GMT-0700 (PDT),http://lorempixel.com/400/400/business,Voluptas est numquam deserunt tempora.,132,Fri Aug 09 2019 08:46:13 GMT-0700 (PDT)
304,9,4,20,Mon Apr 29 2019 20:03:27 GMT-0700 (PDT),http://lorempixel.com/400/400/business,Distinctio sit eaque facere ut ipsa neque quae.,598,Fri May 17 2019 23:51:23 GMT-0700 (PDT)
305,9,4,19,Sun Jun 16 2019 15:01:39 GMT-0700 (PDT),http://lorempixel.com/400/400/business,Odio delectus magni fuga ipsum.,581,Sun Sep 15 2019 20:44:12 GMT-0700 (PDT)
306,35,5,23,Wed Jun 26 2019 02:14:15 GMT-0700 (PDT),http://lorempixel.com/400/400/business,Soluta aperiam repellendus voluptatem.,887,Wed Jul 31 2019 18:37:34 GMT-0700 (PDT)
307,1,5,23,Tue Jun 18 2019 05:07:21 GMT-0700 (PDT),http://lorempixel.com/400/400/business,Rerum dolore ut dicta.,212,Sat Aug 10 2019 15:01:44 GMT-0700 (PDT)
308,60,1,1,Sun Jul 07 2019 06:25:50 GMT-0700 (PDT),http://lorempixel.com/400/400/business,Officia iusto non.,148,Sun Aug 04 2019 05:33:13 GMT-0700 (PDT)
309,76,3,15,Tue Apr 23 2019 07:13:10 GMT-0700 (PDT),http://lorempixel.com/400/400/business,Aut sit adipisci illo consectetur pariatur.,108,Sat May 18 2019 05:48:42 GMT-0700 (PDT)
310,14,3,17,Sat May 04 2019 22:21:25 GMT-0700 (PDT),http://lorempixel.com/400/400/business,Repellendus aut magnam velit.,651,Mon Jul 01 2019 02:16:43 GMT-0700 (PDT)
311,69,4,20,Thu Jul 25 2019 06:03:11 GMT-0700 (PDT),http://lorempixel.com/400/400/business,Est autem aperiam consequuntur voluptatem perspiciatis molestiae sint.,867,Sun Jul 28 2019 20:14:36 GMT-0700 (PDT)
312,97,2,13,Tue May 14 2019 04:54:27 GMT-0700 (PDT),http://lorempixel.com/400/400/business,Blanditiis ut repellat soluta quibusdam et voluptatem cumque possimus omnis.,351,Thu Aug 01 2019 04:34:28 GMT-0700 (PDT)
313,83,1,5,Mon May 20 2019 03:42:35 GMT-0700 (PDT),http://lorempixel.com/400/400/business,Vitae sunt molestiae quibusdam voluptates minus eius quibusdam.,892,Mon Aug 05 2019 08:00:42 GMT-0700 (PDT)
314,36,5,23,Sun Apr 07 2019 20:00:59 GMT-0700 (PDT),http://lorempixel.com/400/400/business,Culpa est fuga veniam nihil at rerum fugiat sit.,840,Tue May 21 2019 02:08:04 GMT-0700 (PDT)
315,100,5,22,Tue Apr 09 2019 07:04:52 GMT-0700 (PDT),http://lorempixel.com/400/400/business,Quos occaecati est deserunt officiis consequatur.,366,Wed Jul 03 2019 03:30:41 GMT-0700 (PDT)
316,83,1,8,Wed Jun 19 2019 14:59:52 GMT-0700 (PDT),http://lorempixel.com/400/400/business,Et itaque delectus sit exercitationem.,709,Sun Aug 04 2019 21:45:38 GMT-0700 (PDT)
317,16,4,19,Sat Jul 13 2019 23:32:59 GMT-0700 (PDT),http://lorempixel.com/400/400/business,Voluptas quaerat omnis iure.,771,Mon Jul 29 2019 00:19:10 GMT-0700 (PDT)
318,61,1,7,Mon May 20 2019 08:45:45 GMT-0700 (PDT),http://lorempixel.com/400/400/business,Facere ea quia.,422,Sat Sep 07 2019 06:46:56 GMT-0700 (PDT)
319,29,3,17,Sat May 25 2019 08:52:13 GMT-0700 (PDT),http://lorempixel.com/400/400/business,Quo aut placeat molestiae.,728,Tue Sep 03 2019 01:54:12 GMT-0700 (PDT)
320,18,4,19,Sun Jun 23 2019 16:44:52 GMT-0700 (PDT),http://lorempixel.com/400/400/business,Cum fugiat sit non autem.,335,Sat Sep 07 2019 10:01:14 GMT-0700 (PDT)
321,23,1,5,Sun Jul 28 2019 12:35:43 GMT-0700 (PDT),http://lorempixel.com/400/400/business,Dignissimos nesciunt numquam nihil non et at qui delectus.,819,Mon Sep 23 2019 18:40:27 GMT-0700 (PDT)
322,68,1,1,Mon Jun 17 2019 03:45:33 GMT-0700 (PDT),http://lorempixel.com/400/400/business,Qui quia totam ut perferendis at saepe nesciunt.,117,Tue Jul 02 2019 09:10:31 GMT-0700 (PDT)
323,18,1,2,Thu Jun 20 2019 06:51:56 GMT-0700 (PDT),http://lorempixel.com/400/400/business,At earum facere dicta assumenda eaque tempora quis voluptas qui.,283,Thu Aug 22 2019 11:05:15 GMT-0700 (PDT)
324,49,4,19,Mon Apr 29 2019 06:43:33 GMT-0700 (PDT),http://lorempixel.com/400/400/business,Ut at facilis suscipit debitis.,807,Mon Aug 12 2019 01:04:50 GMT-0700 (PDT)
325,78,2,11,Sun Jul 28 2019 15:47:23 GMT-0700 (PDT),http://lorempixel.com/400/400/business,Provident vel quia aliquid aspernatur eum omnis inventore autem molestiae.,70,Tue Sep 17 2019 12:40:39 GMT-0700 (PDT)
326,46,2,9,Tue Jun 04 2019 15:06:05 GMT-0700 (PDT),http://lorempixel.com/400/400/business,Ab consequatur nemo.,89,Sun Aug 11 2019 18:45:59 GMT-0700 (PDT)
327,25,5,23,Fri May 17 2019 10:30:52 GMT-0700 (PDT),http://lorempixel.com/400/400/business,Eius maxime eligendi et ab odit magni.,177,Fri Sep 20 2019 10:44:47 GMT-0700 (PDT)
328,91,3,14,Wed May 22 2019 14:17:48 GMT-0700 (PDT),http://lorempixel.com/400/400/business,Debitis delectus nobis magni sequi a porro.,993,Sat Jul 13 2019 15:15:44 GMT-0700 (PDT)
329,47,4,18,Thu May 23 2019 15:11:55 GMT-0700 (PDT),http://lorempixel.com/400/400/business,Doloremque rerum itaque voluptate officiis impedit.,608,Thu Sep 19 2019 19:03:36 GMT-0700 (PDT)
330,63,5,22,Tue Apr 23 2019 17:42:11 GMT-0700 (PDT),http://lorempixel.com/400/400/business,Totam totam et ipsa.,623,Sun Jul 14 2019 13:25:17 GMT-0700 (PDT)
331,56,2,13,Tue May 28 2019 09:51:16 GMT-0700 (PDT),http://lorempixel.com/400/400/business,Laudantium eaque commodi commodi quas laborum aut iusto.,297,Mon Jun 24 2019 06:24:27 GMT-0700 (PDT)
332,44,1,7,Sat Jun 08 2019 12:23:13 GMT-0700 (PDT),http://lorempixel.com/400/400/business,Dolorum vitae aspernatur ut animi reiciendis provident rerum enim consectetur.,976,Sat Jun 29 2019 18:48:48 GMT-0700 (PDT)
333,94,2,12,Sun Apr 14 2019 10:13:43 GMT-0700 (PDT),http://lorempixel.com/400/400/business,Facilis atque perferendis omnis quisquam ratione.,946,Fri Aug 23 2019 05:34:30 GMT-0700 (PDT)
334,96,4,19,Sat Apr 06 2019 22:05:07 GMT-0700 (PDT),http://lorempixel.com/400/400/business,Aut ut et labore magnam.,345,Wed Apr 10 2019 22:01:31 GMT-0700 (PDT)
335,35,4,21,Sun Jun 02 2019 15:32:31 GMT-0700 (PDT),http://lorempixel.com/400/400/business,Ut dolor aut qui magni est harum voluptates inventore vero.,833,Tue Sep 24 2019 13:28:27 GMT-0700 (PDT)
336,25,4,19,Wed May 08 2019 02:17:33 GMT-0700 (PDT),http://lorempixel.com/400/400/business,In voluptate autem praesentium totam quos ad tempora praesentium assumenda.,90,Mon Sep 09 2019 17:00:32 GMT-0700 (PDT)
337,52,1,4,Mon Jul 15 2019 14:02:20 GMT-0700 (PDT),http://lorempixel.com/400/400/business,Optio consequuntur et omnis illo voluptatum nam veniam maxime.,285,Wed Aug 21 2019 03:14:36 GMT-0700 (PDT)
338,41,1,1,Wed May 01 2019 13:54:26 GMT-0700 (PDT),http://lorempixel.com/400/400/business,Culpa rerum autem illo consequatur.,752,Thu Jun 20 2019 17:37:02 GMT-0700 (PDT)
339,57,5,22,Mon Jun 10 2019 00:23:39 GMT-0700 (PDT),http://lorempixel.com/400/400/business,Exercitationem ut aut dicta quam quo necessitatibus.,612,Thu Aug 15 2019 04:40:01 GMT-0700 (PDT)
340,81,1,6,Mon Jun 24 2019 00:57:05 GMT-0700 (PDT),http://lorempixel.com/400/400/business,Quasi repudiandae labore tempore rem quaerat.,230,Fri Aug 23 2019 12:25:01 GMT-0700 (PDT)
341,89,5,23,Tue May 07 2019 14:12:44 GMT-0700 (PDT),http://lorempixel.com/400/400/business,Et eos rem cumque soluta aut.,858,Sat Sep 07 2019 01:35:35 GMT-0700 (PDT)
342,75,4,21,Thu Aug 01 2019 05:18:48 GMT-0700 (PDT),http://lorempixel.com/400/400/business,Maxime eveniet explicabo ea vel.,461,Sat Sep 14 2019 15:50:14 GMT-0700 (PDT)
343,79,4,19,Tue Apr 09 2019 00:57:35 GMT-0700 (PDT),http://lorempixel.com/400/400/business,Qui ut occaecati autem voluptates in.,700,Tue Aug 20 2019 13:32:21 GMT-0700 (PDT)
344,2,2,13,Thu Jun 27 2019 09:30:38 GMT-0700 (PDT),http://lorempixel.com/400/400/business,Deleniti quia voluptas natus ut provident quia eos ut.,998,Fri Jul 19 2019 00:26:03 GMT-0700 (PDT)
345,75,5,22,Thu Aug 01 2019 06:35:29 GMT-0700 (PDT),http://lorempixel.com/400/400/business,Sit dignissimos vitae deleniti ex quod amet.,858,Tue Aug 20 2019 09:36:06 GMT-0700 (PDT)
346,100,2,10,Sat Jun 01 2019 06:30:14 GMT-0700 (PDT),http://lorempixel.com/400/400/business,Ex qui aut.,851,Thu Aug 29 2019 10:43:24 GMT-0700 (PDT)
347,2,1,4,Fri Jul 05 2019 07:32:25 GMT-0700 (PDT),http://lorempixel.com/400/400/business,Asperiores odit ratione modi omnis.,288,Thu Aug 08 2019 18:13:14 GMT-0700 (PDT)
348,23,5,22,Mon May 06 2019 09:39:10 GMT-0700 (PDT),http://lorempixel.com/400/400/business,Eos debitis iusto deserunt numquam facere et nostrum labore.,150,Fri Jul 26 2019 18:16:31 GMT-0700 (PDT)
349,27,1,1,Sat May 04 2019 22:42:18 GMT-0700 (PDT),http://lorempixel.com/400/400/business,Sunt assumenda similique dolores rerum.,193,Tue Aug 13 2019 21:41:44 GMT-0700 (PDT)
350,95,4,20,Fri Aug 02 2019 13:01:30 GMT-0700 (PDT),http://lorempixel.com/400/400/business,Perspiciatis qui rem beatae et est.,405,Wed Sep 25 2019 03:55:41 GMT-0700 (PDT)
351,35,1,6,Sun May 05 2019 09:19:50 GMT-0700 (PDT),http://lorempixel.com/400/400/business,Quisquam accusamus dolore tempore assumenda libero placeat.,572,Fri Aug 02 2019 20:50:00 GMT-0700 (PDT)
352,58,2,13,Fri May 24 2019 07:48:52 GMT-0700 (PDT),http://lorempixel.com/400/400/business,Eveniet aut voluptates harum ullam non.,566,Sat Sep 21 2019 07:47:47 GMT-0700 (PDT)
353,8,3,17,Sun May 05 2019 22:06:42 GMT-0700 (PDT),http://lorempixel.com/400/400/business,A quis sunt vel ut fugiat ipsam deserunt ea cum.,770,Sun Jul 07 2019 02:00:59 GMT-0700 (PDT)
354,52,2,13,Wed Jun 12 2019 06:53:21 GMT-0700 (PDT),http://lorempixel.com/400/400/business,Eum quos ipsam ut voluptatem eum.,271,Sun Sep 22 2019 01:18:50 GMT-0700 (PDT)
355,38,2,13,Mon Jul 08 2019 04:46:50 GMT-0700 (PDT),http://lorempixel.com/400/400/business,Enim quia qui doloribus consequatur.,525,Fri Sep 13 2019 18:26:34 GMT-0700 (PDT)
356,25,2,9,Thu May 16 2019 15:51:41 GMT-0700 (PDT),http://lorempixel.com/400/400/business,Id possimus quo sit numquam omnis magnam.,494,Sun Jul 07 2019 10:53:01 GMT-0700 (PDT)
357,95,2,10,Wed May 08 2019 16:36:54 GMT-0700 (PDT),http://lorempixel.com/400/400/business,Cupiditate veritatis natus vel ipsam eos numquam.,397,Fri Sep 06 2019 14:01:18 GMT-0700 (PDT)
358,26,3,17,Mon Jul 29 2019 17:26:39 GMT-0700 (PDT),http://lorempixel.com/400/400/business,Eveniet quisquam molestiae ut veniam cum.,373,Mon Sep 02 2019 21:40:33 GMT-0700 (PDT)
359,32,3,17,Tue Apr 09 2019 02:54:02 GMT-0700 (PDT),http://lorempixel.com/400/400/business,Molestiae porro in rem molestiae eos.,623,Sun Jun 16 2019 01:25:17 GMT-0700 (PDT)
360,93,3,16,Wed Jul 10 2019 16:42:55 GMT-0700 (PDT),http://lorempixel.com/400/400/business,Sit cupiditate consequuntur.,512,Tue Sep 17 2019 09:28:01 GMT-0700 (PDT)
361,95,1,1,Mon May 06 2019 18:52:42 GMT-0700 (PDT),http://lorempixel.com/400/400/business,Ut hic non aliquid.,719,Thu Jul 18 2019 23:05:54 GMT-0700 (PDT)
362,35,3,14,Wed May 01 2019 10:53:55 GMT-0700 (PDT),http://lorempixel.com/400/400/business,Repellat laboriosam aut consequatur placeat incidunt laboriosam ducimus molestiae qui.,142,Thu Sep 12 2019 20:25:16 GMT-0700 (PDT)
363,47,5,23,Tue Jun 11 2019 04:18:25 GMT-0700 (PDT),http://lorempixel.com/400/400/business,Ut corrupti fugit atque deleniti.,358,Sat Sep 14 2019 17:37:50 GMT-0700 (PDT)
364,65,5,22,Wed Apr 17 2019 15:06:25 GMT-0700 (PDT),http://lorempixel.com/400/400/business,Perferendis explicabo earum repellat eos et illum quos.,759,Mon Jul 15 2019 05:59:30 GMT-0700 (PDT)
365,93,1,2,Sun Jun 30 2019 06:54:40 GMT-0700 (PDT),http://lorempixel.com/400/400/business,Rerum nisi et quibusdam.,227,Mon Aug 26 2019 02:31:10 GMT-0700 (PDT)
366,28,5,23,Wed May 15 2019 02:58:42 GMT-0700 (PDT),http://lorempixel.com/400/400/business,At et omnis temporibus dignissimos.,905,Sat Jul 13 2019 12:43:19 GMT-0700 (PDT)
367,37,2,10,Thu Jun 20 2019 22:09:13 GMT-0700 (PDT),http://lorempixel.com/400/400/business,Iste quia quisquam et nesciunt.,982,Mon Aug 05 2019 11:38:39 GMT-0700 (PDT)
368,24,4,20,Wed Apr 24 2019 01:44:51 GMT-0700 (PDT),http://lorempixel.com/400/400/business,Occaecati aut exercitationem.,610,Tue Sep 10 2019 15:03:19 GMT-0700 (PDT)
369,73,3,17,Wed Jul 17 2019 07:43:38 GMT-0700 (PDT),http://lorempixel.com/400/400/business,Laudantium eaque eligendi voluptas qui.,744,Tue Jul 23 2019 15:12:34 GMT-0700 (PDT)
370,11,5,23,Fri Jul 19 2019 20:59:40 GMT-0700 (PDT),http://lorempixel.com/400/400/business,Similique ratione earum.,20,Thu Aug 15 2019 18:59:07 GMT-0700 (PDT)
371,20,4,19,Sun Jun 16 2019 14:22:01 GMT-0700 (PDT),http://lorempixel.com/400/400/business,Iusto aut omnis beatae et.,264,Wed Jul 03 2019 23:18:00 GMT-0700 (PDT)
372,98,3,15,Sat May 04 2019 07:31:15 GMT-0700 (PDT),http://lorempixel.com/400/400/business,Odio nulla officiis ea qui beatae et dolores dolor.,964,Fri Sep 13 2019 08:42:20 GMT-0700 (PDT)
373,23,3,16,Sun Jul 28 2019 10:35:37 GMT-0700 (PDT),http://lorempixel.com/400/400/business,Totam ut libero quo voluptatum iure molestias architecto.,902,Fri Aug 09 2019 13:49:33 GMT-0700 (PDT)
374,97,2,11,Tue May 28 2019 12:30:37 GMT-0700 (PDT),http://lorempixel.com/400/400/business,Exercitationem commodi accusantium tenetur aut consequuntur id odit dolores.,147,Mon Sep 02 2019 02:31:01 GMT-0700 (PDT)
375,24,3,14,Wed Jul 31 2019 02:10:29 GMT-0700 (PDT),http://lorempixel.com/400/400/business,Quaerat maxime iusto asperiores corporis numquam.,323,Sun Sep 08 2019 02:11:59 GMT-0700 (PDT)
376,15,2,13,Tue May 07 2019 15:14:14 GMT-0700 (PDT),http://lorempixel.com/400/400/business,Et sequi a sed.,427,Sun Jul 28 2019 22:44:18 GMT-0700 (PDT)
377,90,1,2,Wed Jun 19 2019 00:48:02 GMT-0700 (PDT),http://lorempixel.com/400/400/business,Recusandae qui et asperiores ex aliquam deleniti molestiae debitis neque.,341,Fri Sep 13 2019 20:48:41 GMT-0700 (PDT)
378,81,3,15,Sun May 26 2019 16:01:46 GMT-0700 (PDT),http://lorempixel.com/400/400/business,Ab aut voluptatem mollitia dolore.,511,Tue May 28 2019 11:55:51 GMT-0700 (PDT)
379,43,3,17,Sun May 05 2019 20:37:23 GMT-0700 (PDT),http://lorempixel.com/400/400/business,Quidem et itaque autem quaerat officiis impedit maxime.,282,Wed Jul 17 2019 23:09:32 GMT-0700 (PDT)
380,39,4,21,Thu Apr 25 2019 09:57:55 GMT-0700 (PDT),http://lorempixel.com/400/400/business,Cupiditate voluptates accusamus non est.,909,Mon Jun 17 2019 17:06:32 GMT-0700 (PDT)
381,9,5,23,Thu Jun 13 2019 09:59:05 GMT-0700 (PDT),http://lorempixel.com/400/400/business,Voluptatem et expedita et reprehenderit quibusdam fugit.,205,Thu Sep 05 2019 06:15:44 GMT-0700 (PDT)
382,57,2,9,Sat May 18 2019 05:26:59 GMT-0700 (PDT),http://lorempixel.com/400/400/business,Ullam adipisci autem ratione sunt quia omnis.,815,Thu Aug 08 2019 03:34:31 GMT-0700 (PDT)
383,42,2,13,Sat Apr 27 2019 13:17:10 GMT-0700 (PDT),http://lorempixel.com/400/400/business,Omnis modi aut deserunt repellendus veritatis temporibus itaque earum.,99,Wed Aug 21 2019 02:08:31 GMT-0700 (PDT)
384,18,2,9,Sat Apr 13 2019 21:29:54 GMT-0700 (PDT),http://lorempixel.com/400/400/business,Et fuga consequatur quia.,838,Tue Aug 27 2019 11:11:44 GMT-0700 (PDT)
385,22,1,5,Sat Jul 20 2019 19:44:44 GMT-0700 (PDT),http://lorempixel.com/400/400/business,Eos et ducimus molestiae sit ut.,219,Mon Sep 23 2019 08:42:18 GMT-0700 (PDT)
386,62,4,20,Sat May 04 2019 03:19:32 GMT-0700 (PDT),http://lorempixel.com/400/400/business,Dolor et nam.,137,Mon Sep 16 2019 13:34:40 GMT-0700 (PDT)
387,25,5,22,Fri Aug 02 2019 18:31:09 GMT-0700 (PDT),http://lorempixel.com/400/400/business,Inventore optio veritatis voluptas velit dolor ipsum quo.,762,Sat Aug 31 2019 06:21:17 GMT-0700 (PDT)
388,54,2,11,Sat May 25 2019 08:06:40 GMT-0700 (PDT),http://lorempixel.com/400/400/business,Natus enim exercitationem cupiditate exercitationem.,382,Sat Jun 08 2019 01:36:52 GMT-0700 (PDT)
389,65,1,6,Tue Jul 16 2019 10:02:37 GMT-0700 (PDT),http://lorempixel.com/400/400/business,Et qui praesentium ut.,743,Mon Aug 26 2019 01:10:24 GMT-0700 (PDT)
390,85,1,3,Mon Apr 22 2019 18:28:24 GMT-0700 (PDT),http://lorempixel.com/400/400/business,Autem voluptatem qui.,950,Sat Sep 14 2019 22:25:17 GMT-0700 (PDT)
391,77,5,22,Sun Apr 28 2019 16:39:00 GMT-0700 (PDT),http://lorempixel.com/400/400/business,Eveniet sapiente quibusdam.,333,Sun Jun 02 2019 18:18:51 GMT-0700 (PDT)
392,93,4,18,Sun May 19 2019 20:46:58 GMT-0700 (PDT),http://lorempixel.com/400/400/business,Nobis fugiat eaque ad et aut a ut.,934,Tue Jun 04 2019 14:13:33 GMT-0700 (PDT)
393,76,3,16,Mon Jul 01 2019 06:07:18 GMT-0700 (PDT),http://lorempixel.com/400/400/business,Porro voluptates et eum porro iste sapiente.,584,Sun Sep 15 2019 10:20:21 GMT-0700 (PDT)
394,58,2,9,Thu Jun 13 2019 09:13:55 GMT-0700 (PDT),http://lorempixel.com/400/400/business,Sed sint harum aut exercitationem.,158,Tue Sep 10 2019 18:09:21 GMT-0700 (PDT)
395,37,5,22,Sat Jul 06 2019 15:11:26 GMT-0700 (PDT),http://lorempixel.com/400/400/business,Magnam et error et sed.,777,Sat Aug 10 2019 22:20:14 GMT-0700 (PDT)
396,18,1,1,Thu May 09 2019 01:03:22 GMT-0700 (PDT),http://lorempixel.com/400/400/business,Eligendi ducimus deserunt quod fuga sequi libero rerum pariatur.,440,Sat Sep 21 2019 18:30:54 GMT-0700 (PDT)
397,20,3,15,Sat Jul 27 2019 15:35:38 GMT-0700 (PDT),http://lorempixel.com/400/400/business,Recusandae unde sed debitis.,262,Sat Sep 28 2019 18:28:39 GMT-0700 (PDT)
398,62,1,8,Wed Jun 26 2019 19:01:16 GMT-0700 (PDT),http://lorempixel.com/400/400/business,Rerum qui quo aspernatur dolor.,373,Sat Aug 17 2019 12:34:27 GMT-0700 (PDT)
399,72,5,23,Thu Jun 06 2019 06:03:16 GMT-0700 (PDT),http://lorempixel.com/400/400/business,Et ea voluptatem dolor ipsam iste iste.,821,Fri Jun 14 2019 00:18:42 GMT-0700 (PDT)
400,10,3,16,Thu Jun 06 2019 05:53:53 GMT-0700 (PDT),http://lorempixel.com/400/400/business,Ea officiis fuga tempore sed.,65,Thu Jun 20 2019 07:53:37 GMT-0700 (PDT)
401,65,2,12,Mon Jun 03 2019 16:45:25 GMT-0700 (PDT),http://lorempixel.com/400/400/business,Qui sint placeat dolore reprehenderit consequatur magni porro modi.,66,Mon Aug 26 2019 14:02:40 GMT-0700 (PDT)
402,76,4,21,Fri Jul 12 2019 12:22:06 GMT-0700 (PDT),http://lorempixel.com/400/400/business,Provident aliquam repudiandae eos ut saepe rerum dolorum.,600,Sat Aug 03 2019 04:51:55 GMT-0700 (PDT)
403,8,5,23,Wed Jun 19 2019 17:29:15 GMT-0700 (PDT),http://lorempixel.com/400/400/business,Ullam quaerat odio aut.,309,Mon Aug 26 2019 16:18:04 GMT-0700 (PDT)
404,43,4,18,Thu May 02 2019 11:23:16 GMT-0700 (PDT),http://lorempixel.com/400/400/business,Eos id sit autem maxime commodi quis a dolor.,738,Thu Aug 15 2019 17:46:05 GMT-0700 (PDT)
405,56,4,18,Wed Jun 05 2019 00:21:20 GMT-0700 (PDT),http://lorempixel.com/400/400/business,Sed laboriosam et porro modi unde vero eum.,837,Thu Jun 20 2019 04:41:36 GMT-0700 (PDT)
406,75,1,2,Sun Jul 21 2019 06:02:34 GMT-0700 (PDT),http://lorempixel.com/400/400/business,Nulla cumque sint velit quaerat unde nemo velit quas voluptatum.,990,Thu Aug 01 2019 19:12:03 GMT-0700 (PDT)
407,34,4,19,Sun Jul 28 2019 09:45:55 GMT-0700 (PDT),http://lorempixel.com/400/400/business,Nam animi molestiae rerum tempore blanditiis qui.,455,Tue Aug 20 2019 09:54:41 GMT-0700 (PDT)
408,4,1,7,Tue Jul 16 2019 17:47:15 GMT-0700 (PDT),http://lorempixel.com/400/400/business,Sit consequuntur in ut ratione accusantium.,768,Fri Jul 26 2019 13:20:22 GMT-0700 (PDT)
409,34,2,10,Thu Jun 06 2019 10:01:59 GMT-0700 (PDT),http://lorempixel.com/400/400/business,Nesciunt repellat voluptate consequatur aut recusandae ea.,991,Sun Aug 04 2019 19:02:47 GMT-0700 (PDT)
410,25,1,4,Wed Apr 03 2019 07:00:06 GMT-0700 (PDT),http://lorempixel.com/400/400/business,Iusto quidem quam dicta placeat.,17,Sat Jul 27 2019 23:13:51 GMT-0700 (PDT)
411,37,3,14,Sun May 05 2019 13:40:29 GMT-0700 (PDT),http://lorempixel.com/400/400/business,Unde non ullam sapiente animi.,440,Tue May 21 2019 04:08:09 GMT-0700 (PDT)
412,65,5,23,Thu Aug 01 2019 22:42:59 GMT-0700 (PDT),http://lorempixel.com/400/400/business,Tempore aliquam vero amet et eius incidunt.,428,Wed Sep 18 2019 11:46:25 GMT-0700 (PDT)
413,76,5,23,Sun Jun 02 2019 07:47:31 GMT-0700 (PDT),http://lorempixel.com/400/400/business,Amet possimus aut.,764,Thu Sep 05 2019 05:12:30 GMT-0700 (PDT)
414,50,4,20,Sun Jul 28 2019 03:09:08 GMT-0700 (PDT),http://lorempixel.com/400/400/business,Deleniti eius recusandae dolorem aut cumque.,746,Thu Sep 26 2019 13:44:32 GMT-0700 (PDT)
415,86,1,2,Tue Apr 16 2019 01:39:29 GMT-0700 (PDT),http://lorempixel.com/400/400/business,Praesentium quis sunt id eos.,521,Wed May 01 2019 15:00:17 GMT-0700 (PDT)
416,35,5,22,Wed Jul 31 2019 09:48:19 GMT-0700 (PDT),http://lorempixel.com/400/400/business,Enim sit recusandae doloremque quidem ut voluptate numquam.,990,Thu Aug 22 2019 10:07:34 GMT-0700 (PDT)
417,29,3,16,Thu Apr 11 2019 04:14:25 GMT-0700 (PDT),http://lorempixel.com/400/400/business,Repudiandae autem officia earum at sapiente.,437,Fri Sep 20 2019 00:56:41 GMT-0700 (PDT)
418,9,2,13,Wed May 01 2019 04:35:53 GMT-0700 (PDT),http://lorempixel.com/400/400/business,Ut numquam sit et incidunt ut temporibus aut.,522,Tue Aug 27 2019 23:41:47 GMT-0700 (PDT)
419,49,4,20,Tue Jun 04 2019 21:25:05 GMT-0700 (PDT),http://lorempixel.com/400/400/business,Reprehenderit ipsam nulla adipisci dolorem impedit totam.,638,Mon Sep 16 2019 10:07:56 GMT-0700 (PDT)
420,79,2,13,Tue Jun 25 2019 12:12:24 GMT-0700 (PDT),http://lorempixel.com/400/400/business,Quae quidem temporibus vero asperiores omnis sunt.,320,Mon Jul 01 2019 15:00:19 GMT-0700 (PDT)
421,75,3,14,Thu Jul 18 2019 21:55:18 GMT-0700 (PDT),http://lorempixel.com/400/400/business,Corporis vero beatae odit et molestiae magni repellat nihil voluptate.,831,Tue Aug 20 2019 18:44:30 GMT-0700 (PDT)
422,54,5,23,Sun Jul 14 2019 11:37:12 GMT-0700 (PDT),http://lorempixel.com/400/400/business,Neque voluptatem debitis.,565,Tue Sep 17 2019 10:25:09 GMT-0700 (PDT)
423,68,5,22,Mon May 13 2019 15:26:40 GMT-0700 (PDT),http://lorempixel.com/400/400/business,Vel molestiae corrupti eveniet.,915,Tue May 28 2019 00:20:16 GMT-0700 (PDT)
424,87,3,15,Tue Apr 16 2019 09:15:24 GMT-0700 (PDT),http://lorempixel.com/400/400/business,Sed omnis sint corrupti et corporis illum.,849,Wed Aug 14 2019 16:29:57 GMT-0700 (PDT)
425,34,3,16,Sat Jun 15 2019 05:20:18 GMT-0700 (PDT),http://lorempixel.com/400/400/business,Officiis harum omnis repudiandae id tempore commodi voluptas corrupti.,107,Fri Jun 21 2019 06:02:30 GMT-0700 (PDT)
426,9,3,14,Tue Apr 16 2019 23:59:32 GMT-0700 (PDT),http://lorempixel.com/400/400/business,Veritatis sapiente blanditiis enim voluptatem ducimus qui.,458,Sun Sep 08 2019 15:40:37 GMT-0700 (PDT)
427,55,2,11,Tue Jun 04 2019 01:11:57 GMT-0700 (PDT),http://lorempixel.com/400/400/business,Placeat suscipit temporibus quia rem qui nesciunt.,423,Fri Sep 06 2019 23:21:40 GMT-0700 (PDT)
428,7,4,21,Tue Jul 09 2019 13:36:55 GMT-0700 (PDT),http://lorempixel.com/400/400/business,Explicabo molestias praesentium quia at at et a tempora sequi.,171,Sun Aug 18 2019 12:11:43 GMT-0700 (PDT)
429,68,5,23,Tue Apr 30 2019 19:55:00 GMT-0700 (PDT),http://lorempixel.com/400/400/business,Nihil tempore et tempora.,397,Fri Aug 02 2019 17:12:18 GMT-0700 (PDT)
430,50,2,12,Sat Apr 13 2019 02:53:17 GMT-0700 (PDT),http://lorempixel.com/400/400/business,Dolore voluptate saepe.,299,Tue Jul 09 2019 10:00:06 GMT-0700 (PDT)
431,12,3,17,Thu May 16 2019 09:09:49 GMT-0700 (PDT),http://lorempixel.com/400/400/business,Repudiandae debitis voluptate excepturi non est.,809,Sun Aug 18 2019 17:54:19 GMT-0700 (PDT)
432,37,1,6,Sun Jun 16 2019 13:57:34 GMT-0700 (PDT),http://lorempixel.com/400/400/business,Quo alias vel est.,389,Thu Aug 01 2019 15:43:50 GMT-0700 (PDT)
433,45,3,16,Wed Jul 17 2019 08:09:52 GMT-0700 (PDT),http://lorempixel.com/400/400/business,Unde sit ullam labore distinctio.,37,Sun Sep 15 2019 08:26:25 GMT-0700 (PDT)
434,55,1,7,Mon Apr 29 2019 17:12:01 GMT-0700 (PDT),http://lorempixel.com/400/400/business,Doloremque aspernatur rerum.,455,Wed Jun 19 2019 01:42:10 GMT-0700 (PDT)
