id,room_id,category_id,subcategory_id,date,photoUrl,description,cost,dateFixed
1,61,4,21,2019-8-12 04:24:18,http://lorempixel.com/400/400/business,Quia occaecati dicta qui quos.,632,
2,100,2,11,2019-7-28 18:52:32,http://lorempixel.com/400/400/business,Aut ducimus accusantium eaque facilis aut tempore.,339,
3,51,5,22,2019-7-27 20:44:59,http://lorempixel.com/400/400/business,Quae asperiores sint quod qui sit ipsa.,937,
4,72,1,3,2019-7-28 14:55:34,http://lorempixel.com/400/400/business,Cupiditate tempora ut magnam accusamus sapiente.,125,
5,5,1,8,2019-8-1 04:45:20,http://lorempixel.com/400/400/business,Eveniet ut magni non est.,206,
6,24,5,22,2019-7-26 21:34:13,http://lorempixel.com/400/400/business,Itaque autem magnam dolorum.,110,
7,1,4,20,2019-8-13 05:47:18,http://lorempixel.com/400/400/business,Sapiente aliquid reiciendis maxime ea et aspernatur explicabo.,35,
8,54,3,15,2019-8-7 03:54:01,http://lorempixel.com/400/400/business,Dolorem tenetur est consequatur quis et voluptas.,808,
9,20,5,22,2019-7-28 12:48:12,http://lorempixel.com/400/400/business,Animi aliquid fugiat officiis alias saepe facere error molestiae.,483,
10,43,5,23,2019-8-5 03:10:41,http://lorempixel.com/400/400/business,Ut qui tempore atque et laudantium.,51,
11,74,2,13,2019-8-12 07:35:10,http://lorempixel.com/400/400/business,Impedit aliquid suscipit libero.,854,
12,26,3,16,2019-8-3 03:04:23,http://lorempixel.com/400/400/business,Nulla illum temporibus sed ex itaque fugit neque ipsa officiis.,961,
13,6,5,22,2019-8-2 19:13:06,http://lorempixel.com/400/400/business,Nihil asperiores id numquam nam ea ex quis ullam.,565,
14,16,1,5,2019-7-29 10:02:54,http://lorempixel.com/400/400/business,Mollitia cum tempora eum in quisquam animi facilis.,333,
15,76,5,22,2019-8-5 01:22:15,http://lorempixel.com/400/400/business,Tempora tempore eos quisquam aliquid dolores inventore aut quia praesentium.,502,2019-8-30 18:01:04
16,26,5,23,2019-8-4 12:19:38,http://lorempixel.com/400/400/business,Officia et fuga nisi quas voluptatem reprehenderit ex ipsum.,294,2019-8-18 23:00:38
17,31,4,21,2019-7-25 18:48:41,http://lorempixel.com/400/400/business,Est et sunt ut culpa cum voluptatem velit.,60,
18,10,2,10,2019-7-29 09:48:22,http://lorempixel.com/400/400/business,Qui eos in nihil.,88,
19,48,2,13,2019-7-27 23:59:20,http://lorempixel.com/400/400/business,Vero culpa est odio quasi voluptate eos qui laborum voluptatem.,566,2019-9-2 13:27:59
20,35,2,11,2019-8-14 10:19:01,http://lorempixel.com/400/400/business,Ad explicabo quas temporibus qui.,768,
21,40,1,3,2019-8-8 12:33:15,http://lorempixel.com/400/400/business,Quae sint reiciendis animi qui aut illo.,387,
22,36,3,14,2019-7-28 15:59:38,http://lorempixel.com/400/400/business,Qui et quia omnis cumque et nihil.,188,
23,5,3,14,2019-8-11 12:27:41,http://lorempixel.com/400/400/business,Dolores aperiam natus ad nesciunt et quasi.,44,
24,76,3,15,2019-8-10 13:08:09,http://lorempixel.com/400/400/business,Quo eligendi aut vero veritatis consequatur placeat et laudantium dolorum.,911,
25,56,2,11,2019-8-13 10:26:30,http://lorempixel.com/400/400/business,Et porro totam et deserunt.,124,
26,37,3,14,2019-8-6 16:40:50,http://lorempixel.com/400/400/business,Qui nihil eius.,621,
27,34,4,18,2019-7-30 09:30:59,http://lorempixel.com/400/400/business,Voluptatem accusantium voluptatem.,299,
28,8,2,9,2019-8-8 17:30:20,http://lorempixel.com/400/400/business,Quod ad vel nam dicta maxime cupiditate.,492,2019-9-19 16:18:15
29,68,3,17,2019-7-29 10:47:38,http://lorempixel.com/400/400/business,Qui non voluptas autem.,222,
30,15,5,22,2019-7-26 07:38:28,http://lorempixel.com/400/400/business,Quibusdam non eum et.,782,
31,67,3,15,2019-7-30 09:48:35,http://lorempixel.com/400/400/business,Quasi corrupti et tempore dignissimos aliquam illo quo.,109,2019-9-30 12:13:31
32,94,5,23,2019-7-28 12:07:37,http://lorempixel.com/400/400/business,Hic exercitationem deserunt corporis.,16,
33,59,2,12,2019-8-11 16:25:04,http://lorempixel.com/400/400/business,Quaerat facere sunt porro vel.,695,
34,81,3,16,2019-8-5 13:30:48,http://lorempixel.com/400/400/business,Soluta quasi voluptatibus eum cumque animi repellat blanditiis.,247,2019-9-21 20:54:58
35,10,2,12,2019-7-26 05:10:34,http://lorempixel.com/400/400/business,Error iste eum iure.,761,
36,66,1,4,2019-8-9 19:37:02,http://lorempixel.com/400/400/business,Sed et amet quia dolor necessitatibus sequi.,523,2019-9-22 10:45:48
37,54,5,22,2019-8-12 04:43:03,http://lorempixel.com/400/400/business,Dolor culpa laboriosam sit eum dolorum dolorem laboriosam quod architecto.,214,
38,3,4,21,2019-8-13 23:10:24,http://lorempixel.com/400/400/business,Est ea dicta tenetur architecto.,272,
39,24,2,12,2019-8-7 11:05:59,http://lorempixel.com/400/400/business,Ut est sit facilis aliquam.,377,
40,40,1,6,2019-8-3 10:38:19,http://lorempixel.com/400/400/business,Architecto debitis hic itaque.,377,
41,42,5,23,2019-7-29 17:35:19,http://lorempixel.com/400/400/business,A quae dicta in nostrum cupiditate reiciendis.,144,
42,60,5,22,2019-7-26 11:59:00,http://lorempixel.com/400/400/business,Et iste eaque doloribus illum distinctio eaque.,12,2019-9-9 09:03:02
43,22,3,17,2019-8-8 00:44:58,http://lorempixel.com/400/400/business,Non cumque adipisci totam quidem excepturi non aut ea debitis.,357,
44,74,2,11,2019-7-30 14:50:58,http://lorempixel.com/400/400/business,Eum tenetur quidem dicta itaque quasi consequatur maiores commodi.,424,
45,87,5,22,2019-8-1 15:09:38,http://lorempixel.com/400/400/business,Qui id vel facilis nihil sit.,793,2019-9-7 02:42:47
46,32,4,18,2019-8-5 20:39:31,http://lorempixel.com/400/400/business,Aut adipisci assumenda enim ut rerum placeat.,718,
47,36,1,2,2019-8-3 03:45:28,http://lorempixel.com/400/400/business,Beatae voluptas quas dolores distinctio.,590,2019-9-27 07:16:30
48,82,4,18,2019-7-25 16:13:27,http://lorempixel.com/400/400/business,Perferendis cumque et similique temporibus architecto ea pariatur ea eum.,516,
49,87,1,8,2019-8-2 00:25:23,http://lorempixel.com/400/400/business,Et nesciunt et aut.,187,2019-8-8 16:25:13
50,71,3,17,2019-8-3 21:04:33,http://lorempixel.com/400/400/business,Omnis accusantium quae amet provident et est provident provident.,530,2019-9-23 08:42:32
51,98,5,22,2019-8-5 02:45:35,http://lorempixel.com/400/400/business,Autem cupiditate eos perferendis sit reiciendis in et.,314,
52,59,2,13,2019-8-8 10:49:22,http://lorempixel.com/400/400/business,Et eaque quo corporis.,625,
53,87,3,16,2019-8-10 23:12:25,http://lorempixel.com/400/400/business,Minima soluta dolores ipsa ipsa.,837,
54,100,3,15,2019-7-29 06:16:39,http://lorempixel.com/400/400/business,Qui quo molestiae maxime vel et perferendis reiciendis.,487,2019-9-3 02:29:49
55,52,3,14,2019-8-3 06:08:40,http://lorempixel.com/400/400/business,Culpa ab ipsam et.,17,2019-8-29 02:11:39
56,90,3,16,2019-8-3 17:23:07,http://lorempixel.com/400/400/business,Voluptatem sapiente fugit voluptates omnis dolorem.,588,
57,73,3,17,2019-8-11 13:55:40,http://lorempixel.com/400/400/business,Quisquam est placeat dicta nihil voluptatem maxime.,852,2019-9-13 13:54:13
58,70,3,17,2019-8-11 05:28:26,http://lorempixel.com/400/400/business,Rerum cum et voluptas officiis adipisci nulla inventore officia reiciendis.,513,2019-8-27 03:13:26
59,82,3,15,2019-8-5 14:54:23,http://lorempixel.com/400/400/business,Pariatur qui natus.,471,2019-9-6 14:01:46
60,35,4,18,2019-8-1 17:33:50,http://lorempixel.com/400/400/business,Ratione debitis voluptatem sapiente doloremque ducimus in harum sequi.,884,
61,13,5,22,2019-8-8 19:37:30,http://lorempixel.com/400/400/business,Suscipit ullam odit nam nam beatae error.,353,
62,38,1,8,2019-8-5 04:46:42,http://lorempixel.com/400/400/business,Corrupti suscipit culpa in et.,327,2019-8-11 05:06:27
63,95,1,3,2019-8-9 15:44:09,http://lorempixel.com/400/400/business,Voluptatibus necessitatibus suscipit harum nemo tempore.,426,2019-9-1 12:27:04
64,75,3,16,2019-7-27 08:22:33,http://lorempixel.com/400/400/business,Molestiae expedita nam rem dolorem est vel tempora.,339,2019-9-10 20:27:51
65,80,2,11,2019-8-6 11:04:54,http://lorempixel.com/400/400/business,Et rem culpa quis minus.,432,2019-9-15 12:40:41
66,46,4,21,2019-7-31 10:34:43,http://lorempixel.com/400/400/business,Corrupti id perspiciatis excepturi reprehenderit sit nisi occaecati sapiente.,81,
67,3,1,3,2019-8-6 23:03:31,http://lorempixel.com/400/400/business,Magni voluptatum ex iusto voluptatibus ut nemo ab.,913,
68,72,3,17,2019-7-31 09:42:55,http://lorempixel.com/400/400/business,Quia molestias expedita ut minus.,365,2019-8-5 09:33:06
69,66,5,23,2019-8-12 18:28:32,http://lorempixel.com/400/400/business,Voluptatum facilis optio porro.,843,
70,14,2,9,2019-8-10 23:37:06,http://lorempixel.com/400/400/business,Et suscipit inventore quia doloremque et ut reprehenderit harum consectetur.,271,
71,23,4,21,2019-8-1 08:12:19,http://lorempixel.com/400/400/business,Est molestiae dicta earum velit eaque sed minus inventore eaque.,103,
72,92,1,6,2019-8-3 09:53:41,http://lorempixel.com/400/400/business,Et atque eos voluptatem est eos nisi sapiente.,809,
73,25,2,13,2019-7-31 16:17:51,http://lorempixel.com/400/400/business,Corporis error sit doloribus laboriosam error magnam vero aut aut.,266,2019-8-15 12:01:17
74,31,5,22,2019-8-5 07:24:48,http://lorempixel.com/400/400/business,Quia iste dicta.,15,
75,92,5,23,2019-8-5 08:28:54,http://lorempixel.com/400/400/business,Sed id temporibus eum qui natus quia.,439,2019-9-27 11:43:23
76,35,4,19,2019-8-3 03:11:26,http://lorempixel.com/400/400/business,Sint temporibus id sunt exercitationem excepturi necessitatibus.,413,
77,10,4,18,2019-7-30 04:52:55,http://lorempixel.com/400/400/business,Est sed qui.,712,
78,83,3,16,2019-8-7 15:22:09,http://lorempixel.com/400/400/business,Ullam est hic mollitia voluptatem maxime voluptatem impedit rem.,274,
79,6,1,3,2019-8-12 16:02:17,http://lorempixel.com/400/400/business,Quas unde fugit sint modi.,899,2019-8-18 01:18:50
80,39,3,16,2019-7-25 20:48:04,http://lorempixel.com/400/400/business,Omnis non molestias placeat numquam tempora aliquam.,81,
81,19,5,23,2019-7-30 22:20:44,http://lorempixel.com/400/400/business,Dicta quibusdam corrupti natus quia.,837,
82,78,3,17,2019-7-28 03:55:15,http://lorempixel.com/400/400/business,Velit sint neque.,446,2019-9-6 06:50:36
83,43,4,19,2019-7-30 11:13:11,http://lorempixel.com/400/400/business,Provident ut voluptatem.,657,2019-8-26 16:14:51
84,90,2,13,2019-8-5 04:16:56,http://lorempixel.com/400/400/business,Et labore in.,11,
85,37,1,8,2019-7-30 00:12:34,http://lorempixel.com/400/400/business,Consequatur in fuga aspernatur in non vel quia ratione labore.,133,
86,90,2,9,2019-8-7 00:51:19,http://lorempixel.com/400/400/business,Sit sit alias porro dolorem repellendus et quidem.,284,2019-8-16 19:13:12
87,19,2,12,2019-8-13 06:52:59,http://lorempixel.com/400/400/business,Quod cupiditate eius earum dolorum blanditiis.,294,
88,7,5,23,2019-7-31 18:22:03,http://lorempixel.com/400/400/business,Dolor nulla hic omnis voluptatem et.,947,2019-8-30 11:30:14
89,25,4,20,2019-8-8 01:33:28,http://lorempixel.com/400/400/business,Et cumque hic non.,838,
90,9,4,18,2019-8-11 17:08:33,http://lorempixel.com/400/400/business,Autem perspiciatis quo eos aliquid vel quis maiores.,413,2019-8-28 14:45:03
91,20,2,12,2019-7-29 21:46:20,http://lorempixel.com/400/400/business,Aut quis doloremque et ab explicabo aut repudiandae et quibusdam.,279,
92,68,3,14,2019-7-31 00:24:07,http://lorempixel.com/400/400/business,Voluptatem dolorem sunt ipsam.,664,2019-9-19 17:35:23
93,91,4,20,2019-8-3 03:23:54,http://lorempixel.com/400/400/business,Necessitatibus iure facilis nemo ut non necessitatibus voluptatem quasi sit.,772,
94,69,2,9,2019-8-7 22:11:11,http://lorempixel.com/400/400/business,Dolore dolor incidunt quia numquam error et.,257,2019-8-22 16:57:54
95,100,2,11,2019-8-9 23:59:50,http://lorempixel.com/400/400/business,Repellat vel quas autem.,677,
96,64,2,11,2019-8-12 01:36:28,http://lorempixel.com/400/400/business,Dignissimos in fuga temporibus.,694,2019-8-15 06:11:50
97,58,4,21,2019-7-30 15:16:14,http://lorempixel.com/400/400/business,Consequuntur ut minus ullam cumque aut vel vero.,623,
98,29,4,18,2019-7-30 09:42:23,http://lorempixel.com/400/400/business,Et ut voluptatem quos ipsum deleniti harum nisi itaque laborum.,987,
99,81,5,22,2019-7-28 02:53:23,http://lorempixel.com/400/400/business,Quia cum qui debitis.,828,
100,56,2,10,2019-8-13 16:30:21,http://lorempixel.com/400/400/business,Consequatur maiores omnis voluptatum sunt.,344,
101,62,1,3,2019-8-8 10:52:32,http://lorempixel.com/400/400/business,Qui eos voluptatibus dolorum fuga veritatis.,291,
102,46,2,9,2019-7-30 19:37:54,http://lorempixel.com/400/400/business,Enim placeat optio laudantium voluptas eius quia illo.,723,
103,90,3,14,2019-8-3 05:33:38,http://lorempixel.com/400/400/business,Dignissimos molestiae aspernatur et aperiam eum.,445,2019-9-20 08:41:53
104,34,1,3,2019-8-3 17:32:13,http://lorempixel.com/400/400/business,Aperiam pariatur ex quia dignissimos.,256,2019-9-19 20:09:46
105,3,1,4,2019-7-29 18:32:18,http://lorempixel.com/400/400/business,Enim aperiam error est quo autem animi placeat.,62,
106,11,4,21,2019-8-10 21:00:06,http://lorempixel.com/400/400/business,Optio animi saepe quia amet ea est ea nihil.,598,
107,59,5,23,2019-8-9 09:40:15,http://lorempixel.com/400/400/business,Quod et libero doloribus distinctio.,973,2019-9-19 08:20:05
108,67,3,15,2019-8-13 09:20:53,http://lorempixel.com/400/400/business,Accusamus veniam dolores ut accusamus.,378,
109,52,3,17,2019-8-10 16:17:21,http://lorempixel.com/400/400/business,Est laudantium natus modi ex quo praesentium ut minima qui.,356,2019-9-29 14:39:27
110,52,1,3,2019-8-11 15:55:14,http://lorempixel.com/400/400/business,Amet repellendus illo consequuntur incidunt rerum id.,756,
111,54,2,11,2019-7-26 11:14:04,http://lorempixel.com/400/400/business,Dicta perspiciatis in.,195,
112,67,1,2,2019-8-8 16:25:24,http://lorempixel.com/400/400/business,Doloribus voluptas velit hic ut impedit minima et tempore.,269,
113,62,4,21,2019-7-26 01:05:41,http://lorempixel.com/400/400/business,Vel iste voluptates nisi dolor qui.,481,2019-7-30 03:33:19
114,40,4,21,2019-8-8 01:12:33,http://lorempixel.com/400/400/business,Quos autem aspernatur sunt soluta commodi ducimus provident minus explicabo.,143,2019-8-29 06:32:52
115,89,5,23,2019-7-30 05:07:16,http://lorempixel.com/400/400/business,Iure labore quo velit eligendi nesciunt reiciendis sed sapiente.,390,
116,96,3,16,2019-8-14 15:01:23,http://lorempixel.com/400/400/business,Voluptatem numquam distinctio voluptates et enim perspiciatis odit dolores.,708,2019-8-18 16:14:59
117,96,1,3,2019-8-14 08:03:13,http://lorempixel.com/400/400/business,Quae deserunt nisi repellat.,886,2019-9-23 00:35:01
118,78,3,14,2019-8-11 00:11:34,http://lorempixel.com/400/400/business,Optio quasi qui et.,754,2019-8-19 12:19:14
119,40,3,16,2019-7-27 22:44:21,http://lorempixel.com/400/400/business,Suscipit qui tempore ducimus aut est ipsum et et fuga.,737,
120,18,2,12,2019-7-24 20:06:53,http://lorempixel.com/400/400/business,Quos magnam beatae autem nihil dolorum optio enim nulla.,958,
121,84,4,18,2019-7-30 03:16:29,http://lorempixel.com/400/400/business,Qui veritatis natus pariatur est quas quisquam corrupti sit quam.,812,2019-8-6 12:44:43
122,82,3,16,2019-7-30 14:17:57,http://lorempixel.com/400/400/business,Aliquid iure eum unde similique esse qui excepturi non non.,449,
123,74,5,23,2019-8-1 15:21:52,http://lorempixel.com/400/400/business,Quisquam rerum in vitae eveniet.,743,2019-9-29 03:25:28
124,18,3,14,2019-7-28 02:57:56,http://lorempixel.com/400/400/business,Quidem eos sit saepe quia enim omnis est natus quaerat.,517,
125,72,3,17,2019-8-6 01:19:10,http://lorempixel.com/400/400/business,Dolores deserunt et pariatur et pariatur ab omnis.,773,
126,38,3,16,2019-8-14 13:29:36,http://lorempixel.com/400/400/business,Asperiores sed totam natus alias.,844,2019-8-22 12:54:18
127,53,1,5,2019-7-24 20:12:22,http://lorempixel.com/400/400/business,Voluptatem inventore et distinctio consequatur magnam eius reiciendis.,177,2019-7-25 15:02:11
128,34,2,13,2019-7-28 18:05:32,http://lorempixel.com/400/400/business,Ut quas aut maxime quia quis aut exercitationem sed fugit.,6,
129,36,3,16,2019-7-30 12:57:32,http://lorempixel.com/400/400/business,Voluptate corrupti sit.,319,2019-8-9 03:57:31
130,4,1,5,2019-7-30 14:54:32,http://lorempixel.com/400/400/business,Debitis explicabo alias eum iure voluptates error.,556,
131,95,2,9,2019-8-9 13:35:13,http://lorempixel.com/400/400/business,Fuga autem dolore.,576,2019-9-9 12:32:36
132,88,2,10,2019-7-25 02:08:20,http://lorempixel.com/400/400/business,Saepe maiores sit qui libero maxime fugit excepturi ipsum.,886,
133,77,3,16,2019-8-9 16:27:34,http://lorempixel.com/400/400/business,Tenetur molestias nostrum.,190,2019-9-24 16:55:15
134,59,2,9,2019-8-13 23:11:07,http://lorempixel.com/400/400/business,Ad assumenda cumque et quis recusandae sequi tempora odit.,255,
135,32,4,21,2019-7-27 09:18:07,http://lorempixel.com/400/400/business,Architecto autem reiciendis qui dolore mollitia ipsam veniam.,729,
136,60,4,21,2019-7-28 18:13:17,http://lorempixel.com/400/400/business,Facere blanditiis dolore quis inventore eos incidunt qui id aut.,595,
137,80,5,23,2019-8-2 14:57:08,http://lorempixel.com/400/400/business,Aut ut nobis perspiciatis temporibus natus iure.,780,
138,90,3,14,2019-7-26 22:15:37,http://lorempixel.com/400/400/business,Sit ut accusamus neque autem alias.,335,
139,54,3,15,2019-7-27 01:14:01,http://lorempixel.com/400/400/business,Consequatur sit ut occaecati reiciendis nihil.,287,
140,97,5,22,2019-7-30 04:14:07,http://lorempixel.com/400/400/business,Nemo et nihil fugit distinctio.,713,2019-8-17 19:08:42
141,14,2,12,2019-7-26 14:57:03,http://lorempixel.com/400/400/business,Adipisci saepe quis dolores quia et enim dolor nemo dignissimos.,661,2019-9-23 05:40:18
142,64,5,22,2019-8-9 20:40:26,http://lorempixel.com/400/400/business,Eaque eos omnis enim quisquam.,418,
143,82,4,18,2019-8-9 16:31:38,http://lorempixel.com/400/400/business,Occaecati vero voluptas in possimus in.,921,
144,9,3,16,2019-8-13 04:58:18,http://lorempixel.com/400/400/business,Unde incidunt eius unde sint pariatur voluptas quisquam.,192,
145,99,1,2,2019-7-31 00:27:21,http://lorempixel.com/400/400/business,Earum veritatis eveniet voluptatum itaque numquam cum consequatur deleniti.,414,
146,94,2,12,2019-8-6 12:24:22,http://lorempixel.com/400/400/business,Reprehenderit aspernatur amet facilis totam.,703,2019-8-7 17:18:48
147,49,4,18,2019-8-12 01:37:22,http://lorempixel.com/400/400/business,Aliquam at vel exercitationem ducimus voluptatibus quos nobis.,612,2019-8-30 07:06:32
148,20,4,19,2019-8-14 13:16:51,http://lorempixel.com/400/400/business,Provident consequatur expedita itaque est optio et.,157,
149,45,1,3,2019-8-4 10:22:58,http://lorempixel.com/400/400/business,Commodi expedita et.,310,2019-9-21 20:42:18
150,75,5,22,2019-8-13 17:16:51,http://lorempixel.com/400/400/business,Nobis ea velit dolores omnis.,303,
151,64,5,22,2019-7-28 12:03:20,http://lorempixel.com/400/400/business,Placeat aut ea distinctio eum dicta voluptate et voluptatem aut.,844,2019-8-15 21:33:52
152,85,4,18,2019-8-9 23:17:35,http://lorempixel.com/400/400/business,Et quisquam sit dolor quia unde earum ad sunt.,681,
153,29,4,19,2019-8-6 00:54:46,http://lorempixel.com/400/400/business,Vero et non maiores et magnam praesentium accusantium modi asperiores.,858,
154,9,3,17,2019-7-31 13:52:25,http://lorempixel.com/400/400/business,Ipsam repellendus voluptas illo qui dolore nemo maxime odit.,144,2019-9-1 13:15:24
155,8,3,16,2019-7-25 06:36:24,http://lorempixel.com/400/400/business,Temporibus labore id aliquid itaque error qui.,437,
156,35,1,1,2019-7-31 18:10:26,http://lorempixel.com/400/400/business,Qui quibusdam qui quas aliquam optio sed.,164,
157,55,1,2,2019-8-11 06:58:26,http://lorempixel.com/400/400/business,Praesentium perferendis fuga et dicta voluptatibus repudiandae.,55,
158,98,1,2,2019-8-6 08:45:23,http://lorempixel.com/400/400/business,Quam pariatur cumque rerum dolorem et facere ut expedita minima.,367,
159,7,1,6,2019-8-5 11:54:12,http://lorempixel.com/400/400/business,Est enim corporis voluptas dolores temporibus dolor.,727,2019-9-30 05:36:02
160,24,3,17,2019-7-30 05:02:27,http://lorempixel.com/400/400/business,Asperiores aperiam itaque velit iusto omnis sit cupiditate soluta.,256,2019-9-7 15:17:05
161,82,4,18,2019-8-13 11:15:57,http://lorempixel.com/400/400/business,Similique harum culpa sit error.,804,
162,41,2,9,2019-8-8 14:22:19,http://lorempixel.com/400/400/business,Nobis eius magni quia quasi.,689,2019-9-23 12:39:25
163,96,4,21,2019-7-25 02:52:36,http://lorempixel.com/400/400/business,Doloribus molestiae eum delectus nihil.,101,
164,92,2,9,2019-8-13 07:27:20,http://lorempixel.com/400/400/business,Voluptas et numquam.,350,
165,70,4,21,2019-7-29 14:17:10,http://lorempixel.com/400/400/business,Dolor voluptas laudantium ab et corrupti fugit.,892,
166,6,4,20,2019-7-25 04:22:32,http://lorempixel.com/400/400/business,Expedita blanditiis voluptas at non et laudantium iste dolor.,332,
167,56,5,22,2019-7-30 15:05:26,http://lorempixel.com/400/400/business,Sed occaecati doloremque dolorem doloremque rerum quo consequatur et.,711,
168,26,4,18,2019-8-11 03:53:06,http://lorempixel.com/400/400/business,Sed omnis non sed amet non.,133,2019-9-20 22:05:04
169,82,2,9,2019-8-8 13:03:34,http://lorempixel.com/400/400/business,Sed sunt repudiandae nihil est aut distinctio sed.,877,2019-9-15 15:31:01
170,32,4,20,2019-8-3 13:54:02,http://lorempixel.com/400/400/business,Aut veritatis aperiam ut reiciendis aliquid corrupti minima incidunt.,886,
171,93,1,8,2019-7-26 14:37:38,http://lorempixel.com/400/400/business,Dignissimos voluptas in exercitationem suscipit eius.,65,
172,52,2,9,2019-7-25 13:52:43,http://lorempixel.com/400/400/business,Quod et accusantium perspiciatis esse velit.,585,
173,46,1,7,2019-7-28 18:19:26,http://lorempixel.com/400/400/business,Expedita eaque enim omnis nobis quia.,895,
174,28,3,17,2019-8-1 02:56:35,http://lorempixel.com/400/400/business,Ea dolores beatae.,890,
175,25,4,20,2019-8-13 14:21:43,http://lorempixel.com/400/400/business,Dolorem error ut officia in ipsa velit quia.,409,
176,42,3,17,2019-8-8 14:22:22,http://lorempixel.com/400/400/business,Sapiente perferendis odio tenetur vitae.,763,
177,99,2,10,2019-8-1 13:39:40,http://lorempixel.com/400/400/business,Sit atque mollitia vitae fugiat.,882,2019-8-20 16:49:35
178,6,1,3,2019-7-26 09:28:16,http://lorempixel.com/400/400/business,Exercitationem commodi nemo ea iste impedit adipisci qui sequi.,368,2019-9-28 13:08:37
179,36,2,12,2019-8-8 02:19:17,http://lorempixel.com/400/400/business,Impedit et rerum id voluptatibus qui ducimus nihil cupiditate.,668,
180,56,1,4,2019-8-2 12:05:40,http://lorempixel.com/400/400/business,Voluptas sunt adipisci velit ut inventore.,339,
181,57,3,16,2019-8-5 20:56:51,http://lorempixel.com/400/400/business,Repellendus nemo vitae quia.,515,2019-9-7 15:32:50
182,58,1,3,2019-7-28 02:12:54,http://lorempixel.com/400/400/business,Maxime itaque atque quis.,703,2019-7-28 12:41:10
183,5,5,22,2019-7-31 09:46:47,http://lorempixel.com/400/400/business,Inventore velit dolor et praesentium molestiae quis rerum molestiae dolorem.,87,2019-8-14 07:53:37
184,14,4,18,2019-7-25 18:10:10,http://lorempixel.com/400/400/business,Aut sed incidunt ut non impedit.,930,2019-9-12 06:53:00
185,90,3,15,2019-7-28 10:38:16,http://lorempixel.com/400/400/business,Fugit et et.,522,2019-9-11 14:03:29
186,82,1,6,2019-7-29 15:54:02,http://lorempixel.com/400/400/business,Delectus suscipit dolores pariatur minima nesciunt doloremque officia.,850,2019-9-15 05:23:15
187,4,5,23,2019-8-6 12:50:03,http://lorempixel.com/400/400/business,Dolorem sunt non dolorem nihil non perferendis atque.,536,
188,90,5,22,2019-8-3 11:30:33,http://lorempixel.com/400/400/business,Dicta sed non explicabo rem nihil aut perspiciatis.,776,2019-8-23 13:59:30
189,7,4,18,2019-7-27 08:51:12,http://lorempixel.com/400/400/business,Laudantium omnis consequatur dolor eum ipsam enim et nisi ut.,92,2019-8-19 06:50:52
190,54,3,17,2019-8-13 04:11:49,http://lorempixel.com/400/400/business,Quo sapiente dicta eos non enim officiis nisi vero earum.,543,2019-8-23 14:39:55
191,13,2,10,2019-8-6 21:25:43,http://lorempixel.com/400/400/business,Natus voluptas harum ut sit id repudiandae deleniti.,483,
192,15,4,21,2019-8-8 21:07:13,http://lorempixel.com/400/400/business,Earum magnam aliquam est nisi.,995,
193,83,2,11,2019-8-4 04:12:45,http://lorempixel.com/400/400/business,Nisi placeat accusamus rem doloremque voluptas aspernatur velit enim.,982,
194,11,2,12,2019-8-9 05:59:09,http://lorempixel.com/400/400/business,Animi consequatur aliquid ut reprehenderit nobis itaque accusantium.,184,
195,10,5,22,2019-8-12 07:52:08,http://lorempixel.com/400/400/business,Non officia nostrum.,545,
196,4,1,5,2019-8-12 23:22:37,http://lorempixel.com/400/400/business,Assumenda et ipsam aspernatur.,983,2019-8-22 17:09:42
197,82,4,18,2019-8-4 14:01:37,http://lorempixel.com/400/400/business,Soluta aut in consequuntur repudiandae aperiam veritatis iusto placeat.,181,
198,99,5,23,2019-8-4 18:21:01,http://lorempixel.com/400/400/business,Possimus non consequatur soluta.,122,
199,68,1,6,2019-7-27 07:44:02,http://lorempixel.com/400/400/business,Quo voluptatibus dicta nostrum fugiat similique voluptatem.,342,2019-8-4 10:43:50
200,57,2,10,2019-7-29 22:54:37,http://lorempixel.com/400/400/business,Voluptatum enim dolorum aliquid magnam consequuntur sint.,815,
